22:02:12.957797 IP dhcp-140-247-103-184.fas.harvard.edu.44602 > ftp-prod-srv04.it.su.se.ftp: Flags [S], seq 2092694352, win 14600, options [mss 1460,sackOK,TS val 71287512 ecr 0,nop,wscale 6], length 0
22:02:13.071831 IP ftp-prod-srv04.it.su.se.ftp > dhcp-140-247-103-184.fas.harvard.edu.44602: Flags [S.], seq 549278024, ack 2092694353, win 5792, options [mss 1380,sackOK,TS val 769155827 ecr 71287512,nop,wscale 6], length 0
22:02:13.071872 IP dhcp-140-247-103-184.fas.harvard.edu.44602 > ftp-prod-srv04.it.su.se.ftp: Flags [.], ack 1, win 229, options [nop,nop,TS val 71287524 ecr 769155827], length 0
22:02:13.196258 IP ftp-prod-srv04.it.su.se.ftp > dhcp-140-247-103-184.fas.harvard.edu.44602: Flags [P.], seq 1:48, ack 1, win 91, options [nop,nop,TS val 769155858 ecr 71287524], length 47
22:02:13.196284 IP dhcp-140-247-103-184.fas.harvard.edu.44602 > ftp-prod-srv04.it.su.se.ftp: Flags [.], ack 48, win 229, options [nop,nop,TS val 71287536 ecr 769155858], length 0
22:02:13.196455 IP dhcp-140-247-103-184.fas.harvard.edu.44602 > ftp-prod-srv04.it.su.se.ftp: Flags [P.], seq 1:17, ack 48, win 229, options [nop,nop,TS val 71287536 ecr 769155858], length 16
22:02:13.310735 IP ftp-prod-srv04.it.su.se.ftp > dhcp-140-247-103-184.fas.harvard.edu.44602: Flags [.], ack 17, win 91, options [nop,nop,TS val 769155887 ecr 71287536], length 0
22:02:13.310753 IP ftp-prod-srv04.it.su.se.ftp > dhcp-140-247-103-184.fas.harvard.edu.44602: Flags [P.], seq 48:82, ack 17, win 91, options [nop,nop,TS val 769155887 ecr 71287536], length 34
22:02:13.310901 IP dhcp-140-247-103-184.fas.harvard.edu.44602 > ftp-prod-srv04.it.su.se.ftp: Flags [P.], seq 17:42, ack 82, win 229, options [nop,nop,TS val 71287547 ecr 769155887], length 25
22:02:13.427200 IP ftp-prod-srv04.it.su.se.ftp > dhcp-140-247-103-184.fas.harvard.edu.44602: Flags [P.], seq 82:105, ack 42, win 91, options [nop,nop,TS val 769155916 ecr 71287547], length 23
22:02:13.427338 IP dhcp-140-247-103-184.fas.harvard.edu.44602 > ftp-prod-srv04.it.su.se.ftp: Flags [P.], seq 42:48, ack 105, win 229, options [nop,nop,TS val 71287559 ecr 769155916], length 6
22:02:13.541827 IP ftp-prod-srv04.it.su.se.ftp > dhcp-140-247-103-184.fas.harvard.edu.44602: Flags [P.], seq 105:124, ack 48, win 91, options [nop,nop,TS val 769155944 ecr 71287559], length 19
22:02:13.541995 IP dhcp-140-247-103-184.fas.harvard.edu.44602 > ftp-prod-srv04.it.su.se.ftp: Flags [P.], seq 48:53, ack 124, win 229, options [nop,nop,TS val 71287571 ecr 769155944], length 5
22:02:13.656206 IP ftp-prod-srv04.it.su.se.ftp > dhcp-140-247-103-184.fas.harvard.edu.44602: Flags [P.], seq 124:133, ack 53, win 91, options [nop,nop,TS val 769155973 ecr 71287571], length 9
22:02:13.656372 IP dhcp-140-247-103-184.fas.harvard.edu.44602 > ftp-prod-srv04.it.su.se.ftp: Flags [P.], seq 53:61, ack 133, win 229, options [nop,nop,TS val 71287582 ecr 769155973], length 8
22:02:13.771882 IP ftp-prod-srv04.it.su.se.ftp > dhcp-140-247-103-184.fas.harvard.edu.44602: Flags [P.], seq 133:164, ack 61, win 91, options [nop,nop,TS val 769156002 ecr 71287582], length 31
22:02:13.772035 IP dhcp-140-247-103-184.fas.harvard.edu.44602 > ftp-prod-srv04.it.su.se.ftp: Flags [P.], seq 61:67, ack 164, win 229, options [nop,nop,TS val 71287594 ecr 769156002], length 6
22:02:13.886952 IP ftp-prod-srv04.it.su.se.ftp > dhcp-140-247-103-184.fas.harvard.edu.44602: Flags [P.], seq 164:215, ack 67, win 91, options [nop,nop,TS val 769156031 ecr 71287594], length 51
22:02:13.921462 IP dhcp-140-247-103-184.fas.harvard.edu.44602 > ftp-prod-srv04.it.su.se.ftp: Flags [.], ack 215, win 229, options [nop,nop,TS val 71287609 ecr 769156031], length 0
22:02:13.998046 IP dhcp-140-247-103-184.fas.harvard.edu.44602 > ftp-prod-srv04.it.su.se.ftp: Flags [P.], seq 67:75, ack 215, win 229, options [nop,nop,TS val 71287616 ecr 769156031], length 8
22:02:14.112992 IP ftp-prod-srv04.it.su.se.ftp > dhcp-140-247-103-184.fas.harvard.edu.44602: Flags [P.], seq 215:245, ack 75, win 91, options [nop,nop,TS val 769156087 ecr 71287616], length 30
22:02:14.113026 IP dhcp-140-247-103-184.fas.harvard.edu.44602 > ftp-prod-srv04.it.su.se.ftp: Flags [.], ack 245, win 229, options [nop,nop,TS val 71287628 ecr 769156087], length 0
22:02:14.113180 IP dhcp-140-247-103-184.fas.harvard.edu.44602 > ftp-prod-srv04.it.su.se.ftp: Flags [P.], seq 75:81, ack 245, win 229, options [nop,nop,TS val 71287628 ecr 769156087], length 6
22:02:14.228695 IP ftp-prod-srv04.it.su.se.ftp > dhcp-140-247-103-184.fas.harvard.edu.44602: Flags [P.], seq 245:296, ack 81, win 91, options [nop,nop,TS val 769156116 ecr 71287628], length 51
22:02:14.261448 IP dhcp-140-247-103-184.fas.harvard.edu.44602 > ftp-prod-srv04.it.su.se.ftp: Flags [.], ack 296, win 229, options [nop,nop,TS val 71287643 ecr 769156116], length 0
22:02:14.346844 IP dhcp-140-247-103-184.fas.harvard.edu.44602 > ftp-prod-srv04.it.su.se.ftp: Flags [P.], seq 81:88, ack 296, win 229, options [nop,nop,TS val 71287651 ecr 769156116], length 7
22:02:14.460819 IP ftp-prod-srv04.it.su.se.ftp > dhcp-140-247-103-184.fas.harvard.edu.44602: Flags [P.], seq 296:333, ack 88, win 91, options [nop,nop,TS val 769156174 ecr 71287651], length 37
22:02:14.460974 IP dhcp-140-247-103-184.fas.harvard.edu.44602 > ftp-prod-srv04.it.su.se.ftp: Flags [.], ack 333, win 229, options [nop,nop,TS val 71287662 ecr 769156174], length 0
22:02:14.461047 IP dhcp-140-247-103-184.fas.harvard.edu.44602 > ftp-prod-srv04.it.su.se.ftp: Flags [P.], seq 88:97, ack 333, win 229, options [nop,nop,TS val 71287662 ecr 769156174], length 9
22:02:14.575788 IP ftp-prod-srv04.it.su.se.ftp > dhcp-140-247-103-184.fas.harvard.edu.44602: Flags [P.], seq 333:372, ack 97, win 91, options [nop,nop,TS val 769156203 ecr 71287662], length 39
22:02:14.611419 IP dhcp-140-247-103-184.fas.harvard.edu.44602 > ftp-prod-srv04.it.su.se.ftp: Flags [.], ack 372, win 229, options [nop,nop,TS val 71287678 ecr 769156203], length 0
22:02:14.707925 IP ftp-prod-srv04.it.su.se.ftp > dhcp-140-247-103-184.fas.harvard.edu.44602: Flags [P.], seq 372:396, ack 97, win 91, options [nop,nop,TS val 769156236 ecr 71287662], length 24
22:02:14.708082 IP dhcp-140-247-103-184.fas.harvard.edu.44602 > ftp-prod-srv04.it.su.se.ftp: Flags [.], ack 396, win 229, options [nop,nop,TS val 71287687 ecr 769156236], length 0
22:02:14.708180 IP dhcp-140-247-103-184.fas.harvard.edu.44602 > ftp-prod-srv04.it.su.se.ftp: Flags [P.], seq 97:103, ack 396, win 229, options [nop,nop,TS val 71287687 ecr 769156236], length 6
22:02:14.842120 IP ftp-prod-srv04.it.su.se.ftp > dhcp-140-247-103-184.fas.harvard.edu.44602: Flags [P.], seq 396:410, ack 103, win 91, options [nop,nop,TS val 769156265 ecr 71287687], length 14
22:02:14.842150 IP ftp-prod-srv04.it.su.se.ftp > dhcp-140-247-103-184.fas.harvard.edu.44602: Flags [F.], seq 410, ack 103, win 91, options [nop,nop,TS val 769156265 ecr 71287687], length 0
22:02:14.842280 IP dhcp-140-247-103-184.fas.harvard.edu.44602 > ftp-prod-srv04.it.su.se.ftp: Flags [F.], seq 103, ack 411, win 229, options [nop,nop,TS val 71287701 ecr 769156265], length 0
22:02:14.956615 IP ftp-prod-srv04.it.su.se.ftp > dhcp-140-247-103-184.fas.harvard.edu.44602: Flags [.], ack 104, win 91, options [nop,nop,TS val 769156298 ecr 71287701], length 0
22:02:16.462220 IP dhcp-140-247-103-184.fas.harvard.edu.44606 > ftp-prod-srv04.it.su.se.ftp: Flags [S], seq 354112393, win 14600, options [mss 1460,sackOK,TS val 71287863 ecr 0,nop,wscale 6], length 0
22:02:16.576800 IP ftp-prod-srv04.it.su.se.ftp > dhcp-140-247-103-184.fas.harvard.edu.44606: Flags [S.], seq 3439852838, ack 354112394, win 5792, options [mss 1380,sackOK,TS val 769156703 ecr 71287863,nop,wscale 6], length 0
22:02:16.576840 IP dhcp-140-247-103-184.fas.harvard.edu.44606 > ftp-prod-srv04.it.su.se.ftp: Flags [.], ack 1, win 229, options [nop,nop,TS val 71287874 ecr 769156703], length 0
22:02:16.702272 IP ftp-prod-srv04.it.su.se.ftp > dhcp-140-247-103-184.fas.harvard.edu.44606: Flags [P.], seq 1:48, ack 1, win 91, options [nop,nop,TS val 769156734 ecr 71287874], length 47
22:02:16.702310 IP dhcp-140-247-103-184.fas.harvard.edu.44606 > ftp-prod-srv04.it.su.se.ftp: Flags [.], ack 48, win 229, options [nop,nop,TS val 71287887 ecr 769156734], length 0
22:02:16.702427 IP dhcp-140-247-103-184.fas.harvard.edu.44606 > ftp-prod-srv04.it.su.se.ftp: Flags [P.], seq 1:17, ack 48, win 229, options [nop,nop,TS val 71287887 ecr 769156734], length 16
22:02:16.816885 IP ftp-prod-srv04.it.su.se.ftp > dhcp-140-247-103-184.fas.harvard.edu.44606: Flags [.], ack 17, win 91, options [nop,nop,TS val 769156763 ecr 71287887], length 0
22:02:16.816908 IP ftp-prod-srv04.it.su.se.ftp > dhcp-140-247-103-184.fas.harvard.edu.44606: Flags [P.], seq 48:82, ack 17, win 91, options [nop,nop,TS val 769156763 ecr 71287887], length 34
22:02:16.817039 IP dhcp-140-247-103-184.fas.harvard.edu.44606 > ftp-prod-srv04.it.su.se.ftp: Flags [P.], seq 17:42, ack 82, win 229, options [nop,nop,TS val 71287898 ecr 769156763], length 25
22:02:16.933207 IP ftp-prod-srv04.it.su.se.ftp > dhcp-140-247-103-184.fas.harvard.edu.44606: Flags [P.], seq 82:105, ack 42, win 91, options [nop,nop,TS val 769156792 ecr 71287898], length 23
22:02:16.933365 IP dhcp-140-247-103-184.fas.harvard.edu.44606 > ftp-prod-srv04.it.su.se.ftp: Flags [P.], seq 42:48, ack 105, win 229, options [nop,nop,TS val 71287910 ecr 769156792], length 6
22:02:17.047799 IP ftp-prod-srv04.it.su.se.ftp > dhcp-140-247-103-184.fas.harvard.edu.44606: Flags [P.], seq 105:124, ack 48, win 91, options [nop,nop,TS val 769156821 ecr 71287910], length 19
22:02:17.047954 IP dhcp-140-247-103-184.fas.harvard.edu.44606 > ftp-prod-srv04.it.su.se.ftp: Flags [P.], seq 48:53, ack 124, win 229, options [nop,nop,TS val 71287921 ecr 769156821], length 5
22:02:17.162088 IP ftp-prod-srv04.it.su.se.ftp > dhcp-140-247-103-184.fas.harvard.edu.44606: Flags [P.], seq 124:133, ack 53, win 91, options [nop,nop,TS val 769156849 ecr 71287921], length 9
22:02:17.162269 IP dhcp-140-247-103-184.fas.harvard.edu.44606 > ftp-prod-srv04.it.su.se.ftp: Flags [P.], seq 53:61, ack 133, win 229, options [nop,nop,TS val 71287933 ecr 769156849], length 8
22:02:17.277216 IP ftp-prod-srv04.it.su.se.ftp > dhcp-140-247-103-184.fas.harvard.edu.44606: Flags [P.], seq 133:164, ack 61, win 91, options [nop,nop,TS val 769156878 ecr 71287933], length 31
22:02:17.277373 IP dhcp-140-247-103-184.fas.harvard.edu.44606 > ftp-prod-srv04.it.su.se.ftp: Flags [P.], seq 61:67, ack 164, win 229, options [nop,nop,TS val 71287944 ecr 769156878], length 6
22:02:17.391973 IP ftp-prod-srv04.it.su.se.ftp > dhcp-140-247-103-184.fas.harvard.edu.44606: Flags [P.], seq 164:215, ack 67, win 91, options [nop,nop,TS val 769156907 ecr 71287944], length 51
22:02:17.431428 IP dhcp-140-247-103-184.fas.harvard.edu.44606 > ftp-prod-srv04.it.su.se.ftp: Flags [.], ack 215, win 229, options [nop,nop,TS val 71287960 ecr 769156907], length 0
22:02:17.507518 IP dhcp-140-247-103-184.fas.harvard.edu.44606 > ftp-prod-srv04.it.su.se.ftp: Flags [P.], seq 67:78, ack 215, win 229, options [nop,nop,TS val 71287967 ecr 769156907], length 11
22:02:17.658868 IP ftp-prod-srv04.it.su.se.ftp > dhcp-140-247-103-184.fas.harvard.edu.44606: Flags [.], ack 78, win 91, options [nop,nop,TS val 769156974 ecr 71287967], length 0
22:02:17.698512 IP ftp-prod-srv04.it.su.se.ftp > dhcp-140-247-103-184.fas.harvard.edu.44606: Flags [P.], seq 215:245, ack 78, win 91, options [nop,nop,TS val 769156983 ecr 71287967], length 30
22:02:17.698539 IP dhcp-140-247-103-184.fas.harvard.edu.44606 > ftp-prod-srv04.it.su.se.ftp: Flags [.], ack 245, win 229, options [nop,nop,TS val 71287986 ecr 769156983], length 0
22:02:17.698684 IP dhcp-140-247-103-184.fas.harvard.edu.44606 > ftp-prod-srv04.it.su.se.ftp: Flags [P.], seq 78:84, ack 245, win 229, options [nop,nop,TS val 71287986 ecr 769156983], length 6
22:02:17.813035 IP ftp-prod-srv04.it.su.se.ftp > dhcp-140-247-103-184.fas.harvard.edu.44606: Flags [.], ack 84, win 91, options [nop,nop,TS val 769157012 ecr 71287986], length 0
22:02:17.813814 IP ftp-prod-srv04.it.su.se.ftp > dhcp-140-247-103-184.fas.harvard.edu.44606: Flags [P.], seq 245:296, ack 84, win 91, options [nop,nop,TS val 769157012 ecr 71287986], length 51
22:02:17.851411 IP dhcp-140-247-103-184.fas.harvard.edu.44606 > ftp-prod-srv04.it.su.se.ftp: Flags [.], ack 296, win 229, options [nop,nop,TS val 71288002 ecr 769157012], length 0
22:02:17.928716 IP dhcp-140-247-103-184.fas.harvard.edu.44606 > ftp-prod-srv04.it.su.se.ftp: Flags [P.], seq 84:95, ack 296, win 229, options [nop,nop,TS val 71288009 ecr 769157012], length 11
22:02:18.043144 IP ftp-prod-srv04.it.su.se.ftp > dhcp-140-247-103-184.fas.harvard.edu.44606: Flags [P.], seq 296:333, ack 95, win 91, options [nop,nop,TS val 769157070 ecr 71288009], length 37
22:02:18.043253 IP dhcp-140-247-103-184.fas.harvard.edu.44606 > ftp-prod-srv04.it.su.se.ftp: Flags [.], ack 333, win 229, options [nop,nop,TS val 71288021 ecr 769157070], length 0
22:02:18.043316 IP dhcp-140-247-103-184.fas.harvard.edu.44606 > ftp-prod-srv04.it.su.se.ftp: Flags [P.], seq 95:104, ack 333, win 229, options [nop,nop,TS val 71288021 ecr 769157070], length 9
22:02:18.158011 IP ftp-prod-srv04.it.su.se.ftp > dhcp-140-247-103-184.fas.harvard.edu.44606: Flags [P.], seq 333:372, ack 104, win 91, options [nop,nop,TS val 769157098 ecr 71288021], length 39
22:02:18.191420 IP dhcp-140-247-103-184.fas.harvard.edu.44606 > ftp-prod-srv04.it.su.se.ftp: Flags [.], ack 372, win 229, options [nop,nop,TS val 71288036 ecr 769157098], length 0
22:02:18.276026 IP ftp-prod-srv04.it.su.se.ftp > dhcp-140-247-103-184.fas.harvard.edu.44606: Flags [P.], seq 372:396, ack 104, win 91, options [nop,nop,TS val 769157128 ecr 71288021], length 24
22:02:18.276187 IP dhcp-140-247-103-184.fas.harvard.edu.44606 > ftp-prod-srv04.it.su.se.ftp: Flags [.], ack 396, win 229, options [nop,nop,TS val 71288044 ecr 769157128], length 0
22:02:18.276259 IP dhcp-140-247-103-184.fas.harvard.edu.44606 > ftp-prod-srv04.it.su.se.ftp: Flags [P.], seq 104:110, ack 396, win 229, options [nop,nop,TS val 71288044 ecr 769157128], length 6
22:02:18.390915 IP ftp-prod-srv04.it.su.se.ftp > dhcp-140-247-103-184.fas.harvard.edu.44606: Flags [P.], seq 396:410, ack 110, win 91, options [nop,nop,TS val 769157156 ecr 71288044], length 14
22:02:18.390943 IP ftp-prod-srv04.it.su.se.ftp > dhcp-140-247-103-184.fas.harvard.edu.44606: Flags [F.], seq 410, ack 110, win 91, options [nop,nop,TS val 769157156 ecr 71288044], length 0
22:02:18.391047 IP dhcp-140-247-103-184.fas.harvard.edu.44606 > ftp-prod-srv04.it.su.se.ftp: Flags [F.], seq 110, ack 411, win 229, options [nop,nop,TS val 71288055 ecr 769157156], length 0
22:02:18.505610 IP ftp-prod-srv04.it.su.se.ftp > dhcp-140-247-103-184.fas.harvard.edu.44606: Flags [.], ack 111, win 91, options [nop,nop,TS val 769157185 ecr 71288055], length 0
22:02:20.998457 IP dhcp-140-247-103-184.fas.harvard.edu.44610 > ftp-prod-srv04.it.su.se.ftp: Flags [S], seq 2372686961, win 14600, options [mss 1460,sackOK,TS val 71288316 ecr 0,nop,wscale 6], length 0
22:02:21.116083 IP ftp-prod-srv04.it.su.se.ftp > dhcp-140-247-103-184.fas.harvard.edu.44610: Flags [S.], seq 2707229119, ack 2372686962, win 5792, options [mss 1380,sackOK,TS val 769157838 ecr 71288316,nop,wscale 6], length 0
22:02:21.116124 IP dhcp-140-247-103-184.fas.harvard.edu.44610 > ftp-prod-srv04.it.su.se.ftp: Flags [.], ack 1, win 229, options [nop,nop,TS val 71288328 ecr 769157838], length 0
22:02:21.244594 IP ftp-prod-srv04.it.su.se.ftp > dhcp-140-247-103-184.fas.harvard.edu.44610: Flags [P.], seq 1:48, ack 1, win 91, options [nop,nop,TS val 769157870 ecr 71288328], length 47
22:02:21.244630 IP dhcp-140-247-103-184.fas.harvard.edu.44610 > ftp-prod-srv04.it.su.se.ftp: Flags [.], ack 48, win 229, options [nop,nop,TS val 71288341 ecr 769157870], length 0
22:02:21.244729 IP dhcp-140-247-103-184.fas.harvard.edu.44610 > ftp-prod-srv04.it.su.se.ftp: Flags [P.], seq 1:17, ack 48, win 229, options [nop,nop,TS val 71288341 ecr 769157870], length 16
22:02:21.362729 IP ftp-prod-srv04.it.su.se.ftp > dhcp-140-247-103-184.fas.harvard.edu.44610: Flags [.], ack 17, win 91, options [nop,nop,TS val 769157900 ecr 71288341], length 0
22:02:21.362756 IP ftp-prod-srv04.it.su.se.ftp > dhcp-140-247-103-184.fas.harvard.edu.44610: Flags [P.], seq 48:82, ack 17, win 91, options [nop,nop,TS val 769157900 ecr 71288341], length 34
22:02:21.362914 IP dhcp-140-247-103-184.fas.harvard.edu.44610 > ftp-prod-srv04.it.su.se.ftp: Flags [P.], seq 17:42, ack 82, win 229, options [nop,nop,TS val 71288353 ecr 769157900], length 25
22:02:21.482821 IP ftp-prod-srv04.it.su.se.ftp > dhcp-140-247-103-184.fas.harvard.edu.44610: Flags [P.], seq 82:105, ack 42, win 91, options [nop,nop,TS val 769157930 ecr 71288353], length 23
22:02:21.482982 IP dhcp-140-247-103-184.fas.harvard.edu.44610 > ftp-prod-srv04.it.su.se.ftp: Flags [P.], seq 42:48, ack 105, win 229, options [nop,nop,TS val 71288365 ecr 769157930], length 6
22:02:21.601533 IP ftp-prod-srv04.it.su.se.ftp > dhcp-140-247-103-184.fas.harvard.edu.44610: Flags [P.], seq 105:124, ack 48, win 91, options [nop,nop,TS val 769157959 ecr 71288365], length 19
22:02:21.601696 IP dhcp-140-247-103-184.fas.harvard.edu.44610 > ftp-prod-srv04.it.su.se.ftp: Flags [P.], seq 48:53, ack 124, win 229, options [nop,nop,TS val 71288377 ecr 769157959], length 5
22:02:21.720525 IP ftp-prod-srv04.it.su.se.ftp > dhcp-140-247-103-184.fas.harvard.edu.44610: Flags [P.], seq 124:133, ack 53, win 91, options [nop,nop,TS val 769157989 ecr 71288377], length 9
22:02:21.720693 IP dhcp-140-247-103-184.fas.harvard.edu.44610 > ftp-prod-srv04.it.su.se.ftp: Flags [P.], seq 53:61, ack 133, win 229, options [nop,nop,TS val 71288388 ecr 769157989], length 8
22:02:21.838851 IP ftp-prod-srv04.it.su.se.ftp > dhcp-140-247-103-184.fas.harvard.edu.44610: Flags [P.], seq 133:164, ack 61, win 91, options [nop,nop,TS val 769158018 ecr 71288388], length 31
22:02:21.838999 IP dhcp-140-247-103-184.fas.harvard.edu.44610 > ftp-prod-srv04.it.su.se.ftp: Flags [P.], seq 61:67, ack 164, win 229, options [nop,nop,TS val 71288400 ecr 769158018], length 6
22:02:21.957903 IP ftp-prod-srv04.it.su.se.ftp > dhcp-140-247-103-184.fas.harvard.edu.44610: Flags [P.], seq 164:214, ack 67, win 91, options [nop,nop,TS val 769158048 ecr 71288400], length 50
22:02:21.991464 IP dhcp-140-247-103-184.fas.harvard.edu.44610 > ftp-prod-srv04.it.su.se.ftp: Flags [.], ack 214, win 229, options [nop,nop,TS val 71288416 ecr 769158048], length 0
22:02:22.073554 IP dhcp-140-247-103-184.fas.harvard.edu.44610 > ftp-prod-srv04.it.su.se.ftp: Flags [P.], seq 67:75, ack 214, win 229, options [nop,nop,TS val 71288424 ecr 769158048], length 8
22:02:22.191688 IP ftp-prod-srv04.it.su.se.ftp > dhcp-140-247-103-184.fas.harvard.edu.44610: Flags [P.], seq 214:244, ack 75, win 91, options [nop,nop,TS val 769158106 ecr 71288424], length 30
22:02:22.191724 IP dhcp-140-247-103-184.fas.harvard.edu.44610 > ftp-prod-srv04.it.su.se.ftp: Flags [.], ack 244, win 229, options [nop,nop,TS val 71288436 ecr 769158106], length 0
22:02:22.191885 IP dhcp-140-247-103-184.fas.harvard.edu.44610 > ftp-prod-srv04.it.su.se.ftp: Flags [P.], seq 75:81, ack 244, win 229, options [nop,nop,TS val 71288436 ecr 769158106], length 6
22:02:22.310459 IP ftp-prod-srv04.it.su.se.ftp > dhcp-140-247-103-184.fas.harvard.edu.44610: Flags [P.], seq 244:295, ack 81, win 91, options [nop,nop,TS val 769158136 ecr 71288436], length 51
22:02:22.341434 IP dhcp-140-247-103-184.fas.harvard.edu.44610 > ftp-prod-srv04.it.su.se.ftp: Flags [.], ack 295, win 229, options [nop,nop,TS val 71288451 ecr 769158136], length 0
22:02:22.425638 IP dhcp-140-247-103-184.fas.harvard.edu.44610 > ftp-prod-srv04.it.su.se.ftp: Flags [P.], seq 81:88, ack 295, win 229, options [nop,nop,TS val 71288459 ecr 769158136], length 7
22:02:22.544131 IP ftp-prod-srv04.it.su.se.ftp > dhcp-140-247-103-184.fas.harvard.edu.44610: Flags [P.], seq 295:332, ack 88, win 91, options [nop,nop,TS val 769158195 ecr 71288459], length 37
22:02:22.544236 IP dhcp-140-247-103-184.fas.harvard.edu.44610 > ftp-prod-srv04.it.su.se.ftp: Flags [.], ack 332, win 229, options [nop,nop,TS val 71288471 ecr 769158195], length 0
22:02:22.544351 IP dhcp-140-247-103-184.fas.harvard.edu.44610 > ftp-prod-srv04.it.su.se.ftp: Flags [P.], seq 88:97, ack 332, win 229, options [nop,nop,TS val 71288471 ecr 769158195], length 9
22:02:22.663202 IP ftp-prod-srv04.it.su.se.ftp > dhcp-140-247-103-184.fas.harvard.edu.44610: Flags [P.], seq 332:371, ack 97, win 91, options [nop,nop,TS val 769158224 ecr 71288471], length 39
22:02:22.701458 IP dhcp-140-247-103-184.fas.harvard.edu.44610 > ftp-prod-srv04.it.su.se.ftp: Flags [.], ack 371, win 229, options [nop,nop,TS val 71288487 ecr 769158224], length 0
22:02:22.781515 IP ftp-prod-srv04.it.su.se.ftp > dhcp-140-247-103-184.fas.harvard.edu.44610: Flags [P.], seq 371:395, ack 97, win 91, options [nop,nop,TS val 769158254 ecr 71288471], length 24
22:02:22.781620 IP dhcp-140-247-103-184.fas.harvard.edu.44610 > ftp-prod-srv04.it.su.se.ftp: Flags [.], ack 395, win 229, options [nop,nop,TS val 71288495 ecr 769158254], length 0
22:02:22.781686 IP dhcp-140-247-103-184.fas.harvard.edu.44610 > ftp-prod-srv04.it.su.se.ftp: Flags [P.], seq 97:103, ack 395, win 229, options [nop,nop,TS val 71288495 ecr 769158254], length 6
22:02:22.900321 IP ftp-prod-srv04.it.su.se.ftp > dhcp-140-247-103-184.fas.harvard.edu.44610: Flags [P.], seq 395:409, ack 103, win 91, options [nop,nop,TS val 769158284 ecr 71288495], length 14
22:02:22.900350 IP ftp-prod-srv04.it.su.se.ftp > dhcp-140-247-103-184.fas.harvard.edu.44610: Flags [F.], seq 409, ack 103, win 91, options [nop,nop,TS val 769158284 ecr 71288495], length 0
22:02:22.900491 IP dhcp-140-247-103-184.fas.harvard.edu.44610 > ftp-prod-srv04.it.su.se.ftp: Flags [F.], seq 103, ack 410, win 229, options [nop,nop,TS val 71288506 ecr 769158284], length 0
22:02:23.017941 IP ftp-prod-srv04.it.su.se.ftp > dhcp-140-247-103-184.fas.harvard.edu.44610: Flags [.], ack 104, win 91, options [nop,nop,TS val 769158313 ecr 71288506], length 0
22:02:23.614696 IP dhcp-140-247-103-184.fas.harvard.edu.44613 > ftp-prod-srv04.it.su.se.ftp: Flags [S], seq 3148595659, win 14600, options [mss 1460,sackOK,TS val 71288578 ecr 0,nop,wscale 6], length 0
22:02:23.734088 IP ftp-prod-srv04.it.su.se.ftp > dhcp-140-247-103-184.fas.harvard.edu.44613: Flags [S.], seq 3168923254, ack 3148595660, win 5792, options [mss 1380,sackOK,TS val 769158492 ecr 71288578,nop,wscale 6], length 0
22:02:23.734129 IP dhcp-140-247-103-184.fas.harvard.edu.44613 > ftp-prod-srv04.it.su.se.ftp: Flags [.], ack 1, win 229, options [nop,nop,TS val 71288590 ecr 769158492], length 0
22:02:23.862826 IP ftp-prod-srv04.it.su.se.ftp > dhcp-140-247-103-184.fas.harvard.edu.44613: Flags [P.], seq 1:48, ack 1, win 91, options [nop,nop,TS val 769158524 ecr 71288590], length 47
22:02:23.862857 IP dhcp-140-247-103-184.fas.harvard.edu.44613 > ftp-prod-srv04.it.su.se.ftp: Flags [.], ack 48, win 229, options [nop,nop,TS val 71288603 ecr 769158524], length 0
22:02:23.863001 IP dhcp-140-247-103-184.fas.harvard.edu.44613 > ftp-prod-srv04.it.su.se.ftp: Flags [P.], seq 1:17, ack 48, win 229, options [nop,nop,TS val 71288603 ecr 769158524], length 16
22:02:23.981224 IP ftp-prod-srv04.it.su.se.ftp > dhcp-140-247-103-184.fas.harvard.edu.44613: Flags [.], ack 17, win 91, options [nop,nop,TS val 769158554 ecr 71288603], length 0
22:02:23.981249 IP ftp-prod-srv04.it.su.se.ftp > dhcp-140-247-103-184.fas.harvard.edu.44613: Flags [P.], seq 48:82, ack 17, win 91, options [nop,nop,TS val 769158554 ecr 71288603], length 34
22:02:23.981368 IP dhcp-140-247-103-184.fas.harvard.edu.44613 > ftp-prod-srv04.it.su.se.ftp: Flags [P.], seq 17:42, ack 82, win 229, options [nop,nop,TS val 71288614 ecr 769158554], length 25
22:02:24.101119 IP ftp-prod-srv04.it.su.se.ftp > dhcp-140-247-103-184.fas.harvard.edu.44613: Flags [P.], seq 82:105, ack 42, win 91, options [nop,nop,TS val 769158584 ecr 71288614], length 23
22:02:24.101282 IP dhcp-140-247-103-184.fas.harvard.edu.44613 > ftp-prod-srv04.it.su.se.ftp: Flags [P.], seq 42:48, ack 105, win 229, options [nop,nop,TS val 71288626 ecr 769158584], length 6
22:02:24.220083 IP ftp-prod-srv04.it.su.se.ftp > dhcp-140-247-103-184.fas.harvard.edu.44613: Flags [P.], seq 105:124, ack 48, win 91, options [nop,nop,TS val 769158614 ecr 71288626], length 19
22:02:24.220296 IP dhcp-140-247-103-184.fas.harvard.edu.44613 > ftp-prod-srv04.it.su.se.ftp: Flags [P.], seq 48:53, ack 124, win 229, options [nop,nop,TS val 71288638 ecr 769158614], length 5
22:02:24.338444 IP ftp-prod-srv04.it.su.se.ftp > dhcp-140-247-103-184.fas.harvard.edu.44613: Flags [P.], seq 124:133, ack 53, win 91, options [nop,nop,TS val 769158644 ecr 71288638], length 9
22:02:24.338614 IP dhcp-140-247-103-184.fas.harvard.edu.44613 > ftp-prod-srv04.it.su.se.ftp: Flags [P.], seq 53:61, ack 133, win 229, options [nop,nop,TS val 71288650 ecr 769158644], length 8
22:02:24.459436 IP ftp-prod-srv04.it.su.se.ftp > dhcp-140-247-103-184.fas.harvard.edu.44613: Flags [P.], seq 133:164, ack 61, win 91, options [nop,nop,TS val 769158673 ecr 71288650], length 31
22:02:24.459597 IP dhcp-140-247-103-184.fas.harvard.edu.44613 > ftp-prod-srv04.it.su.se.ftp: Flags [P.], seq 61:67, ack 164, win 229, options [nop,nop,TS val 71288662 ecr 769158673], length 6
22:02:24.578162 IP ftp-prod-srv04.it.su.se.ftp > dhcp-140-247-103-184.fas.harvard.edu.44613: Flags [P.], seq 164:215, ack 67, win 91, options [nop,nop,TS val 769158703 ecr 71288662], length 51
22:02:24.611432 IP dhcp-140-247-103-184.fas.harvard.edu.44613 > ftp-prod-srv04.it.su.se.ftp: Flags [.], ack 215, win 229, options [nop,nop,TS val 71288678 ecr 769158703], length 0
22:02:24.689752 IP dhcp-140-247-103-184.fas.harvard.edu.44613 > ftp-prod-srv04.it.su.se.ftp: Flags [P.], seq 67:78, ack 215, win 229, options [nop,nop,TS val 71288685 ecr 769158703], length 11
22:02:24.891518 IP ftp-prod-srv04.it.su.se.ftp > dhcp-140-247-103-184.fas.harvard.edu.44613: Flags [.], ack 78, win 91, options [nop,nop,TS val 769158771 ecr 71288685], length 0
22:02:24.891545 IP ftp-prod-srv04.it.su.se.ftp > dhcp-140-247-103-184.fas.harvard.edu.44613: Flags [P.], seq 215:245, ack 78, win 91, options [nop,nop,TS val 769158777 ecr 71288685], length 30
22:02:24.891557 IP dhcp-140-247-103-184.fas.harvard.edu.44613 > ftp-prod-srv04.it.su.se.ftp: Flags [.], ack 245, win 229, options [nop,nop,TS val 71288706 ecr 769158777], length 0
22:02:24.891707 IP dhcp-140-247-103-184.fas.harvard.edu.44613 > ftp-prod-srv04.it.su.se.ftp: Flags [P.], seq 78:84, ack 245, win 229, options [nop,nop,TS val 71288706 ecr 769158777], length 6
22:02:25.052682 IP ftp-prod-srv04.it.su.se.ftp > dhcp-140-247-103-184.fas.harvard.edu.44613: Flags [.], ack 84, win 91, options [nop,nop,TS val 769158812 ecr 71288706], length 0
22:02:25.052912 IP ftp-prod-srv04.it.su.se.ftp > dhcp-140-247-103-184.fas.harvard.edu.44613: Flags [P.], seq 245:295, ack 84, win 91, options [nop,nop,TS val 769158812 ecr 71288706], length 50
22:02:25.091464 IP dhcp-140-247-103-184.fas.harvard.edu.44613 > ftp-prod-srv04.it.su.se.ftp: Flags [.], ack 295, win 229, options [nop,nop,TS val 71288726 ecr 769158812], length 0
22:02:25.169195 IP dhcp-140-247-103-184.fas.harvard.edu.44613 > ftp-prod-srv04.it.su.se.ftp: Flags [P.], seq 84:95, ack 295, win 229, options [nop,nop,TS val 71288733 ecr 769158812], length 11
22:02:25.287288 IP ftp-prod-srv04.it.su.se.ftp > dhcp-140-247-103-184.fas.harvard.edu.44613: Flags [P.], seq 295:332, ack 95, win 91, options [nop,nop,TS val 769158881 ecr 71288733], length 37
22:02:25.287378 IP dhcp-140-247-103-184.fas.harvard.edu.44613 > ftp-prod-srv04.it.su.se.ftp: Flags [.], ack 332, win 229, options [nop,nop,TS val 71288745 ecr 769158881], length 0
22:02:25.287478 IP dhcp-140-247-103-184.fas.harvard.edu.44613 > ftp-prod-srv04.it.su.se.ftp: Flags [P.], seq 95:104, ack 332, win 229, options [nop,nop,TS val 71288745 ecr 769158881], length 9
22:02:25.405632 IP ftp-prod-srv04.it.su.se.ftp > dhcp-140-247-103-184.fas.harvard.edu.44613: Flags [P.], seq 332:371, ack 104, win 91, options [nop,nop,TS val 769158910 ecr 71288745], length 39
22:02:25.441425 IP dhcp-140-247-103-184.fas.harvard.edu.44613 > ftp-prod-srv04.it.su.se.ftp: Flags [.], ack 371, win 229, options [nop,nop,TS val 71288761 ecr 769158910], length 0
22:02:25.667507 IP ftp-prod-srv04.it.su.se.ftp > dhcp-140-247-103-184.fas.harvard.edu.44613: Flags [P.], seq 371:395, ack 104, win 91, options [nop,nop,TS val 769158976 ecr 71288761], length 24
22:02:25.667607 IP dhcp-140-247-103-184.fas.harvard.edu.44613 > ftp-prod-srv04.it.su.se.ftp: Flags [.], ack 395, win 229, options [nop,nop,TS val 71288783 ecr 769158976], length 0
22:02:25.667684 IP dhcp-140-247-103-184.fas.harvard.edu.44613 > ftp-prod-srv04.it.su.se.ftp: Flags [P.], seq 104:110, ack 395, win 229, options [nop,nop,TS val 71288783 ecr 769158976], length 6
22:02:25.789446 IP ftp-prod-srv04.it.su.se.ftp > dhcp-140-247-103-184.fas.harvard.edu.44613: Flags [P.], seq 395:409, ack 110, win 91, options [nop,nop,TS val 769159006 ecr 71288783], length 14
22:02:25.789470 IP ftp-prod-srv04.it.su.se.ftp > dhcp-140-247-103-184.fas.harvard.edu.44613: Flags [F.], seq 409, ack 110, win 91, options [nop,nop,TS val 769159006 ecr 71288783], length 0
22:02:25.789575 IP dhcp-140-247-103-184.fas.harvard.edu.44613 > ftp-prod-srv04.it.su.se.ftp: Flags [F.], seq 110, ack 410, win 229, options [nop,nop,TS val 71288795 ecr 769159006], length 0
22:02:25.907983 IP ftp-prod-srv04.it.su.se.ftp > dhcp-140-247-103-184.fas.harvard.edu.44613: Flags [.], ack 111, win 91, options [nop,nop,TS val 769159036 ecr 71288795], length 0
22:02:27.483584 IP dhcp-140-247-103-184.fas.harvard.edu.44616 > ftp-prod-srv04.it.su.se.ftp: Flags [S], seq 297470122, win 14600, options [mss 1460,sackOK,TS val 71288965 ecr 0,nop,wscale 6], length 0
22:02:27.601873 IP ftp-prod-srv04.it.su.se.ftp > dhcp-140-247-103-184.fas.harvard.edu.44616: Flags [S.], seq 4058155540, ack 297470123, win 5792, options [mss 1380,sackOK,TS val 769159459 ecr 71288965,nop,wscale 6], length 0
22:02:27.601914 IP dhcp-140-247-103-184.fas.harvard.edu.44616 > ftp-prod-srv04.it.su.se.ftp: Flags [.], ack 1, win 229, options [nop,nop,TS val 71288977 ecr 769159459], length 0
22:02:27.738650 IP ftp-prod-srv04.it.su.se.ftp > dhcp-140-247-103-184.fas.harvard.edu.44616: Flags [P.], seq 1:48, ack 1, win 91, options [nop,nop,TS val 769159493 ecr 71288977], length 47
22:02:27.738688 IP dhcp-140-247-103-184.fas.harvard.edu.44616 > ftp-prod-srv04.it.su.se.ftp: Flags [.], ack 48, win 229, options [nop,nop,TS val 71288990 ecr 769159493], length 0
22:02:27.738788 IP dhcp-140-247-103-184.fas.harvard.edu.44616 > ftp-prod-srv04.it.su.se.ftp: Flags [P.], seq 1:17, ack 48, win 229, options [nop,nop,TS val 71288990 ecr 769159493], length 16
22:02:27.856666 IP ftp-prod-srv04.it.su.se.ftp > dhcp-140-247-103-184.fas.harvard.edu.44616: Flags [.], ack 17, win 91, options [nop,nop,TS val 769159523 ecr 71288990], length 0
22:02:27.856817 IP ftp-prod-srv04.it.su.se.ftp > dhcp-140-247-103-184.fas.harvard.edu.44616: Flags [P.], seq 48:82, ack 17, win 91, options [nop,nop,TS val 769159523 ecr 71288990], length 34
22:02:27.856928 IP dhcp-140-247-103-184.fas.harvard.edu.44616 > ftp-prod-srv04.it.su.se.ftp: Flags [P.], seq 17:42, ack 82, win 229, options [nop,nop,TS val 71289002 ecr 769159523], length 25
22:02:27.984412 IP ftp-prod-srv04.it.su.se.ftp > dhcp-140-247-103-184.fas.harvard.edu.44616: Flags [P.], seq 82:105, ack 42, win 91, options [nop,nop,TS val 769159555 ecr 71289002], length 23
22:02:27.984562 IP dhcp-140-247-103-184.fas.harvard.edu.44616 > ftp-prod-srv04.it.su.se.ftp: Flags [P.], seq 42:48, ack 105, win 229, options [nop,nop,TS val 71289015 ecr 769159555], length 6
22:02:28.102803 IP ftp-prod-srv04.it.su.se.ftp > dhcp-140-247-103-184.fas.harvard.edu.44616: Flags [P.], seq 105:124, ack 48, win 91, options [nop,nop,TS val 769159584 ecr 71289015], length 19
22:02:28.102952 IP dhcp-140-247-103-184.fas.harvard.edu.44616 > ftp-prod-srv04.it.su.se.ftp: Flags [P.], seq 48:53, ack 124, win 229, options [nop,nop,TS val 71289027 ecr 769159584], length 5
22:02:28.223917 IP ftp-prod-srv04.it.su.se.ftp > dhcp-140-247-103-184.fas.harvard.edu.44616: Flags [P.], seq 124:133, ack 53, win 91, options [nop,nop,TS val 769159614 ecr 71289027], length 9
22:02:28.224067 IP dhcp-140-247-103-184.fas.harvard.edu.44616 > ftp-prod-srv04.it.su.se.ftp: Flags [P.], seq 53:61, ack 133, win 229, options [nop,nop,TS val 71289039 ecr 769159614], length 8
22:02:28.342148 IP ftp-prod-srv04.it.su.se.ftp > dhcp-140-247-103-184.fas.harvard.edu.44616: Flags [P.], seq 133:164, ack 61, win 91, options [nop,nop,TS val 769159644 ecr 71289039], length 31
22:02:28.342332 IP dhcp-140-247-103-184.fas.harvard.edu.44616 > ftp-prod-srv04.it.su.se.ftp: Flags [P.], seq 61:67, ack 164, win 229, options [nop,nop,TS val 71289051 ecr 769159644], length 6
22:02:28.461012 IP ftp-prod-srv04.it.su.se.ftp > dhcp-140-247-103-184.fas.harvard.edu.44616: Flags [P.], seq 164:213, ack 67, win 91, options [nop,nop,TS val 769159674 ecr 71289051], length 49
22:02:28.491464 IP dhcp-140-247-103-184.fas.harvard.edu.44616 > ftp-prod-srv04.it.su.se.ftp: Flags [.], ack 213, win 229, options [nop,nop,TS val 71289066 ecr 769159674], length 0
22:02:28.575744 IP dhcp-140-247-103-184.fas.harvard.edu.44616 > ftp-prod-srv04.it.su.se.ftp: Flags [P.], seq 67:75, ack 213, win 229, options [nop,nop,TS val 71289074 ecr 769159674], length 8
22:02:28.693847 IP ftp-prod-srv04.it.su.se.ftp > dhcp-140-247-103-184.fas.harvard.edu.44616: Flags [P.], seq 213:243, ack 75, win 91, options [nop,nop,TS val 769159732 ecr 71289074], length 30
22:02:28.693880 IP dhcp-140-247-103-184.fas.harvard.edu.44616 > ftp-prod-srv04.it.su.se.ftp: Flags [.], ack 243, win 229, options [nop,nop,TS val 71289086 ecr 769159732], length 0
22:02:28.694014 IP dhcp-140-247-103-184.fas.harvard.edu.44616 > ftp-prod-srv04.it.su.se.ftp: Flags [P.], seq 75:81, ack 243, win 229, options [nop,nop,TS val 71289086 ecr 769159732], length 6
22:02:28.812869 IP ftp-prod-srv04.it.su.se.ftp > dhcp-140-247-103-184.fas.harvard.edu.44616: Flags [P.], seq 243:292, ack 81, win 91, options [nop,nop,TS val 769159762 ecr 71289086], length 49
22:02:28.851491 IP dhcp-140-247-103-184.fas.harvard.edu.44616 > ftp-prod-srv04.it.su.se.ftp: Flags [.], ack 292, win 229, options [nop,nop,TS val 71289102 ecr 769159762], length 0
22:02:28.924859 IP dhcp-140-247-103-184.fas.harvard.edu.44616 > ftp-prod-srv04.it.su.se.ftp: Flags [P.], seq 81:88, ack 292, win 229, options [nop,nop,TS val 71289109 ecr 769159762], length 7
22:02:29.044543 IP ftp-prod-srv04.it.su.se.ftp > dhcp-140-247-103-184.fas.harvard.edu.44616: Flags [P.], seq 292:329, ack 88, win 91, options [nop,nop,TS val 769159820 ecr 71289109], length 37
22:02:29.044619 IP dhcp-140-247-103-184.fas.harvard.edu.44616 > ftp-prod-srv04.it.su.se.ftp: Flags [.], ack 329, win 229, options [nop,nop,TS val 71289121 ecr 769159820], length 0
22:02:29.044699 IP dhcp-140-247-103-184.fas.harvard.edu.44616 > ftp-prod-srv04.it.su.se.ftp: Flags [P.], seq 88:97, ack 329, win 229, options [nop,nop,TS val 71289121 ecr 769159820], length 9
22:02:29.163320 IP ftp-prod-srv04.it.su.se.ftp > dhcp-140-247-103-184.fas.harvard.edu.44616: Flags [P.], seq 329:368, ack 97, win 91, options [nop,nop,TS val 769159850 ecr 71289121], length 39
22:02:29.201448 IP dhcp-140-247-103-184.fas.harvard.edu.44616 > ftp-prod-srv04.it.su.se.ftp: Flags [.], ack 368, win 229, options [nop,nop,TS val 71289137 ecr 769159850], length 0
22:02:29.289131 IP ftp-prod-srv04.it.su.se.ftp > dhcp-140-247-103-184.fas.harvard.edu.44616: Flags [P.], seq 368:392, ack 97, win 91, options [nop,nop,TS val 769159881 ecr 71289121], length 24
22:02:29.289247 IP dhcp-140-247-103-184.fas.harvard.edu.44616 > ftp-prod-srv04.it.su.se.ftp: Flags [.], ack 392, win 229, options [nop,nop,TS val 71289145 ecr 769159881], length 0
22:02:29.289322 IP dhcp-140-247-103-184.fas.harvard.edu.44616 > ftp-prod-srv04.it.su.se.ftp: Flags [P.], seq 97:103, ack 392, win 229, options [nop,nop,TS val 71289145 ecr 769159881], length 6
22:02:29.408124 IP ftp-prod-srv04.it.su.se.ftp > dhcp-140-247-103-184.fas.harvard.edu.44616: Flags [P.], seq 392:406, ack 103, win 91, options [nop,nop,TS val 769159911 ecr 71289145], length 14
22:02:29.408153 IP ftp-prod-srv04.it.su.se.ftp > dhcp-140-247-103-184.fas.harvard.edu.44616: Flags [F.], seq 406, ack 103, win 91, options [nop,nop,TS val 769159911 ecr 71289145], length 0
22:02:29.408263 IP dhcp-140-247-103-184.fas.harvard.edu.44616 > ftp-prod-srv04.it.su.se.ftp: Flags [F.], seq 103, ack 407, win 229, options [nop,nop,TS val 71289157 ecr 769159911], length 0
22:02:29.526083 IP ftp-prod-srv04.it.su.se.ftp > dhcp-140-247-103-184.fas.harvard.edu.44616: Flags [.], ack 104, win 91, options [nop,nop,TS val 769159940 ecr 71289157], length 0
22:02:30.495078 IP dhcp-140-247-103-184.fas.harvard.edu.44619 > ftp-prod-srv04.it.su.se.ftp: Flags [S], seq 194764161, win 14600, options [mss 1460,sackOK,TS val 71289266 ecr 0,nop,wscale 6], length 0
22:02:30.609869 IP ftp-prod-srv04.it.su.se.ftp > dhcp-140-247-103-184.fas.harvard.edu.44619: Flags [S.], seq 739900414, ack 194764162, win 5792, options [mss 1380,sackOK,TS val 769160211 ecr 71289266,nop,wscale 6], length 0
22:02:30.609908 IP dhcp-140-247-103-184.fas.harvard.edu.44619 > ftp-prod-srv04.it.su.se.ftp: Flags [.], ack 1, win 229, options [nop,nop,TS val 71289277 ecr 769160211], length 0
22:02:30.734742 IP ftp-prod-srv04.it.su.se.ftp > dhcp-140-247-103-184.fas.harvard.edu.44619: Flags [P.], seq 1:48, ack 1, win 91, options [nop,nop,TS val 769160242 ecr 71289277], length 47
22:02:30.734776 IP dhcp-140-247-103-184.fas.harvard.edu.44619 > ftp-prod-srv04.it.su.se.ftp: Flags [.], ack 48, win 229, options [nop,nop,TS val 71289290 ecr 769160242], length 0
22:02:30.734925 IP dhcp-140-247-103-184.fas.harvard.edu.44619 > ftp-prod-srv04.it.su.se.ftp: Flags [P.], seq 1:17, ack 48, win 229, options [nop,nop,TS val 71289290 ecr 769160242], length 16
22:02:30.849389 IP ftp-prod-srv04.it.su.se.ftp > dhcp-140-247-103-184.fas.harvard.edu.44619: Flags [.], ack 17, win 91, options [nop,nop,TS val 769160271 ecr 71289290], length 0
22:02:30.849415 IP ftp-prod-srv04.it.su.se.ftp > dhcp-140-247-103-184.fas.harvard.edu.44619: Flags [P.], seq 48:82, ack 17, win 91, options [nop,nop,TS val 769160271 ecr 71289290], length 34
22:02:30.849534 IP dhcp-140-247-103-184.fas.harvard.edu.44619 > ftp-prod-srv04.it.su.se.ftp: Flags [P.], seq 17:42, ack 82, win 229, options [nop,nop,TS val 71289301 ecr 769160271], length 25
22:02:30.977216 IP ftp-prod-srv04.it.su.se.ftp > dhcp-140-247-103-184.fas.harvard.edu.44619: Flags [P.], seq 82:105, ack 42, win 91, options [nop,nop,TS val 769160303 ecr 71289301], length 23
22:02:30.977357 IP dhcp-140-247-103-184.fas.harvard.edu.44619 > ftp-prod-srv04.it.su.se.ftp: Flags [P.], seq 42:48, ack 105, win 229, options [nop,nop,TS val 71289314 ecr 769160303], length 6
22:02:31.093532 IP ftp-prod-srv04.it.su.se.ftp > dhcp-140-247-103-184.fas.harvard.edu.44619: Flags [P.], seq 105:124, ack 48, win 91, options [nop,nop,TS val 769160332 ecr 71289314], length 19
22:02:31.093740 IP dhcp-140-247-103-184.fas.harvard.edu.44619 > ftp-prod-srv04.it.su.se.ftp: Flags [P.], seq 48:53, ack 124, win 229, options [nop,nop,TS val 71289326 ecr 769160332], length 5
22:02:31.209281 IP ftp-prod-srv04.it.su.se.ftp > dhcp-140-247-103-184.fas.harvard.edu.44619: Flags [P.], seq 124:133, ack 53, win 91, options [nop,nop,TS val 769160361 ecr 71289326], length 9
22:02:31.209425 IP dhcp-140-247-103-184.fas.harvard.edu.44619 > ftp-prod-srv04.it.su.se.ftp: Flags [P.], seq 53:61, ack 133, win 229, options [nop,nop,TS val 71289337 ecr 769160361], length 8
22:02:31.324580 IP ftp-prod-srv04.it.su.se.ftp > dhcp-140-247-103-184.fas.harvard.edu.44619: Flags [P.], seq 133:164, ack 61, win 91, options [nop,nop,TS val 769160390 ecr 71289337], length 31
