17:36:41.266021 IP ThinkPad.56255 > ftp-prod-srv04.it.su.se.ftp: Flags [S], seq 3572387167, win 14600, options [mss 1460,sackOK,TS val 43774343 ecr 0,nop,wscale 6], length 0
17:36:41.388465 IP ftp-prod-srv04.it.su.se.ftp > ThinkPad.56255: Flags [S.], seq 2136184502, ack 3572387168, win 5792, options [mss 1380,sackOK,TS val 700372831 ecr 43774343,nop,wscale 6], length 0
17:36:41.388510 IP ThinkPad.56255 > ftp-prod-srv04.it.su.se.ftp: Flags [.], ack 1, win 229, options [nop,nop,TS val 43774355 ecr 700372831], length 0
17:36:41.564926 IP ftp-prod-srv04.it.su.se.ftp > ThinkPad.56255: Flags [P.], seq 1:48, ack 1, win 91, options [nop,nop,TS val 700372876 ecr 43774355], length 47
17:36:41.564962 IP ThinkPad.56255 > ftp-prod-srv04.it.su.se.ftp: Flags [.], ack 48, win 229, options [nop,nop,TS val 43774373 ecr 700372876], length 0
17:36:41.565057 IP ThinkPad.56255 > ftp-prod-srv04.it.su.se.ftp: Flags [P.], seq 1:17, ack 48, win 229, options [nop,nop,TS val 43774373 ecr 700372876], length 16
17:36:41.690957 IP ftp-prod-srv04.it.su.se.ftp > ThinkPad.56255: Flags [.], ack 17, win 91, options [nop,nop,TS val 700372907 ecr 43774373], length 0
17:36:41.690988 IP ftp-prod-srv04.it.su.se.ftp > ThinkPad.56255: Flags [P.], seq 48:82, ack 17, win 91, options [nop,nop,TS val 700372907 ecr 43774373], length 34
17:36:41.691132 IP ThinkPad.56255 > ftp-prod-srv04.it.su.se.ftp: Flags [P.], seq 17:42, ack 82, win 229, options [nop,nop,TS val 43774385 ecr 700372907], length 25
17:36:41.857097 IP ftp-prod-srv04.it.su.se.ftp > ThinkPad.56255: Flags [.], ack 42, win 91, options [nop,nop,TS val 700372949 ecr 43774385], length 0
17:36:43.082958 IP ftp-prod-srv04.it.su.se.ftp > ThinkPad.56255: Flags [P.], seq 82:105, ack 42, win 91, options [nop,nop,TS val 700373255 ecr 43774385], length 23
17:36:43.083077 IP ThinkPad.56255 > ftp-prod-srv04.it.su.se.ftp: Flags [P.], seq 42:48, ack 105, win 229, options [nop,nop,TS val 43774525 ecr 700373255], length 6
17:36:43.206937 IP ftp-prod-srv04.it.su.se.ftp > ThinkPad.56255: Flags [.], ack 48, win 91, options [nop,nop,TS val 700373286 ecr 43774525], length 0
17:36:43.206966 IP ftp-prod-srv04.it.su.se.ftp > ThinkPad.56255: Flags [P.], seq 105:124, ack 48, win 91, options [nop,nop,TS val 700373286 ecr 43774525], length 19
17:36:43.207088 IP ThinkPad.56255 > ftp-prod-srv04.it.su.se.ftp: Flags [P.], seq 48:53, ack 124, win 229, options [nop,nop,TS val 43774537 ecr 700373286], length 5
17:36:43.330448 IP ftp-prod-srv04.it.su.se.ftp > ThinkPad.56255: Flags [P.], seq 124:133, ack 53, win 91, options [nop,nop,TS val 700373317 ecr 43774537], length 9
17:36:43.330574 IP ThinkPad.56255 > ftp-prod-srv04.it.su.se.ftp: Flags [P.], seq 53:61, ack 133, win 229, options [nop,nop,TS val 43774549 ecr 700373317], length 8
17:36:43.456971 IP ftp-prod-srv04.it.su.se.ftp > ThinkPad.56255: Flags [P.], seq 133:164, ack 61, win 91, options [nop,nop,TS val 700373348 ecr 43774549], length 31
17:36:43.457110 IP ThinkPad.56255 > ftp-prod-srv04.it.su.se.ftp: Flags [P.], seq 61:67, ack 164, win 229, options [nop,nop,TS val 43774562 ecr 700373348], length 6
17:36:43.587958 IP ftp-prod-srv04.it.su.se.ftp > ThinkPad.56255: Flags [P.], seq 164:215, ack 67, win 91, options [nop,nop,TS val 700373381 ecr 43774562], length 51
17:36:43.621464 IP ThinkPad.56255 > ftp-prod-srv04.it.su.se.ftp: Flags [.], ack 215, win 229, options [nop,nop,TS val 43774579 ecr 700373381], length 0
17:36:43.714772 IP ThinkPad.56255 > ftp-prod-srv04.it.su.se.ftp: Flags [P.], seq 67:86, ack 215, win 229, options [nop,nop,TS val 43774588 ecr 700373381], length 19
17:36:43.838014 IP ftp-prod-srv04.it.su.se.ftp > ThinkPad.56255: Flags [P.], seq 215:245, ack 86, win 91, options [nop,nop,TS val 700373444 ecr 43774588], length 30
17:36:43.838046 IP ThinkPad.56255 > ftp-prod-srv04.it.su.se.ftp: Flags [.], ack 245, win 229, options [nop,nop,TS val 43774600 ecr 700373444], length 0
17:36:43.838193 IP ThinkPad.56255 > ftp-prod-srv04.it.su.se.ftp: Flags [P.], seq 86:92, ack 245, win 229, options [nop,nop,TS val 43774600 ecr 700373444], length 6
17:36:43.966054 IP ftp-prod-srv04.it.su.se.ftp > ThinkPad.56255: Flags [P.], seq 245:296, ack 92, win 91, options [nop,nop,TS val 700373475 ecr 43774600], length 51
17:36:44.001469 IP ThinkPad.56255 > ftp-prod-srv04.it.su.se.ftp: Flags [.], ack 296, win 229, options [nop,nop,TS val 43774617 ecr 700373475], length 0
17:36:44.093013 IP ThinkPad.56255 > ftp-prod-srv04.it.su.se.ftp: Flags [P.], seq 92:111, ack 296, win 229, options [nop,nop,TS val 43774626 ecr 700373475], length 19
17:36:44.227787 IP ftp-prod-srv04.it.su.se.ftp > ThinkPad.56255: Flags [P.], seq 296:302, ack 111, win 91, options [nop,nop,TS val 700373541 ecr 43774626], length 6
17:36:44.227814 IP ThinkPad.56255 > ftp-prod-srv04.it.su.se.ftp: Flags [.], ack 302, win 229, options [nop,nop,TS val 43774639 ecr 700373541], length 0
17:36:44.227842 IP ftp-prod-srv04.it.su.se.ftp > ThinkPad.56255: Flags [P.], seq 302:339, ack 111, win 91, options [nop,nop,TS val 700373541 ecr 43774626], length 37
17:36:44.227853 IP ThinkPad.56255 > ftp-prod-srv04.it.su.se.ftp: Flags [.], ack 339, win 229, options [nop,nop,TS val 43774639 ecr 700373541], length 0
17:36:44.227872 IP ftp-prod-srv04.it.su.se.ftp > ThinkPad.56255: Flags [P.], seq 339:381, ack 111, win 91, options [nop,nop,TS val 700373541 ecr 43774626], length 42
17:36:44.227884 IP ThinkPad.56255 > ftp-prod-srv04.it.su.se.ftp: Flags [.], ack 381, win 229, options [nop,nop,TS val 43774639 ecr 700373541], length 0
17:36:44.227901 IP ftp-prod-srv04.it.su.se.ftp > ThinkPad.56255: Flags [P.], seq 381:412, ack 111, win 91, options [nop,nop,TS val 700373541 ecr 43774626], length 31
17:36:44.227914 IP ftp-prod-srv04.it.su.se.ftp > ThinkPad.56255: Flags [P.], seq 412:479, ack 111, win 91, options [nop,nop,TS val 700373541 ecr 43774626], length 67
17:36:44.227918 IP ThinkPad.56255 > ftp-prod-srv04.it.su.se.ftp: Flags [.], ack 412, win 229, options [nop,nop,TS val 43774639 ecr 700373541], length 0
17:36:44.227945 IP ThinkPad.56255 > ftp-prod-srv04.it.su.se.ftp: Flags [.], ack 479, win 229, options [nop,nop,TS val 43774639 ecr 700373541], length 0
17:36:44.356402 IP ftp-prod-srv04.it.su.se.ftp > ThinkPad.56255: Flags [.], seq 479:1847, ack 111, win 91, options [nop,nop,TS val 700373574 ecr 43774639], length 1368
17:36:44.356429 IP ThinkPad.56255 > ftp-prod-srv04.it.su.se.ftp: Flags [.], ack 1847, win 274, options [nop,nop,TS val 43774652 ecr 700373574], length 0
17:36:44.356456 IP ftp-prod-srv04.it.su.se.ftp > ThinkPad.56255: Flags [P.], seq 1847:1998, ack 111, win 91, options [nop,nop,TS val 700373574 ecr 43774639], length 151
17:36:44.356469 IP ThinkPad.56255 > ftp-prod-srv04.it.su.se.ftp: Flags [.], ack 1998, win 317, options [nop,nop,TS val 43774652 ecr 700373574], length 0
17:36:44.356614 IP ThinkPad.56255 > ftp-prod-srv04.it.su.se.ftp: Flags [P.], seq 111:120, ack 1998, win 317, options [nop,nop,TS val 43774652 ecr 700373574], length 9
17:36:44.492218 IP ftp-prod-srv04.it.su.se.ftp > ThinkPad.56255: Flags [P.], seq 1998:2037, ack 120, win 91, options [nop,nop,TS val 700373606 ecr 43774652], length 39
17:36:44.531476 IP ThinkPad.56255 > ftp-prod-srv04.it.su.se.ftp: Flags [.], ack 2037, win 317, options [nop,nop,TS val 43774670 ecr 700373606], length 0
17:36:44.799679 IP ThinkPad.56255 > ftp-prod-srv04.it.su.se.ftp: Flags [F.], seq 120, ack 2037, win 317, options [nop,nop,TS val 43774696 ecr 700373606], length 0
17:36:44.924980 IP ftp-prod-srv04.it.su.se.ftp > ThinkPad.56255: Flags [P.], seq 2037:2061, ack 121, win 91, options [nop,nop,TS val 700373715 ecr 43774696], length 24
17:36:44.925008 IP ThinkPad.56255 > ftp-prod-srv04.it.su.se.ftp: Flags [R], seq 3572387288, win 0, length 0
17:36:44.927931 IP ftp-prod-srv04.it.su.se.ftp > ThinkPad.56255: Flags [P.], seq 2061:2071, ack 121, win 91, options [nop,nop,TS val 700373715 ecr 43774696], length 10
17:36:44.927947 IP ThinkPad.56255 > ftp-prod-srv04.it.su.se.ftp: Flags [R], seq 3572387288, win 0, length 0
17:36:44.927966 IP ftp-prod-srv04.it.su.se.ftp > ThinkPad.56255: Flags [P.], seq 2071:2101, ack 121, win 91, options [nop,nop,TS val 700373715 ecr 43774696], length 30
17:36:44.927974 IP ThinkPad.56255 > ftp-prod-srv04.it.su.se.ftp: Flags [R], seq 3572387288, win 0, length 0
17:36:44.927989 IP ftp-prod-srv04.it.su.se.ftp > ThinkPad.56255: Flags [P.], seq 2101:2103, ack 121, win 91, options [nop,nop,TS val 700373715 ecr 43774696], length 2
17:36:44.927997 IP ThinkPad.56255 > ftp-prod-srv04.it.su.se.ftp: Flags [R], seq 3572387288, win 0, length 0
17:36:44.928011 IP ftp-prod-srv04.it.su.se.ftp > ThinkPad.56255: Flags [FP.], seq 2103:2135, ack 121, win 91, options [nop,nop,TS val 700373715 ecr 43774696], length 32
17:36:44.928018 IP ThinkPad.56255 > ftp-prod-srv04.it.su.se.ftp: Flags [R], seq 3572387288, win 0, length 0
17:36:46.808475 IP ThinkPad.56258 > ftp-prod-srv04.it.su.se.ftp: Flags [S], seq 4047825231, win 14600, options [mss 1460,sackOK,TS val 43774897 ecr 0,nop,wscale 6], length 0
17:36:46.935974 IP ftp-prod-srv04.it.su.se.ftp > ThinkPad.56258: Flags [S.], seq 492499513, ack 4047825232, win 5792, options [mss 1380,sackOK,TS val 700374218 ecr 43774897,nop,wscale 6], length 0
17:36:46.936017 IP ThinkPad.56258 > ftp-prod-srv04.it.su.se.ftp: Flags [.], ack 1, win 229, options [nop,nop,TS val 43774910 ecr 700374218], length 0
17:36:47.073729 IP ftp-prod-srv04.it.su.se.ftp > ThinkPad.56258: Flags [P.], seq 1:48, ack 1, win 91, options [nop,nop,TS val 700374253 ecr 43774910], length 47
17:36:47.073771 IP ThinkPad.56258 > ftp-prod-srv04.it.su.se.ftp: Flags [.], ack 48, win 229, options [nop,nop,TS val 43774924 ecr 700374253], length 0
17:36:47.073883 IP ThinkPad.56258 > ftp-prod-srv04.it.su.se.ftp: Flags [P.], seq 1:17, ack 48, win 229, options [nop,nop,TS val 43774924 ecr 700374253], length 16
17:36:47.199116 IP ftp-prod-srv04.it.su.se.ftp > ThinkPad.56258: Flags [.], ack 17, win 91, options [nop,nop,TS val 700374284 ecr 43774924], length 0
17:36:47.199144 IP ftp-prod-srv04.it.su.se.ftp > ThinkPad.56258: Flags [P.], seq 48:82, ack 17, win 91, options [nop,nop,TS val 700374284 ecr 43774924], length 34
17:36:47.199271 IP ThinkPad.56258 > ftp-prod-srv04.it.su.se.ftp: Flags [P.], seq 17:42, ack 82, win 229, options [nop,nop,TS val 43774936 ecr 700374284], length 25
17:36:47.368715 IP ftp-prod-srv04.it.su.se.ftp > ThinkPad.56258: Flags [.], ack 42, win 91, options [nop,nop,TS val 700374326 ecr 43774936], length 0
17:36:47.569765 IP ftp-prod-srv04.it.su.se.ftp > ThinkPad.56258: Flags [P.], seq 82:105, ack 42, win 91, options [nop,nop,TS val 700374377 ecr 43774936], length 23
17:36:47.569910 IP ThinkPad.56258 > ftp-prod-srv04.it.su.se.ftp: Flags [P.], seq 42:48, ack 105, win 229, options [nop,nop,TS val 43774973 ecr 700374377], length 6
17:36:47.696461 IP ftp-prod-srv04.it.su.se.ftp > ThinkPad.56258: Flags [.], ack 48, win 91, options [nop,nop,TS val 700374409 ecr 43774973], length 0
17:36:47.696487 IP ftp-prod-srv04.it.su.se.ftp > ThinkPad.56258: Flags [P.], seq 105:124, ack 48, win 91, options [nop,nop,TS val 700374409 ecr 43774973], length 19
17:36:47.696606 IP ThinkPad.56258 > ftp-prod-srv04.it.su.se.ftp: Flags [P.], seq 48:53, ack 124, win 229, options [nop,nop,TS val 43774986 ecr 700374409], length 5
17:36:47.821878 IP ftp-prod-srv04.it.su.se.ftp > ThinkPad.56258: Flags [P.], seq 124:133, ack 53, win 91, options [nop,nop,TS val 700374439 ecr 43774986], length 9
17:36:47.822006 IP ThinkPad.56258 > ftp-prod-srv04.it.su.se.ftp: Flags [P.], seq 53:61, ack 133, win 229, options [nop,nop,TS val 43774999 ecr 700374439], length 8
17:36:47.946939 IP ftp-prod-srv04.it.su.se.ftp > ThinkPad.56258: Flags [P.], seq 133:164, ack 61, win 91, options [nop,nop,TS val 700374471 ecr 43774999], length 31
17:36:47.947109 IP ThinkPad.56258 > ftp-prod-srv04.it.su.se.ftp: Flags [P.], seq 61:67, ack 164, win 229, options [nop,nop,TS val 43775011 ecr 700374471], length 6
17:36:48.073819 IP ftp-prod-srv04.it.su.se.ftp > ThinkPad.56258: Flags [P.], seq 164:215, ack 67, win 91, options [nop,nop,TS val 700374503 ecr 43775011], length 51
17:36:48.111436 IP ThinkPad.56258 > ftp-prod-srv04.it.su.se.ftp: Flags [.], ack 215, win 229, options [nop,nop,TS val 43775028 ecr 700374503], length 0
17:36:48.194417 IP ThinkPad.56258 > ftp-prod-srv04.it.su.se.ftp: Flags [P.], seq 67:90, ack 215, win 229, options [nop,nop,TS val 43775036 ecr 700374503], length 23
17:36:48.319871 IP ftp-prod-srv04.it.su.se.ftp > ThinkPad.56258: Flags [P.], seq 215:245, ack 90, win 91, options [nop,nop,TS val 700374565 ecr 43775036], length 30
17:36:48.319911 IP ThinkPad.56258 > ftp-prod-srv04.it.su.se.ftp: Flags [.], ack 245, win 229, options [nop,nop,TS val 43775048 ecr 700374565], length 0
17:36:48.320090 IP ThinkPad.56258 > ftp-prod-srv04.it.su.se.ftp: Flags [P.], seq 90:96, ack 245, win 229, options [nop,nop,TS val 43775048 ecr 700374565], length 6
17:36:48.440880 IP ftp-prod-srv04.it.su.se.ftp > ThinkPad.56258: Flags [P.], seq 245:296, ack 96, win 91, options [nop,nop,TS val 700374595 ecr 43775048], length 51
17:36:48.471464 IP ThinkPad.56258 > ftp-prod-srv04.it.su.se.ftp: Flags [.], ack 296, win 229, options [nop,nop,TS val 43775064 ecr 700374595], length 0
17:36:48.570034 IP ThinkPad.56258 > ftp-prod-srv04.it.su.se.ftp: Flags [P.], seq 96:119, ack 296, win 229, options [nop,nop,TS val 43775073 ecr 700374595], length 23
17:36:48.719080 IP ftp-prod-srv04.it.su.se.ftp > ThinkPad.56258: Flags [P.], seq 296:333, ack 119, win 91, options [nop,nop,TS val 700374664 ecr 43775073], length 37
17:36:48.719201 IP ThinkPad.56258 > ftp-prod-srv04.it.su.se.ftp: Flags [.], ack 333, win 229, options [nop,nop,TS val 43775088 ecr 700374664], length 0
17:36:48.719271 IP ThinkPad.56258 > ftp-prod-srv04.it.su.se.ftp: Flags [P.], seq 119:128, ack 333, win 229, options [nop,nop,TS val 43775088 ecr 700374664], length 9
17:36:48.843266 IP ftp-prod-srv04.it.su.se.ftp > ThinkPad.56258: Flags [P.], seq 333:372, ack 128, win 91, options [nop,nop,TS val 700374696 ecr 43775088], length 39
17:36:48.882059 IP ThinkPad.56258 > ftp-prod-srv04.it.su.se.ftp: Flags [.], ack 372, win 229, options [nop,nop,TS val 43775105 ecr 700374696], length 0
17:36:48.973334 IP ftp-prod-srv04.it.su.se.ftp > ThinkPad.56258: Flags [P.], seq 372:396, ack 128, win 91, options [nop,nop,TS val 700374728 ecr 43775088], length 24
17:36:48.973425 IP ThinkPad.56258 > ftp-prod-srv04.it.su.se.ftp: Flags [.], ack 396, win 229, options [nop,nop,TS val 43775114 ecr 700374728], length 0
17:36:48.973495 IP ThinkPad.56258 > ftp-prod-srv04.it.su.se.ftp: Flags [P.], seq 128:134, ack 396, win 229, options [nop,nop,TS val 43775114 ecr 700374728], length 6
17:36:49.094975 IP ftp-prod-srv04.it.su.se.ftp > ThinkPad.56258: Flags [P.], seq 396:410, ack 134, win 91, options [nop,nop,TS val 700374758 ecr 43775114], length 14
17:36:49.095014 IP ftp-prod-srv04.it.su.se.ftp > ThinkPad.56258: Flags [F.], seq 410, ack 134, win 91, options [nop,nop,TS val 700374758 ecr 43775114], length 0
17:36:49.095118 IP ThinkPad.56258 > ftp-prod-srv04.it.su.se.ftp: Flags [F.], seq 134, ack 411, win 229, options [nop,nop,TS val 43775126 ecr 700374758], length 0
17:36:49.218499 IP ftp-prod-srv04.it.su.se.ftp > ThinkPad.56258: Flags [.], ack 135, win 91, options [nop,nop,TS val 700374789 ecr 43775126], length 0
17:36:50.061246 IP ThinkPad.56261 > ftp-prod-srv04.it.su.se.ftp: Flags [S], seq 1536699439, win 14600, options [mss 1460,sackOK,TS val 43775222 ecr 0,nop,wscale 6], length 0
17:36:50.190538 IP ftp-prod-srv04.it.su.se.ftp > ThinkPad.56261: Flags [S.], seq 1448070892, ack 1536699440, win 5792, options [mss 1380,sackOK,TS val 700375031 ecr 43775222,nop,wscale 6], length 0
17:36:50.190584 IP ThinkPad.56261 > ftp-prod-srv04.it.su.se.ftp: Flags [.], ack 1, win 229, options [nop,nop,TS val 43775235 ecr 700375031], length 0
17:36:50.330907 IP ftp-prod-srv04.it.su.se.ftp > ThinkPad.56261: Flags [P.], seq 1:48, ack 1, win 91, options [nop,nop,TS val 700375067 ecr 43775235], length 47
17:36:50.330937 IP ThinkPad.56261 > ftp-prod-srv04.it.su.se.ftp: Flags [.], ack 48, win 229, options [nop,nop,TS val 43775249 ecr 700375067], length 0
17:36:50.331049 IP ThinkPad.56261 > ftp-prod-srv04.it.su.se.ftp: Flags [P.], seq 1:17, ack 48, win 229, options [nop,nop,TS val 43775249 ecr 700375067], length 16
17:36:50.455641 IP ftp-prod-srv04.it.su.se.ftp > ThinkPad.56261: Flags [.], ack 17, win 91, options [nop,nop,TS val 700375098 ecr 43775249], length 0
17:36:50.459251 IP ftp-prod-srv04.it.su.se.ftp > ThinkPad.56261: Flags [P.], seq 48:82, ack 17, win 91, options [nop,nop,TS val 700375099 ecr 43775249], length 34
17:36:50.459379 IP ThinkPad.56261 > ftp-prod-srv04.it.su.se.ftp: Flags [P.], seq 17:42, ack 82, win 229, options [nop,nop,TS val 43775262 ecr 700375099], length 25
17:36:50.628122 IP ftp-prod-srv04.it.su.se.ftp > ThinkPad.56261: Flags [.], ack 42, win 91, options [nop,nop,TS val 700375141 ecr 43775262], length 0
17:36:51.573690 IP ftp-prod-srv04.it.su.se.ftp > ThinkPad.56261: Flags [P.], seq 82:105, ack 42, win 91, options [nop,nop,TS val 700375378 ecr 43775262], length 23
17:36:51.573848 IP ThinkPad.56261 > ftp-prod-srv04.it.su.se.ftp: Flags [P.], seq 42:48, ack 105, win 229, options [nop,nop,TS val 43775374 ecr 700375378], length 6
17:36:51.695537 IP ftp-prod-srv04.it.su.se.ftp > ThinkPad.56261: Flags [.], ack 48, win 91, options [nop,nop,TS val 700375408 ecr 43775374], length 0
17:36:51.695563 IP ftp-prod-srv04.it.su.se.ftp > ThinkPad.56261: Flags [P.], seq 105:124, ack 48, win 91, options [nop,nop,TS val 700375409 ecr 43775374], length 19
17:36:51.695684 IP ThinkPad.56261 > ftp-prod-srv04.it.su.se.ftp: Flags [P.], seq 48:53, ack 124, win 229, options [nop,nop,TS val 43775386 ecr 700375409], length 5
17:36:51.818752 IP ftp-prod-srv04.it.su.se.ftp > ThinkPad.56261: Flags [P.], seq 124:133, ack 53, win 91, options [nop,nop,TS val 700375439 ecr 43775386], length 9
17:36:51.818902 IP ThinkPad.56261 > ftp-prod-srv04.it.su.se.ftp: Flags [P.], seq 53:61, ack 133, win 229, options [nop,nop,TS val 43775398 ecr 700375439], length 8
17:36:51.944203 IP ftp-prod-srv04.it.su.se.ftp > ThinkPad.56261: Flags [P.], seq 133:164, ack 61, win 91, options [nop,nop,TS val 700375470 ecr 43775398], length 31
17:36:51.944361 IP ThinkPad.56261 > ftp-prod-srv04.it.su.se.ftp: Flags [P.], seq 61:67, ack 164, win 229, options [nop,nop,TS val 43775411 ecr 700375470], length 6
17:36:52.074583 IP ftp-prod-srv04.it.su.se.ftp > ThinkPad.56261: Flags [P.], seq 164:215, ack 67, win 91, options [nop,nop,TS val 700375502 ecr 43775411], length 51
17:36:52.111462 IP ThinkPad.56261 > ftp-prod-srv04.it.su.se.ftp: Flags [.], ack 215, win 229, options [nop,nop,TS val 43775428 ecr 700375502], length 0
17:36:52.195612 IP ThinkPad.56261 > ftp-prod-srv04.it.su.se.ftp: Flags [P.], seq 67:94, ack 215, win 229, options [nop,nop,TS val 43775436 ecr 700375502], length 27
17:36:52.367361 IP ftp-prod-srv04.it.su.se.ftp > ThinkPad.56261: Flags [P.], seq 215:245, ack 94, win 91, options [nop,nop,TS val 700375577 ecr 43775436], length 30
17:36:52.367391 IP ThinkPad.56261 > ftp-prod-srv04.it.su.se.ftp: Flags [.], ack 245, win 229, options [nop,nop,TS val 43775453 ecr 700375577], length 0
17:36:52.367524 IP ThinkPad.56261 > ftp-prod-srv04.it.su.se.ftp: Flags [P.], seq 94:100, ack 245, win 229, options [nop,nop,TS val 43775453 ecr 700375577], length 6
17:36:52.492998 IP ftp-prod-srv04.it.su.se.ftp > ThinkPad.56261: Flags [P.], seq 245:296, ack 100, win 91, options [nop,nop,TS val 700375608 ecr 43775453], length 51
17:36:52.531416 IP ThinkPad.56261 > ftp-prod-srv04.it.su.se.ftp: Flags [.], ack 296, win 229, options [nop,nop,TS val 43775470 ecr 700375608], length 0
17:36:52.620444 IP ThinkPad.56261 > ftp-prod-srv04.it.su.se.ftp: Flags [P.], seq 100:127, ack 296, win 229, options [nop,nop,TS val 43775478 ecr 700375608], length 27
17:36:52.779382 IP ftp-prod-srv04.it.su.se.ftp > ThinkPad.56261: Flags [.], ack 127, win 91, options [nop,nop,TS val 700375680 ecr 43775478], length 0
17:36:54.323517 IP ftp-prod-srv04.it.su.se.ftp > ThinkPad.56261: Flags [P.], seq 296:333, ack 127, win 91, options [nop,nop,TS val 700376065 ecr 43775478], length 37
17:36:54.323551 IP ThinkPad.56261 > ftp-prod-srv04.it.su.se.ftp: Flags [.], ack 333, win 229, options [nop,nop,TS val 43775649 ecr 700376065], length 0
17:36:54.323730 IP ThinkPad.56261 > ftp-prod-srv04.it.su.se.ftp: Flags [P.], seq 127:136, ack 333, win 229, options [nop,nop,TS val 43775649 ecr 700376065], length 9
17:36:54.448971 IP ftp-prod-srv04.it.su.se.ftp > ThinkPad.56261: Flags [.], ack 136, win 91, options [nop,nop,TS val 700376097 ecr 43775649], length 0
17:36:54.449008 IP ftp-prod-srv04.it.su.se.ftp > ThinkPad.56261: Flags [P.], seq 333:372, ack 136, win 91, options [nop,nop,TS val 700376097 ecr 43775649], length 39
17:36:54.481422 IP ThinkPad.56261 > ftp-prod-srv04.it.su.se.ftp: Flags [.], ack 372, win 229, options [nop,nop,TS val 43775665 ecr 700376097], length 0
17:36:54.654602 IP ftp-prod-srv04.it.su.se.ftp > ThinkPad.56261: Flags [P.], seq 372:396, ack 136, win 91, options [nop,nop,TS val 700376148 ecr 43775665], length 24
17:36:54.654624 IP ThinkPad.56261 > ftp-prod-srv04.it.su.se.ftp: Flags [.], ack 396, win 229, options [nop,nop,TS val 43775682 ecr 700376148], length 0
17:36:54.654782 IP ThinkPad.56261 > ftp-prod-srv04.it.su.se.ftp: Flags [P.], seq 136:142, ack 396, win 229, options [nop,nop,TS val 43775682 ecr 700376148], length 6
17:36:54.780365 IP ftp-prod-srv04.it.su.se.ftp > ThinkPad.56261: Flags [P.], seq 396:410, ack 142, win 91, options [nop,nop,TS val 700376180 ecr 43775682], length 14
17:36:54.780413 IP ftp-prod-srv04.it.su.se.ftp > ThinkPad.56261: Flags [F.], seq 410, ack 142, win 91, options [nop,nop,TS val 700376180 ecr 43775682], length 0
17:36:54.780516 IP ThinkPad.56261 > ftp-prod-srv04.it.su.se.ftp: Flags [F.], seq 142, ack 411, win 229, options [nop,nop,TS val 43775694 ecr 700376180], length 0
17:36:54.908303 IP ftp-prod-srv04.it.su.se.ftp > ThinkPad.56261: Flags [.], ack 143, win 91, options [nop,nop,TS val 700376212 ecr 43775694], length 0
17:36:56.200988 IP ThinkPad.56264 > ftp-prod-srv04.it.su.se.ftp: Flags [S], seq 2631326114, win 14600, options [mss 1460,sackOK,TS val 43775836 ecr 0,nop,wscale 6], length 0
17:36:56.325764 IP ftp-prod-srv04.it.su.se.ftp > ThinkPad.56264: Flags [S.], seq 1760312601, ack 2631326115, win 5792, options [mss 1380,sackOK,TS val 700376566 ecr 43775836,nop,wscale 6], length 0
17:36:56.325806 IP ThinkPad.56264 > ftp-prod-srv04.it.su.se.ftp: Flags [.], ack 1, win 229, options [nop,nop,TS val 43775849 ecr 700376566], length 0
17:36:56.457448 IP ftp-prod-srv04.it.su.se.ftp > ThinkPad.56264: Flags [P.], seq 1:48, ack 1, win 91, options [nop,nop,TS val 700376598 ecr 43775849], length 47
17:36:56.457480 IP ThinkPad.56264 > ftp-prod-srv04.it.su.se.ftp: Flags [.], ack 48, win 229, options [nop,nop,TS val 43775862 ecr 700376598], length 0
17:36:56.457603 IP ThinkPad.56264 > ftp-prod-srv04.it.su.se.ftp: Flags [P.], seq 1:17, ack 48, win 229, options [nop,nop,TS val 43775862 ecr 700376598], length 16
17:36:56.581190 IP ftp-prod-srv04.it.su.se.ftp > ThinkPad.56264: Flags [.], ack 17, win 91, options [nop,nop,TS val 700376630 ecr 43775862], length 0
17:36:56.581225 IP ftp-prod-srv04.it.su.se.ftp > ThinkPad.56264: Flags [P.], seq 48:82, ack 17, win 91, options [nop,nop,TS val 700376630 ecr 43775862], length 34
17:36:56.581376 IP ThinkPad.56264 > ftp-prod-srv04.it.su.se.ftp: Flags [P.], seq 17:42, ack 82, win 229, options [nop,nop,TS val 43775874 ecr 700376630], length 25
17:36:56.749863 IP ftp-prod-srv04.it.su.se.ftp > ThinkPad.56264: Flags [.], ack 42, win 91, options [nop,nop,TS val 700376672 ecr 43775874], length 0
17:36:58.003192 IP ftp-prod-srv04.it.su.se.ftp > ThinkPad.56264: Flags [P.], seq 82:105, ack 42, win 91, options [nop,nop,TS val 700376985 ecr 43775874], length 23
17:36:58.003351 IP ThinkPad.56264 > ftp-prod-srv04.it.su.se.ftp: Flags [P.], seq 42:48, ack 105, win 229, options [nop,nop,TS val 43776017 ecr 700376985], length 6
17:36:58.124117 IP ftp-prod-srv04.it.su.se.ftp > ThinkPad.56264: Flags [.], ack 48, win 91, options [nop,nop,TS val 700377016 ecr 43776017], length 0
17:36:58.124148 IP ftp-prod-srv04.it.su.se.ftp > ThinkPad.56264: Flags [P.], seq 105:124, ack 48, win 91, options [nop,nop,TS val 700377016 ecr 43776017], length 19
17:36:58.124289 IP ThinkPad.56264 > ftp-prod-srv04.it.su.se.ftp: Flags [P.], seq 48:53, ack 124, win 229, options [nop,nop,TS val 43776029 ecr 700377016], length 5
17:36:58.245837 IP ftp-prod-srv04.it.su.se.ftp > ThinkPad.56264: Flags [P.], seq 124:133, ack 53, win 91, options [nop,nop,TS val 700377046 ecr 43776029], length 9
17:36:58.246013 IP ThinkPad.56264 > ftp-prod-srv04.it.su.se.ftp: Flags [P.], seq 53:61, ack 133, win 229, options [nop,nop,TS val 43776041 ecr 700377046], length 8
17:36:58.371108 IP ftp-prod-srv04.it.su.se.ftp > ThinkPad.56264: Flags [P.], seq 133:164, ack 61, win 91, options [nop,nop,TS val 700377077 ecr 43776041], length 31
17:36:58.371257 IP ThinkPad.56264 > ftp-prod-srv04.it.su.se.ftp: Flags [P.], seq 61:67, ack 164, win 229, options [nop,nop,TS val 43776053 ecr 700377077], length 6
17:36:58.497115 IP ftp-prod-srv04.it.su.se.ftp > ThinkPad.56264: Flags [P.], seq 164:214, ack 67, win 91, options [nop,nop,TS val 700377108 ecr 43776053], length 50
17:36:58.531479 IP ThinkPad.56264 > ftp-prod-srv04.it.su.se.ftp: Flags [.], ack 214, win 229, options [nop,nop,TS val 43776070 ecr 700377108], length 0
17:36:58.623920 IP ThinkPad.56264 > ftp-prod-srv04.it.su.se.ftp: Flags [P.], seq 67:102, ack 214, win 229, options [nop,nop,TS val 43776079 ecr 700377108], length 35
17:36:58.786946 IP ftp-prod-srv04.it.su.se.ftp > ThinkPad.56264: Flags [.], ack 102, win 91, options [nop,nop,TS val 700377182 ecr 43776079], length 0
17:36:58.817245 IP ftp-prod-srv04.it.su.se.ftp > ThinkPad.56264: Flags [P.], seq 214:244, ack 102, win 91, options [nop,nop,TS val 700377189 ecr 43776079], length 30
17:36:58.817267 IP ThinkPad.56264 > ftp-prod-srv04.it.su.se.ftp: Flags [.], ack 244, win 229, options [nop,nop,TS val 43776098 ecr 700377189], length 0
17:36:58.817410 IP ThinkPad.56264 > ftp-prod-srv04.it.su.se.ftp: Flags [P.], seq 102:108, ack 244, win 229, options [nop,nop,TS val 43776098 ecr 700377189], length 6
17:36:58.941445 IP ftp-prod-srv04.it.su.se.ftp > ThinkPad.56264: Flags [.], ack 108, win 91, options [nop,nop,TS val 700377220 ecr 43776098], length 0
17:36:58.941465 IP ftp-prod-srv04.it.su.se.ftp > ThinkPad.56264: Flags [P.], seq 244:295, ack 108, win 91, options [nop,nop,TS val 700377220 ecr 43776098], length 51
17:36:58.981439 IP ThinkPad.56264 > ftp-prod-srv04.it.su.se.ftp: Flags [.], ack 295, win 229, options [nop,nop,TS val 43776115 ecr 700377220], length 0
17:36:59.063842 IP ThinkPad.56264 > ftp-prod-srv04.it.su.se.ftp: Flags [P.], seq 108:143, ack 295, win 229, options [nop,nop,TS val 43776123 ecr 700377220], length 35
17:36:59.206777 IP ftp-prod-srv04.it.su.se.ftp > ThinkPad.56264: Flags [P.], seq 295:332, ack 143, win 91, options [nop,nop,TS val 700377286 ecr 43776123], length 37
17:36:59.206812 IP ThinkPad.56264 > ftp-prod-srv04.it.su.se.ftp: Flags [.], ack 332, win 229, options [nop,nop,TS val 43776137 ecr 700377286], length 0
17:36:59.206951 IP ThinkPad.56264 > ftp-prod-srv04.it.su.se.ftp: Flags [P.], seq 143:152, ack 332, win 229, options [nop,nop,TS val 43776137 ecr 700377286], length 9
17:36:59.332418 IP ftp-prod-srv04.it.su.se.ftp > ThinkPad.56264: Flags [P.], seq 332:371, ack 152, win 91, options [nop,nop,TS val 700377317 ecr 43776137], length 39
17:36:59.371448 IP ThinkPad.56264 > ftp-prod-srv04.it.su.se.ftp: Flags [.], ack 371, win 229, options [nop,nop,TS val 43776154 ecr 700377317], length 0
17:36:59.463764 IP ftp-prod-srv04.it.su.se.ftp > ThinkPad.56264: Flags [P.], seq 371:395, ack 152, win 91, options [nop,nop,TS val 700377350 ecr 43776137], length 24
17:36:59.463825 IP ThinkPad.56264 > ftp-prod-srv04.it.su.se.ftp: Flags [.], ack 395, win 229, options [nop,nop,TS val 43776163 ecr 700377350], length 0
17:36:59.463899 IP ThinkPad.56264 > ftp-prod-srv04.it.su.se.ftp: Flags [P.], seq 152:158, ack 395, win 229, options [nop,nop,TS val 43776163 ecr 700377350], length 6
17:36:59.590185 IP ftp-prod-srv04.it.su.se.ftp > ThinkPad.56264: Flags [P.], seq 395:409, ack 158, win 91, options [nop,nop,TS val 700377382 ecr 43776163], length 14
17:36:59.590236 IP ftp-prod-srv04.it.su.se.ftp > ThinkPad.56264: Flags [F.], seq 409, ack 158, win 91, options [nop,nop,TS val 700377382 ecr 43776163], length 0
17:36:59.590419 IP ThinkPad.56264 > ftp-prod-srv04.it.su.se.ftp: Flags [F.], seq 158, ack 410, win 229, options [nop,nop,TS val 43776175 ecr 700377382], length 0
17:36:59.716070 IP ftp-prod-srv04.it.su.se.ftp > ThinkPad.56264: Flags [.], ack 159, win 91, options [nop,nop,TS val 700377413 ecr 43776175], length 0
17:37:01.662481 IP ThinkPad.56267 > ftp-prod-srv04.it.su.se.ftp: Flags [S], seq 1325970171, win 14600, options [mss 1460,sackOK,TS val 43776383 ecr 0,nop,wscale 6], length 0
17:37:01.788797 IP ftp-prod-srv04.it.su.se.ftp > ThinkPad.56267: Flags [S.], seq 358025833, ack 1325970172, win 5792, options [mss 1380,sackOK,TS val 700377931 ecr 43776383,nop,wscale 6], length 0
17:37:01.788845 IP ThinkPad.56267 > ftp-prod-srv04.it.su.se.ftp: Flags [.], ack 1, win 229, options [nop,nop,TS val 43776395 ecr 700377931], length 0
17:37:01.929352 IP ftp-prod-srv04.it.su.se.ftp > ThinkPad.56267: Flags [P.], seq 1:48, ack 1, win 91, options [nop,nop,TS val 700377966 ecr 43776395], length 47
17:37:01.929391 IP ThinkPad.56267 > ftp-prod-srv04.it.su.se.ftp: Flags [.], ack 48, win 229, options [nop,nop,TS val 43776409 ecr 700377966], length 0
17:37:01.929492 IP ThinkPad.56267 > ftp-prod-srv04.it.su.se.ftp: Flags [P.], seq 1:17, ack 48, win 229, options [nop,nop,TS val 43776409 ecr 700377966], length 16
17:37:02.050204 IP ftp-prod-srv04.it.su.se.ftp > ThinkPad.56267: Flags [.], ack 17, win 91, options [nop,nop,TS val 700377997 ecr 43776409], length 0
17:37:02.050239 IP ftp-prod-srv04.it.su.se.ftp > ThinkPad.56267: Flags [P.], seq 48:82, ack 17, win 91, options [nop,nop,TS val 700377997 ecr 43776409], length 34
17:37:02.050364 IP ThinkPad.56267 > ftp-prod-srv04.it.su.se.ftp: Flags [P.], seq 17:42, ack 82, win 229, options [nop,nop,TS val 43776421 ecr 700377997], length 25
17:37:02.173154 IP ftp-prod-srv04.it.su.se.ftp > ThinkPad.56267: Flags [P.], seq 82:105, ack 42, win 91, options [nop,nop,TS val 700378028 ecr 43776421], length 23
17:37:02.173319 IP ThinkPad.56267 > ftp-prod-srv04.it.su.se.ftp: Flags [P.], seq 42:48, ack 105, win 229, options [nop,nop,TS val 43776434 ecr 700378028], length 6
17:37:02.295183 IP ftp-prod-srv04.it.su.se.ftp > ThinkPad.56267: Flags [P.], seq 105:124, ack 48, win 91, options [nop,nop,TS val 700378058 ecr 43776434], length 19
17:37:02.295341 IP ThinkPad.56267 > ftp-prod-srv04.it.su.se.ftp: Flags [P.], seq 48:53, ack 124, win 229, options [nop,nop,TS val 43776446 ecr 700378058], length 5
17:37:02.421527 IP ftp-prod-srv04.it.su.se.ftp > ThinkPad.56267: Flags [P.], seq 124:133, ack 53, win 91, options [nop,nop,TS val 700378089 ecr 43776446], length 9
17:37:02.421686 IP ThinkPad.56267 > ftp-prod-srv04.it.su.se.ftp: Flags [P.], seq 53:61, ack 133, win 229, options [nop,nop,TS val 43776459 ecr 700378089], length 8
17:37:02.545230 IP ftp-prod-srv04.it.su.se.ftp > ThinkPad.56267: Flags [P.], seq 133:164, ack 61, win 91, options [nop,nop,TS val 700378121 ecr 43776459], length 31
17:37:02.545380 IP ThinkPad.56267 > ftp-prod-srv04.it.su.se.ftp: Flags [P.], seq 61:67, ack 164, win 229, options [nop,nop,TS val 43776471 ecr 700378121], length 6
17:37:02.674291 IP ftp-prod-srv04.it.su.se.ftp > ThinkPad.56267: Flags [P.], seq 164:215, ack 67, win 91, options [nop,nop,TS val 700378152 ecr 43776471], length 51
17:37:02.711414 IP ThinkPad.56267 > ftp-prod-srv04.it.su.se.ftp: Flags [.], ack 215, win 229, options [nop,nop,TS val 43776488 ecr 700378152], length 0
17:37:02.801127 IP ThinkPad.56267 > ftp-prod-srv04.it.su.se.ftp: Flags [P.], seq 67:109, ack 215, win 229, options [nop,nop,TS val 43776496 ecr 700378152], length 42
17:37:02.931493 IP ftp-prod-srv04.it.su.se.ftp > ThinkPad.56267: Flags [P.], seq 215:224, ack 109, win 91, options [nop,nop,TS val 700378217 ecr 43776496], length 9
17:37:02.931529 IP ThinkPad.56267 > ftp-prod-srv04.it.su.se.ftp: Flags [.], ack 224, win 229, options [nop,nop,TS val 43776510 ecr 700378217], length 0
17:37:02.931705 IP ThinkPad.56267 > ftp-prod-srv04.it.su.se.ftp: Flags [P.], seq 109:150, ack 224, win 229, options [nop,nop,TS val 43776510 ecr 700378217], length 41
17:37:03.053062 IP ftp-prod-srv04.it.su.se.ftp > ThinkPad.56267: Flags [P.], seq 224:257, ack 150, win 91, options [nop,nop,TS val 700378248 ecr 43776510], length 33
17:37:03.053213 IP ThinkPad.56267 > ftp-prod-srv04.it.su.se.ftp: Flags [P.], seq 150:156, ack 257, win 229, options [nop,nop,TS val 43776522 ecr 700378248], length 6
17:37:03.179294 IP ftp-prod-srv04.it.su.se.ftp > ThinkPad.56267: Flags [P.], seq 257:308, ack 156, win 91, options [nop,nop,TS val 700378279 ecr 43776522], length 51
17:37:03.211450 IP ThinkPad.56267 > ftp-prod-srv04.it.su.se.ftp: Flags [.], ack 308, win 229, options [nop,nop,TS val 43776538 ecr 700378279], length 0
17:37:03.301598 IP ThinkPad.56267 > ftp-prod-srv04.it.su.se.ftp: Flags [P.], seq 156:198, ack 308, win 229, options [nop,nop,TS val 43776547 ecr 700378279], length 42
17:37:03.441689 IP ftp-prod-srv04.it.su.se.ftp > ThinkPad.56267: Flags [P.], seq 308:402, ack 198, win 91, options [nop,nop,TS val 700378344 ecr 43776547], length 94
17:37:03.441795 IP ThinkPad.56267 > ftp-prod-srv04.it.su.se.ftp: Flags [.], ack 402, win 229, options [nop,nop,TS val 43776561 ecr 700378344], length 0
17:37:03.593401 IP ftp-prod-srv04.it.su.se.ftp > ThinkPad.56267: Flags [P.], seq 402:426, ack 198, win 91, options [nop,nop,TS val 700378382 ecr 43776561], length 24
17:37:03.593555 IP ThinkPad.56267 > ftp-prod-srv04.it.su.se.ftp: Flags [.], ack 426, win 229, options [nop,nop,TS val 43776576 ecr 700378382], length 0
17:37:03.593642 IP ThinkPad.56267 > ftp-prod-srv04.it.su.se.ftp: Flags [P.], seq 198:204, ack 426, win 229, options [nop,nop,TS val 43776576 ecr 700378382], length 6
17:37:03.721480 IP ftp-prod-srv04.it.su.se.ftp > ThinkPad.56267: Flags [P.], seq 426:440, ack 204, win 91, options [nop,nop,TS val 700378415 ecr 43776576], length 14
17:37:03.721528 IP ftp-prod-srv04.it.su.se.ftp > ThinkPad.56267: Flags [F.], seq 440, ack 204, win 91, options [nop,nop,TS val 700378415 ecr 43776576], length 0
17:37:03.721609 IP ThinkPad.56267 > ftp-prod-srv04.it.su.se.ftp: Flags [F.], seq 204, ack 441, win 229, options [nop,nop,TS val 43776589 ecr 700378415], length 0
17:37:03.845254 IP ftp-prod-srv04.it.su.se.ftp > ThinkPad.56267: Flags [.], ack 205, win 91, options [nop,nop,TS val 700378446 ecr 43776589], length 0
17:37:05.946626 IP ThinkPad.56270 > ftp-prod-srv04.it.su.se.ftp: Flags [S], seq 2581245641, win 14600, options [mss 1460,sackOK,TS val 43776811 ecr 0,nop,wscale 6], length 0
17:37:06.067455 IP ftp-prod-srv04.it.su.se.ftp > ThinkPad.56270: Flags [S.], seq 1026576161, ack 2581245642, win 5792, options [mss 1380,sackOK,TS val 700379002 ecr 43776811,nop,wscale 6], length 0
17:37:06.067503 IP ThinkPad.56270 > ftp-prod-srv04.it.su.se.ftp: Flags [.], ack 1, win 229, options [nop,nop,TS val 43776823 ecr 700379002], length 0
17:37:06.601298 IP ftp-prod-srv04.it.su.se.ftp > ThinkPad.56270: Flags [P.], seq 1:48, ack 1, win 91, options [nop,nop,TS val 700379135 ecr 43776823], length 47
17:37:06.601336 IP ThinkPad.56270 > ftp-prod-srv04.it.su.se.ftp: Flags [.], ack 48, win 229, options [nop,nop,TS val 43776876 ecr 700379135], length 0
17:37:06.601450 IP ThinkPad.56270 > ftp-prod-srv04.it.su.se.ftp: Flags [P.], seq 1:17, ack 48, win 229, options [nop,nop,TS val 43776877 ecr 700379135], length 16
17:37:06.726873 IP ftp-prod-srv04.it.su.se.ftp > ThinkPad.56270: Flags [.], ack 17, win 91, options [nop,nop,TS val 700379166 ecr 43776877], length 0
17:37:06.726913 IP ftp-prod-srv04.it.su.se.ftp > ThinkPad.56270: Flags [P.], seq 48:82, ack 17, win 91, options [nop,nop,TS val 700379166 ecr 43776877], length 34
17:37:06.727117 IP ThinkPad.56270 > ftp-prod-srv04.it.su.se.ftp: Flags [P.], seq 17:42, ack 82, win 229, options [nop,nop,TS val 43776889 ecr 700379166], length 25
17:37:06.853617 IP ftp-prod-srv04.it.su.se.ftp > ThinkPad.56270: Flags [P.], seq 82:105, ack 42, win 91, options [nop,nop,TS val 700379198 ecr 43776889], length 23
17:37:06.853775 IP ThinkPad.56270 > ftp-prod-srv04.it.su.se.ftp: Flags [P.], seq 42:48, ack 105, win 229, options [nop,nop,TS val 43776902 ecr 700379198], length 6
17:37:06.978003 IP ftp-prod-srv04.it.su.se.ftp > ThinkPad.56270: Flags [P.], seq 105:124, ack 48, win 91, options [nop,nop,TS val 700379229 ecr 43776902], length 19
17:37:06.978171 IP ThinkPad.56270 > ftp-prod-srv04.it.su.se.ftp: Flags [P.], seq 48:53, ack 124, win 229, options [nop,nop,TS val 43776914 ecr 700379229], length 5
17:37:07.105852 IP ftp-prod-srv04.it.su.se.ftp > ThinkPad.56270: Flags [P.], seq 124:133, ack 53, win 91, options [nop,nop,TS val 700379261 ecr 43776914], length 9
17:37:07.106034 IP ThinkPad.56270 > ftp-prod-srv04.it.su.se.ftp: Flags [P.], seq 53:61, ack 133, win 229, options [nop,nop,TS val 43776927 ecr 700379261], length 8
17:37:07.227564 IP ftp-prod-srv04.it.su.se.ftp > ThinkPad.56270: Flags [P.], seq 133:164, ack 61, win 91, options [nop,nop,TS val 700379292 ecr 43776927], length 31
17:37:07.227730 IP ThinkPad.56270 > ftp-prod-srv04.it.su.se.ftp: Flags [P.], seq 61:67, ack 164, win 229, options [nop,nop,TS val 43776939 ecr 700379292], length 6
17:37:07.372417 IP ftp-prod-srv04.it.su.se.ftp > ThinkPad.56270: Flags [P.], seq 164:215, ack 67, win 91, options [nop,nop,TS val 700379322 ecr 43776939], length 51
17:37:07.411485 IP ThinkPad.56270 > ftp-prod-srv04.it.su.se.ftp: Flags [.], ack 215, win 229, options [nop,nop,TS val 43776958 ecr 700379322], length 0
17:37:07.498923 IP ThinkPad.56270 > ftp-prod-srv04.it.su.se.ftp: Flags [P.], seq 67:102, ack 215, win 229, options [nop,nop,TS val 43776966 ecr 700379322], length 35
17:37:07.628693 IP ftp-prod-srv04.it.su.se.ftp > ThinkPad.56270: Flags [P.], seq 215:245, ack 102, win 91, options [nop,nop,TS val 700379391 ecr 43776966], length 30
17:37:07.628722 IP ThinkPad.56270 > ftp-prod-srv04.it.su.se.ftp: Flags [.], ack 245, win 229, options [nop,nop,TS val 43776979 ecr 700379391], length 0
17:37:07.628866 IP ThinkPad.56270 > ftp-prod-srv04.it.su.se.ftp: Flags [P.], seq 102:108, ack 245, win 229, options [nop,nop,TS val 43776979 ecr 700379391], length 6
17:37:07.756177 IP ftp-prod-srv04.it.su.se.ftp > ThinkPad.56270: Flags [P.], seq 245:295, ack 108, win 91, options [nop,nop,TS val 700379423 ecr 43776979], length 50
17:37:07.791448 IP ThinkPad.56270 > ftp-prod-srv04.it.su.se.ftp: Flags [.], ack 295, win 229, options [nop,nop,TS val 43776996 ecr 700379423], length 0
17:37:07.881129 IP ThinkPad.56270 > ftp-prod-srv04.it.su.se.ftp: Flags [P.], seq 108:143, ack 295, win 229, options [nop,nop,TS val 43777004 ecr 700379423], length 35
17:37:08.008053 IP ftp-prod-srv04.it.su.se.ftp > ThinkPad.56270: Flags [P.], seq 295:332, ack 143, win 91, options [nop,nop,TS val 700379487 ecr 43777004], length 37
17:37:08.008173 IP ThinkPad.56270 > ftp-prod-srv04.it.su.se.ftp: Flags [.], ack 332, win 229, options [nop,nop,TS val 43777017 ecr 700379487], length 0
17:37:08.008254 IP ThinkPad.56270 > ftp-prod-srv04.it.su.se.ftp: Flags [P.], seq 143:152, ack 332, win 229, options [nop,nop,TS val 43777017 ecr 700379487], length 9
17:37:08.136080 IP ftp-prod-srv04.it.su.se.ftp > ThinkPad.56270: Flags [P.], seq 332:371, ack 152, win 91, options [nop,nop,TS val 700379518 ecr 43777017], length 39
17:37:08.138835 IP ThinkPad.56270 > ftp-prod-srv04.it.su.se.ftp: Flags [F.], seq 152, ack 371, win 229, options [nop,nop,TS val 43777030 ecr 700379518], length 0
