21:32:10.033860 IP dhcp-140-247-103-184.fas.harvard.edu.49344 > ftp-prod-srv04.it.su.se.ftp: Flags [S], seq 3352020017, win 14600, options [mss 1460,sackOK,TS val 9822144 ecr 0,nop,wscale 6], length 0
21:32:10.152193 IP ftp-prod-srv04.it.su.se.ftp > dhcp-140-247-103-184.fas.harvard.edu.49344: Flags [S.], seq 3653184779, ack 3352020018, win 5792, options [mss 1380,sackOK,TS val 941504883 ecr 9822144,nop,wscale 6], length 0
21:32:10.152234 IP dhcp-140-247-103-184.fas.harvard.edu.49344 > ftp-prod-srv04.it.su.se.ftp: Flags [.], ack 1, win 229, options [nop,nop,TS val 9822155 ecr 941504883], length 0
21:32:11.135920 IP ftp-prod-srv04.it.su.se.ftp > dhcp-140-247-103-184.fas.harvard.edu.49344: Flags [P.], seq 1:48, ack 1, win 91, options [nop,nop,TS val 941505129 ecr 9822155], length 47
21:32:11.135950 IP dhcp-140-247-103-184.fas.harvard.edu.49344 > ftp-prod-srv04.it.su.se.ftp: Flags [.], ack 48, win 229, options [nop,nop,TS val 9822254 ecr 941505129], length 0
21:32:11.136111 IP dhcp-140-247-103-184.fas.harvard.edu.49344 > ftp-prod-srv04.it.su.se.ftp: Flags [P.], seq 1:17, ack 48, win 229, options [nop,nop,TS val 9822254 ecr 941505129], length 16
21:32:11.254416 IP ftp-prod-srv04.it.su.se.ftp > dhcp-140-247-103-184.fas.harvard.edu.49344: Flags [.], ack 17, win 91, options [nop,nop,TS val 941505158 ecr 9822254], length 0
21:32:11.254438 IP ftp-prod-srv04.it.su.se.ftp > dhcp-140-247-103-184.fas.harvard.edu.49344: Flags [P.], seq 48:82, ack 17, win 91, options [nop,nop,TS val 941505158 ecr 9822254], length 34
21:32:11.254561 IP dhcp-140-247-103-184.fas.harvard.edu.49344 > ftp-prod-srv04.it.su.se.ftp: Flags [P.], seq 17:42, ack 82, win 229, options [nop,nop,TS val 9822266 ecr 941505158], length 25
21:32:11.375150 IP ftp-prod-srv04.it.su.se.ftp > dhcp-140-247-103-184.fas.harvard.edu.49344: Flags [P.], seq 82:105, ack 42, win 91, options [nop,nop,TS val 941505188 ecr 9822266], length 23
21:32:11.375295 IP dhcp-140-247-103-184.fas.harvard.edu.49344 > ftp-prod-srv04.it.su.se.ftp: Flags [P.], seq 42:48, ack 105, win 229, options [nop,nop,TS val 9822278 ecr 941505188], length 6
21:32:11.493453 IP ftp-prod-srv04.it.su.se.ftp > dhcp-140-247-103-184.fas.harvard.edu.49344: Flags [P.], seq 105:124, ack 48, win 91, options [nop,nop,TS val 941505218 ecr 9822278], length 19
21:32:11.493582 IP dhcp-140-247-103-184.fas.harvard.edu.49344 > ftp-prod-srv04.it.su.se.ftp: Flags [P.], seq 48:53, ack 124, win 229, options [nop,nop,TS val 9822290 ecr 941505218], length 5
21:32:11.611575 IP ftp-prod-srv04.it.su.se.ftp > dhcp-140-247-103-184.fas.harvard.edu.49344: Flags [P.], seq 124:133, ack 53, win 91, options [nop,nop,TS val 941505248 ecr 9822290], length 9
21:32:11.611690 IP dhcp-140-247-103-184.fas.harvard.edu.49344 > ftp-prod-srv04.it.su.se.ftp: Flags [P.], seq 53:61, ack 133, win 229, options [nop,nop,TS val 9822301 ecr 941505248], length 8
21:32:11.729683 IP ftp-prod-srv04.it.su.se.ftp > dhcp-140-247-103-184.fas.harvard.edu.49344: Flags [P.], seq 133:164, ack 61, win 91, options [nop,nop,TS val 941505277 ecr 9822301], length 31
21:32:11.729829 IP dhcp-140-247-103-184.fas.harvard.edu.49344 > ftp-prod-srv04.it.su.se.ftp: Flags [P.], seq 61:67, ack 164, win 229, options [nop,nop,TS val 9822313 ecr 941505277], length 6
21:32:11.848709 IP ftp-prod-srv04.it.su.se.ftp > dhcp-140-247-103-184.fas.harvard.edu.49344: Flags [P.], seq 164:214, ack 67, win 91, options [nop,nop,TS val 941505307 ecr 9822313], length 50
21:32:11.883409 IP dhcp-140-247-103-184.fas.harvard.edu.49344 > ftp-prod-srv04.it.su.se.ftp: Flags [.], ack 214, win 229, options [nop,nop,TS val 9822329 ecr 941505307], length 0
21:32:11.972206 IP dhcp-140-247-103-184.fas.harvard.edu.49344 > ftp-prod-srv04.it.su.se.ftp: Flags [P.], seq 67:78, ack 214, win 229, options [nop,nop,TS val 9822337 ecr 941505307], length 11
21:32:12.092776 IP ftp-prod-srv04.it.su.se.ftp > dhcp-140-247-103-184.fas.harvard.edu.49344: Flags [P.], seq 214:244, ack 78, win 91, options [nop,nop,TS val 941505368 ecr 9822337], length 30
21:32:12.092805 IP dhcp-140-247-103-184.fas.harvard.edu.49344 > ftp-prod-srv04.it.su.se.ftp: Flags [.], ack 244, win 229, options [nop,nop,TS val 9822349 ecr 941505368], length 0
21:32:12.093011 IP dhcp-140-247-103-184.fas.harvard.edu.49344 > ftp-prod-srv04.it.su.se.ftp: Flags [P.], seq 78:84, ack 244, win 229, options [nop,nop,TS val 9822349 ecr 941505368], length 6
21:32:12.211372 IP ftp-prod-srv04.it.su.se.ftp > dhcp-140-247-103-184.fas.harvard.edu.49344: Flags [P.], seq 244:295, ack 84, win 91, options [nop,nop,TS val 941505397 ecr 9822349], length 51
21:32:12.243379 IP dhcp-140-247-103-184.fas.harvard.edu.49344 > ftp-prod-srv04.it.su.se.ftp: Flags [.], ack 295, win 229, options [nop,nop,TS val 9822365 ecr 941505397], length 0
21:32:12.322719 IP dhcp-140-247-103-184.fas.harvard.edu.49344 > ftp-prod-srv04.it.su.se.ftp: Flags [P.], seq 84:95, ack 295, win 229, options [nop,nop,TS val 9822372 ecr 941505397], length 11
21:32:12.440906 IP ftp-prod-srv04.it.su.se.ftp > dhcp-140-247-103-184.fas.harvard.edu.49344: Flags [P.], seq 295:332, ack 95, win 91, options [nop,nop,TS val 941505455 ecr 9822372], length 37
21:32:12.441030 IP dhcp-140-247-103-184.fas.harvard.edu.49344 > ftp-prod-srv04.it.su.se.ftp: Flags [.], ack 332, win 229, options [nop,nop,TS val 9822384 ecr 941505455], length 0
21:32:12.441100 IP dhcp-140-247-103-184.fas.harvard.edu.49344 > ftp-prod-srv04.it.su.se.ftp: Flags [P.], seq 95:104, ack 332, win 229, options [nop,nop,TS val 9822384 ecr 941505455], length 9
21:32:12.559803 IP ftp-prod-srv04.it.su.se.ftp > dhcp-140-247-103-184.fas.harvard.edu.49344: Flags [P.], seq 332:371, ack 104, win 91, options [nop,nop,TS val 941505485 ecr 9822384], length 39
21:32:12.593413 IP dhcp-140-247-103-184.fas.harvard.edu.49344 > ftp-prod-srv04.it.su.se.ftp: Flags [.], ack 371, win 229, options [nop,nop,TS val 9822400 ecr 941505485], length 0
21:32:12.716831 IP ftp-prod-srv04.it.su.se.ftp > dhcp-140-247-103-184.fas.harvard.edu.49344: Flags [P.], seq 371:395, ack 104, win 91, options [nop,nop,TS val 941505524 ecr 9822400], length 24
21:32:12.716880 IP dhcp-140-247-103-184.fas.harvard.edu.49344 > ftp-prod-srv04.it.su.se.ftp: Flags [.], ack 395, win 229, options [nop,nop,TS val 9822412 ecr 941505524], length 0
21:32:12.716970 IP dhcp-140-247-103-184.fas.harvard.edu.49344 > ftp-prod-srv04.it.su.se.ftp: Flags [P.], seq 104:110, ack 395, win 229, options [nop,nop,TS val 9822412 ecr 941505524], length 6
21:32:12.836304 IP ftp-prod-srv04.it.su.se.ftp > dhcp-140-247-103-184.fas.harvard.edu.49344: Flags [P.], seq 395:409, ack 110, win 91, options [nop,nop,TS val 941505553 ecr 9822412], length 14
21:32:12.836331 IP ftp-prod-srv04.it.su.se.ftp > dhcp-140-247-103-184.fas.harvard.edu.49344: Flags [F.], seq 409, ack 110, win 91, options [nop,nop,TS val 941505553 ecr 9822412], length 0
21:32:12.836410 IP dhcp-140-247-103-184.fas.harvard.edu.49344 > ftp-prod-srv04.it.su.se.ftp: Flags [F.], seq 110, ack 410, win 229, options [nop,nop,TS val 9822424 ecr 941505553], length 0
21:32:12.954312 IP ftp-prod-srv04.it.su.se.ftp > dhcp-140-247-103-184.fas.harvard.edu.49344: Flags [.], ack 111, win 91, options [nop,nop,TS val 941505583 ecr 9822424], length 0
21:32:14.131073 IP dhcp-140-247-103-184.fas.harvard.edu.49347 > ftp-prod-srv04.it.su.se.ftp: Flags [S], seq 813993249, win 14600, options [mss 1460,sackOK,TS val 9822553 ecr 0,nop,wscale 6], length 0
21:32:14.252649 IP ftp-prod-srv04.it.su.se.ftp > dhcp-140-247-103-184.fas.harvard.edu.49347: Flags [S.], seq 2495533068, ack 813993250, win 5792, options [mss 1380,sackOK,TS val 941505908 ecr 9822553,nop,wscale 6], length 0
21:32:14.252684 IP dhcp-140-247-103-184.fas.harvard.edu.49347 > ftp-prod-srv04.it.su.se.ftp: Flags [.], ack 1, win 229, options [nop,nop,TS val 9822565 ecr 941505908], length 0
21:32:14.384859 IP ftp-prod-srv04.it.su.se.ftp > dhcp-140-247-103-184.fas.harvard.edu.49347: Flags [P.], seq 1:48, ack 1, win 91, options [nop,nop,TS val 941505941 ecr 9822565], length 47
21:32:14.384880 IP dhcp-140-247-103-184.fas.harvard.edu.49347 > ftp-prod-srv04.it.su.se.ftp: Flags [.], ack 48, win 229, options [nop,nop,TS val 9822579 ecr 941505941], length 0
21:32:14.385000 IP dhcp-140-247-103-184.fas.harvard.edu.49347 > ftp-prod-srv04.it.su.se.ftp: Flags [P.], seq 1:17, ack 48, win 229, options [nop,nop,TS val 9822579 ecr 941505941], length 16
21:32:14.503506 IP ftp-prod-srv04.it.su.se.ftp > dhcp-140-247-103-184.fas.harvard.edu.49347: Flags [.], ack 17, win 91, options [nop,nop,TS val 941505970 ecr 9822579], length 0
21:32:14.503525 IP ftp-prod-srv04.it.su.se.ftp > dhcp-140-247-103-184.fas.harvard.edu.49347: Flags [P.], seq 48:82, ack 17, win 91, options [nop,nop,TS val 941505970 ecr 9822579], length 34
21:32:14.503645 IP dhcp-140-247-103-184.fas.harvard.edu.49347 > ftp-prod-srv04.it.su.se.ftp: Flags [P.], seq 17:42, ack 82, win 229, options [nop,nop,TS val 9822591 ecr 941505970], length 25
21:32:14.624019 IP ftp-prod-srv04.it.su.se.ftp > dhcp-140-247-103-184.fas.harvard.edu.49347: Flags [P.], seq 82:105, ack 42, win 91, options [nop,nop,TS val 941506000 ecr 9822591], length 23
21:32:14.624170 IP dhcp-140-247-103-184.fas.harvard.edu.49347 > ftp-prod-srv04.it.su.se.ftp: Flags [P.], seq 42:48, ack 105, win 229, options [nop,nop,TS val 9822603 ecr 941506000], length 6
21:32:14.742295 IP ftp-prod-srv04.it.su.se.ftp > dhcp-140-247-103-184.fas.harvard.edu.49347: Flags [P.], seq 105:124, ack 48, win 91, options [nop,nop,TS val 941506030 ecr 9822603], length 19
21:32:14.742422 IP dhcp-140-247-103-184.fas.harvard.edu.49347 > ftp-prod-srv04.it.su.se.ftp: Flags [P.], seq 48:53, ack 124, win 229, options [nop,nop,TS val 9822614 ecr 941506030], length 5
21:32:14.860537 IP ftp-prod-srv04.it.su.se.ftp > dhcp-140-247-103-184.fas.harvard.edu.49347: Flags [P.], seq 124:133, ack 53, win 91, options [nop,nop,TS val 941506060 ecr 9822614], length 9
21:32:14.860675 IP dhcp-140-247-103-184.fas.harvard.edu.49347 > ftp-prod-srv04.it.su.se.ftp: Flags [P.], seq 53:61, ack 133, win 229, options [nop,nop,TS val 9822626 ecr 941506060], length 8
21:32:14.979164 IP ftp-prod-srv04.it.su.se.ftp > dhcp-140-247-103-184.fas.harvard.edu.49347: Flags [P.], seq 133:164, ack 61, win 91, options [nop,nop,TS val 941506089 ecr 9822626], length 31
21:32:14.979303 IP dhcp-140-247-103-184.fas.harvard.edu.49347 > ftp-prod-srv04.it.su.se.ftp: Flags [P.], seq 61:67, ack 164, win 229, options [nop,nop,TS val 9822638 ecr 941506089], length 6
21:32:15.100351 IP ftp-prod-srv04.it.su.se.ftp > dhcp-140-247-103-184.fas.harvard.edu.49347: Flags [P.], seq 164:214, ack 67, win 91, options [nop,nop,TS val 941506119 ecr 9822638], length 50
21:32:15.133438 IP dhcp-140-247-103-184.fas.harvard.edu.49347 > ftp-prod-srv04.it.su.se.ftp: Flags [.], ack 214, win 229, options [nop,nop,TS val 9822654 ecr 941506119], length 0
21:32:15.221189 IP dhcp-140-247-103-184.fas.harvard.edu.49347 > ftp-prod-srv04.it.su.se.ftp: Flags [P.], seq 67:90, ack 214, win 229, options [nop,nop,TS val 9822662 ecr 941506119], length 23
21:32:15.339253 IP ftp-prod-srv04.it.su.se.ftp > dhcp-140-247-103-184.fas.harvard.edu.49347: Flags [P.], seq 214:244, ack 90, win 91, options [nop,nop,TS val 941506179 ecr 9822662], length 30
21:32:15.339270 IP dhcp-140-247-103-184.fas.harvard.edu.49347 > ftp-prod-srv04.it.su.se.ftp: Flags [.], ack 244, win 229, options [nop,nop,TS val 9822674 ecr 941506179], length 0
21:32:15.339388 IP dhcp-140-247-103-184.fas.harvard.edu.49347 > ftp-prod-srv04.it.su.se.ftp: Flags [P.], seq 90:96, ack 244, win 229, options [nop,nop,TS val 9822674 ecr 941506179], length 6
21:32:15.461803 IP ftp-prod-srv04.it.su.se.ftp > dhcp-140-247-103-184.fas.harvard.edu.49347: Flags [P.], seq 244:295, ack 96, win 91, options [nop,nop,TS val 941506209 ecr 9822674], length 51
21:32:15.493453 IP dhcp-140-247-103-184.fas.harvard.edu.49347 > ftp-prod-srv04.it.su.se.ftp: Flags [.], ack 295, win 229, options [nop,nop,TS val 9822690 ecr 941506209], length 0
21:32:15.576758 IP dhcp-140-247-103-184.fas.harvard.edu.49347 > ftp-prod-srv04.it.su.se.ftp: Flags [P.], seq 96:119, ack 295, win 229, options [nop,nop,TS val 9822698 ecr 941506209], length 23
21:32:15.698486 IP ftp-prod-srv04.it.su.se.ftp > dhcp-140-247-103-184.fas.harvard.edu.49347: Flags [P.], seq 295:332, ack 119, win 91, options [nop,nop,TS val 941506269 ecr 9822698], length 37
21:32:15.698590 IP dhcp-140-247-103-184.fas.harvard.edu.49347 > ftp-prod-srv04.it.su.se.ftp: Flags [.], ack 332, win 229, options [nop,nop,TS val 9822710 ecr 941506269], length 0
21:32:15.698630 IP dhcp-140-247-103-184.fas.harvard.edu.49347 > ftp-prod-srv04.it.su.se.ftp: Flags [P.], seq 119:128, ack 332, win 229, options [nop,nop,TS val 9822710 ecr 941506269], length 9
21:32:15.817267 IP ftp-prod-srv04.it.su.se.ftp > dhcp-140-247-103-184.fas.harvard.edu.49347: Flags [P.], seq 332:371, ack 128, win 91, options [nop,nop,TS val 941506299 ecr 9822710], length 39
21:32:15.839629 IP dhcp-140-247-103-184.fas.harvard.edu.49347 > ftp-prod-srv04.it.su.se.ftp: Flags [F.], seq 128, ack 371, win 229, options [nop,nop,TS val 9822724 ecr 941506299], length 0
21:32:15.953418 IP ftp-prod-srv04.it.su.se.ftp > dhcp-140-247-103-184.fas.harvard.edu.49347: Flags [P.], seq 371:395, ack 128, win 91, options [nop,nop,TS val 941506333 ecr 9822710], length 24
21:32:15.953443 IP dhcp-140-247-103-184.fas.harvard.edu.49347 > ftp-prod-srv04.it.su.se.ftp: Flags [R], seq 813993377, win 0, length 0
21:32:18.191811 IP dhcp-140-247-103-184.fas.harvard.edu.49350 > ftp-prod-srv04.it.su.se.ftp: Flags [S], seq 4264925035, win 14600, options [mss 1460,sackOK,TS val 9822959 ecr 0,nop,wscale 6], length 0
21:32:18.310815 IP ftp-prod-srv04.it.su.se.ftp > dhcp-140-247-103-184.fas.harvard.edu.49350: Flags [S.], seq 1574536933, ack 4264925036, win 5792, options [mss 1380,sackOK,TS val 941506922 ecr 9822959,nop,wscale 6], length 0
21:32:18.310851 IP dhcp-140-247-103-184.fas.harvard.edu.49350 > ftp-prod-srv04.it.su.se.ftp: Flags [.], ack 1, win 229, options [nop,nop,TS val 9822971 ecr 941506922], length 0
21:32:18.431244 IP ftp-prod-srv04.it.su.se.ftp > dhcp-140-247-103-184.fas.harvard.edu.49350: Flags [P.], seq 1:48, ack 1, win 91, options [nop,nop,TS val 941506952 ecr 9822971], length 47
21:32:18.431271 IP dhcp-140-247-103-184.fas.harvard.edu.49350 > ftp-prod-srv04.it.su.se.ftp: Flags [.], ack 48, win 229, options [nop,nop,TS val 9822983 ecr 941506952], length 0
21:32:18.431383 IP dhcp-140-247-103-184.fas.harvard.edu.49350 > ftp-prod-srv04.it.su.se.ftp: Flags [P.], seq 1:17, ack 48, win 229, options [nop,nop,TS val 9822983 ecr 941506952], length 16
21:32:18.546397 IP ftp-prod-srv04.it.su.se.ftp > dhcp-140-247-103-184.fas.harvard.edu.49350: Flags [.], ack 17, win 91, options [nop,nop,TS val 941506981 ecr 9822983], length 0
21:32:18.546511 IP ftp-prod-srv04.it.su.se.ftp > dhcp-140-247-103-184.fas.harvard.edu.49350: Flags [P.], seq 48:82, ack 17, win 91, options [nop,nop,TS val 941506981 ecr 9822983], length 34
21:32:18.546624 IP dhcp-140-247-103-184.fas.harvard.edu.49350 > ftp-prod-srv04.it.su.se.ftp: Flags [P.], seq 17:42, ack 82, win 229, options [nop,nop,TS val 9822995 ecr 941506981], length 25
21:32:18.661561 IP ftp-prod-srv04.it.su.se.ftp > dhcp-140-247-103-184.fas.harvard.edu.49350: Flags [P.], seq 82:105, ack 42, win 91, options [nop,nop,TS val 941507010 ecr 9822995], length 23
21:32:18.661717 IP dhcp-140-247-103-184.fas.harvard.edu.49350 > ftp-prod-srv04.it.su.se.ftp: Flags [P.], seq 42:48, ack 105, win 229, options [nop,nop,TS val 9823006 ecr 941507010], length 6
21:32:18.776411 IP ftp-prod-srv04.it.su.se.ftp > dhcp-140-247-103-184.fas.harvard.edu.49350: Flags [P.], seq 105:124, ack 48, win 91, options [nop,nop,TS val 941507039 ecr 9823006], length 19
21:32:18.776505 IP dhcp-140-247-103-184.fas.harvard.edu.49350 > ftp-prod-srv04.it.su.se.ftp: Flags [P.], seq 48:53, ack 124, win 229, options [nop,nop,TS val 9823018 ecr 941507039], length 5
21:32:18.891535 IP ftp-prod-srv04.it.su.se.ftp > dhcp-140-247-103-184.fas.harvard.edu.49350: Flags [P.], seq 124:133, ack 53, win 91, options [nop,nop,TS val 941507067 ecr 9823018], length 9
21:32:18.891653 IP dhcp-140-247-103-184.fas.harvard.edu.49350 > ftp-prod-srv04.it.su.se.ftp: Flags [P.], seq 53:61, ack 133, win 229, options [nop,nop,TS val 9823029 ecr 941507067], length 8
21:32:19.006552 IP ftp-prod-srv04.it.su.se.ftp > dhcp-140-247-103-184.fas.harvard.edu.49350: Flags [P.], seq 133:164, ack 61, win 91, options [nop,nop,TS val 941507096 ecr 9823029], length 31
21:32:19.006811 IP dhcp-140-247-103-184.fas.harvard.edu.49350 > ftp-prod-srv04.it.su.se.ftp: Flags [P.], seq 61:67, ack 164, win 229, options [nop,nop,TS val 9823041 ecr 941507096], length 6
21:32:19.121658 IP ftp-prod-srv04.it.su.se.ftp > dhcp-140-247-103-184.fas.harvard.edu.49350: Flags [P.], seq 164:215, ack 67, win 91, options [nop,nop,TS val 941507125 ecr 9823041], length 51
21:32:19.153413 IP dhcp-140-247-103-184.fas.harvard.edu.49350 > ftp-prod-srv04.it.su.se.ftp: Flags [.], ack 215, win 229, options [nop,nop,TS val 9823056 ecr 941507125], length 0
21:32:19.241521 IP dhcp-140-247-103-184.fas.harvard.edu.49350 > ftp-prod-srv04.it.su.se.ftp: Flags [P.], seq 67:129, ack 215, win 229, options [nop,nop,TS val 9823064 ecr 941507125], length 62
21:32:19.357680 IP ftp-prod-srv04.it.su.se.ftp > dhcp-140-247-103-184.fas.harvard.edu.49350: Flags [P.], seq 215:227, ack 129, win 91, options [nop,nop,TS val 941507184 ecr 9823064], length 12
21:32:19.357698 IP dhcp-140-247-103-184.fas.harvard.edu.49350 > ftp-prod-srv04.it.su.se.ftp: Flags [.], ack 227, win 229, options [nop,nop,TS val 9823076 ecr 941507184], length 0
21:32:19.357826 IP dhcp-140-247-103-184.fas.harvard.edu.49350 > ftp-prod-srv04.it.su.se.ftp: Flags [P.], seq 129:190, ack 227, win 229, options [nop,nop,TS val 9823076 ecr 941507184], length 61
21:32:19.474869 IP ftp-prod-srv04.it.su.se.ftp > dhcp-140-247-103-184.fas.harvard.edu.49350: Flags [P.], seq 227:260, ack 190, win 91, options [nop,nop,TS val 941507213 ecr 9823076], length 33
21:32:19.475001 IP dhcp-140-247-103-184.fas.harvard.edu.49350 > ftp-prod-srv04.it.su.se.ftp: Flags [P.], seq 190:196, ack 260, win 229, options [nop,nop,TS val 9823088 ecr 941507213], length 6
21:32:19.590145 IP ftp-prod-srv04.it.su.se.ftp > dhcp-140-247-103-184.fas.harvard.edu.49350: Flags [P.], seq 260:311, ack 196, win 91, options [nop,nop,TS val 941507242 ecr 9823088], length 51
21:32:19.623422 IP dhcp-140-247-103-184.fas.harvard.edu.49350 > ftp-prod-srv04.it.su.se.ftp: Flags [.], ack 311, win 229, options [nop,nop,TS val 9823103 ecr 941507242], length 0
21:32:19.705636 IP dhcp-140-247-103-184.fas.harvard.edu.49350 > ftp-prod-srv04.it.su.se.ftp: Flags [P.], seq 196:258, ack 311, win 229, options [nop,nop,TS val 9823111 ecr 941507242], length 62
21:32:19.821810 IP ftp-prod-srv04.it.su.se.ftp > dhcp-140-247-103-184.fas.harvard.edu.49350: Flags [P.], seq 311:428, ack 258, win 91, options [nop,nop,TS val 941507300 ecr 9823111], length 117
21:32:19.821905 IP dhcp-140-247-103-184.fas.harvard.edu.49350 > ftp-prod-srv04.it.su.se.ftp: Flags [.], ack 428, win 229, options [nop,nop,TS val 9823122 ecr 941507300], length 0
21:32:21.980022 IP ftp-prod-srv04.it.su.se.ftp > dhcp-140-247-103-184.fas.harvard.edu.49350: Flags [P.], seq 428:452, ack 258, win 91, options [nop,nop,TS val 941507840 ecr 9823122], length 24
21:32:21.980038 IP dhcp-140-247-103-184.fas.harvard.edu.49350 > ftp-prod-srv04.it.su.se.ftp: Flags [.], ack 452, win 229, options [nop,nop,TS val 9823338 ecr 941507840], length 0
21:32:21.980140 IP dhcp-140-247-103-184.fas.harvard.edu.49350 > ftp-prod-srv04.it.su.se.ftp: Flags [P.], seq 258:264, ack 452, win 229, options [nop,nop,TS val 9823338 ecr 941507840], length 6
21:32:22.094442 IP ftp-prod-srv04.it.su.se.ftp > dhcp-140-247-103-184.fas.harvard.edu.49350: Flags [P.], seq 452:466, ack 264, win 91, options [nop,nop,TS val 941507868 ecr 9823338], length 14
21:32:22.094466 IP ftp-prod-srv04.it.su.se.ftp > dhcp-140-247-103-184.fas.harvard.edu.49350: Flags [F.], seq 466, ack 264, win 91, options [nop,nop,TS val 941507868 ecr 9823338], length 0
21:32:22.094581 IP dhcp-140-247-103-184.fas.harvard.edu.49350 > ftp-prod-srv04.it.su.se.ftp: Flags [F.], seq 264, ack 467, win 229, options [nop,nop,TS val 9823350 ecr 941507868], length 0
21:32:22.208767 IP ftp-prod-srv04.it.su.se.ftp > dhcp-140-247-103-184.fas.harvard.edu.49350: Flags [.], ack 265, win 91, options [nop,nop,TS val 941507897 ecr 9823350], length 0
21:32:23.556985 IP dhcp-140-247-103-184.fas.harvard.edu.49353 > ftp-prod-srv04.it.su.se.ftp: Flags [S], seq 1735541447, win 14600, options [mss 1460,sackOK,TS val 9823496 ecr 0,nop,wscale 6], length 0
21:32:23.673281 IP ftp-prod-srv04.it.su.se.ftp > dhcp-140-247-103-184.fas.harvard.edu.49353: Flags [S.], seq 3268374694, ack 1735541448, win 5792, options [mss 1380,sackOK,TS val 941508263 ecr 9823496,nop,wscale 6], length 0
21:32:23.673318 IP dhcp-140-247-103-184.fas.harvard.edu.49353 > ftp-prod-srv04.it.su.se.ftp: Flags [.], ack 1, win 229, options [nop,nop,TS val 9823507 ecr 941508263], length 0
21:32:23.793614 IP ftp-prod-srv04.it.su.se.ftp > dhcp-140-247-103-184.fas.harvard.edu.49353: Flags [P.], seq 1:48, ack 1, win 91, options [nop,nop,TS val 941508293 ecr 9823507], length 47
21:32:23.793642 IP dhcp-140-247-103-184.fas.harvard.edu.49353 > ftp-prod-srv04.it.su.se.ftp: Flags [.], ack 48, win 229, options [nop,nop,TS val 9823520 ecr 941508293], length 0
21:32:23.793775 IP dhcp-140-247-103-184.fas.harvard.edu.49353 > ftp-prod-srv04.it.su.se.ftp: Flags [P.], seq 1:17, ack 48, win 229, options [nop,nop,TS val 9823520 ecr 941508293], length 16
21:32:23.908030 IP ftp-prod-srv04.it.su.se.ftp > dhcp-140-247-103-184.fas.harvard.edu.49353: Flags [.], ack 17, win 91, options [nop,nop,TS val 941508322 ecr 9823520], length 0
21:32:23.908664 IP ftp-prod-srv04.it.su.se.ftp > dhcp-140-247-103-184.fas.harvard.edu.49353: Flags [P.], seq 48:82, ack 17, win 91, options [nop,nop,TS val 941508322 ecr 9823520], length 34
21:32:23.908804 IP dhcp-140-247-103-184.fas.harvard.edu.49353 > ftp-prod-srv04.it.su.se.ftp: Flags [P.], seq 17:42, ack 82, win 229, options [nop,nop,TS val 9823531 ecr 941508322], length 25
21:32:24.024659 IP ftp-prod-srv04.it.su.se.ftp > dhcp-140-247-103-184.fas.harvard.edu.49353: Flags [P.], seq 82:105, ack 42, win 91, options [nop,nop,TS val 941508351 ecr 9823531], length 23
21:32:24.024800 IP dhcp-140-247-103-184.fas.harvard.edu.49353 > ftp-prod-srv04.it.su.se.ftp: Flags [P.], seq 42:48, ack 105, win 229, options [nop,nop,TS val 9823543 ecr 941508351], length 6
21:32:24.139754 IP ftp-prod-srv04.it.su.se.ftp > dhcp-140-247-103-184.fas.harvard.edu.49353: Flags [P.], seq 105:124, ack 48, win 91, options [nop,nop,TS val 941508380 ecr 9823543], length 19
21:32:24.139912 IP dhcp-140-247-103-184.fas.harvard.edu.49353 > ftp-prod-srv04.it.su.se.ftp: Flags [P.], seq 48:53, ack 124, win 229, options [nop,nop,TS val 9823554 ecr 941508380], length 5
21:32:24.253938 IP ftp-prod-srv04.it.su.se.ftp > dhcp-140-247-103-184.fas.harvard.edu.49353: Flags [P.], seq 124:133, ack 53, win 91, options [nop,nop,TS val 941508408 ecr 9823554], length 9
21:32:24.254077 IP dhcp-140-247-103-184.fas.harvard.edu.49353 > ftp-prod-srv04.it.su.se.ftp: Flags [P.], seq 53:61, ack 133, win 229, options [nop,nop,TS val 9823566 ecr 941508408], length 8
21:32:24.369023 IP ftp-prod-srv04.it.su.se.ftp > dhcp-140-247-103-184.fas.harvard.edu.49353: Flags [P.], seq 133:164, ack 61, win 91, options [nop,nop,TS val 941508437 ecr 9823566], length 31
21:32:24.369183 IP dhcp-140-247-103-184.fas.harvard.edu.49353 > ftp-prod-srv04.it.su.se.ftp: Flags [P.], seq 61:67, ack 164, win 229, options [nop,nop,TS val 9823577 ecr 941508437], length 6
21:32:24.484893 IP ftp-prod-srv04.it.su.se.ftp > dhcp-140-247-103-184.fas.harvard.edu.49353: Flags [P.], seq 164:214, ack 67, win 91, options [nop,nop,TS val 941508466 ecr 9823577], length 50
21:32:24.523451 IP dhcp-140-247-103-184.fas.harvard.edu.49353 > ftp-prod-srv04.it.su.se.ftp: Flags [.], ack 214, win 229, options [nop,nop,TS val 9823593 ecr 941508466], length 0
21:32:24.599531 IP dhcp-140-247-103-184.fas.harvard.edu.49353 > ftp-prod-srv04.it.su.se.ftp: Flags [P.], seq 67:78, ack 214, win 229, options [nop,nop,TS val 9823600 ecr 941508466], length 11
21:32:24.716476 IP ftp-prod-srv04.it.su.se.ftp > dhcp-140-247-103-184.fas.harvard.edu.49353: Flags [P.], seq 214:244, ack 78, win 91, options [nop,nop,TS val 941508524 ecr 9823600], length 30
21:32:24.716505 IP dhcp-140-247-103-184.fas.harvard.edu.49353 > ftp-prod-srv04.it.su.se.ftp: Flags [.], ack 244, win 229, options [nop,nop,TS val 9823612 ecr 941508524], length 0
21:32:24.716657 IP dhcp-140-247-103-184.fas.harvard.edu.49353 > ftp-prod-srv04.it.su.se.ftp: Flags [P.], seq 78:84, ack 244, win 229, options [nop,nop,TS val 9823612 ecr 941508524], length 6
21:32:24.831177 IP ftp-prod-srv04.it.su.se.ftp > dhcp-140-247-103-184.fas.harvard.edu.49353: Flags [P.], seq 244:293, ack 84, win 91, options [nop,nop,TS val 941508552 ecr 9823612], length 49
21:32:24.863412 IP dhcp-140-247-103-184.fas.harvard.edu.49353 > ftp-prod-srv04.it.su.se.ftp: Flags [.], ack 293, win 229, options [nop,nop,TS val 9823627 ecr 941508552], length 0
21:32:24.950836 IP dhcp-140-247-103-184.fas.harvard.edu.49353 > ftp-prod-srv04.it.su.se.ftp: Flags [P.], seq 84:95, ack 293, win 229, options [nop,nop,TS val 9823635 ecr 941508552], length 11
21:32:25.066555 IP ftp-prod-srv04.it.su.se.ftp > dhcp-140-247-103-184.fas.harvard.edu.49353: Flags [P.], seq 293:330, ack 95, win 91, options [nop,nop,TS val 941508611 ecr 9823635], length 37
21:32:25.066667 IP dhcp-140-247-103-184.fas.harvard.edu.49353 > ftp-prod-srv04.it.su.se.ftp: Flags [.], ack 330, win 229, options [nop,nop,TS val 9823647 ecr 941508611], length 0
21:32:25.066725 IP dhcp-140-247-103-184.fas.harvard.edu.49353 > ftp-prod-srv04.it.su.se.ftp: Flags [P.], seq 95:104, ack 330, win 229, options [nop,nop,TS val 9823647 ecr 941508611], length 9
21:32:25.181929 IP ftp-prod-srv04.it.su.se.ftp > dhcp-140-247-103-184.fas.harvard.edu.49353: Flags [P.], seq 330:369, ack 104, win 91, options [nop,nop,TS val 941508640 ecr 9823647], length 39
21:32:25.213390 IP dhcp-140-247-103-184.fas.harvard.edu.49353 > ftp-prod-srv04.it.su.se.ftp: Flags [.], ack 369, win 229, options [nop,nop,TS val 9823662 ecr 941508640], length 0
21:32:25.298690 IP ftp-prod-srv04.it.su.se.ftp > dhcp-140-247-103-184.fas.harvard.edu.49353: Flags [P.], seq 369:393, ack 104, win 91, options [nop,nop,TS val 941508669 ecr 9823647], length 24
21:32:25.298771 IP dhcp-140-247-103-184.fas.harvard.edu.49353 > ftp-prod-srv04.it.su.se.ftp: Flags [.], ack 393, win 229, options [nop,nop,TS val 9823670 ecr 941508669], length 0
21:32:25.298832 IP dhcp-140-247-103-184.fas.harvard.edu.49353 > ftp-prod-srv04.it.su.se.ftp: Flags [P.], seq 104:110, ack 393, win 229, options [nop,nop,TS val 9823670 ecr 941508669], length 6
21:32:25.415587 IP ftp-prod-srv04.it.su.se.ftp > dhcp-140-247-103-184.fas.harvard.edu.49353: Flags [P.], seq 393:407, ack 110, win 91, options [nop,nop,TS val 941508699 ecr 9823670], length 14
21:32:25.415611 IP ftp-prod-srv04.it.su.se.ftp > dhcp-140-247-103-184.fas.harvard.edu.49353: Flags [F.], seq 407, ack 110, win 91, options [nop,nop,TS val 941508699 ecr 9823670], length 0
21:32:25.415694 IP dhcp-140-247-103-184.fas.harvard.edu.49353 > ftp-prod-srv04.it.su.se.ftp: Flags [F.], seq 110, ack 408, win 229, options [nop,nop,TS val 9823682 ecr 941508699], length 0
21:32:25.530271 IP ftp-prod-srv04.it.su.se.ftp > dhcp-140-247-103-184.fas.harvard.edu.49353: Flags [.], ack 111, win 91, options [nop,nop,TS val 941508727 ecr 9823682], length 0
21:32:27.518248 IP dhcp-140-247-103-184.fas.harvard.edu.49356 > ftp-prod-srv04.it.su.se.ftp: Flags [S], seq 958676178, win 14600, options [mss 1460,sackOK,TS val 9823892 ecr 0,nop,wscale 6], length 0
21:32:27.632193 IP ftp-prod-srv04.it.su.se.ftp > dhcp-140-247-103-184.fas.harvard.edu.49356: Flags [S.], seq 4214957717, ack 958676179, win 5792, options [mss 1380,sackOK,TS val 941509253 ecr 9823892,nop,wscale 6], length 0
21:32:27.632224 IP dhcp-140-247-103-184.fas.harvard.edu.49356 > ftp-prod-srv04.it.su.se.ftp: Flags [.], ack 1, win 229, options [nop,nop,TS val 9823903 ecr 941509253], length 0
21:32:27.754810 IP ftp-prod-srv04.it.su.se.ftp > dhcp-140-247-103-184.fas.harvard.edu.49356: Flags [P.], seq 1:48, ack 1, win 91, options [nop,nop,TS val 941509283 ecr 9823903], length 47
21:32:27.754833 IP dhcp-140-247-103-184.fas.harvard.edu.49356 > ftp-prod-srv04.it.su.se.ftp: Flags [.], ack 48, win 229, options [nop,nop,TS val 9823916 ecr 941509283], length 0
21:32:27.755058 IP dhcp-140-247-103-184.fas.harvard.edu.49356 > ftp-prod-srv04.it.su.se.ftp: Flags [P.], seq 1:17, ack 48, win 229, options [nop,nop,TS val 9823916 ecr 941509283], length 16
21:32:27.868862 IP ftp-prod-srv04.it.su.se.ftp > dhcp-140-247-103-184.fas.harvard.edu.49356: Flags [.], ack 17, win 91, options [nop,nop,TS val 941509312 ecr 9823916], length 0
21:32:27.868880 IP ftp-prod-srv04.it.su.se.ftp > dhcp-140-247-103-184.fas.harvard.edu.49356: Flags [P.], seq 48:82, ack 17, win 91, options [nop,nop,TS val 941509312 ecr 9823916], length 34
21:32:27.869013 IP dhcp-140-247-103-184.fas.harvard.edu.49356 > ftp-prod-srv04.it.su.se.ftp: Flags [P.], seq 17:42, ack 82, win 229, options [nop,nop,TS val 9823927 ecr 941509312], length 25
21:32:27.995174 IP ftp-prod-srv04.it.su.se.ftp > dhcp-140-247-103-184.fas.harvard.edu.49356: Flags [P.], seq 82:105, ack 42, win 91, options [nop,nop,TS val 941509343 ecr 9823927], length 23
21:32:27.995331 IP dhcp-140-247-103-184.fas.harvard.edu.49356 > ftp-prod-srv04.it.su.se.ftp: Flags [P.], seq 42:48, ack 105, win 229, options [nop,nop,TS val 9823940 ecr 941509343], length 6
21:32:28.109935 IP ftp-prod-srv04.it.su.se.ftp > dhcp-140-247-103-184.fas.harvard.edu.49356: Flags [P.], seq 105:124, ack 48, win 91, options [nop,nop,TS val 941509372 ecr 9823940], length 19
21:32:28.110072 IP dhcp-140-247-103-184.fas.harvard.edu.49356 > ftp-prod-srv04.it.su.se.ftp: Flags [P.], seq 48:53, ack 124, win 229, options [nop,nop,TS val 9823951 ecr 941509372], length 5
21:32:28.224017 IP ftp-prod-srv04.it.su.se.ftp > dhcp-140-247-103-184.fas.harvard.edu.49356: Flags [P.], seq 124:133, ack 53, win 91, options [nop,nop,TS val 941509401 ecr 9823951], length 9
21:32:28.224192 IP dhcp-140-247-103-184.fas.harvard.edu.49356 > ftp-prod-srv04.it.su.se.ftp: Flags [P.], seq 53:61, ack 133, win 229, options [nop,nop,TS val 9823963 ecr 941509401], length 8
21:32:28.338227 IP ftp-prod-srv04.it.su.se.ftp > dhcp-140-247-103-184.fas.harvard.edu.49356: Flags [P.], seq 133:164, ack 61, win 91, options [nop,nop,TS val 941509429 ecr 9823963], length 31
21:32:28.338353 IP dhcp-140-247-103-184.fas.harvard.edu.49356 > ftp-prod-srv04.it.su.se.ftp: Flags [P.], seq 61:67, ack 164, win 229, options [nop,nop,TS val 9823974 ecr 941509429], length 6
21:32:28.453025 IP ftp-prod-srv04.it.su.se.ftp > dhcp-140-247-103-184.fas.harvard.edu.49356: Flags [P.], seq 164:215, ack 67, win 91, options [nop,nop,TS val 941509458 ecr 9823974], length 51
21:32:28.483409 IP dhcp-140-247-103-184.fas.harvard.edu.49356 > ftp-prod-srv04.it.su.se.ftp: Flags [.], ack 215, win 229, options [nop,nop,TS val 9823989 ecr 941509458], length 0
21:32:28.563751 IP dhcp-140-247-103-184.fas.harvard.edu.49356 > ftp-prod-srv04.it.su.se.ftp: Flags [P.], seq 67:86, ack 215, win 229, options [nop,nop,TS val 9823997 ecr 941509458], length 19
21:32:28.678614 IP ftp-prod-srv04.it.su.se.ftp > dhcp-140-247-103-184.fas.harvard.edu.49356: Flags [P.], seq 215:245, ack 86, win 91, options [nop,nop,TS val 941509514 ecr 9823997], length 30
21:32:28.678636 IP dhcp-140-247-103-184.fas.harvard.edu.49356 > ftp-prod-srv04.it.su.se.ftp: Flags [.], ack 245, win 229, options [nop,nop,TS val 9824008 ecr 941509514], length 0
21:32:28.678787 IP dhcp-140-247-103-184.fas.harvard.edu.49356 > ftp-prod-srv04.it.su.se.ftp: Flags [P.], seq 86:92, ack 245, win 229, options [nop,nop,TS val 9824008 ecr 941509514], length 6
21:32:28.793491 IP ftp-prod-srv04.it.su.se.ftp > dhcp-140-247-103-184.fas.harvard.edu.49356: Flags [P.], seq 245:294, ack 92, win 91, options [nop,nop,TS val 941509543 ecr 9824008], length 49
21:32:28.833467 IP dhcp-140-247-103-184.fas.harvard.edu.49356 > ftp-prod-srv04.it.su.se.ftp: Flags [.], ack 294, win 229, options [nop,nop,TS val 9824024 ecr 941509543], length 0
21:32:28.910391 IP dhcp-140-247-103-184.fas.harvard.edu.49356 > ftp-prod-srv04.it.su.se.ftp: Flags [P.], seq 92:111, ack 294, win 229, options [nop,nop,TS val 9824031 ecr 941509543], length 19
21:32:29.024907 IP ftp-prod-srv04.it.su.se.ftp > dhcp-140-247-103-184.fas.harvard.edu.49356: Flags [P.], seq 294:331, ack 111, win 91, options [nop,nop,TS val 941509601 ecr 9824031], length 37
21:32:29.024979 IP dhcp-140-247-103-184.fas.harvard.edu.49356 > ftp-prod-srv04.it.su.se.ftp: Flags [.], ack 331, win 229, options [nop,nop,TS val 9824043 ecr 941509601], length 0
21:32:29.025066 IP dhcp-140-247-103-184.fas.harvard.edu.49356 > ftp-prod-srv04.it.su.se.ftp: Flags [P.], seq 111:120, ack 331, win 229, options [nop,nop,TS val 9824043 ecr 941509601], length 9
21:32:29.140838 IP ftp-prod-srv04.it.su.se.ftp > dhcp-140-247-103-184.fas.harvard.edu.49356: Flags [P.], seq 331:370, ack 120, win 91, options [nop,nop,TS val 941509630 ecr 9824043], length 39
21:32:29.173416 IP dhcp-140-247-103-184.fas.harvard.edu.49356 > ftp-prod-srv04.it.su.se.ftp: Flags [.], ack 370, win 229, options [nop,nop,TS val 9824058 ecr 941509630], length 0
21:32:29.489050 IP ftp-prod-srv04.it.su.se.ftp > dhcp-140-247-103-184.fas.harvard.edu.49356: Flags [P.], seq 370:394, ack 120, win 91, options [nop,nop,TS val 941509716 ecr 9824058], length 24
21:32:29.489068 IP dhcp-140-247-103-184.fas.harvard.edu.49356 > ftp-prod-srv04.it.su.se.ftp: Flags [.], ack 394, win 229, options [nop,nop,TS val 9824089 ecr 941509716], length 0
21:32:29.489163 IP dhcp-140-247-103-184.fas.harvard.edu.49356 > ftp-prod-srv04.it.su.se.ftp: Flags [P.], seq 120:126, ack 394, win 229, options [nop,nop,TS val 9824089 ecr 941509716], length 6
21:32:29.604628 IP ftp-prod-srv04.it.su.se.ftp > dhcp-140-247-103-184.fas.harvard.edu.49356: Flags [P.], seq 394:408, ack 126, win 91, options [nop,nop,TS val 941509746 ecr 9824089], length 14
21:32:29.604784 IP dhcp-140-247-103-184.fas.harvard.edu.49356 > ftp-prod-srv04.it.su.se.ftp: Flags [F.], seq 126, ack 408, win 229, options [nop,nop,TS val 9824101 ecr 941509746], length 0
21:32:29.604930 IP ftp-prod-srv04.it.su.se.ftp > dhcp-140-247-103-184.fas.harvard.edu.49356: Flags [F.], seq 408, ack 126, win 91, options [nop,nop,TS val 941509746 ecr 9824089], length 0
21:32:29.604945 IP dhcp-140-247-103-184.fas.harvard.edu.49356 > ftp-prod-srv04.it.su.se.ftp: Flags [.], ack 409, win 229, options [nop,nop,TS val 9824101 ecr 941509746], length 0
21:32:29.719075 IP ftp-prod-srv04.it.su.se.ftp > dhcp-140-247-103-184.fas.harvard.edu.49356: Flags [.], ack 127, win 91, options [nop,nop,TS val 941509774 ecr 9824101], length 0
21:32:30.619146 IP dhcp-140-247-103-184.fas.harvard.edu.49359 > ftp-prod-srv04.it.su.se.ftp: Flags [S], seq 3828284525, win 14600, options [mss 1460,sackOK,TS val 9824202 ecr 0,nop,wscale 6], length 0
21:32:30.737522 IP ftp-prod-srv04.it.su.se.ftp > dhcp-140-247-103-184.fas.harvard.edu.49359: Flags [S.], seq 1886781765, ack 3828284526, win 5792, options [mss 1380,sackOK,TS val 941510029 ecr 9824202,nop,wscale 6], length 0
21:32:30.737553 IP dhcp-140-247-103-184.fas.harvard.edu.49359 > ftp-prod-srv04.it.su.se.ftp: Flags [.], ack 1, win 229, options [nop,nop,TS val 9824214 ecr 941510029], length 0
21:32:30.869793 IP ftp-prod-srv04.it.su.se.ftp > dhcp-140-247-103-184.fas.harvard.edu.49359: Flags [P.], seq 1:48, ack 1, win 91, options [nop,nop,TS val 941510061 ecr 9824214], length 47
21:32:30.869820 IP dhcp-140-247-103-184.fas.harvard.edu.49359 > ftp-prod-srv04.it.su.se.ftp: Flags [.], ack 48, win 229, options [nop,nop,TS val 9824227 ecr 941510061], length 0
21:32:30.869928 IP dhcp-140-247-103-184.fas.harvard.edu.49359 > ftp-prod-srv04.it.su.se.ftp: Flags [P.], seq 1:17, ack 48, win 229, options [nop,nop,TS val 9824227 ecr 941510061], length 16
21:32:30.989205 IP ftp-prod-srv04.it.su.se.ftp > dhcp-140-247-103-184.fas.harvard.edu.49359: Flags [.], ack 17, win 91, options [nop,nop,TS val 941510092 ecr 9824227], length 0
21:32:30.989226 IP ftp-prod-srv04.it.su.se.ftp > dhcp-140-247-103-184.fas.harvard.edu.49359: Flags [P.], seq 48:82, ack 17, win 91, options [nop,nop,TS val 941510092 ecr 9824227], length 34
21:32:30.989235 IP ftp-prod-srv04.it.su.se.ftp > dhcp-140-247-103-184.fas.harvard.edu.49359: Flags [.], ack 17, win 91, options [nop,nop,TS val 941510092 ecr 9824227], length 0
21:32:30.989338 IP dhcp-140-247-103-184.fas.harvard.edu.49359 > ftp-prod-srv04.it.su.se.ftp: Flags [P.], seq 17:42, ack 82, win 229, options [nop,nop,TS val 9824239 ecr 941510092], length 25
21:32:31.109595 IP ftp-prod-srv04.it.su.se.ftp > dhcp-140-247-103-184.fas.harvard.edu.49359: Flags [P.], seq 82:105, ack 42, win 91, options [nop,nop,TS val 941510122 ecr 9824239], length 23
21:32:31.109744 IP dhcp-140-247-103-184.fas.harvard.edu.49359 > ftp-prod-srv04.it.su.se.ftp: Flags [P.], seq 42:48, ack 105, win 229, options [nop,nop,TS val 9824251 ecr 941510122], length 6
21:32:31.227905 IP ftp-prod-srv04.it.su.se.ftp > dhcp-140-247-103-184.fas.harvard.edu.49359: Flags [P.], seq 105:124, ack 48, win 91, options [nop,nop,TS val 941510152 ecr 9824251], length 19
21:32:31.228082 IP dhcp-140-247-103-184.fas.harvard.edu.49359 > ftp-prod-srv04.it.su.se.ftp: Flags [P.], seq 48:53, ack 124, win 229, options [nop,nop,TS val 9824263 ecr 941510152], length 5
21:32:31.346264 IP ftp-prod-srv04.it.su.se.ftp > dhcp-140-247-103-184.fas.harvard.edu.49359: Flags [P.], seq 124:133, ack 53, win 91, options [nop,nop,TS val 941510181 ecr 9824263], length 9
21:32:31.346394 IP dhcp-140-247-103-184.fas.harvard.edu.49359 > ftp-prod-srv04.it.su.se.ftp: Flags [P.], seq 53:61, ack 133, win 229, options [nop,nop,TS val 9824275 ecr 941510181], length 8
21:32:31.464497 IP ftp-prod-srv04.it.su.se.ftp > dhcp-140-247-103-184.fas.harvard.edu.49359: Flags [P.], seq 133:164, ack 61, win 91, options [nop,nop,TS val 941510211 ecr 9824275], length 31
21:32:31.464614 IP dhcp-140-247-103-184.fas.harvard.edu.49359 > ftp-prod-srv04.it.su.se.ftp: Flags [P.], seq 61:67, ack 164, win 229, options [nop,nop,TS val 9824287 ecr 941510211], length 6
21:32:31.584582 IP ftp-prod-srv04.it.su.se.ftp > dhcp-140-247-103-184.fas.harvard.edu.49359: Flags [P.], seq 164:215, ack 67, win 91, options [nop,nop,TS val 941510241 ecr 9824287], length 51
21:32:31.623403 IP dhcp-140-247-103-184.fas.harvard.edu.49359 > ftp-prod-srv04.it.su.se.ftp: Flags [.], ack 215, win 229, options [nop,nop,TS val 9824303 ecr 941510241], length 0
21:32:31.695785 IP dhcp-140-247-103-184.fas.harvard.edu.49359 > ftp-prod-srv04.it.su.se.ftp: Flags [P.], seq 67:97, ack 215, win 229, options [nop,nop,TS val 9824310 ecr 941510241], length 30
21:32:31.816545 IP ftp-prod-srv04.it.su.se.ftp > dhcp-140-247-103-184.fas.harvard.edu.49359: Flags [P.], seq 215:245, ack 97, win 91, options [nop,nop,TS val 941510298 ecr 9824310], length 30
21:32:31.816569 IP dhcp-140-247-103-184.fas.harvard.edu.49359 > ftp-prod-srv04.it.su.se.ftp: Flags [.], ack 245, win 229, options [nop,nop,TS val 9824322 ecr 941510298], length 0
21:32:31.816675 IP dhcp-140-247-103-184.fas.harvard.edu.49359 > ftp-prod-srv04.it.su.se.ftp: Flags [P.], seq 97:103, ack 245, win 229, options [nop,nop,TS val 9824322 ecr 941510298], length 6
21:32:31.935263 IP ftp-prod-srv04.it.su.se.ftp > dhcp-140-247-103-184.fas.harvard.edu.49359: Flags [P.], seq 245:296, ack 103, win 91, options [nop,nop,TS val 941510328 ecr 9824322], length 51
21:32:31.973436 IP dhcp-140-247-103-184.fas.harvard.edu.49359 > ftp-prod-srv04.it.su.se.ftp: Flags [.], ack 296, win 229, options [nop,nop,TS val 9824338 ecr 941510328], length 0
