22:46:34.435154 IP raspoutine.rezel.enst.fr.ssh > dhcp-140-247-103-184.fas.harvard.edu.44259: Flags [P.], seq 2280019991:2280020087, ack 525702911, win 435, options [nop,nop,TS val 143184469 ecr 10268432], length 96
22:46:34.435176 IP dhcp-140-247-103-184.fas.harvard.edu.44259 > raspoutine.rezel.enst.fr.ssh: Flags [.], ack 96, win 661, options [nop,nop,TS val 10268584 ecr 143184469], length 0
22:46:35.743761 IP dhcp-140-247-103-184.fas.harvard.edu.44259 > raspoutine.rezel.enst.fr.ssh: Flags [P.], seq 1:49, ack 96, win 661, options [nop,nop,TS val 10268715 ecr 143184469], length 48
22:46:35.849464 IP raspoutine.rezel.enst.fr.ssh > dhcp-140-247-103-184.fas.harvard.edu.44259: Flags [P.], seq 96:144, ack 49, win 435, options [nop,nop,TS val 143184823 ecr 10268715], length 48
22:46:35.849492 IP dhcp-140-247-103-184.fas.harvard.edu.44259 > raspoutine.rezel.enst.fr.ssh: Flags [.], ack 144, win 661, options [nop,nop,TS val 10268725 ecr 143184823], length 0
22:46:35.849503 IP raspoutine.rezel.enst.fr.ssh > dhcp-140-247-103-184.fas.harvard.edu.44259: Flags [P.], seq 144:192, ack 49, win 435, options [nop,nop,TS val 143184823 ecr 10268715], length 48
22:46:35.849507 IP dhcp-140-247-103-184.fas.harvard.edu.44259 > raspoutine.rezel.enst.fr.ssh: Flags [.], ack 192, win 661, options [nop,nop,TS val 10268725 ecr 143184823], length 0
22:46:35.849511 IP raspoutine.rezel.enst.fr.ssh > dhcp-140-247-103-184.fas.harvard.edu.44259: Flags [P.], seq 192:240, ack 49, win 435, options [nop,nop,TS val 143184823 ecr 10268715], length 48
22:46:35.849515 IP dhcp-140-247-103-184.fas.harvard.edu.44259 > raspoutine.rezel.enst.fr.ssh: Flags [.], ack 240, win 661, options [nop,nop,TS val 10268725 ecr 143184823], length 0
22:46:35.954976 IP raspoutine.rezel.enst.fr.ssh > dhcp-140-247-103-184.fas.harvard.edu.44259: Flags [P.], seq 240:608, ack 49, win 435, options [nop,nop,TS val 143184849 ecr 10268725], length 368
22:46:35.954997 IP dhcp-140-247-103-184.fas.harvard.edu.44259 > raspoutine.rezel.enst.fr.ssh: Flags [.], ack 608, win 661, options [nop,nop,TS val 10268736 ecr 143184849], length 0
22:46:41.038676 IP dhcp-140-247-103-184.fas.harvard.edu.44259 > raspoutine.rezel.enst.fr.ssh: Flags [P.], seq 49:97, ack 608, win 661, options [nop,nop,TS val 10269244 ecr 143184849], length 48
22:46:41.144415 IP raspoutine.rezel.enst.fr.ssh > dhcp-140-247-103-184.fas.harvard.edu.44259: Flags [P.], seq 608:656, ack 97, win 435, options [nop,nop,TS val 143186146 ecr 10269244], length 48
22:46:41.144438 IP dhcp-140-247-103-184.fas.harvard.edu.44259 > raspoutine.rezel.enst.fr.ssh: Flags [.], ack 656, win 661, options [nop,nop,TS val 10269255 ecr 143186146], length 0
22:46:41.436106 IP dhcp-140-247-103-184.fas.harvard.edu.44259 > raspoutine.rezel.enst.fr.ssh: Flags [P.], seq 97:145, ack 656, win 661, options [nop,nop,TS val 10269284 ecr 143186146], length 48
22:46:41.541573 IP raspoutine.rezel.enst.fr.ssh > dhcp-140-247-103-184.fas.harvard.edu.44259: Flags [P.], seq 656:704, ack 145, win 435, options [nop,nop,TS val 143186246 ecr 10269284], length 48
22:46:41.541594 IP dhcp-140-247-103-184.fas.harvard.edu.44259 > raspoutine.rezel.enst.fr.ssh: Flags [.], ack 704, win 661, options [nop,nop,TS val 10269294 ecr 143186246], length 0
22:46:41.699189 IP dhcp-140-247-103-184.fas.harvard.edu.44259 > raspoutine.rezel.enst.fr.ssh: Flags [P.], seq 145:193, ack 704, win 661, options [nop,nop,TS val 10269310 ecr 143186246], length 48
22:46:41.804786 IP raspoutine.rezel.enst.fr.ssh > dhcp-140-247-103-184.fas.harvard.edu.44259: Flags [P.], seq 704:752, ack 193, win 435, options [nop,nop,TS val 143186312 ecr 10269310], length 48
22:46:41.804808 IP dhcp-140-247-103-184.fas.harvard.edu.44259 > raspoutine.rezel.enst.fr.ssh: Flags [.], ack 752, win 661, options [nop,nop,TS val 10269321 ecr 143186312], length 0
22:46:41.961512 IP dhcp-140-247-103-184.fas.harvard.edu.44259 > raspoutine.rezel.enst.fr.ssh: Flags [P.], seq 193:241, ack 752, win 661, options [nop,nop,TS val 10269336 ecr 143186312], length 48
22:46:42.066949 IP raspoutine.rezel.enst.fr.ssh > dhcp-140-247-103-184.fas.harvard.edu.44259: Flags [P.], seq 752:800, ack 241, win 435, options [nop,nop,TS val 143186377 ecr 10269336], length 48
22:46:42.066972 IP dhcp-140-247-103-184.fas.harvard.edu.44259 > raspoutine.rezel.enst.fr.ssh: Flags [.], ack 800, win 661, options [nop,nop,TS val 10269347 ecr 143186377], length 0
22:46:42.602507 IP dhcp-140-247-103-184.fas.harvard.edu.44259 > raspoutine.rezel.enst.fr.ssh: Flags [P.], seq 241:289, ack 800, win 661, options [nop,nop,TS val 10269400 ecr 143186377], length 48
22:46:42.708177 IP raspoutine.rezel.enst.fr.ssh > dhcp-140-247-103-184.fas.harvard.edu.44259: Flags [P.], seq 800:848, ack 289, win 435, options [nop,nop,TS val 143186537 ecr 10269400], length 48
22:46:42.708198 IP dhcp-140-247-103-184.fas.harvard.edu.44259 > raspoutine.rezel.enst.fr.ssh: Flags [.], ack 848, win 661, options [nop,nop,TS val 10269411 ecr 143186537], length 0
22:46:42.890358 IP dhcp-140-247-103-184.fas.harvard.edu.44259 > raspoutine.rezel.enst.fr.ssh: Flags [P.], seq 289:337, ack 848, win 661, options [nop,nop,TS val 10269429 ecr 143186537], length 48
22:46:42.995956 IP raspoutine.rezel.enst.fr.ssh > dhcp-140-247-103-184.fas.harvard.edu.44259: Flags [P.], seq 848:896, ack 337, win 435, options [nop,nop,TS val 143186609 ecr 10269429], length 48
22:46:42.995978 IP dhcp-140-247-103-184.fas.harvard.edu.44259 > raspoutine.rezel.enst.fr.ssh: Flags [.], ack 896, win 661, options [nop,nop,TS val 10269440 ecr 143186609], length 0
22:46:43.079063 IP dhcp-140-247-103-184.fas.harvard.edu.44259 > raspoutine.rezel.enst.fr.ssh: Flags [P.], seq 337:385, ack 896, win 661, options [nop,nop,TS val 10269448 ecr 143186609], length 48
22:46:43.184544 IP raspoutine.rezel.enst.fr.ssh > dhcp-140-247-103-184.fas.harvard.edu.44259: Flags [P.], seq 896:944, ack 385, win 435, options [nop,nop,TS val 143186657 ecr 10269448], length 48
22:46:43.184566 IP dhcp-140-247-103-184.fas.harvard.edu.44259 > raspoutine.rezel.enst.fr.ssh: Flags [.], ack 944, win 661, options [nop,nop,TS val 10269459 ecr 143186657], length 0
22:46:43.283645 IP dhcp-140-247-103-184.fas.harvard.edu.44259 > raspoutine.rezel.enst.fr.ssh: Flags [P.], seq 385:433, ack 944, win 661, options [nop,nop,TS val 10269469 ecr 143186657], length 48
22:46:43.389084 IP raspoutine.rezel.enst.fr.ssh > dhcp-140-247-103-184.fas.harvard.edu.44259: Flags [P.], seq 944:992, ack 433, win 435, options [nop,nop,TS val 143186708 ecr 10269469], length 48
22:46:43.389102 IP dhcp-140-247-103-184.fas.harvard.edu.44259 > raspoutine.rezel.enst.fr.ssh: Flags [.], ack 992, win 661, options [nop,nop,TS val 10269479 ecr 143186708], length 0
22:46:43.467514 IP dhcp-140-247-103-184.fas.harvard.edu.44259 > raspoutine.rezel.enst.fr.ssh: Flags [P.], seq 433:481, ack 992, win 661, options [nop,nop,TS val 10269487 ecr 143186708], length 48
22:46:43.573058 IP raspoutine.rezel.enst.fr.ssh > dhcp-140-247-103-184.fas.harvard.edu.44259: Flags [P.], seq 992:1040, ack 481, win 435, options [nop,nop,TS val 143186754 ecr 10269487], length 48
22:46:43.573080 IP dhcp-140-247-103-184.fas.harvard.edu.44259 > raspoutine.rezel.enst.fr.ssh: Flags [.], ack 1040, win 661, options [nop,nop,TS val 10269497 ecr 143186754], length 0
22:46:43.714148 IP dhcp-140-247-103-184.fas.harvard.edu.44259 > raspoutine.rezel.enst.fr.ssh: Flags [P.], seq 481:529, ack 1040, win 661, options [nop,nop,TS val 10269512 ecr 143186754], length 48
22:46:43.769449 IP dhcp-140-247-103-184.fas.harvard.edu.44259 > raspoutine.rezel.enst.fr.ssh: Flags [P.], seq 529:577, ack 1040, win 661, options [nop,nop,TS val 10269517 ecr 143186754], length 48
22:46:43.819770 IP raspoutine.rezel.enst.fr.ssh > dhcp-140-247-103-184.fas.harvard.edu.44259: Flags [P.], seq 1040:1088, ack 529, win 435, options [nop,nop,TS val 143186815 ecr 10269512], length 48
22:46:43.819793 IP dhcp-140-247-103-184.fas.harvard.edu.44259 > raspoutine.rezel.enst.fr.ssh: Flags [.], ack 1088, win 661, options [nop,nop,TS val 10269522 ecr 143186815], length 0
22:46:43.874896 IP raspoutine.rezel.enst.fr.ssh > dhcp-140-247-103-184.fas.harvard.edu.44259: Flags [P.], seq 1088:1136, ack 577, win 435, options [nop,nop,TS val 143186829 ecr 10269517], length 48
22:46:43.874924 IP dhcp-140-247-103-184.fas.harvard.edu.44259 > raspoutine.rezel.enst.fr.ssh: Flags [.], ack 1136, win 661, options [nop,nop,TS val 10269528 ecr 143186829], length 0
22:46:43.884572 IP dhcp-140-247-103-184.fas.harvard.edu.44259 > raspoutine.rezel.enst.fr.ssh: Flags [P.], seq 577:625, ack 1136, win 661, options [nop,nop,TS val 10269529 ecr 143186829], length 48
22:46:43.989974 IP raspoutine.rezel.enst.fr.ssh > dhcp-140-247-103-184.fas.harvard.edu.44259: Flags [P.], seq 1136:1184, ack 625, win 435, options [nop,nop,TS val 143186858 ecr 10269529], length 48
22:46:44.023436 IP dhcp-140-247-103-184.fas.harvard.edu.44259 > raspoutine.rezel.enst.fr.ssh: Flags [.], ack 1184, win 661, options [nop,nop,TS val 10269543 ecr 143186858], length 0
22:46:44.084479 IP dhcp-140-247-103-184.fas.harvard.edu.44259 > raspoutine.rezel.enst.fr.ssh: Flags [P.], seq 625:673, ack 1184, win 661, options [nop,nop,TS val 10269549 ecr 143186858], length 48
22:46:44.190197 IP raspoutine.rezel.enst.fr.ssh > dhcp-140-247-103-184.fas.harvard.edu.44259: Flags [P.], seq 1184:1232, ack 673, win 435, options [nop,nop,TS val 143186908 ecr 10269549], length 48
22:46:44.190265 IP dhcp-140-247-103-184.fas.harvard.edu.44259 > raspoutine.rezel.enst.fr.ssh: Flags [.], ack 1232, win 661, options [nop,nop,TS val 10269559 ecr 143186908], length 0
22:46:44.498029 IP raspoutine.rezel.enst.fr.ssh > dhcp-140-247-103-184.fas.harvard.edu.44259: Flags [P.], seq 1232:1328, ack 673, win 435, options [nop,nop,TS val 143186985 ecr 10269559], length 96
22:46:44.498120 IP dhcp-140-247-103-184.fas.harvard.edu.44259 > raspoutine.rezel.enst.fr.ssh: Flags [.], ack 1328, win 661, options [nop,nop,TS val 10269590 ecr 143186985], length 0
22:46:44.501038 IP raspoutine.rezel.enst.fr.ssh > dhcp-140-247-103-184.fas.harvard.edu.44259: Flags [P.], seq 1328:1424, ack 673, win 435, options [nop,nop,TS val 143186985 ecr 10269559], length 96
22:46:44.501099 IP dhcp-140-247-103-184.fas.harvard.edu.44259 > raspoutine.rezel.enst.fr.ssh: Flags [.], ack 1424, win 661, options [nop,nop,TS val 10269590 ecr 143186985], length 0
22:46:44.501899 IP raspoutine.rezel.enst.fr.ssh > dhcp-140-247-103-184.fas.harvard.edu.44259: Flags [P.], seq 1424:1504, ack 673, win 435, options [nop,nop,TS val 143186985 ecr 10269559], length 80
22:46:44.501956 IP dhcp-140-247-103-184.fas.harvard.edu.44259 > raspoutine.rezel.enst.fr.ssh: Flags [.], ack 1504, win 661, options [nop,nop,TS val 10269590 ecr 143186985], length 0
22:46:44.502020 IP raspoutine.rezel.enst.fr.ssh > dhcp-140-247-103-184.fas.harvard.edu.44259: Flags [P.], seq 1504:1584, ack 673, win 435, options [nop,nop,TS val 143186986 ecr 10269559], length 80
22:46:44.502052 IP dhcp-140-247-103-184.fas.harvard.edu.44259 > raspoutine.rezel.enst.fr.ssh: Flags [.], ack 1584, win 661, options [nop,nop,TS val 10269590 ecr 143186986], length 0
22:46:44.616707 IP raspoutine.rezel.enst.fr.ssh > dhcp-140-247-103-184.fas.harvard.edu.44259: Flags [P.], seq 1584:1696, ack 673, win 435, options [nop,nop,TS val 143187015 ecr 10269590], length 112
22:46:44.616789 IP dhcp-140-247-103-184.fas.harvard.edu.44259 > raspoutine.rezel.enst.fr.ssh: Flags [.], ack 1696, win 661, options [nop,nop,TS val 10269602 ecr 143187015], length 0
22:46:45.814262 IP dhcp-140-247-103-184.fas.harvard.edu.44259 > raspoutine.rezel.enst.fr.ssh: Flags [P.], seq 673:721, ack 1696, win 661, options [nop,nop,TS val 10269722 ecr 143187015], length 48
22:46:45.919871 IP raspoutine.rezel.enst.fr.ssh > dhcp-140-247-103-184.fas.harvard.edu.44259: Flags [P.], seq 1696:1744, ack 721, win 435, options [nop,nop,TS val 143187340 ecr 10269722], length 48
22:46:45.919904 IP dhcp-140-247-103-184.fas.harvard.edu.44259 > raspoutine.rezel.enst.fr.ssh: Flags [.], ack 1744, win 661, options [nop,nop,TS val 10269732 ecr 143187340], length 0
22:46:45.920070 IP raspoutine.rezel.enst.fr.ssh > dhcp-140-247-103-184.fas.harvard.edu.44259: Flags [P.], seq 1744:1888, ack 721, win 435, options [nop,nop,TS val 143187340 ecr 10269722], length 144
22:46:45.920081 IP dhcp-140-247-103-184.fas.harvard.edu.44259 > raspoutine.rezel.enst.fr.ssh: Flags [.], ack 1888, win 661, options [nop,nop,TS val 10269732 ecr 143187340], length 0
22:46:45.920102 IP raspoutine.rezel.enst.fr.ssh > dhcp-140-247-103-184.fas.harvard.edu.44259: Flags [P.], seq 1888:1936, ack 721, win 435, options [nop,nop,TS val 143187340 ecr 10269722], length 48
22:46:45.920106 IP dhcp-140-247-103-184.fas.harvard.edu.44259 > raspoutine.rezel.enst.fr.ssh: Flags [.], ack 1936, win 661, options [nop,nop,TS val 10269732 ecr 143187340], length 0
22:46:46.025253 IP raspoutine.rezel.enst.fr.ssh > dhcp-140-247-103-184.fas.harvard.edu.44259: Flags [P.], seq 1936:2144, ack 721, win 435, options [nop,nop,TS val 143187367 ecr 10269732], length 208
22:46:46.025271 IP dhcp-140-247-103-184.fas.harvard.edu.44259 > raspoutine.rezel.enst.fr.ssh: Flags [.], ack 2144, win 661, options [nop,nop,TS val 10269743 ecr 143187367], length 0
22:46:49.785136 IP dhcp-140-247-103-184.fas.harvard.edu.44259 > raspoutine.rezel.enst.fr.ssh: Flags [P.], seq 721:769, ack 2144, win 661, options [nop,nop,TS val 10270119 ecr 143187367], length 48
22:46:49.890768 IP raspoutine.rezel.enst.fr.ssh > dhcp-140-247-103-184.fas.harvard.edu.44259: Flags [P.], seq 2144:2208, ack 769, win 435, options [nop,nop,TS val 143188333 ecr 10270119], length 64
22:46:49.890795 IP dhcp-140-247-103-184.fas.harvard.edu.44259 > raspoutine.rezel.enst.fr.ssh: Flags [.], ack 2208, win 661, options [nop,nop,TS val 10270129 ecr 143188333], length 0
22:46:49.891642 IP raspoutine.rezel.enst.fr.ssh > dhcp-140-247-103-184.fas.harvard.edu.44259: Flags [P.], seq 2208:2336, ack 769, win 435, options [nop,nop,TS val 143188333 ecr 10270119], length 128
22:46:49.891657 IP dhcp-140-247-103-184.fas.harvard.edu.44259 > raspoutine.rezel.enst.fr.ssh: Flags [.], ack 2336, win 661, options [nop,nop,TS val 10270129 ecr 143188333], length 0
22:46:49.913207 IP raspoutine.rezel.enst.fr.ssh > dhcp-140-247-103-184.fas.harvard.edu.44259: Flags [P.], seq 2336:2416, ack 769, win 435, options [nop,nop,TS val 143188339 ecr 10270119], length 80
22:46:49.913235 IP dhcp-140-247-103-184.fas.harvard.edu.44259 > raspoutine.rezel.enst.fr.ssh: Flags [.], ack 2416, win 661, options [nop,nop,TS val 10270131 ecr 143188339], length 0
22:46:49.996417 IP raspoutine.rezel.enst.fr.ssh > dhcp-140-247-103-184.fas.harvard.edu.44259: Flags [.], seq 2416:5152, ack 769, win 435, options [nop,nop,TS val 143188360 ecr 10270129], length 2736
22:46:49.996443 IP dhcp-140-247-103-184.fas.harvard.edu.44259 > raspoutine.rezel.enst.fr.ssh: Flags [.], ack 5152, win 658, options [nop,nop,TS val 10270140 ecr 143188360], length 0
22:46:49.997246 IP raspoutine.rezel.enst.fr.ssh > dhcp-140-247-103-184.fas.harvard.edu.44259: Flags [P.], seq 5152:6512, ack 769, win 435, options [nop,nop,TS val 143188360 ecr 10270129], length 1360
22:46:49.997258 IP dhcp-140-247-103-184.fas.harvard.edu.44259 > raspoutine.rezel.enst.fr.ssh: Flags [.], ack 6512, win 661, options [nop,nop,TS val 10270140 ecr 143188360], length 0
22:46:51.079027 IP dhcp-140-247-103-184.fas.harvard.edu.44259 > raspoutine.rezel.enst.fr.ssh: Flags [P.], seq 769:817, ack 6512, win 661, options [nop,nop,TS val 10270248 ecr 143188360], length 48
22:46:51.184599 IP raspoutine.rezel.enst.fr.ssh > dhcp-140-247-103-184.fas.harvard.edu.44259: Flags [P.], seq 6512:6576, ack 817, win 435, options [nop,nop,TS val 143188657 ecr 10270248], length 64
22:46:51.184620 IP dhcp-140-247-103-184.fas.harvard.edu.44259 > raspoutine.rezel.enst.fr.ssh: Flags [.], ack 6576, win 661, options [nop,nop,TS val 10270259 ecr 143188657], length 0
22:46:51.184834 IP raspoutine.rezel.enst.fr.ssh > dhcp-140-247-103-184.fas.harvard.edu.44259: Flags [P.], seq 6576:6624, ack 817, win 435, options [nop,nop,TS val 143188657 ecr 10270248], length 48
22:46:51.184846 IP dhcp-140-247-103-184.fas.harvard.edu.44259 > raspoutine.rezel.enst.fr.ssh: Flags [.], ack 6624, win 661, options [nop,nop,TS val 10270259 ecr 143188657], length 0
22:46:51.184853 IP raspoutine.rezel.enst.fr.ssh > dhcp-140-247-103-184.fas.harvard.edu.44259: Flags [P.], seq 6624:6672, ack 817, win 435, options [nop,nop,TS val 143188657 ecr 10270248], length 48
22:46:51.184858 IP dhcp-140-247-103-184.fas.harvard.edu.44259 > raspoutine.rezel.enst.fr.ssh: Flags [.], ack 6672, win 661, options [nop,nop,TS val 10270259 ecr 143188657], length 0
22:46:51.290025 IP raspoutine.rezel.enst.fr.ssh > dhcp-140-247-103-184.fas.harvard.edu.44259: Flags [P.], seq 6672:6880, ack 817, win 435, options [nop,nop,TS val 143188683 ecr 10270259], length 208
22:46:51.290062 IP dhcp-140-247-103-184.fas.harvard.edu.44259 > raspoutine.rezel.enst.fr.ssh: Flags [.], ack 6880, win 661, options [nop,nop,TS val 10270269 ecr 143188683], length 0
22:46:51.290425 IP dhcp-140-247-103-184.fas.harvard.edu.44259 > raspoutine.rezel.enst.fr.ssh: Flags [P.], seq 817:865, ack 6880, win 661, options [nop,nop,TS val 10270269 ecr 143188683], length 48
22:46:51.395860 IP raspoutine.rezel.enst.fr.ssh > dhcp-140-247-103-184.fas.harvard.edu.44259: Flags [P.], seq 6880:6944, ack 865, win 435, options [nop,nop,TS val 143188710 ecr 10270269], length 64
22:46:51.395893 IP raspoutine.rezel.enst.fr.ssh > dhcp-140-247-103-184.fas.harvard.edu.44259: Flags [P.], seq 6944:6992, ack 865, win 435, options [nop,nop,TS val 143188710 ecr 10270269], length 48
22:46:51.395910 IP dhcp-140-247-103-184.fas.harvard.edu.44259 > raspoutine.rezel.enst.fr.ssh: Flags [.], ack 6992, win 661, options [nop,nop,TS val 10270280 ecr 143188710], length 0
22:46:51.395982 IP raspoutine.rezel.enst.fr.ssh > dhcp-140-247-103-184.fas.harvard.edu.44259: Flags [P.], seq 6992:7040, ack 865, win 435, options [nop,nop,TS val 143188710 ecr 10270269], length 48
22:46:51.395989 IP raspoutine.rezel.enst.fr.ssh > dhcp-140-247-103-184.fas.harvard.edu.44259: Flags [P.], seq 7040:7088, ack 865, win 435, options [nop,nop,TS val 143188710 ecr 10270269], length 48
22:46:51.395991 IP raspoutine.rezel.enst.fr.ssh > dhcp-140-247-103-184.fas.harvard.edu.44259: Flags [P.], seq 7088:7136, ack 865, win 435, options [nop,nop,TS val 143188710 ecr 10270269], length 48
22:46:51.396007 IP dhcp-140-247-103-184.fas.harvard.edu.44259 > raspoutine.rezel.enst.fr.ssh: Flags [.], ack 7136, win 661, options [nop,nop,TS val 10270280 ecr 143188710], length 0
22:46:51.396058 IP raspoutine.rezel.enst.fr.ssh > dhcp-140-247-103-184.fas.harvard.edu.44259: Flags [P.], seq 7136:7184, ack 865, win 435, options [nop,nop,TS val 143188710 ecr 10270269], length 48
22:46:51.433474 IP dhcp-140-247-103-184.fas.harvard.edu.44259 > raspoutine.rezel.enst.fr.ssh: Flags [.], ack 7184, win 661, options [nop,nop,TS val 10270284 ecr 143188710], length 0
22:46:51.501182 IP raspoutine.rezel.enst.fr.ssh > dhcp-140-247-103-184.fas.harvard.edu.44259: Flags [P.], seq 7184:7248, ack 865, win 435, options [nop,nop,TS val 143188736 ecr 10270280], length 64
22:46:51.501196 IP dhcp-140-247-103-184.fas.harvard.edu.44259 > raspoutine.rezel.enst.fr.ssh: Flags [.], ack 7248, win 661, options [nop,nop,TS val 10270290 ecr 143188736], length 0
22:46:51.951045 IP dhcp-140-247-103-184.fas.harvard.edu.44259 > raspoutine.rezel.enst.fr.ssh: Flags [P.], seq 865:913, ack 7248, win 661, options [nop,nop,TS val 10270335 ecr 143188736], length 48
22:46:51.991816 IP dhcp-140-247-103-184.fas.harvard.edu.44259 > raspoutine.rezel.enst.fr.ssh: Flags [P.], seq 913:961, ack 7248, win 661, options [nop,nop,TS val 10270339 ecr 143188736], length 48
22:46:52.032467 IP dhcp-140-247-103-184.fas.harvard.edu.44259 > raspoutine.rezel.enst.fr.ssh: Flags [P.], seq 961:1009, ack 7248, win 661, options [nop,nop,TS val 10270343 ecr 143188736], length 48
22:46:52.056667 IP raspoutine.rezel.enst.fr.ssh > dhcp-140-247-103-184.fas.harvard.edu.44259: Flags [P.], seq 7248:7312, ack 913, win 435, options [nop,nop,TS val 143188875 ecr 10270335], length 64
22:46:52.056690 IP dhcp-140-247-103-184.fas.harvard.edu.44259 > raspoutine.rezel.enst.fr.ssh: Flags [.], ack 7312, win 661, options [nop,nop,TS val 10270346 ecr 143188875], length 0
22:46:52.056788 IP raspoutine.rezel.enst.fr.ssh > dhcp-140-247-103-184.fas.harvard.edu.44259: Flags [P.], seq 7312:7360, ack 913, win 435, options [nop,nop,TS val 143188875 ecr 10270335], length 48
22:46:52.056800 IP dhcp-140-247-103-184.fas.harvard.edu.44259 > raspoutine.rezel.enst.fr.ssh: Flags [.], ack 7360, win 661, options [nop,nop,TS val 10270346 ecr 143188875], length 0
22:46:52.056867 IP raspoutine.rezel.enst.fr.ssh > dhcp-140-247-103-184.fas.harvard.edu.44259: Flags [P.], seq 7360:7408, ack 913, win 435, options [nop,nop,TS val 143188875 ecr 10270335], length 48
22:46:52.056876 IP dhcp-140-247-103-184.fas.harvard.edu.44259 > raspoutine.rezel.enst.fr.ssh: Flags [.], ack 7408, win 661, options [nop,nop,TS val 10270346 ecr 143188875], length 0
22:46:52.056883 IP raspoutine.rezel.enst.fr.ssh > dhcp-140-247-103-184.fas.harvard.edu.44259: Flags [P.], seq 7408:7456, ack 913, win 435, options [nop,nop,TS val 143188875 ecr 10270335], length 48
22:46:52.056890 IP dhcp-140-247-103-184.fas.harvard.edu.44259 > raspoutine.rezel.enst.fr.ssh: Flags [.], ack 7456, win 661, options [nop,nop,TS val 10270346 ecr 143188875], length 0
22:46:52.072294 IP dhcp-140-247-103-184.fas.harvard.edu.44259 > raspoutine.rezel.enst.fr.ssh: Flags [P.], seq 1009:1057, ack 7456, win 661, options [nop,nop,TS val 10270347 ecr 143188875], length 48
22:46:52.112914 IP dhcp-140-247-103-184.fas.harvard.edu.44259 > raspoutine.rezel.enst.fr.ssh: Flags [P.], seq 1057:1105, ack 7456, win 661, options [nop,nop,TS val 10270351 ecr 143188875], length 48
22:46:52.137200 IP raspoutine.rezel.enst.fr.ssh > dhcp-140-247-103-184.fas.harvard.edu.44259: Flags [.], ack 961, win 435, options [nop,nop,TS val 143188895 ecr 10270339], length 0
22:46:52.137703 IP raspoutine.rezel.enst.fr.ssh > dhcp-140-247-103-184.fas.harvard.edu.44259: Flags [.], ack 1009, win 435, options [nop,nop,TS val 143188895 ecr 10270343], length 0
22:46:52.153263 IP dhcp-140-247-103-184.fas.harvard.edu.44259 > raspoutine.rezel.enst.fr.ssh: Flags [P.], seq 1105:1153, ack 7456, win 661, options [nop,nop,TS val 10270355 ecr 143188895], length 48
22:46:52.162273 IP raspoutine.rezel.enst.fr.ssh > dhcp-140-247-103-184.fas.harvard.edu.44259: Flags [P.], seq 7456:8352, ack 1009, win 435, options [nop,nop,TS val 143188901 ecr 10270346], length 896
22:46:52.177705 IP raspoutine.rezel.enst.fr.ssh > dhcp-140-247-103-184.fas.harvard.edu.44259: Flags [P.], seq 8352:8416, ack 1057, win 435, options [nop,nop,TS val 143188905 ecr 10270347], length 64
22:46:52.177791 IP raspoutine.rezel.enst.fr.ssh > dhcp-140-247-103-184.fas.harvard.edu.44259: Flags [P.], seq 8416:8464, ack 1057, win 435, options [nop,nop,TS val 143188905 ecr 10270347], length 48
22:46:52.177799 IP raspoutine.rezel.enst.fr.ssh > dhcp-140-247-103-184.fas.harvard.edu.44259: Flags [P.], seq 8464:8512, ack 1057, win 435, options [nop,nop,TS val 143188905 ecr 10270347], length 48
22:46:52.177841 IP dhcp-140-247-103-184.fas.harvard.edu.44259 > raspoutine.rezel.enst.fr.ssh: Flags [.], ack 8512, win 661, options [nop,nop,TS val 10270358 ecr 143188901], length 0
22:46:52.177900 IP raspoutine.rezel.enst.fr.ssh > dhcp-140-247-103-184.fas.harvard.edu.44259: Flags [P.], seq 8512:8560, ack 1057, win 435, options [nop,nop,TS val 143188905 ecr 10270347], length 48
22:46:52.177910 IP raspoutine.rezel.enst.fr.ssh > dhcp-140-247-103-184.fas.harvard.edu.44259: Flags [P.], seq 8560:8608, ack 1057, win 435, options [nop,nop,TS val 143188905 ecr 10270347], length 48
22:46:52.177935 IP dhcp-140-247-103-184.fas.harvard.edu.44259 > raspoutine.rezel.enst.fr.ssh: Flags [.], ack 8608, win 661, options [nop,nop,TS val 10270358 ecr 143188905], length 0
22:46:52.178047 IP raspoutine.rezel.enst.fr.ssh > dhcp-140-247-103-184.fas.harvard.edu.44259: Flags [P.], seq 8608:8656, ack 1057, win 435, options [nop,nop,TS val 143188905 ecr 10270347], length 48
22:46:52.193907 IP dhcp-140-247-103-184.fas.harvard.edu.44259 > raspoutine.rezel.enst.fr.ssh: Flags [P.], seq 1153:1201, ack 8656, win 661, options [nop,nop,TS val 10270360 ecr 143188905], length 48
22:46:52.233978 IP dhcp-140-247-103-184.fas.harvard.edu.44259 > raspoutine.rezel.enst.fr.ssh: Flags [P.], seq 1201:1249, ack 8656, win 661, options [nop,nop,TS val 10270364 ecr 143188905], length 48
22:46:52.257194 IP raspoutine.rezel.enst.fr.ssh > dhcp-140-247-103-184.fas.harvard.edu.44259: Flags [.], ack 1105, win 435, options [nop,nop,TS val 143188925 ecr 10270351], length 0
22:46:52.258566 IP raspoutine.rezel.enst.fr.ssh > dhcp-140-247-103-184.fas.harvard.edu.44259: Flags [.], ack 1153, win 435, options [nop,nop,TS val 143188925 ecr 10270355], length 0
22:46:52.273943 IP dhcp-140-247-103-184.fas.harvard.edu.44259 > raspoutine.rezel.enst.fr.ssh: Flags [P.], seq 1249:1297, ack 8656, win 661, options [nop,nop,TS val 10270368 ecr 143188925], length 48
22:46:52.283455 IP raspoutine.rezel.enst.fr.ssh > dhcp-140-247-103-184.fas.harvard.edu.44259: Flags [P.], seq 8656:9456, ack 1153, win 435, options [nop,nop,TS val 143188932 ecr 10270358], length 800
22:46:52.299392 IP raspoutine.rezel.enst.fr.ssh > dhcp-140-247-103-184.fas.harvard.edu.44259: Flags [P.], seq 9456:9520, ack 1201, win 435, options [nop,nop,TS val 143188935 ecr 10270360], length 64
22:46:52.299409 IP raspoutine.rezel.enst.fr.ssh > dhcp-140-247-103-184.fas.harvard.edu.44259: Flags [P.], seq 9520:9568, ack 1201, win 435, options [nop,nop,TS val 143188935 ecr 10270360], length 48
22:46:52.299415 IP raspoutine.rezel.enst.fr.ssh > dhcp-140-247-103-184.fas.harvard.edu.44259: Flags [P.], seq 9568:9616, ack 1201, win 435, options [nop,nop,TS val 143188935 ecr 10270360], length 48
22:46:52.299490 IP dhcp-140-247-103-184.fas.harvard.edu.44259 > raspoutine.rezel.enst.fr.ssh: Flags [.], ack 9616, win 661, options [nop,nop,TS val 10270370 ecr 143188932], length 0
22:46:52.299498 IP raspoutine.rezel.enst.fr.ssh > dhcp-140-247-103-184.fas.harvard.edu.44259: Flags [P.], seq 9616:9664, ack 1201, win 435, options [nop,nop,TS val 143188935 ecr 10270360], length 48
22:46:52.299632 IP raspoutine.rezel.enst.fr.ssh > dhcp-140-247-103-184.fas.harvard.edu.44259: Flags [P.], seq 9664:9712, ack 1201, win 435, options [nop,nop,TS val 143188935 ecr 10270360], length 48
22:46:52.299642 IP raspoutine.rezel.enst.fr.ssh > dhcp-140-247-103-184.fas.harvard.edu.44259: Flags [P.], seq 9760:9824, ack 1201, win 435, options [nop,nop,TS val 143188935 ecr 10270360], length 64
22:46:52.299653 IP dhcp-140-247-103-184.fas.harvard.edu.44259 > raspoutine.rezel.enst.fr.ssh: Flags [.], ack 9712, win 661, options [nop,nop,TS val 10270370 ecr 143188935,nop,nop,sack 1 {9760:9824}], length 0
22:46:52.299659 IP raspoutine.rezel.enst.fr.ssh > dhcp-140-247-103-184.fas.harvard.edu.44259: Flags [P.], seq 9712:9760, ack 1201, win 435, options [nop,nop,TS val 143188935 ecr 10270360], length 48
22:46:52.299666 IP dhcp-140-247-103-184.fas.harvard.edu.44259 > raspoutine.rezel.enst.fr.ssh: Flags [.], ack 9824, win 661, options [nop,nop,TS val 10270370 ecr 143188935], length 0
22:46:52.315029 IP dhcp-140-247-103-184.fas.harvard.edu.44259 > raspoutine.rezel.enst.fr.ssh: Flags [P.], seq 1297:1345, ack 9824, win 661, options [nop,nop,TS val 10270372 ecr 143188935], length 48
22:46:52.355574 IP dhcp-140-247-103-184.fas.harvard.edu.44259 > raspoutine.rezel.enst.fr.ssh: Flags [P.], seq 1345:1393, ack 9824, win 661, options [nop,nop,TS val 10270376 ecr 143188935], length 48
22:46:52.377160 IP raspoutine.rezel.enst.fr.ssh > dhcp-140-247-103-184.fas.harvard.edu.44259: Flags [.], ack 1249, win 435, options [nop,nop,TS val 143188955 ecr 10270364], length 0
22:46:52.379228 IP raspoutine.rezel.enst.fr.ssh > dhcp-140-247-103-184.fas.harvard.edu.44259: Flags [.], ack 1297, win 435, options [nop,nop,TS val 143188955 ecr 10270368], length 0
22:46:52.396509 IP dhcp-140-247-103-184.fas.harvard.edu.44259 > raspoutine.rezel.enst.fr.ssh: Flags [P.], seq 1393:1441, ack 9824, win 661, options [nop,nop,TS val 10270380 ecr 143188955], length 48
22:46:52.404947 IP raspoutine.rezel.enst.fr.ssh > dhcp-140-247-103-184.fas.harvard.edu.44259: Flags [P.], seq 9824:10560, ack 1297, win 435, options [nop,nop,TS val 143188962 ecr 10270370], length 736
22:46:52.420438 IP raspoutine.rezel.enst.fr.ssh > dhcp-140-247-103-184.fas.harvard.edu.44259: Flags [P.], seq 10560:10624, ack 1345, win 435, options [nop,nop,TS val 143188965 ecr 10270372], length 64
22:46:52.420455 IP raspoutine.rezel.enst.fr.ssh > dhcp-140-247-103-184.fas.harvard.edu.44259: Flags [P.], seq 10624:10672, ack 1345, win 435, options [nop,nop,TS val 143188965 ecr 10270372], length 48
22:46:52.420481 IP dhcp-140-247-103-184.fas.harvard.edu.44259 > raspoutine.rezel.enst.fr.ssh: Flags [.], ack 10672, win 661, options [nop,nop,TS val 10270382 ecr 143188962], length 0
22:46:52.420539 IP raspoutine.rezel.enst.fr.ssh > dhcp-140-247-103-184.fas.harvard.edu.44259: Flags [P.], seq 10672:10720, ack 1345, win 435, options [nop,nop,TS val 143188965 ecr 10270372], length 48
22:46:52.436346 IP dhcp-140-247-103-184.fas.harvard.edu.44259 > raspoutine.rezel.enst.fr.ssh: Flags [P.], seq 1441:1489, ack 10720, win 661, options [nop,nop,TS val 10270384 ecr 143188965], length 48
22:46:52.475836 IP dhcp-140-247-103-184.fas.harvard.edu.44259 > raspoutine.rezel.enst.fr.ssh: Flags [P.], seq 1489:1537, ack 10720, win 661, options [nop,nop,TS val 10270388 ecr 143188965], length 48
22:46:52.497179 IP raspoutine.rezel.enst.fr.ssh > dhcp-140-247-103-184.fas.harvard.edu.44259: Flags [.], ack 1393, win 435, options [nop,nop,TS val 143188985 ecr 10270376], length 0
22:46:52.501898 IP raspoutine.rezel.enst.fr.ssh > dhcp-140-247-103-184.fas.harvard.edu.44259: Flags [.], ack 1441, win 435, options [nop,nop,TS val 143188986 ecr 10270380], length 0
22:46:52.516430 IP dhcp-140-247-103-184.fas.harvard.edu.44259 > raspoutine.rezel.enst.fr.ssh: Flags [P.], seq 1537:1585, ack 10720, win 661, options [nop,nop,TS val 10270392 ecr 143188986], length 48
22:46:52.526147 IP raspoutine.rezel.enst.fr.ssh > dhcp-140-247-103-184.fas.harvard.edu.44259: Flags [P.], seq 10720:11664, ack 1441, win 435, options [nop,nop,TS val 143188992 ecr 10270382], length 944
22:46:52.541775 IP raspoutine.rezel.enst.fr.ssh > dhcp-140-247-103-184.fas.harvard.edu.44259: Flags [P.], seq 11664:11728, ack 1489, win 435, options [nop,nop,TS val 143188996 ecr 10270384], length 64
22:46:52.541791 IP raspoutine.rezel.enst.fr.ssh > dhcp-140-247-103-184.fas.harvard.edu.44259: Flags [P.], seq 11728:11776, ack 1489, win 435, options [nop,nop,TS val 143188996 ecr 10270384], length 48
22:46:52.541795 IP raspoutine.rezel.enst.fr.ssh > dhcp-140-247-103-184.fas.harvard.edu.44259: Flags [P.], seq 11776:11824, ack 1489, win 435, options [nop,nop,TS val 143188996 ecr 10270384], length 48
22:46:52.541872 IP raspoutine.rezel.enst.fr.ssh > dhcp-140-247-103-184.fas.harvard.edu.44259: Flags [P.], seq 11824:11872, ack 1489, win 435, options [nop,nop,TS val 143188996 ecr 10270384], length 48
22:46:52.541925 IP dhcp-140-247-103-184.fas.harvard.edu.44259 > raspoutine.rezel.enst.fr.ssh: Flags [.], ack 11872, win 661, options [nop,nop,TS val 10270394 ecr 143188992], length 0
22:46:52.541980 IP raspoutine.rezel.enst.fr.ssh > dhcp-140-247-103-184.fas.harvard.edu.44259: Flags [P.], seq 11872:11920, ack 1489, win 435, options [nop,nop,TS val 143188996 ecr 10270384], length 48
22:46:52.573431 IP dhcp-140-247-103-184.fas.harvard.edu.44259 > raspoutine.rezel.enst.fr.ssh: Flags [.], ack 11920, win 661, options [nop,nop,TS val 10270398 ecr 143188996], length 0
22:46:52.621154 IP raspoutine.rezel.enst.fr.ssh > dhcp-140-247-103-184.fas.harvard.edu.44259: Flags [.], ack 1537, win 435, options [nop,nop,TS val 143189016 ecr 10270388], length 0
22:46:52.621764 IP raspoutine.rezel.enst.fr.ssh > dhcp-140-247-103-184.fas.harvard.edu.44259: Flags [.], ack 1585, win 435, options [nop,nop,TS val 143189016 ecr 10270392], length 0
22:46:52.647392 IP raspoutine.rezel.enst.fr.ssh > dhcp-140-247-103-184.fas.harvard.edu.44259: Flags [P.], seq 11920:12768, ack 1585, win 435, options [nop,nop,TS val 143189023 ecr 10270394], length 848
22:46:52.647405 IP dhcp-140-247-103-184.fas.harvard.edu.44259 > raspoutine.rezel.enst.fr.ssh: Flags [.], ack 12768, win 661, options [nop,nop,TS val 10270405 ecr 143189023], length 0
22:46:53.437062 IP dhcp-140-247-103-184.fas.harvard.edu.44259 > raspoutine.rezel.enst.fr.ssh: Flags [P.], seq 1585:1633, ack 12768, win 661, options [nop,nop,TS val 10270484 ecr 143189023], length 48
22:46:53.542571 IP raspoutine.rezel.enst.fr.ssh > dhcp-140-247-103-184.fas.harvard.edu.44259: Flags [P.], seq 12768:12832, ack 1633, win 435, options [nop,nop,TS val 143189246 ecr 10270484], length 64
22:46:53.542594 IP dhcp-140-247-103-184.fas.harvard.edu.44259 > raspoutine.rezel.enst.fr.ssh: Flags [.], ack 12832, win 661, options [nop,nop,TS val 10270494 ecr 143189246], length 0
22:46:53.542784 IP raspoutine.rezel.enst.fr.ssh > dhcp-140-247-103-184.fas.harvard.edu.44259: Flags [P.], seq 12832:12880, ack 1633, win 435, options [nop,nop,TS val 143189246 ecr 10270484], length 48
22:46:53.542796 IP dhcp-140-247-103-184.fas.harvard.edu.44259 > raspoutine.rezel.enst.fr.ssh: Flags [.], ack 12880, win 661, options [nop,nop,TS val 10270494 ecr 143189246], length 0
22:46:53.542804 IP raspoutine.rezel.enst.fr.ssh > dhcp-140-247-103-184.fas.harvard.edu.44259: Flags [P.], seq 12880:12928, ack 1633, win 435, options [nop,nop,TS val 143189246 ecr 10270484], length 48
22:46:53.542808 IP dhcp-140-247-103-184.fas.harvard.edu.44259 > raspoutine.rezel.enst.fr.ssh: Flags [.], ack 12928, win 661, options [nop,nop,TS val 10270494 ecr 143189246], length 0
22:46:53.647901 IP raspoutine.rezel.enst.fr.ssh > dhcp-140-247-103-184.fas.harvard.edu.44259: Flags [P.], seq 12928:13136, ack 1633, win 435, options [nop,nop,TS val 143189273 ecr 10270494], length 208
22:46:53.647918 IP dhcp-140-247-103-184.fas.harvard.edu.44259 > raspoutine.rezel.enst.fr.ssh: Flags [.], ack 13136, win 661, options [nop,nop,TS val 10270505 ecr 143189273], length 0
22:46:54.097661 IP dhcp-140-247-103-184.fas.harvard.edu.44259 > raspoutine.rezel.enst.fr.ssh: Flags [P.], seq 1633:1681, ack 13136, win 661, options [nop,nop,TS val 10270550 ecr 143189273], length 48
22:46:54.138824 IP dhcp-140-247-103-184.fas.harvard.edu.44259 > raspoutine.rezel.enst.fr.ssh: Flags [P.], seq 1681:1729, ack 13136, win 661, options [nop,nop,TS val 10270554 ecr 143189273], length 48
22:46:54.179503 IP dhcp-140-247-103-184.fas.harvard.edu.44259 > raspoutine.rezel.enst.fr.ssh: Flags [P.], seq 1729:1777, ack 13136, win 661, options [nop,nop,TS val 10270558 ecr 143189273], length 48
22:46:54.203274 IP raspoutine.rezel.enst.fr.ssh > dhcp-140-247-103-184.fas.harvard.edu.44259: Flags [P.], seq 13136:13200, ack 1681, win 435, options [nop,nop,TS val 143189411 ecr 10270550], length 64
22:46:54.203296 IP dhcp-140-247-103-184.fas.harvard.edu.44259 > raspoutine.rezel.enst.fr.ssh: Flags [.], ack 13200, win 661, options [nop,nop,TS val 10270560 ecr 143189411], length 0
22:46:54.203385 IP raspoutine.rezel.enst.fr.ssh > dhcp-140-247-103-184.fas.harvard.edu.44259: Flags [P.], seq 13200:13248, ack 1681, win 435, options [nop,nop,TS val 143189411 ecr 10270550], length 48
22:46:54.203397 IP dhcp-140-247-103-184.fas.harvard.edu.44259 > raspoutine.rezel.enst.fr.ssh: Flags [.], ack 13248, win 661, options [nop,nop,TS val 10270561 ecr 143189411], length 0
22:46:54.203484 IP raspoutine.rezel.enst.fr.ssh > dhcp-140-247-103-184.fas.harvard.edu.44259: Flags [P.], seq 13248:13296, ack 1681, win 435, options [nop,nop,TS val 143189411 ecr 10270550], length 48
22:46:54.203495 IP dhcp-140-247-103-184.fas.harvard.edu.44259 > raspoutine.rezel.enst.fr.ssh: Flags [.], ack 13296, win 661, options [nop,nop,TS val 10270561 ecr 143189411], length 0
22:46:54.219282 IP dhcp-140-247-103-184.fas.harvard.edu.44259 > raspoutine.rezel.enst.fr.ssh: Flags [P.], seq 1777:1825, ack 13296, win 661, options [nop,nop,TS val 10270562 ecr 143189411], length 48
22:46:54.260003 IP dhcp-140-247-103-184.fas.harvard.edu.44259 > raspoutine.rezel.enst.fr.ssh: Flags [P.], seq 1825:1873, ack 13296, win 661, options [nop,nop,TS val 10270566 ecr 143189411], length 48
22:46:54.281076 IP raspoutine.rezel.enst.fr.ssh > dhcp-140-247-103-184.fas.harvard.edu.44259: Flags [.], ack 1729, win 435, options [nop,nop,TS val 143189431 ecr 10270554], length 0
22:46:54.284764 IP raspoutine.rezel.enst.fr.ssh > dhcp-140-247-103-184.fas.harvard.edu.44259: Flags [.], ack 1777, win 435, options [nop,nop,TS val 143189431 ecr 10270558], length 0
22:46:54.300605 IP dhcp-140-247-103-184.fas.harvard.edu.44259 > raspoutine.rezel.enst.fr.ssh: Flags [P.], seq 1873:1921, ack 13296, win 661, options [nop,nop,TS val 10270570 ecr 143189431], length 48
22:46:54.308799 IP raspoutine.rezel.enst.fr.ssh > dhcp-140-247-103-184.fas.harvard.edu.44259: Flags [P.], seq 13296:14240, ack 1777, win 435, options [nop,nop,TS val 143189438 ecr 10270560], length 944
22:46:54.324704 IP raspoutine.rezel.enst.fr.ssh > dhcp-140-247-103-184.fas.harvard.edu.44259: Flags [P.], seq 14240:14304, ack 1825, win 435, options [nop,nop,TS val 143189442 ecr 10270562], length 64
22:46:54.324746 IP dhcp-140-247-103-184.fas.harvard.edu.44259 > raspoutine.rezel.enst.fr.ssh: Flags [.], ack 14304, win 661, options [nop,nop,TS val 10270573 ecr 143189438], length 0
22:46:54.324778 IP raspoutine.rezel.enst.fr.ssh > dhcp-140-247-103-184.fas.harvard.edu.44259: Flags [P.], seq 14304:14352, ack 1825, win 435, options [nop,nop,TS val 143189442 ecr 10270562], length 48
22:46:54.324817 IP raspoutine.rezel.enst.fr.ssh > dhcp-140-247-103-184.fas.harvard.edu.44259: Flags [P.], seq 14352:14400, ack 1825, win 435, options [nop,nop,TS val 143189442 ecr 10270562], length 48
22:46:54.324847 IP dhcp-140-247-103-184.fas.harvard.edu.44259 > raspoutine.rezel.enst.fr.ssh: Flags [.], ack 14400, win 661, options [nop,nop,TS val 10270573 ecr 143189442], length 0
22:46:54.324885 IP raspoutine.rezel.enst.fr.ssh > dhcp-140-247-103-184.fas.harvard.edu.44259: Flags [P.], seq 14400:14448, ack 1825, win 435, options [nop,nop,TS val 143189442 ecr 10270562], length 48
22:46:54.324895 IP raspoutine.rezel.enst.fr.ssh > dhcp-140-247-103-184.fas.harvard.edu.44259: Flags [P.], seq 14448:14496, ack 1825, win 435, options [nop,nop,TS val 143189442 ecr 10270562], length 48
22:46:54.324921 IP dhcp-140-247-103-184.fas.harvard.edu.44259 > raspoutine.rezel.enst.fr.ssh: Flags [.], ack 14496, win 661, options [nop,nop,TS val 10270573 ecr 143189442], length 0
22:46:54.405069 IP raspoutine.rezel.enst.fr.ssh > dhcp-140-247-103-184.fas.harvard.edu.44259: Flags [.], ack 1873, win 435, options [nop,nop,TS val 143189462 ecr 10270566], length 0
22:46:54.405913 IP raspoutine.rezel.enst.fr.ssh > dhcp-140-247-103-184.fas.harvard.edu.44259: Flags [.], ack 1921, win 435, options [nop,nop,TS val 143189462 ecr 10270570], length 0
22:46:54.430218 IP raspoutine.rezel.enst.fr.ssh > dhcp-140-247-103-184.fas.harvard.edu.44259: Flags [P.], seq 14496:15376, ack 1921, win 435, options [nop,nop,TS val 143189468 ecr 10270573], length 880
22:46:54.463437 IP dhcp-140-247-103-184.fas.harvard.edu.44259 > raspoutine.rezel.enst.fr.ssh: Flags [.], ack 15376, win 661, options [nop,nop,TS val 10270587 ecr 143189468], length 0
22:46:55.322051 IP dhcp-140-247-103-184.fas.harvard.edu.44259 > raspoutine.rezel.enst.fr.ssh: Flags [P.], seq 1921:1969, ack 15376, win 661, options [nop,nop,TS val 10270672 ecr 143189468], length 48
22:46:55.427608 IP raspoutine.rezel.enst.fr.ssh > dhcp-140-247-103-184.fas.harvard.edu.44259: Flags [P.], seq 15376:15440, ack 1969, win 435, options [nop,nop,TS val 143189718 ecr 10270672], length 64
