22:47:34.557343 IP dhcp-140-247-103-184.fas.harvard.edu.44259 > raspoutine.rezel.enst.fr.ssh: Flags [P.], seq 525709343:525709391, ack 2280197223, win 661, options [nop,nop,TS val 10274596 ecr 143197263], length 48
22:47:34.663025 IP raspoutine.rezel.enst.fr.ssh > dhcp-140-247-103-184.fas.harvard.edu.44259: Flags [P.], seq 1:65, ack 48, win 435, options [nop,nop,TS val 143199527 ecr 10274596], length 64
22:47:34.663049 IP dhcp-140-247-103-184.fas.harvard.edu.44259 > raspoutine.rezel.enst.fr.ssh: Flags [.], ack 65, win 661, options [nop,nop,TS val 10274606 ecr 143199527], length 0
22:47:34.664758 IP raspoutine.rezel.enst.fr.ssh > dhcp-140-247-103-184.fas.harvard.edu.44259: Flags [P.], seq 65:1137, ack 48, win 435, options [nop,nop,TS val 143199527 ecr 10274596], length 1072
22:47:34.664771 IP dhcp-140-247-103-184.fas.harvard.edu.44259 > raspoutine.rezel.enst.fr.ssh: Flags [.], ack 1137, win 661, options [nop,nop,TS val 10274607 ecr 143199527], length 0
22:47:34.664913 IP raspoutine.rezel.enst.fr.ssh > dhcp-140-247-103-184.fas.harvard.edu.44259: Flags [P.], seq 1137:2209, ack 48, win 435, options [nop,nop,TS val 143199527 ecr 10274596], length 1072
22:47:34.664925 IP dhcp-140-247-103-184.fas.harvard.edu.44259 > raspoutine.rezel.enst.fr.ssh: Flags [.], ack 2209, win 661, options [nop,nop,TS val 10274607 ecr 143199527], length 0
22:47:34.723146 IP dhcp-140-247-103-184.fas.harvard.edu.44259 > raspoutine.rezel.enst.fr.ssh: Flags [P.], seq 48:96, ack 2209, win 661, options [nop,nop,TS val 10274612 ecr 143199527], length 48
22:47:34.768463 IP raspoutine.rezel.enst.fr.ssh > dhcp-140-247-103-184.fas.harvard.edu.44259: Flags [P.], seq 2209:2817, ack 48, win 435, options [nop,nop,TS val 143199554 ecr 10274606], length 608
22:47:34.768479 IP dhcp-140-247-103-184.fas.harvard.edu.44259 > raspoutine.rezel.enst.fr.ssh: Flags [.], ack 2817, win 661, options [nop,nop,TS val 10274617 ecr 143199554], length 0
22:47:34.828578 IP raspoutine.rezel.enst.fr.ssh > dhcp-140-247-103-184.fas.harvard.edu.44259: Flags [P.], seq 2817:2881, ack 96, win 435, options [nop,nop,TS val 143199569 ecr 10274612], length 64
22:47:34.828595 IP dhcp-140-247-103-184.fas.harvard.edu.44259 > raspoutine.rezel.enst.fr.ssh: Flags [.], ack 2881, win 661, options [nop,nop,TS val 10274623 ecr 143199569], length 0
22:47:34.830523 IP raspoutine.rezel.enst.fr.ssh > dhcp-140-247-103-184.fas.harvard.edu.44259: Flags [P.], seq 2881:3953, ack 96, win 435, options [nop,nop,TS val 143199569 ecr 10274612], length 1072
22:47:34.830535 IP dhcp-140-247-103-184.fas.harvard.edu.44259 > raspoutine.rezel.enst.fr.ssh: Flags [.], ack 3953, win 661, options [nop,nop,TS val 10274623 ecr 143199569], length 0
22:47:34.830661 IP raspoutine.rezel.enst.fr.ssh > dhcp-140-247-103-184.fas.harvard.edu.44259: Flags [P.], seq 3953:5025, ack 96, win 435, options [nop,nop,TS val 143199569 ecr 10274612], length 1072
22:47:34.830673 IP dhcp-140-247-103-184.fas.harvard.edu.44259 > raspoutine.rezel.enst.fr.ssh: Flags [.], ack 5025, win 661, options [nop,nop,TS val 10274623 ecr 143199569], length 0
22:47:34.830681 IP raspoutine.rezel.enst.fr.ssh > dhcp-140-247-103-184.fas.harvard.edu.44259: Flags [P.], seq 5025:5329, ack 96, win 435, options [nop,nop,TS val 143199569 ecr 10274612], length 304
22:47:34.830685 IP dhcp-140-247-103-184.fas.harvard.edu.44259 > raspoutine.rezel.enst.fr.ssh: Flags [.], ack 5329, win 657, options [nop,nop,TS val 10274623 ecr 143199569], length 0
22:47:34.830688 IP raspoutine.rezel.enst.fr.ssh > dhcp-140-247-103-184.fas.harvard.edu.44259: Flags [P.], seq 5329:5377, ack 96, win 435, options [nop,nop,TS val 143199569 ecr 10274612], length 48
22:47:34.830694 IP dhcp-140-247-103-184.fas.harvard.edu.44259 > raspoutine.rezel.enst.fr.ssh: Flags [.], ack 5377, win 657, options [nop,nop,TS val 10274623 ecr 143199569], length 0
22:47:34.857375 IP dhcp-140-247-103-184.fas.harvard.edu.44259 > raspoutine.rezel.enst.fr.ssh: Flags [P.], seq 96:144, ack 5377, win 661, options [nop,nop,TS val 10274626 ecr 143199569], length 48
22:47:34.873791 IP raspoutine.rezel.enst.fr.ssh > dhcp-140-247-103-184.fas.harvard.edu.44259: Flags [P.], seq 5377:5585, ack 96, win 435, options [nop,nop,TS val 143199580 ecr 10274617], length 208
22:47:34.913414 IP dhcp-140-247-103-184.fas.harvard.edu.44259 > raspoutine.rezel.enst.fr.ssh: Flags [.], ack 5585, win 661, options [nop,nop,TS val 10274632 ecr 143199580], length 0
22:47:34.962842 IP raspoutine.rezel.enst.fr.ssh > dhcp-140-247-103-184.fas.harvard.edu.44259: Flags [P.], seq 5585:5649, ack 144, win 435, options [nop,nop,TS val 143199602 ecr 10274626], length 64
22:47:34.962874 IP dhcp-140-247-103-184.fas.harvard.edu.44259 > raspoutine.rezel.enst.fr.ssh: Flags [.], ack 5649, win 661, options [nop,nop,TS val 10274636 ecr 143199602], length 0
22:47:34.964422 IP raspoutine.rezel.enst.fr.ssh > dhcp-140-247-103-184.fas.harvard.edu.44259: Flags [P.], seq 5649:6721, ack 144, win 435, options [nop,nop,TS val 143199602 ecr 10274626], length 1072
22:47:34.964436 IP dhcp-140-247-103-184.fas.harvard.edu.44259 > raspoutine.rezel.enst.fr.ssh: Flags [.], ack 6721, win 661, options [nop,nop,TS val 10274637 ecr 143199602], length 0
22:47:34.964543 IP raspoutine.rezel.enst.fr.ssh > dhcp-140-247-103-184.fas.harvard.edu.44259: Flags [P.], seq 6721:7793, ack 144, win 435, options [nop,nop,TS val 143199602 ecr 10274626], length 1072
22:47:34.964556 IP dhcp-140-247-103-184.fas.harvard.edu.44259 > raspoutine.rezel.enst.fr.ssh: Flags [.], ack 7793, win 661, options [nop,nop,TS val 10274637 ecr 143199602], length 0
22:47:34.964564 IP raspoutine.rezel.enst.fr.ssh > dhcp-140-247-103-184.fas.harvard.edu.44259: Flags [P.], seq 7793:8017, ack 144, win 435, options [nop,nop,TS val 143199602 ecr 10274626], length 224
22:47:34.964570 IP dhcp-140-247-103-184.fas.harvard.edu.44259 > raspoutine.rezel.enst.fr.ssh: Flags [.], ack 8017, win 658, options [nop,nop,TS val 10274637 ecr 143199602], length 0
22:47:34.964575 IP raspoutine.rezel.enst.fr.ssh > dhcp-140-247-103-184.fas.harvard.edu.44259: Flags [P.], seq 8065:8113, ack 144, win 435, options [nop,nop,TS val 143199602 ecr 10274626], length 48
22:47:34.964581 IP dhcp-140-247-103-184.fas.harvard.edu.44259 > raspoutine.rezel.enst.fr.ssh: Flags [.], ack 8017, win 658, options [nop,nop,TS val 10274637 ecr 143199602,nop,nop,sack 1 {8065:8113}], length 0
22:47:34.964585 IP raspoutine.rezel.enst.fr.ssh > dhcp-140-247-103-184.fas.harvard.edu.44259: Flags [P.], seq 8017:8065, ack 144, win 435, options [nop,nop,TS val 143199602 ecr 10274626], length 48
22:47:34.964589 IP raspoutine.rezel.enst.fr.ssh > dhcp-140-247-103-184.fas.harvard.edu.44259: Flags [P.], seq 8113:8161, ack 144, win 435, options [nop,nop,TS val 143199602 ecr 10274626], length 48
22:47:34.964592 IP raspoutine.rezel.enst.fr.ssh > dhcp-140-247-103-184.fas.harvard.edu.44259: Flags [P.], seq 8161:8209, ack 144, win 435, options [nop,nop,TS val 143199602 ecr 10274626], length 48
22:47:34.964599 IP dhcp-140-247-103-184.fas.harvard.edu.44259 > raspoutine.rezel.enst.fr.ssh: Flags [.], ack 8113, win 661, options [nop,nop,TS val 10274637 ecr 143199602], length 0
22:47:34.964611 IP dhcp-140-247-103-184.fas.harvard.edu.44259 > raspoutine.rezel.enst.fr.ssh: Flags [.], ack 8161, win 661, options [nop,nop,TS val 10274637 ecr 143199602], length 0
22:47:34.964616 IP dhcp-140-247-103-184.fas.harvard.edu.44259 > raspoutine.rezel.enst.fr.ssh: Flags [.], ack 8209, win 661, options [nop,nop,TS val 10274637 ecr 143199602], length 0
22:47:34.998716 IP dhcp-140-247-103-184.fas.harvard.edu.44259 > raspoutine.rezel.enst.fr.ssh: Flags [P.], seq 144:192, ack 8209, win 661, options [nop,nop,TS val 10274640 ecr 143199602], length 48
22:47:35.018695 IP raspoutine.rezel.enst.fr.ssh > dhcp-140-247-103-184.fas.harvard.edu.44259: Flags [P.], seq 8209:8273, ack 144, win 435, options [nop,nop,TS val 143199616 ecr 10274632], length 64
22:47:35.053403 IP dhcp-140-247-103-184.fas.harvard.edu.44259 > raspoutine.rezel.enst.fr.ssh: Flags [.], ack 8273, win 661, options [nop,nop,TS val 10274646 ecr 143199616], length 0
22:47:35.104325 IP raspoutine.rezel.enst.fr.ssh > dhcp-140-247-103-184.fas.harvard.edu.44259: Flags [P.], seq 8273:8337, ack 192, win 435, options [nop,nop,TS val 143199638 ecr 10274640], length 64
22:47:35.104340 IP dhcp-140-247-103-184.fas.harvard.edu.44259 > raspoutine.rezel.enst.fr.ssh: Flags [.], ack 8337, win 661, options [nop,nop,TS val 10274651 ecr 143199638], length 0
22:47:35.106056 IP raspoutine.rezel.enst.fr.ssh > dhcp-140-247-103-184.fas.harvard.edu.44259: Flags [P.], seq 8337:9409, ack 192, win 435, options [nop,nop,TS val 143199638 ecr 10274640], length 1072
22:47:35.106068 IP dhcp-140-247-103-184.fas.harvard.edu.44259 > raspoutine.rezel.enst.fr.ssh: Flags [.], ack 9409, win 661, options [nop,nop,TS val 10274651 ecr 143199638], length 0
22:47:35.106164 IP raspoutine.rezel.enst.fr.ssh > dhcp-140-247-103-184.fas.harvard.edu.44259: Flags [P.], seq 9409:10481, ack 192, win 435, options [nop,nop,TS val 143199638 ecr 10274640], length 1072
22:47:35.106176 IP dhcp-140-247-103-184.fas.harvard.edu.44259 > raspoutine.rezel.enst.fr.ssh: Flags [.], ack 10481, win 661, options [nop,nop,TS val 10274651 ecr 143199638], length 0
22:47:35.106183 IP raspoutine.rezel.enst.fr.ssh > dhcp-140-247-103-184.fas.harvard.edu.44259: Flags [P.], seq 10481:10737, ack 192, win 435, options [nop,nop,TS val 143199638 ecr 10274640], length 256
22:47:35.106187 IP dhcp-140-247-103-184.fas.harvard.edu.44259 > raspoutine.rezel.enst.fr.ssh: Flags [.], ack 10737, win 657, options [nop,nop,TS val 10274651 ecr 143199638], length 0
22:47:35.106191 IP raspoutine.rezel.enst.fr.ssh > dhcp-140-247-103-184.fas.harvard.edu.44259: Flags [P.], seq 10737:10785, ack 192, win 435, options [nop,nop,TS val 143199638 ecr 10274640], length 48
22:47:35.106196 IP dhcp-140-247-103-184.fas.harvard.edu.44259 > raspoutine.rezel.enst.fr.ssh: Flags [.], ack 10785, win 657, options [nop,nop,TS val 10274651 ecr 143199638], length 0
22:47:35.106199 IP raspoutine.rezel.enst.fr.ssh > dhcp-140-247-103-184.fas.harvard.edu.44259: Flags [P.], seq 10785:10833, ack 192, win 435, options [nop,nop,TS val 143199638 ecr 10274640], length 48
22:47:35.106203 IP dhcp-140-247-103-184.fas.harvard.edu.44259 > raspoutine.rezel.enst.fr.ssh: Flags [.], ack 10833, win 657, options [nop,nop,TS val 10274651 ecr 143199638], length 0
22:47:35.148542 IP dhcp-140-247-103-184.fas.harvard.edu.44259 > raspoutine.rezel.enst.fr.ssh: Flags [P.], seq 192:240, ack 10833, win 661, options [nop,nop,TS val 10274655 ecr 143199638], length 48
22:47:35.158880 IP raspoutine.rezel.enst.fr.ssh > dhcp-140-247-103-184.fas.harvard.edu.44259: Flags [P.], seq 10833:10993, ack 192, win 435, options [nop,nop,TS val 143199651 ecr 10274646], length 160
22:47:35.158893 IP dhcp-140-247-103-184.fas.harvard.edu.44259 > raspoutine.rezel.enst.fr.ssh: Flags [.], ack 10993, win 661, options [nop,nop,TS val 10274656 ecr 143199651], length 0
22:47:35.253993 IP raspoutine.rezel.enst.fr.ssh > dhcp-140-247-103-184.fas.harvard.edu.44259: Flags [P.], seq 10993:11057, ack 240, win 435, options [nop,nop,TS val 143199675 ecr 10274655], length 64
22:47:35.254009 IP dhcp-140-247-103-184.fas.harvard.edu.44259 > raspoutine.rezel.enst.fr.ssh: Flags [.], ack 11057, win 661, options [nop,nop,TS val 10274666 ecr 143199675], length 0
22:47:35.255853 IP raspoutine.rezel.enst.fr.ssh > dhcp-140-247-103-184.fas.harvard.edu.44259: Flags [P.], seq 11057:12129, ack 240, win 435, options [nop,nop,TS val 143199675 ecr 10274655], length 1072
22:47:35.255864 IP dhcp-140-247-103-184.fas.harvard.edu.44259 > raspoutine.rezel.enst.fr.ssh: Flags [.], ack 12129, win 661, options [nop,nop,TS val 10274666 ecr 143199675], length 0
22:47:35.255930 IP raspoutine.rezel.enst.fr.ssh > dhcp-140-247-103-184.fas.harvard.edu.44259: Flags [P.], seq 12129:13201, ack 240, win 435, options [nop,nop,TS val 143199675 ecr 10274655], length 1072
22:47:35.255939 IP raspoutine.rezel.enst.fr.ssh > dhcp-140-247-103-184.fas.harvard.edu.44259: Flags [P.], seq 13201:13425, ack 240, win 435, options [nop,nop,TS val 143199675 ecr 10274655], length 224
22:47:35.255943 IP raspoutine.rezel.enst.fr.ssh > dhcp-140-247-103-184.fas.harvard.edu.44259: Flags [P.], seq 13473:13521, ack 240, win 435, options [nop,nop,TS val 143199675 ecr 10274655], length 48
22:47:35.255949 IP dhcp-140-247-103-184.fas.harvard.edu.44259 > raspoutine.rezel.enst.fr.ssh: Flags [.], ack 13425, win 651, options [nop,nop,TS val 10274666 ecr 143199675,nop,nop,sack 1 {13473:13521}], length 0
22:47:35.255954 IP raspoutine.rezel.enst.fr.ssh > dhcp-140-247-103-184.fas.harvard.edu.44259: Flags [P.], seq 13425:13473, ack 240, win 435, options [nop,nop,TS val 143199675 ecr 10274655], length 48
22:47:35.255960 IP dhcp-140-247-103-184.fas.harvard.edu.44259 > raspoutine.rezel.enst.fr.ssh: Flags [.], ack 13521, win 661, options [nop,nop,TS val 10274666 ecr 143199675], length 0
22:47:35.256029 IP raspoutine.rezel.enst.fr.ssh > dhcp-140-247-103-184.fas.harvard.edu.44259: Flags [P.], seq 13521:13569, ack 240, win 435, options [nop,nop,TS val 143199675 ecr 10274655], length 48
22:47:35.256037 IP dhcp-140-247-103-184.fas.harvard.edu.44259 > raspoutine.rezel.enst.fr.ssh: Flags [.], ack 13569, win 661, options [nop,nop,TS val 10274666 ecr 143199675], length 0
22:47:35.256048 IP raspoutine.rezel.enst.fr.ssh > dhcp-140-247-103-184.fas.harvard.edu.44259: Flags [P.], seq 13569:13617, ack 240, win 435, options [nop,nop,TS val 143199675 ecr 10274655], length 48
22:47:35.256055 IP dhcp-140-247-103-184.fas.harvard.edu.44259 > raspoutine.rezel.enst.fr.ssh: Flags [.], ack 13617, win 661, options [nop,nop,TS val 10274666 ecr 143199675], length 0
22:47:35.256060 IP raspoutine.rezel.enst.fr.ssh > dhcp-140-247-103-184.fas.harvard.edu.44259: Flags [P.], seq 13617:13681, ack 240, win 435, options [nop,nop,TS val 143199675 ecr 10274655], length 64
22:47:35.256066 IP dhcp-140-247-103-184.fas.harvard.edu.44259 > raspoutine.rezel.enst.fr.ssh: Flags [.], ack 13681, win 661, options [nop,nop,TS val 10274666 ecr 143199675], length 0
22:47:35.282324 IP dhcp-140-247-103-184.fas.harvard.edu.44259 > raspoutine.rezel.enst.fr.ssh: Flags [P.], seq 240:288, ack 13681, win 661, options [nop,nop,TS val 10274668 ecr 143199675], length 48
22:47:35.387896 IP raspoutine.rezel.enst.fr.ssh > dhcp-140-247-103-184.fas.harvard.edu.44259: Flags [P.], seq 13681:13745, ack 288, win 435, options [nop,nop,TS val 143199709 ecr 10274668], length 64
22:47:35.389365 IP raspoutine.rezel.enst.fr.ssh > dhcp-140-247-103-184.fas.harvard.edu.44259: Flags [P.], seq 13745:14817, ack 288, win 435, options [nop,nop,TS val 143199709 ecr 10274668], length 1072
22:47:35.389377 IP dhcp-140-247-103-184.fas.harvard.edu.44259 > raspoutine.rezel.enst.fr.ssh: Flags [.], ack 14817, win 661, options [nop,nop,TS val 10274679 ecr 143199709], length 0
22:47:35.389459 IP raspoutine.rezel.enst.fr.ssh > dhcp-140-247-103-184.fas.harvard.edu.44259: Flags [P.], seq 14817:15889, ack 288, win 435, options [nop,nop,TS val 143199709 ecr 10274668], length 1072
22:47:35.389473 IP raspoutine.rezel.enst.fr.ssh > dhcp-140-247-103-184.fas.harvard.edu.44259: Flags [P.], seq 15889:16049, ack 288, win 435, options [nop,nop,TS val 143199709 ecr 10274668], length 160
22:47:35.389479 IP dhcp-140-247-103-184.fas.harvard.edu.44259 > raspoutine.rezel.enst.fr.ssh: Flags [.], ack 16049, win 661, options [nop,nop,TS val 10274679 ecr 143199709], length 0
22:47:35.389484 IP raspoutine.rezel.enst.fr.ssh > dhcp-140-247-103-184.fas.harvard.edu.44259: Flags [P.], seq 16049:16097, ack 288, win 435, options [nop,nop,TS val 143199709 ecr 10274668], length 48
22:47:35.389488 IP raspoutine.rezel.enst.fr.ssh > dhcp-140-247-103-184.fas.harvard.edu.44259: Flags [P.], seq 16097:16145, ack 288, win 435, options [nop,nop,TS val 143199709 ecr 10274668], length 48
22:47:35.389491 IP raspoutine.rezel.enst.fr.ssh > dhcp-140-247-103-184.fas.harvard.edu.44259: Flags [P.], seq 16145:16193, ack 288, win 435, options [nop,nop,TS val 143199709 ecr 10274668], length 48
22:47:35.389591 IP dhcp-140-247-103-184.fas.harvard.edu.44259 > raspoutine.rezel.enst.fr.ssh: Flags [.], ack 16193, win 661, options [nop,nop,TS val 10274679 ecr 143199709], length 0
22:47:35.432267 IP dhcp-140-247-103-184.fas.harvard.edu.44259 > raspoutine.rezel.enst.fr.ssh: Flags [P.], seq 288:336, ack 16193, win 661, options [nop,nop,TS val 10274683 ecr 143199709], length 48
22:47:35.494687 IP raspoutine.rezel.enst.fr.ssh > dhcp-140-247-103-184.fas.harvard.edu.44259: Flags [P.], seq 16193:16305, ack 288, win 435, options [nop,nop,TS val 143199735 ecr 10274679], length 112
22:47:35.533436 IP dhcp-140-247-103-184.fas.harvard.edu.44259 > raspoutine.rezel.enst.fr.ssh: Flags [.], ack 16305, win 661, options [nop,nop,TS val 10274694 ecr 143199735], length 0
22:47:35.537708 IP raspoutine.rezel.enst.fr.ssh > dhcp-140-247-103-184.fas.harvard.edu.44259: Flags [P.], seq 16305:16369, ack 336, win 435, options [nop,nop,TS val 143199746 ecr 10274683], length 64
22:47:35.537724 IP dhcp-140-247-103-184.fas.harvard.edu.44259 > raspoutine.rezel.enst.fr.ssh: Flags [.], ack 16369, win 661, options [nop,nop,TS val 10274694 ecr 143199746], length 0
22:47:35.539186 IP raspoutine.rezel.enst.fr.ssh > dhcp-140-247-103-184.fas.harvard.edu.44259: Flags [P.], seq 16369:17441, ack 336, win 435, options [nop,nop,TS val 143199746 ecr 10274683], length 1072
22:47:35.539198 IP dhcp-140-247-103-184.fas.harvard.edu.44259 > raspoutine.rezel.enst.fr.ssh: Flags [.], ack 17441, win 661, options [nop,nop,TS val 10274694 ecr 143199746], length 0
22:47:35.539298 IP raspoutine.rezel.enst.fr.ssh > dhcp-140-247-103-184.fas.harvard.edu.44259: Flags [P.], seq 17441:18513, ack 336, win 435, options [nop,nop,TS val 143199746 ecr 10274683], length 1072
22:47:35.539307 IP dhcp-140-247-103-184.fas.harvard.edu.44259 > raspoutine.rezel.enst.fr.ssh: Flags [.], ack 18513, win 661, options [nop,nop,TS val 10274694 ecr 143199746], length 0
22:47:35.539315 IP raspoutine.rezel.enst.fr.ssh > dhcp-140-247-103-184.fas.harvard.edu.44259: Flags [P.], seq 18513:18737, ack 336, win 435, options [nop,nop,TS val 143199746 ecr 10274683], length 224
22:47:35.539319 IP dhcp-140-247-103-184.fas.harvard.edu.44259 > raspoutine.rezel.enst.fr.ssh: Flags [.], ack 18737, win 658, options [nop,nop,TS val 10274694 ecr 143199746], length 0
22:47:35.539323 IP raspoutine.rezel.enst.fr.ssh > dhcp-140-247-103-184.fas.harvard.edu.44259: Flags [P.], seq 18737:18785, ack 336, win 435, options [nop,nop,TS val 143199746 ecr 10274683], length 48
22:47:35.539330 IP dhcp-140-247-103-184.fas.harvard.edu.44259 > raspoutine.rezel.enst.fr.ssh: Flags [.], ack 18785, win 658, options [nop,nop,TS val 10274694 ecr 143199746], length 0
22:47:35.539334 IP raspoutine.rezel.enst.fr.ssh > dhcp-140-247-103-184.fas.harvard.edu.44259: Flags [P.], seq 18785:18833, ack 336, win 435, options [nop,nop,TS val 143199746 ecr 10274683], length 48
22:47:35.539338 IP raspoutine.rezel.enst.fr.ssh > dhcp-140-247-103-184.fas.harvard.edu.44259: Flags [P.], seq 18833:18881, ack 336, win 435, options [nop,nop,TS val 143199746 ecr 10274683], length 48
22:47:35.539341 IP raspoutine.rezel.enst.fr.ssh > dhcp-140-247-103-184.fas.harvard.edu.44259: Flags [P.], seq 18881:18929, ack 336, win 435, options [nop,nop,TS val 143199746 ecr 10274683], length 48
22:47:35.539370 IP dhcp-140-247-103-184.fas.harvard.edu.44259 > raspoutine.rezel.enst.fr.ssh: Flags [.], ack 18929, win 661, options [nop,nop,TS val 10274694 ecr 143199746], length 0
22:47:35.581866 IP dhcp-140-247-103-184.fas.harvard.edu.44259 > raspoutine.rezel.enst.fr.ssh: Flags [P.], seq 336:384, ack 18929, win 661, options [nop,nop,TS val 10274698 ecr 143199746], length 48
22:47:35.638752 IP raspoutine.rezel.enst.fr.ssh > dhcp-140-247-103-184.fas.harvard.edu.44259: Flags [P.], seq 18929:18993, ack 336, win 435, options [nop,nop,TS val 143199771 ecr 10274694], length 64
22:47:35.638815 IP dhcp-140-247-103-184.fas.harvard.edu.44259 > raspoutine.rezel.enst.fr.ssh: Flags [.], ack 18993, win 661, options [nop,nop,TS val 10274704 ecr 143199771], length 0
22:47:35.687534 IP raspoutine.rezel.enst.fr.ssh > dhcp-140-247-103-184.fas.harvard.edu.44259: Flags [P.], seq 18993:19057, ack 384, win 435, options [nop,nop,TS val 143199784 ecr 10274698], length 64
22:47:35.687573 IP dhcp-140-247-103-184.fas.harvard.edu.44259 > raspoutine.rezel.enst.fr.ssh: Flags [.], ack 19057, win 661, options [nop,nop,TS val 10274709 ecr 143199784], length 0
22:47:35.688926 IP raspoutine.rezel.enst.fr.ssh > dhcp-140-247-103-184.fas.harvard.edu.44259: Flags [P.], seq 19057:20129, ack 384, win 435, options [nop,nop,TS val 143199784 ecr 10274698], length 1072
22:47:35.689064 IP raspoutine.rezel.enst.fr.ssh > dhcp-140-247-103-184.fas.harvard.edu.44259: Flags [P.], seq 20129:21201, ack 384, win 435, options [nop,nop,TS val 143199784 ecr 10274698], length 1072
22:47:35.689076 IP dhcp-140-247-103-184.fas.harvard.edu.44259 > raspoutine.rezel.enst.fr.ssh: Flags [.], ack 21201, win 661, options [nop,nop,TS val 10274709 ecr 143199784], length 0
22:47:35.689084 IP raspoutine.rezel.enst.fr.ssh > dhcp-140-247-103-184.fas.harvard.edu.44259: Flags [P.], seq 21201:21569, ack 384, win 435, options [nop,nop,TS val 143199784 ecr 10274698], length 368
22:47:35.689088 IP raspoutine.rezel.enst.fr.ssh > dhcp-140-247-103-184.fas.harvard.edu.44259: Flags [P.], seq 21569:21617, ack 384, win 435, options [nop,nop,TS val 143199784 ecr 10274698], length 48
22:47:35.689093 IP raspoutine.rezel.enst.fr.ssh > dhcp-140-247-103-184.fas.harvard.edu.44259: Flags [P.], seq 21665:21713, ack 384, win 435, options [nop,nop,TS val 143199784 ecr 10274698], length 48
22:47:35.689097 IP dhcp-140-247-103-184.fas.harvard.edu.44259 > raspoutine.rezel.enst.fr.ssh: Flags [.], ack 21617, win 655, options [nop,nop,TS val 10274709 ecr 143199784,nop,nop,sack 1 {21665:21713}], length 0
22:47:35.689102 IP raspoutine.rezel.enst.fr.ssh > dhcp-140-247-103-184.fas.harvard.edu.44259: Flags [P.], seq 21617:21665, ack 384, win 435, options [nop,nop,TS val 143199784 ecr 10274698], length 48
22:47:35.689105 IP raspoutine.rezel.enst.fr.ssh > dhcp-140-247-103-184.fas.harvard.edu.44259: Flags [P.], seq 21713:21761, ack 384, win 435, options [nop,nop,TS val 143199784 ecr 10274698], length 48
22:47:35.689110 IP dhcp-140-247-103-184.fas.harvard.edu.44259 > raspoutine.rezel.enst.fr.ssh: Flags [.], ack 21713, win 661, options [nop,nop,TS val 10274709 ecr 143199784], length 0
22:47:35.689116 IP dhcp-140-247-103-184.fas.harvard.edu.44259 > raspoutine.rezel.enst.fr.ssh: Flags [.], ack 21761, win 661, options [nop,nop,TS val 10274709 ecr 143199784], length 0
22:47:35.689151 IP raspoutine.rezel.enst.fr.ssh > dhcp-140-247-103-184.fas.harvard.edu.44259: Flags [P.], seq 21761:21825, ack 384, win 435, options [nop,nop,TS val 143199784 ecr 10274698], length 64
22:47:35.689159 IP dhcp-140-247-103-184.fas.harvard.edu.44259 > raspoutine.rezel.enst.fr.ssh: Flags [.], ack 21825, win 661, options [nop,nop,TS val 10274709 ecr 143199784], length 0
22:47:35.715742 IP dhcp-140-247-103-184.fas.harvard.edu.44259 > raspoutine.rezel.enst.fr.ssh: Flags [P.], seq 384:432, ack 21825, win 661, options [nop,nop,TS val 10274712 ecr 143199784], length 48
22:47:35.821286 IP raspoutine.rezel.enst.fr.ssh > dhcp-140-247-103-184.fas.harvard.edu.44259: Flags [P.], seq 21825:21889, ack 432, win 435, options [nop,nop,TS val 143199817 ecr 10274712], length 64
22:47:35.823045 IP raspoutine.rezel.enst.fr.ssh > dhcp-140-247-103-184.fas.harvard.edu.44259: Flags [P.], seq 21889:22961, ack 432, win 435, options [nop,nop,TS val 143199817 ecr 10274712], length 1072
22:47:35.823057 IP dhcp-140-247-103-184.fas.harvard.edu.44259 > raspoutine.rezel.enst.fr.ssh: Flags [.], ack 22961, win 661, options [nop,nop,TS val 10274722 ecr 143199817], length 0
22:47:35.823157 IP raspoutine.rezel.enst.fr.ssh > dhcp-140-247-103-184.fas.harvard.edu.44259: Flags [P.], seq 22961:24033, ack 432, win 435, options [nop,nop,TS val 143199817 ecr 10274712], length 1072
22:47:35.823169 IP raspoutine.rezel.enst.fr.ssh > dhcp-140-247-103-184.fas.harvard.edu.44259: Flags [P.], seq 24033:24417, ack 432, win 435, options [nop,nop,TS val 143199817 ecr 10274712], length 384
22:47:35.823173 IP raspoutine.rezel.enst.fr.ssh > dhcp-140-247-103-184.fas.harvard.edu.44259: Flags [P.], seq 24417:24465, ack 432, win 435, options [nop,nop,TS val 143199817 ecr 10274712], length 48
22:47:35.823203 IP dhcp-140-247-103-184.fas.harvard.edu.44259 > raspoutine.rezel.enst.fr.ssh: Flags [.], ack 24465, win 661, options [nop,nop,TS val 10274722 ecr 143199817], length 0
22:47:35.823267 IP raspoutine.rezel.enst.fr.ssh > dhcp-140-247-103-184.fas.harvard.edu.44259: Flags [P.], seq 24465:24513, ack 432, win 435, options [nop,nop,TS val 143199817 ecr 10274712], length 48
22:47:35.853437 IP dhcp-140-247-103-184.fas.harvard.edu.44259 > raspoutine.rezel.enst.fr.ssh: Flags [.], ack 24513, win 661, options [nop,nop,TS val 10274726 ecr 143199817], length 0
22:47:35.865646 IP dhcp-140-247-103-184.fas.harvard.edu.44259 > raspoutine.rezel.enst.fr.ssh: Flags [P.], seq 432:480, ack 24513, win 661, options [nop,nop,TS val 10274727 ecr 143199817], length 48
22:47:35.928381 IP raspoutine.rezel.enst.fr.ssh > dhcp-140-247-103-184.fas.harvard.edu.44259: Flags [P.], seq 24513:24673, ack 432, win 435, options [nop,nop,TS val 143199844 ecr 10274722], length 160
22:47:35.928395 IP dhcp-140-247-103-184.fas.harvard.edu.44259 > raspoutine.rezel.enst.fr.ssh: Flags [.], ack 24673, win 661, options [nop,nop,TS val 10274733 ecr 143199844], length 0
22:47:35.971070 IP raspoutine.rezel.enst.fr.ssh > dhcp-140-247-103-184.fas.harvard.edu.44259: Flags [P.], seq 24673:24737, ack 480, win 435, options [nop,nop,TS val 143199854 ecr 10274727], length 64
22:47:35.971099 IP dhcp-140-247-103-184.fas.harvard.edu.44259 > raspoutine.rezel.enst.fr.ssh: Flags [.], ack 24737, win 661, options [nop,nop,TS val 10274737 ecr 143199854], length 0
22:47:35.972544 IP raspoutine.rezel.enst.fr.ssh > dhcp-140-247-103-184.fas.harvard.edu.44259: Flags [P.], seq 24737:25809, ack 480, win 435, options [nop,nop,TS val 143199854 ecr 10274727], length 1072
22:47:35.972556 IP dhcp-140-247-103-184.fas.harvard.edu.44259 > raspoutine.rezel.enst.fr.ssh: Flags [.], ack 25809, win 661, options [nop,nop,TS val 10274737 ecr 143199854], length 0
22:47:35.972648 IP raspoutine.rezel.enst.fr.ssh > dhcp-140-247-103-184.fas.harvard.edu.44259: Flags [P.], seq 25809:26881, ack 480, win 435, options [nop,nop,TS val 143199854 ecr 10274727], length 1072
22:47:35.972661 IP dhcp-140-247-103-184.fas.harvard.edu.44259 > raspoutine.rezel.enst.fr.ssh: Flags [.], ack 26881, win 661, options [nop,nop,TS val 10274737 ecr 143199854], length 0
22:47:35.972668 IP raspoutine.rezel.enst.fr.ssh > dhcp-140-247-103-184.fas.harvard.edu.44259: Flags [P.], seq 26881:27121, ack 480, win 435, options [nop,nop,TS val 143199854 ecr 10274727], length 240
22:47:35.972674 IP dhcp-140-247-103-184.fas.harvard.edu.44259 > raspoutine.rezel.enst.fr.ssh: Flags [.], ack 27121, win 658, options [nop,nop,TS val 10274737 ecr 143199854], length 0
22:47:35.972681 IP raspoutine.rezel.enst.fr.ssh > dhcp-140-247-103-184.fas.harvard.edu.44259: Flags [P.], seq 27121:27169, ack 480, win 435, options [nop,nop,TS val 143199854 ecr 10274727], length 48
22:47:35.972689 IP dhcp-140-247-103-184.fas.harvard.edu.44259 > raspoutine.rezel.enst.fr.ssh: Flags [.], ack 27169, win 658, options [nop,nop,TS val 10274737 ecr 143199854], length 0
22:47:35.972693 IP raspoutine.rezel.enst.fr.ssh > dhcp-140-247-103-184.fas.harvard.edu.44259: Flags [P.], seq 27169:27217, ack 480, win 435, options [nop,nop,TS val 143199854 ecr 10274727], length 48
22:47:35.972697 IP dhcp-140-247-103-184.fas.harvard.edu.44259 > raspoutine.rezel.enst.fr.ssh: Flags [.], ack 27217, win 661, options [nop,nop,TS val 10274737 ecr 143199854], length 0
22:47:35.972861 IP raspoutine.rezel.enst.fr.ssh > dhcp-140-247-103-184.fas.harvard.edu.44259: Flags [P.], seq 27217:27265, ack 480, win 435, options [nop,nop,TS val 143199854 ecr 10274727], length 48
22:47:35.972897 IP dhcp-140-247-103-184.fas.harvard.edu.44259 > raspoutine.rezel.enst.fr.ssh: Flags [.], ack 27265, win 661, options [nop,nop,TS val 10274737 ecr 143199854], length 0
22:47:36.007380 IP dhcp-140-247-103-184.fas.harvard.edu.44259 > raspoutine.rezel.enst.fr.ssh: Flags [P.], seq 480:528, ack 27265, win 661, options [nop,nop,TS val 10274741 ecr 143199854], length 48
22:47:36.034012 IP raspoutine.rezel.enst.fr.ssh > dhcp-140-247-103-184.fas.harvard.edu.44259: Flags [P.], seq 27265:27377, ack 480, win 435, options [nop,nop,TS val 143199870 ecr 10274733], length 112
22:47:36.034073 IP dhcp-140-247-103-184.fas.harvard.edu.44259 > raspoutine.rezel.enst.fr.ssh: Flags [.], ack 27377, win 661, options [nop,nop,TS val 10274744 ecr 143199870], length 0
22:47:36.112833 IP raspoutine.rezel.enst.fr.ssh > dhcp-140-247-103-184.fas.harvard.edu.44259: Flags [P.], seq 27377:27441, ack 528, win 435, options [nop,nop,TS val 143199890 ecr 10274741], length 64
22:47:36.112928 IP dhcp-140-247-103-184.fas.harvard.edu.44259 > raspoutine.rezel.enst.fr.ssh: Flags [.], ack 27441, win 661, options [nop,nop,TS val 10274751 ecr 143199890], length 0
22:47:36.114780 IP raspoutine.rezel.enst.fr.ssh > dhcp-140-247-103-184.fas.harvard.edu.44259: Flags [P.], seq 27441:28513, ack 528, win 435, options [nop,nop,TS val 143199890 ecr 10274741], length 1072
22:47:36.114792 IP raspoutine.rezel.enst.fr.ssh > dhcp-140-247-103-184.fas.harvard.edu.44259: Flags [P.], seq 28513:29585, ack 528, win 435, options [nop,nop,TS val 143199890 ecr 10274741], length 1072
22:47:36.114795 IP raspoutine.rezel.enst.fr.ssh > dhcp-140-247-103-184.fas.harvard.edu.44259: Flags [P.], seq 29585:29857, ack 528, win 435, options [nop,nop,TS val 143199890 ecr 10274741], length 272
22:47:36.114800 IP raspoutine.rezel.enst.fr.ssh > dhcp-140-247-103-184.fas.harvard.edu.44259: Flags [P.], seq 29857:29905, ack 528, win 435, options [nop,nop,TS val 143199890 ecr 10274741], length 48
22:47:36.114804 IP raspoutine.rezel.enst.fr.ssh > dhcp-140-247-103-184.fas.harvard.edu.44259: Flags [P.], seq 29905:29953, ack 528, win 435, options [nop,nop,TS val 143199890 ecr 10274741], length 48
22:47:36.114807 IP raspoutine.rezel.enst.fr.ssh > dhcp-140-247-103-184.fas.harvard.edu.44259: Flags [P.], seq 29953:30001, ack 528, win 435, options [nop,nop,TS val 143199890 ecr 10274741], length 48
22:47:36.114809 IP raspoutine.rezel.enst.fr.ssh > dhcp-140-247-103-184.fas.harvard.edu.44259: Flags [P.], seq 30001:30049, ack 528, win 435, options [nop,nop,TS val 143199890 ecr 10274741], length 48
22:47:36.114812 IP raspoutine.rezel.enst.fr.ssh > dhcp-140-247-103-184.fas.harvard.edu.44259: Flags [P.], seq 30049:30113, ack 528, win 435, options [nop,nop,TS val 143199890 ecr 10274741], length 64
22:47:36.114843 IP dhcp-140-247-103-184.fas.harvard.edu.44259 > raspoutine.rezel.enst.fr.ssh: Flags [.], ack 30113, win 661, options [nop,nop,TS val 10274752 ecr 143199890], length 0
22:47:36.149365 IP dhcp-140-247-103-184.fas.harvard.edu.44259 > raspoutine.rezel.enst.fr.ssh: Flags [P.], seq 528:576, ack 30113, win 661, options [nop,nop,TS val 10274755 ecr 143199890], length 48
22:47:36.254944 IP raspoutine.rezel.enst.fr.ssh > dhcp-140-247-103-184.fas.harvard.edu.44259: Flags [P.], seq 30113:30177, ack 576, win 435, options [nop,nop,TS val 143199925 ecr 10274755], length 64
22:47:36.256474 IP raspoutine.rezel.enst.fr.ssh > dhcp-140-247-103-184.fas.harvard.edu.44259: Flags [P.], seq 30177:31249, ack 576, win 435, options [nop,nop,TS val 143199925 ecr 10274755], length 1072
22:47:36.256487 IP dhcp-140-247-103-184.fas.harvard.edu.44259 > raspoutine.rezel.enst.fr.ssh: Flags [.], ack 31249, win 661, options [nop,nop,TS val 10274766 ecr 143199925], length 0
22:47:36.256495 IP raspoutine.rezel.enst.fr.ssh > dhcp-140-247-103-184.fas.harvard.edu.44259: Flags [P.], seq 31249:32321, ack 576, win 435, options [nop,nop,TS val 143199925 ecr 10274755], length 1072
22:47:36.256499 IP raspoutine.rezel.enst.fr.ssh > dhcp-140-247-103-184.fas.harvard.edu.44259: Flags [P.], seq 32321:32705, ack 576, win 435, options [nop,nop,TS val 143199925 ecr 10274755], length 384
22:47:36.256503 IP raspoutine.rezel.enst.fr.ssh > dhcp-140-247-103-184.fas.harvard.edu.44259: Flags [P.], seq 32705:32753, ack 576, win 435, options [nop,nop,TS val 143199925 ecr 10274755], length 48
22:47:36.256505 IP raspoutine.rezel.enst.fr.ssh > dhcp-140-247-103-184.fas.harvard.edu.44259: Flags [P.], seq 32753:32801, ack 576, win 435, options [nop,nop,TS val 143199925 ecr 10274755], length 48
22:47:36.256594 IP dhcp-140-247-103-184.fas.harvard.edu.44259 > raspoutine.rezel.enst.fr.ssh: Flags [.], ack 32801, win 661, options [nop,nop,TS val 10274766 ecr 143199925], length 0
22:47:36.256603 IP raspoutine.rezel.enst.fr.ssh > dhcp-140-247-103-184.fas.harvard.edu.44259: Flags [P.], seq 32801:32849, ack 576, win 435, options [nop,nop,TS val 143199925 ecr 10274755], length 48
22:47:36.256690 IP raspoutine.rezel.enst.fr.ssh > dhcp-140-247-103-184.fas.harvard.edu.44259: Flags [P.], seq 32849:32897, ack 576, win 435, options [nop,nop,TS val 143199925 ecr 10274755], length 48
22:47:36.256702 IP raspoutine.rezel.enst.fr.ssh > dhcp-140-247-103-184.fas.harvard.edu.44259: Flags [P.], seq 32897:32961, ack 576, win 435, options [nop,nop,TS val 143199925 ecr 10274755], length 64
22:47:36.256726 IP dhcp-140-247-103-184.fas.harvard.edu.44259 > raspoutine.rezel.enst.fr.ssh: Flags [.], ack 32961, win 661, options [nop,nop,TS val 10274766 ecr 143199925], length 0
22:47:36.297426 IP dhcp-140-247-103-184.fas.harvard.edu.44259 > raspoutine.rezel.enst.fr.ssh: Flags [P.], seq 576:624, ack 32961, win 661, options [nop,nop,TS val 10274770 ecr 143199925], length 48
22:47:36.402912 IP raspoutine.rezel.enst.fr.ssh > dhcp-140-247-103-184.fas.harvard.edu.44259: Flags [P.], seq 32961:33025, ack 624, win 435, options [nop,nop,TS val 143199962 ecr 10274770], length 64
22:47:36.404358 IP raspoutine.rezel.enst.fr.ssh > dhcp-140-247-103-184.fas.harvard.edu.44259: Flags [P.], seq 33025:34097, ack 624, win 435, options [nop,nop,TS val 143199962 ecr 10274770], length 1072
22:47:36.404370 IP dhcp-140-247-103-184.fas.harvard.edu.44259 > raspoutine.rezel.enst.fr.ssh: Flags [.], ack 34097, win 661, options [nop,nop,TS val 10274781 ecr 143199962], length 0
22:47:36.404468 IP raspoutine.rezel.enst.fr.ssh > dhcp-140-247-103-184.fas.harvard.edu.44259: Flags [P.], seq 34097:35169, ack 624, win 435, options [nop,nop,TS val 143199962 ecr 10274770], length 1072
22:47:36.404480 IP raspoutine.rezel.enst.fr.ssh > dhcp-140-247-103-184.fas.harvard.edu.44259: Flags [P.], seq 35169:35489, ack 624, win 435, options [nop,nop,TS val 143199962 ecr 10274770], length 320
22:47:36.404484 IP raspoutine.rezel.enst.fr.ssh > dhcp-140-247-103-184.fas.harvard.edu.44259: Flags [P.], seq 35489:35537, ack 624, win 435, options [nop,nop,TS val 143199962 ecr 10274770], length 48
22:47:36.404488 IP raspoutine.rezel.enst.fr.ssh > dhcp-140-247-103-184.fas.harvard.edu.44259: Flags [P.], seq 35537:35585, ack 624, win 435, options [nop,nop,TS val 143199962 ecr 10274770], length 48
22:47:36.404567 IP dhcp-140-247-103-184.fas.harvard.edu.44259 > raspoutine.rezel.enst.fr.ssh: Flags [.], ack 35585, win 661, options [nop,nop,TS val 10274781 ecr 143199962], length 0
22:47:36.404671 IP raspoutine.rezel.enst.fr.ssh > dhcp-140-247-103-184.fas.harvard.edu.44259: Flags [P.], seq 35585:35633, ack 624, win 435, options [nop,nop,TS val 143199962 ecr 10274770], length 48
22:47:36.404682 IP raspoutine.rezel.enst.fr.ssh > dhcp-140-247-103-184.fas.harvard.edu.44259: Flags [P.], seq 35633:35681, ack 624, win 435, options [nop,nop,TS val 143199962 ecr 10274770], length 48
22:47:36.404686 IP raspoutine.rezel.enst.fr.ssh > dhcp-140-247-103-184.fas.harvard.edu.44259: Flags [P.], seq 35681:35745, ack 624, win 435, options [nop,nop,TS val 143199962 ecr 10274770], length 64
22:47:36.404786 IP dhcp-140-247-103-184.fas.harvard.edu.44259 > raspoutine.rezel.enst.fr.ssh: Flags [.], ack 35745, win 661, options [nop,nop,TS val 10274781 ecr 143199962], length 0
22:47:36.432775 IP dhcp-140-247-103-184.fas.harvard.edu.44259 > raspoutine.rezel.enst.fr.ssh: Flags [P.], seq 624:672, ack 35745, win 661, options [nop,nop,TS val 10274783 ecr 143199962], length 48
22:47:36.538186 IP raspoutine.rezel.enst.fr.ssh > dhcp-140-247-103-184.fas.harvard.edu.44259: Flags [P.], seq 35745:35809, ack 672, win 435, options [nop,nop,TS val 143199996 ecr 10274783], length 64
22:47:36.539734 IP raspoutine.rezel.enst.fr.ssh > dhcp-140-247-103-184.fas.harvard.edu.44259: Flags [P.], seq 35809:36881, ack 672, win 435, options [nop,nop,TS val 143199996 ecr 10274783], length 1072
22:47:36.539747 IP dhcp-140-247-103-184.fas.harvard.edu.44259 > raspoutine.rezel.enst.fr.ssh: Flags [.], ack 36881, win 661, options [nop,nop,TS val 10274794 ecr 143199996], length 0
22:47:36.539818 IP raspoutine.rezel.enst.fr.ssh > dhcp-140-247-103-184.fas.harvard.edu.44259: Flags [P.], seq 36881:37953, ack 672, win 435, options [nop,nop,TS val 143199996 ecr 10274783], length 1072
22:47:36.539826 IP raspoutine.rezel.enst.fr.ssh > dhcp-140-247-103-184.fas.harvard.edu.44259: Flags [P.], seq 37953:38209, ack 672, win 435, options [nop,nop,TS val 143199996 ecr 10274783], length 256
22:47:36.539833 IP raspoutine.rezel.enst.fr.ssh > dhcp-140-247-103-184.fas.harvard.edu.44259: Flags [P.], seq 38209:38257, ack 672, win 435, options [nop,nop,TS val 143199996 ecr 10274783], length 48
22:47:36.539837 IP raspoutine.rezel.enst.fr.ssh > dhcp-140-247-103-184.fas.harvard.edu.44259: Flags [P.], seq 38257:38305, ack 672, win 435, options [nop,nop,TS val 143199996 ecr 10274783], length 48
22:47:36.539842 IP raspoutine.rezel.enst.fr.ssh > dhcp-140-247-103-184.fas.harvard.edu.44259: Flags [P.], seq 38305:38353, ack 672, win 435, options [nop,nop,TS val 143199996 ecr 10274783], length 48
22:47:36.539846 IP raspoutine.rezel.enst.fr.ssh > dhcp-140-247-103-184.fas.harvard.edu.44259: Flags [P.], seq 38353:38401, ack 672, win 435, options [nop,nop,TS val 143199996 ecr 10274783], length 48
22:47:36.539908 IP raspoutine.rezel.enst.fr.ssh > dhcp-140-247-103-184.fas.harvard.edu.44259: Flags [P.], seq 38401:38465, ack 672, win 435, options [nop,nop,TS val 143199996 ecr 10274783], length 64
22:47:36.539946 IP dhcp-140-247-103-184.fas.harvard.edu.44259 > raspoutine.rezel.enst.fr.ssh: Flags [.], ack 38465, win 661, options [nop,nop,TS val 10274794 ecr 143199996], length 0
22:47:36.574646 IP dhcp-140-247-103-184.fas.harvard.edu.44259 > raspoutine.rezel.enst.fr.ssh: Flags [P.], seq 672:720, ack 38465, win 661, options [nop,nop,TS val 10274798 ecr 143199996], length 48
22:47:36.680123 IP raspoutine.rezel.enst.fr.ssh > dhcp-140-247-103-184.fas.harvard.edu.44259: Flags [P.], seq 38465:38529, ack 720, win 435, options [nop,nop,TS val 143200032 ecr 10274798], length 64
22:47:36.681627 IP raspoutine.rezel.enst.fr.ssh > dhcp-140-247-103-184.fas.harvard.edu.44259: Flags [P.], seq 38529:39601, ack 720, win 435, options [nop,nop,TS val 143200032 ecr 10274798], length 1072
22:47:36.681641 IP dhcp-140-247-103-184.fas.harvard.edu.44259 > raspoutine.rezel.enst.fr.ssh: Flags [.], ack 39601, win 661, options [nop,nop,TS val 10274808 ecr 143200032], length 0
22:47:36.681715 IP raspoutine.rezel.enst.fr.ssh > dhcp-140-247-103-184.fas.harvard.edu.44259: Flags [P.], seq 39601:40673, ack 720, win 435, options [nop,nop,TS val 143200032 ecr 10274798], length 1072
22:47:36.681723 IP raspoutine.rezel.enst.fr.ssh > dhcp-140-247-103-184.fas.harvard.edu.44259: Flags [P.], seq 40673:40993, ack 720, win 435, options [nop,nop,TS val 143200032 ecr 10274798], length 320
22:47:36.681731 IP raspoutine.rezel.enst.fr.ssh > dhcp-140-247-103-184.fas.harvard.edu.44259: Flags [P.], seq 40993:41041, ack 720, win 435, options [nop,nop,TS val 143200032 ecr 10274798], length 48
