22:37:08.686648 IP dhcp-140-247-103-184.fas.harvard.edu.40884 > a1plpkivs-v03.any.prod.ash1.secureserver.net.http: Flags [S], seq 671341052, win 14600, options [mss 1460,sackOK,TS val 10212009 ecr 0,nop,wscale 6], length 0
22:37:08.721302 IP a1plpkivs-v03.any.prod.ash1.secureserver.net.http > dhcp-140-247-103-184.fas.harvard.edu.40884: Flags [S.], seq 993550601, ack 671341053, win 5792, options [mss 1380,sackOK,TS val 1670144290 ecr 10212009,nop,wscale 7], length 0
22:37:08.721336 IP dhcp-140-247-103-184.fas.harvard.edu.40884 > a1plpkivs-v03.any.prod.ash1.secureserver.net.http: Flags [.], ack 1, win 229, options [nop,nop,TS val 10212012 ecr 1670144290], length 0
22:37:08.721733 IP dhcp-140-247-103-184.fas.harvard.edu.40884 > a1plpkivs-v03.any.prod.ash1.secureserver.net.http: Flags [P.], seq 1:389, ack 1, win 229, options [nop,nop,TS val 10212012 ecr 1670144290], length 388
22:37:08.755804 IP a1plpkivs-v03.any.prod.ash1.secureserver.net.http > dhcp-140-247-103-184.fas.harvard.edu.40884: Flags [.], ack 389, win 54, options [nop,nop,TS val 1670144324 ecr 10212012], length 0
22:37:08.756348 IP a1plpkivs-v03.any.prod.ash1.secureserver.net.http > dhcp-140-247-103-184.fas.harvard.edu.40884: Flags [P.], seq 1:2413, ack 389, win 54, options [nop,nop,TS val 1670144325 ecr 10212012], length 2412
22:37:08.756361 IP dhcp-140-247-103-184.fas.harvard.edu.40884 > a1plpkivs-v03.any.prod.ash1.secureserver.net.http: Flags [.], ack 2413, win 304, options [nop,nop,TS val 10212016 ecr 1670144325], length 0
22:37:08.756371 IP a1plpkivs-v03.any.prod.ash1.secureserver.net.http > dhcp-140-247-103-184.fas.harvard.edu.40884: Flags [F.], seq 2413, ack 389, win 54, options [nop,nop,TS val 1670144325 ecr 10212012], length 0
22:37:08.756707 IP dhcp-140-247-103-184.fas.harvard.edu.40884 > a1plpkivs-v03.any.prod.ash1.secureserver.net.http: Flags [F.], seq 389, ack 2414, win 304, options [nop,nop,TS val 10212016 ecr 1670144325], length 0
22:37:08.790513 IP a1plpkivs-v03.any.prod.ash1.secureserver.net.http > dhcp-140-247-103-184.fas.harvard.edu.40884: Flags [.], ack 390, win 54, options [nop,nop,TS val 1670144359 ecr 10212016], length 0
22:37:08.916338 IP dhcp-140-247-103-184.fas.harvard.edu.40886 > a1plpkivs-v03.any.prod.ash1.secureserver.net.http: Flags [S], seq 4183759298, win 14600, options [mss 1460,sackOK,TS val 10212032 ecr 0,nop,wscale 6], length 0
22:37:08.950402 IP a1plpkivs-v03.any.prod.ash1.secureserver.net.http > dhcp-140-247-103-184.fas.harvard.edu.40886: Flags [S.], seq 2811095202, ack 4183759299, win 5792, options [mss 1380,sackOK,TS val 1670144519 ecr 10212032,nop,wscale 7], length 0
22:37:08.950434 IP dhcp-140-247-103-184.fas.harvard.edu.40886 > a1plpkivs-v03.any.prod.ash1.secureserver.net.http: Flags [.], ack 1, win 229, options [nop,nop,TS val 10212035 ecr 1670144519], length 0
22:37:08.950767 IP dhcp-140-247-103-184.fas.harvard.edu.40886 > a1plpkivs-v03.any.prod.ash1.secureserver.net.http: Flags [P.], seq 1:389, ack 1, win 229, options [nop,nop,TS val 10212035 ecr 1670144519], length 388
22:37:08.984472 IP a1plpkivs-v03.any.prod.ash1.secureserver.net.http > dhcp-140-247-103-184.fas.harvard.edu.40886: Flags [.], ack 389, win 54, options [nop,nop,TS val 1670144553 ecr 10212035], length 0
22:37:08.985313 IP a1plpkivs-v03.any.prod.ash1.secureserver.net.http > dhcp-140-247-103-184.fas.harvard.edu.40886: Flags [.], seq 1:1369, ack 389, win 54, options [nop,nop,TS val 1670144554 ecr 10212035], length 1368
22:37:08.985326 IP dhcp-140-247-103-184.fas.harvard.edu.40886 > a1plpkivs-v03.any.prod.ash1.secureserver.net.http: Flags [.], ack 1369, win 274, options [nop,nop,TS val 10212039 ecr 1670144554], length 0
22:37:08.985332 IP a1plpkivs-v03.any.prod.ash1.secureserver.net.http > dhcp-140-247-103-184.fas.harvard.edu.40886: Flags [F.], seq 2413, ack 389, win 54, options [nop,nop,TS val 1670144554 ecr 10212035], length 0
22:37:08.985336 IP dhcp-140-247-103-184.fas.harvard.edu.40886 > a1plpkivs-v03.any.prod.ash1.secureserver.net.http: Flags [.], ack 1369, win 274, options [nop,nop,TS val 10212039 ecr 1670144554,nop,nop,sack 1 {2413:2414}], length 0
22:37:08.985341 IP a1plpkivs-v03.any.prod.ash1.secureserver.net.http > dhcp-140-247-103-184.fas.harvard.edu.40886: Flags [P.], seq 1369:2413, ack 389, win 54, options [nop,nop,TS val 1670144554 ecr 10212035], length 1044
22:37:08.985347 IP dhcp-140-247-103-184.fas.harvard.edu.40886 > a1plpkivs-v03.any.prod.ash1.secureserver.net.http: Flags [.], ack 2414, win 319, options [nop,nop,TS val 10212039 ecr 1670144554], length 0
22:37:08.985642 IP dhcp-140-247-103-184.fas.harvard.edu.40886 > a1plpkivs-v03.any.prod.ash1.secureserver.net.http: Flags [F.], seq 389, ack 2414, win 319, options [nop,nop,TS val 10212039 ecr 1670144554], length 0
22:37:09.019359 IP a1plpkivs-v03.any.prod.ash1.secureserver.net.http > dhcp-140-247-103-184.fas.harvard.edu.40886: Flags [.], ack 390, win 54, options [nop,nop,TS val 1670144588 ecr 10212039], length 0
22:37:09.657124 IP dhcp-140-247-103-184.fas.harvard.edu.39242 > lga15s29-in-f19.1e100.net.http: Flags [S], seq 1051007592, win 14600, options [mss 1460,sackOK,TS val 10212106 ecr 0,nop,wscale 6], length 0
22:37:09.657163 IP dhcp-140-247-103-184.fas.harvard.edu.39243 > lga15s29-in-f19.1e100.net.http: Flags [S], seq 201094354, win 14600, options [mss 1460,sackOK,TS val 10212106 ecr 0,nop,wscale 6], length 0
22:37:09.657196 IP dhcp-140-247-103-184.fas.harvard.edu.39244 > lga15s29-in-f19.1e100.net.http: Flags [S], seq 2688384147, win 14600, options [mss 1460,sackOK,TS val 10212106 ecr 0,nop,wscale 6], length 0
22:37:09.663361 IP lga15s29-in-f19.1e100.net.http > dhcp-140-247-103-184.fas.harvard.edu.39244: Flags [S.], seq 649746961, ack 2688384148, win 62392, options [mss 1380,sackOK,TS val 2740452661 ecr 10212106,nop,wscale 6], length 0
22:37:09.663413 IP dhcp-140-247-103-184.fas.harvard.edu.39244 > lga15s29-in-f19.1e100.net.http: Flags [.], ack 1, win 229, options [nop,nop,TS val 10212107 ecr 2740452661], length 0
22:37:09.663536 IP lga15s29-in-f19.1e100.net.http > dhcp-140-247-103-184.fas.harvard.edu.39242: Flags [S.], seq 649685702, ack 1051007593, win 62392, options [mss 1380,sackOK,TS val 2740452661 ecr 10212106,nop,wscale 6], length 0
22:37:09.663558 IP dhcp-140-247-103-184.fas.harvard.edu.39242 > lga15s29-in-f19.1e100.net.http: Flags [.], ack 1, win 229, options [nop,nop,TS val 10212107 ecr 2740452661], length 0
22:37:09.663568 IP lga15s29-in-f19.1e100.net.http > dhcp-140-247-103-184.fas.harvard.edu.39243: Flags [S.], seq 665902813, ack 201094355, win 62392, options [mss 1380,sackOK,TS val 2740452661 ecr 10212106,nop,wscale 6], length 0
22:37:09.663580 IP dhcp-140-247-103-184.fas.harvard.edu.39243 > lga15s29-in-f19.1e100.net.http: Flags [.], ack 1, win 229, options [nop,nop,TS val 10212107 ecr 2740452661], length 0
22:37:09.663751 IP dhcp-140-247-103-184.fas.harvard.edu.39244 > lga15s29-in-f19.1e100.net.http: Flags [.], seq 1:1369, ack 1, win 229, options [nop,nop,TS val 10212107 ecr 2740452661], length 1368
22:37:09.663761 IP dhcp-140-247-103-184.fas.harvard.edu.39244 > lga15s29-in-f19.1e100.net.http: Flags [P.], seq 1369:1456, ack 1, win 229, options [nop,nop,TS val 10212107 ecr 2740452661], length 87
22:37:09.669730 IP lga15s29-in-f19.1e100.net.http > dhcp-140-247-103-184.fas.harvard.edu.39244: Flags [.], ack 1456, win 954, options [nop,nop,TS val 2740452667 ecr 10212107], length 0
22:37:10.463967 IP dhcp-140-247-103-184.fas.harvard.edu.39244 > lga15s29-in-f19.1e100.net.http: Flags [F.], seq 1456, ack 1, win 229, options [nop,nop,TS val 10212187 ecr 2740452667], length 0
22:37:10.466005 IP dhcp-140-247-103-184.fas.harvard.edu.39242 > lga15s29-in-f19.1e100.net.http: Flags [P.], seq 1:1285, ack 1, win 229, options [nop,nop,TS val 10212187 ecr 2740452661], length 1284
22:37:10.471939 IP lga15s29-in-f19.1e100.net.http > dhcp-140-247-103-184.fas.harvard.edu.39242: Flags [.], ack 1285, win 1002, options [nop,nop,TS val 2740453470 ecr 10212187], length 0
22:37:10.494769 IP lga15s29-in-f19.1e100.net.http > dhcp-140-247-103-184.fas.harvard.edu.39242: Flags [.], seq 1:1369, ack 1285, win 1002, options [nop,nop,TS val 2740453493 ecr 10212187], length 1368
22:37:10.494791 IP dhcp-140-247-103-184.fas.harvard.edu.39242 > lga15s29-in-f19.1e100.net.http: Flags [.], ack 1369, win 274, options [nop,nop,TS val 10212190 ecr 2740453493], length 0
22:37:10.494803 IP lga15s29-in-f19.1e100.net.http > dhcp-140-247-103-184.fas.harvard.edu.39242: Flags [.], seq 1369:2737, ack 1285, win 1002, options [nop,nop,TS val 2740453493 ecr 10212187], length 1368
22:37:10.494808 IP dhcp-140-247-103-184.fas.harvard.edu.39242 > lga15s29-in-f19.1e100.net.http: Flags [.], ack 2737, win 319, options [nop,nop,TS val 10212190 ecr 2740453493], length 0
22:37:10.494813 IP lga15s29-in-f19.1e100.net.http > dhcp-140-247-103-184.fas.harvard.edu.39242: Flags [.], seq 2737:4105, ack 1285, win 1002, options [nop,nop,TS val 2740453493 ecr 10212187], length 1368
22:37:10.494821 IP dhcp-140-247-103-184.fas.harvard.edu.39242 > lga15s29-in-f19.1e100.net.http: Flags [.], ack 4105, win 364, options [nop,nop,TS val 10212190 ecr 2740453493], length 0
22:37:10.494825 IP lga15s29-in-f19.1e100.net.http > dhcp-140-247-103-184.fas.harvard.edu.39242: Flags [.], seq 4105:5473, ack 1285, win 1002, options [nop,nop,TS val 2740453493 ecr 10212187], length 1368
22:37:10.494830 IP dhcp-140-247-103-184.fas.harvard.edu.39242 > lga15s29-in-f19.1e100.net.http: Flags [.], ack 5473, win 410, options [nop,nop,TS val 10212190 ecr 2740453493], length 0
22:37:10.494834 IP lga15s29-in-f19.1e100.net.http > dhcp-140-247-103-184.fas.harvard.edu.39242: Flags [.], seq 5473:6841, ack 1285, win 1002, options [nop,nop,TS val 2740453493 ecr 10212187], length 1368
22:37:10.494839 IP dhcp-140-247-103-184.fas.harvard.edu.39242 > lga15s29-in-f19.1e100.net.http: Flags [.], ack 6841, win 455, options [nop,nop,TS val 10212190 ecr 2740453493], length 0
22:37:10.494843 IP lga15s29-in-f19.1e100.net.http > dhcp-140-247-103-184.fas.harvard.edu.39242: Flags [.], seq 6841:8209, ack 1285, win 1002, options [nop,nop,TS val 2740453493 ecr 10212187], length 1368
22:37:10.494848 IP dhcp-140-247-103-184.fas.harvard.edu.39242 > lga15s29-in-f19.1e100.net.http: Flags [.], ack 8209, win 500, options [nop,nop,TS val 10212190 ecr 2740453493], length 0
22:37:10.494852 IP lga15s29-in-f19.1e100.net.http > dhcp-140-247-103-184.fas.harvard.edu.39242: Flags [.], seq 8209:9577, ack 1285, win 1002, options [nop,nop,TS val 2740453493 ecr 10212187], length 1368
22:37:10.494857 IP dhcp-140-247-103-184.fas.harvard.edu.39242 > lga15s29-in-f19.1e100.net.http: Flags [.], ack 9577, win 545, options [nop,nop,TS val 10212190 ecr 2740453493], length 0
22:37:10.494861 IP lga15s29-in-f19.1e100.net.http > dhcp-140-247-103-184.fas.harvard.edu.39242: Flags [.], seq 9577:10945, ack 1285, win 1002, options [nop,nop,TS val 2740453493 ecr 10212187], length 1368
22:37:10.494865 IP dhcp-140-247-103-184.fas.harvard.edu.39242 > lga15s29-in-f19.1e100.net.http: Flags [.], ack 10945, win 568, options [nop,nop,TS val 10212190 ecr 2740453493], length 0
22:37:10.494869 IP lga15s29-in-f19.1e100.net.http > dhcp-140-247-103-184.fas.harvard.edu.39242: Flags [.], seq 10945:12313, ack 1285, win 1002, options [nop,nop,TS val 2740453493 ecr 10212187], length 1368
22:37:10.494874 IP dhcp-140-247-103-184.fas.harvard.edu.39242 > lga15s29-in-f19.1e100.net.http: Flags [.], ack 12313, win 554, options [nop,nop,TS val 10212190 ecr 2740453493], length 0
22:37:10.494878 IP lga15s29-in-f19.1e100.net.http > dhcp-140-247-103-184.fas.harvard.edu.39242: Flags [P.], seq 12313:13116, ack 1285, win 1002, options [nop,nop,TS val 2740453493 ecr 10212187], length 803
22:37:10.494882 IP dhcp-140-247-103-184.fas.harvard.edu.39242 > lga15s29-in-f19.1e100.net.http: Flags [.], ack 13116, win 542, options [nop,nop,TS val 10212190 ecr 2740453493], length 0
22:37:10.510814 IP lga15s29-in-f19.1e100.net.http > dhcp-140-247-103-184.fas.harvard.edu.39244: Flags [.], ack 1457, win 975, options [nop,nop,TS val 2740453508 ecr 10212187], length 0
22:37:10.575479 IP lga15s29-in-f19.1e100.net.http > dhcp-140-247-103-184.fas.harvard.edu.39242: Flags [.], seq 13116:14484, ack 1285, win 1002, options [nop,nop,TS val 2740453573 ecr 10212190], length 1368
22:37:10.575507 IP dhcp-140-247-103-184.fas.harvard.edu.39242 > lga15s29-in-f19.1e100.net.http: Flags [.], ack 14484, win 636, options [nop,nop,TS val 10212198 ecr 2740453573], length 0
22:37:10.575519 IP lga15s29-in-f19.1e100.net.http > dhcp-140-247-103-184.fas.harvard.edu.39242: Flags [.], seq 14484:15852, ack 1285, win 1002, options [nop,nop,TS val 2740453573 ecr 10212190], length 1368
22:37:10.575524 IP dhcp-140-247-103-184.fas.harvard.edu.39242 > lga15s29-in-f19.1e100.net.http: Flags [.], ack 15852, win 654, options [nop,nop,TS val 10212198 ecr 2740453573], length 0
22:37:10.575528 IP lga15s29-in-f19.1e100.net.http > dhcp-140-247-103-184.fas.harvard.edu.39242: Flags [.], seq 15852:17220, ack 1285, win 1002, options [nop,nop,TS val 2740453573 ecr 10212190], length 1368
22:37:10.575533 IP dhcp-140-247-103-184.fas.harvard.edu.39242 > lga15s29-in-f19.1e100.net.http: Flags [.], ack 17220, win 640, options [nop,nop,TS val 10212198 ecr 2740453573], length 0
22:37:10.575537 IP lga15s29-in-f19.1e100.net.http > dhcp-140-247-103-184.fas.harvard.edu.39242: Flags [P.], seq 17220:18189, ack 1285, win 1002, options [nop,nop,TS val 2740453573 ecr 10212190], length 969
22:37:10.575541 IP dhcp-140-247-103-184.fas.harvard.edu.39242 > lga15s29-in-f19.1e100.net.http: Flags [.], ack 18189, win 626, options [nop,nop,TS val 10212198 ecr 2740453573], length 0
22:37:10.723962 IP lga15s29-in-f19.1e100.net.http > dhcp-140-247-103-184.fas.harvard.edu.39244: Flags [.], seq 1:1369, ack 1457, win 975, options [nop,nop,TS val 2740453722 ecr 10212187], length 1368
22:37:10.723989 IP dhcp-140-247-103-184.fas.harvard.edu.39244 > lga15s29-in-f19.1e100.net.http: Flags [R], seq 2688385604, win 0, length 0
22:37:10.723997 IP lga15s29-in-f19.1e100.net.http > dhcp-140-247-103-184.fas.harvard.edu.39244: Flags [.], seq 1369:2737, ack 1457, win 975, options [nop,nop,TS val 2740453722 ecr 10212187], length 1368
22:37:10.724003 IP dhcp-140-247-103-184.fas.harvard.edu.39244 > lga15s29-in-f19.1e100.net.http: Flags [R], seq 2688385604, win 0, length 0
22:37:10.724007 IP lga15s29-in-f19.1e100.net.http > dhcp-140-247-103-184.fas.harvard.edu.39244: Flags [P.], seq 2737:4088, ack 1457, win 975, options [nop,nop,TS val 2740453722 ecr 10212187], length 1351
22:37:10.724010 IP dhcp-140-247-103-184.fas.harvard.edu.39244 > lga15s29-in-f19.1e100.net.http: Flags [R], seq 2688385604, win 0, length 0
22:37:10.724014 IP lga15s29-in-f19.1e100.net.http > dhcp-140-247-103-184.fas.harvard.edu.39244: Flags [F.], seq 4088, ack 1457, win 975, options [nop,nop,TS val 2740453722 ecr 10212187], length 0
22:37:10.724017 IP dhcp-140-247-103-184.fas.harvard.edu.39244 > lga15s29-in-f19.1e100.net.http: Flags [R], seq 2688385604, win 0, length 0
22:37:11.765195 IP dhcp-140-247-103-184.fas.harvard.edu.51250 > wikipedia-lb.eqiad.wikimedia.org.http: Flags [S], seq 1471744905, win 14600, options [mss 1460,sackOK,TS val 10212317 ecr 0,nop,wscale 6], length 0
22:37:11.765276 IP dhcp-140-247-103-184.fas.harvard.edu.51251 > wikipedia-lb.eqiad.wikimedia.org.http: Flags [S], seq 1372801472, win 14600, options [mss 1460,sackOK,TS val 10212317 ecr 0,nop,wscale 6], length 0
22:37:11.765302 IP dhcp-140-247-103-184.fas.harvard.edu.51252 > wikipedia-lb.eqiad.wikimedia.org.http: Flags [S], seq 3051726986, win 14600, options [mss 1460,sackOK,TS val 10212317 ecr 0,nop,wscale 6], length 0
22:37:11.765326 IP dhcp-140-247-103-184.fas.harvard.edu.51253 > wikipedia-lb.eqiad.wikimedia.org.http: Flags [S], seq 1006638756, win 14600, options [mss 1460,sackOK,TS val 10212317 ecr 0,nop,wscale 6], length 0
22:37:11.765405 IP dhcp-140-247-103-184.fas.harvard.edu.41904 > bits-lb.eqiad.wikimedia.org.http: Flags [S], seq 642696253, win 14600, options [mss 1460,sackOK,TS val 10212317 ecr 0,nop,wscale 6], length 0
22:37:11.765451 IP dhcp-140-247-103-184.fas.harvard.edu.41905 > bits-lb.eqiad.wikimedia.org.http: Flags [S], seq 3312230972, win 14600, options [mss 1460,sackOK,TS val 10212317 ecr 0,nop,wscale 6], length 0
22:37:11.765476 IP dhcp-140-247-103-184.fas.harvard.edu.41906 > bits-lb.eqiad.wikimedia.org.http: Flags [S], seq 3514148799, win 14600, options [mss 1460,sackOK,TS val 10212317 ecr 0,nop,wscale 6], length 0
22:37:11.765497 IP dhcp-140-247-103-184.fas.harvard.edu.41907 > bits-lb.eqiad.wikimedia.org.http: Flags [S], seq 82551037, win 14600, options [mss 1460,sackOK,TS val 10212317 ecr 0,nop,wscale 6], length 0
22:37:11.765521 IP dhcp-140-247-103-184.fas.harvard.edu.41908 > bits-lb.eqiad.wikimedia.org.http: Flags [S], seq 1739542850, win 14600, options [mss 1460,sackOK,TS val 10212317 ecr 0,nop,wscale 6], length 0
22:37:11.765542 IP dhcp-140-247-103-184.fas.harvard.edu.41909 > bits-lb.eqiad.wikimedia.org.http: Flags [S], seq 62823481, win 14600, options [mss 1460,sackOK,TS val 10212317 ecr 0,nop,wscale 6], length 0
22:37:11.770616 IP dhcp-140-247-103-184.fas.harvard.edu.46120 > wikimedia-lb.eqiad.wikimedia.org.http: Flags [S], seq 1805368334, win 14600, options [mss 1460,sackOK,TS val 10212317 ecr 0,nop,wscale 6], length 0
22:37:11.770646 IP dhcp-140-247-103-184.fas.harvard.edu.46121 > wikimedia-lb.eqiad.wikimedia.org.http: Flags [S], seq 2362891172, win 14600, options [mss 1460,sackOK,TS val 10212317 ecr 0,nop,wscale 6], length 0
22:37:11.770670 IP dhcp-140-247-103-184.fas.harvard.edu.46122 > wikimedia-lb.eqiad.wikimedia.org.http: Flags [S], seq 2081400314, win 14600, options [mss 1460,sackOK,TS val 10212317 ecr 0,nop,wscale 6], length 0
22:37:11.770694 IP dhcp-140-247-103-184.fas.harvard.edu.46123 > wikimedia-lb.eqiad.wikimedia.org.http: Flags [S], seq 4114888155, win 14600, options [mss 1460,sackOK,TS val 10212317 ecr 0,nop,wscale 6], length 0
22:37:11.770769 IP dhcp-140-247-103-184.fas.harvard.edu.36803 > upload-lb.eqiad.wikimedia.org.http: Flags [S], seq 3443788727, win 14600, options [mss 1460,sackOK,TS val 10212317 ecr 0,nop,wscale 6], length 0
22:37:11.770859 IP dhcp-140-247-103-184.fas.harvard.edu.36804 > upload-lb.eqiad.wikimedia.org.http: Flags [S], seq 3591458648, win 14600, options [mss 1460,sackOK,TS val 10212317 ecr 0,nop,wscale 6], length 0
22:37:11.770895 IP dhcp-140-247-103-184.fas.harvard.edu.36805 > upload-lb.eqiad.wikimedia.org.http: Flags [S], seq 2065996167, win 14600, options [mss 1460,sackOK,TS val 10212317 ecr 0,nop,wscale 6], length 0
22:37:11.770933 IP dhcp-140-247-103-184.fas.harvard.edu.36806 > upload-lb.eqiad.wikimedia.org.http: Flags [S], seq 2112473998, win 14600, options [mss 1460,sackOK,TS val 10212317 ecr 0,nop,wscale 6], length 0
22:37:11.770962 IP dhcp-140-247-103-184.fas.harvard.edu.36807 > upload-lb.eqiad.wikimedia.org.http: Flags [S], seq 2215119275, win 14600, options [mss 1460,sackOK,TS val 10212317 ecr 0,nop,wscale 6], length 0
22:37:11.770986 IP dhcp-140-247-103-184.fas.harvard.edu.36808 > upload-lb.eqiad.wikimedia.org.http: Flags [S], seq 1178014822, win 14600, options [mss 1460,sackOK,TS val 10212317 ecr 0,nop,wscale 6], length 0
22:37:11.807703 IP wikipedia-lb.eqiad.wikimedia.org.http > dhcp-140-247-103-184.fas.harvard.edu.51250: Flags [S.], seq 971986606, ack 1471744906, win 5792, options [mss 1380,sackOK,TS val 4080466686 ecr 10212317,nop,wscale 9], length 0
22:37:11.807731 IP dhcp-140-247-103-184.fas.harvard.edu.51250 > wikipedia-lb.eqiad.wikimedia.org.http: Flags [.], ack 1, win 229, options [nop,nop,TS val 10212321 ecr 4080466686], length 0
22:37:11.807827 IP wikipedia-lb.eqiad.wikimedia.org.http > dhcp-140-247-103-184.fas.harvard.edu.51251: Flags [S.], seq 3455854903, ack 1372801473, win 5792, options [mss 1380,sackOK,TS val 4080759188 ecr 10212317,nop,wscale 9], length 0
22:37:11.807840 IP dhcp-140-247-103-184.fas.harvard.edu.51251 > wikipedia-lb.eqiad.wikimedia.org.http: Flags [.], ack 1, win 229, options [nop,nop,TS val 10212321 ecr 4080759188], length 0
22:37:11.807846 IP wikipedia-lb.eqiad.wikimedia.org.http > dhcp-140-247-103-184.fas.harvard.edu.51252: Flags [S.], seq 1077237087, ack 3051726987, win 5792, options [mss 1380,sackOK,TS val 4080512763 ecr 10212317,nop,wscale 9], length 0
22:37:11.807854 IP dhcp-140-247-103-184.fas.harvard.edu.51252 > wikipedia-lb.eqiad.wikimedia.org.http: Flags [.], ack 1, win 229, options [nop,nop,TS val 10212321 ecr 4080512763], length 0
22:37:11.807922 IP bits-lb.eqiad.wikimedia.org.http > dhcp-140-247-103-184.fas.harvard.edu.41906: Flags [S.], seq 1814121585, ack 3514148800, win 14480, options [mss 1380,sackOK,TS val 1158050511 ecr 10212317,nop,wscale 9], length 0
22:37:11.807939 IP dhcp-140-247-103-184.fas.harvard.edu.41906 > bits-lb.eqiad.wikimedia.org.http: Flags [.], ack 1, win 229, options [nop,nop,TS val 10212321 ecr 1158050511], length 0
22:37:11.807984 IP dhcp-140-247-103-184.fas.harvard.edu.51250 > wikipedia-lb.eqiad.wikimedia.org.http: Flags [P.], seq 1:820, ack 1, win 229, options [nop,nop,TS val 10212321 ecr 4080466686], length 819
22:37:11.807985 IP bits-lb.eqiad.wikimedia.org.http > dhcp-140-247-103-184.fas.harvard.edu.41905: Flags [S.], seq 2481237195, ack 3312230973, win 14480, options [mss 1380,sackOK,TS val 1158341421 ecr 10212317,nop,wscale 9], length 0
22:37:11.807997 IP dhcp-140-247-103-184.fas.harvard.edu.41905 > bits-lb.eqiad.wikimedia.org.http: Flags [.], ack 1, win 229, options [nop,nop,TS val 10212321 ecr 1158341421], length 0
22:37:11.808160 IP bits-lb.eqiad.wikimedia.org.http > dhcp-140-247-103-184.fas.harvard.edu.41907: Flags [S.], seq 2177246166, ack 82551038, win 14480, options [mss 1380,sackOK,TS val 1198814431 ecr 10212317,nop,wscale 9], length 0
22:37:11.808174 IP dhcp-140-247-103-184.fas.harvard.edu.41907 > bits-lb.eqiad.wikimedia.org.http: Flags [.], ack 1, win 229, options [nop,nop,TS val 10212321 ecr 1198814431], length 0
22:37:11.808179 IP bits-lb.eqiad.wikimedia.org.http > dhcp-140-247-103-184.fas.harvard.edu.41909: Flags [S.], seq 4162291638, ack 62823482, win 14480, options [mss 1380,sackOK,TS val 1158050511 ecr 10212317,nop,wscale 9], length 0
22:37:11.808188 IP dhcp-140-247-103-184.fas.harvard.edu.41909 > bits-lb.eqiad.wikimedia.org.http: Flags [.], ack 1, win 229, options [nop,nop,TS val 10212321 ecr 1158050511], length 0
22:37:11.850381 IP wikipedia-lb.eqiad.wikimedia.org.http > dhcp-140-247-103-184.fas.harvard.edu.51250: Flags [.], ack 820, win 15, options [nop,nop,TS val 4080466690 ecr 10212321], length 0
22:37:11.852304 IP wikipedia-lb.eqiad.wikimedia.org.http > dhcp-140-247-103-184.fas.harvard.edu.51250: Flags [P.], seq 1:566, ack 820, win 15, options [nop,nop,TS val 4080466690 ecr 10212321], length 565
22:37:11.852314 IP dhcp-140-247-103-184.fas.harvard.edu.51250 > wikipedia-lb.eqiad.wikimedia.org.http: Flags [.], ack 566, win 246, options [nop,nop,TS val 10212325 ecr 4080466690], length 0
22:37:11.852365 IP wikipedia-lb.eqiad.wikimedia.org.http > dhcp-140-247-103-184.fas.harvard.edu.51250: Flags [.], seq 566:1934, ack 820, win 15, options [nop,nop,TS val 4080466690 ecr 10212321], length 1368
22:37:11.852376 IP dhcp-140-247-103-184.fas.harvard.edu.51250 > wikipedia-lb.eqiad.wikimedia.org.http: Flags [.], ack 1934, win 292, options [nop,nop,TS val 10212325 ecr 4080466690], length 0
22:37:11.852464 IP wikipedia-lb.eqiad.wikimedia.org.http > dhcp-140-247-103-184.fas.harvard.edu.51250: Flags [P.], seq 1934:4662, ack 820, win 15, options [nop,nop,TS val 4080466690 ecr 10212321], length 2728
22:37:11.852474 IP dhcp-140-247-103-184.fas.harvard.edu.51250 > wikipedia-lb.eqiad.wikimedia.org.http: Flags [.], ack 4662, win 377, options [nop,nop,TS val 10212325 ecr 4080466690], length 0
22:37:11.852484 IP wikipedia-lb.eqiad.wikimedia.org.http > dhcp-140-247-103-184.fas.harvard.edu.51250: Flags [P.], seq 4662:8758, ack 820, win 15, options [nop,nop,TS val 4080466690 ecr 10212321], length 4096
22:37:11.852491 IP dhcp-140-247-103-184.fas.harvard.edu.51250 > wikipedia-lb.eqiad.wikimedia.org.http: Flags [.], ack 8758, win 505, options [nop,nop,TS val 10212325 ecr 4080466690], length 0
22:37:11.852494 IP wikipedia-lb.eqiad.wikimedia.org.http > dhcp-140-247-103-184.fas.harvard.edu.51250: Flags [P.], seq 8758:9621, ack 820, win 15, options [nop,nop,TS val 4080466690 ecr 10212321], length 863
22:37:11.988051 IP dhcp-140-247-103-184.fas.harvard.edu.41906 > bits-lb.eqiad.wikimedia.org.http: Flags [P.], seq 1:726, ack 1, win 229, options [nop,nop,TS val 10212339 ecr 1158050511], length 725
22:37:11.988196 IP dhcp-140-247-103-184.fas.harvard.edu.41905 > bits-lb.eqiad.wikimedia.org.http: Flags [P.], seq 1:569, ack 1, win 229, options [nop,nop,TS val 10212339 ecr 1158341421], length 568
22:37:11.988341 IP dhcp-140-247-103-184.fas.harvard.edu.41907 > bits-lb.eqiad.wikimedia.org.http: Flags [P.], seq 1:558, ack 1, win 229, options [nop,nop,TS val 10212339 ecr 1198814431], length 557
22:37:11.988478 IP dhcp-140-247-103-184.fas.harvard.edu.41909 > bits-lb.eqiad.wikimedia.org.http: Flags [P.], seq 1:481, ack 1, win 229, options [nop,nop,TS val 10212339 ecr 1158050511], length 480
22:37:11.988616 IP dhcp-140-247-103-184.fas.harvard.edu.51250 > wikipedia-lb.eqiad.wikimedia.org.http: Flags [P.], seq 820:1728, ack 9621, win 548, options [nop,nop,TS val 10212339 ecr 4080466690], length 908
22:37:11.988741 IP dhcp-140-247-103-184.fas.harvard.edu.41904 > bits-lb.eqiad.wikimedia.org.http: Flags [P.], seq 642696254:642696808, ack 3098204404, win 229, options [nop,nop,TS val 10212339 ecr 1157069709], length 554
22:37:12.030282 IP bits-lb.eqiad.wikimedia.org.http > dhcp-140-247-103-184.fas.harvard.edu.41906: Flags [.], ack 726, win 32, options [nop,nop,TS val 1158050566 ecr 10212339], length 0
22:37:12.030305 IP bits-lb.eqiad.wikimedia.org.http > dhcp-140-247-103-184.fas.harvard.edu.41905: Flags [.], ack 569, win 31, options [nop,nop,TS val 1158341477 ecr 10212339], length 0
22:37:12.030401 IP bits-lb.eqiad.wikimedia.org.http > dhcp-140-247-103-184.fas.harvard.edu.41906: Flags [P.], seq 1:571, ack 726, win 32, options [nop,nop,TS val 1158050566 ecr 10212339], length 570
22:37:12.030418 IP dhcp-140-247-103-184.fas.harvard.edu.41906 > bits-lb.eqiad.wikimedia.org.http: Flags [.], ack 571, win 246, options [nop,nop,TS val 10212343 ecr 1158050566], length 0
22:37:12.030428 IP bits-lb.eqiad.wikimedia.org.http > dhcp-140-247-103-184.fas.harvard.edu.41907: Flags [.], ack 558, win 31, options [nop,nop,TS val 1198814487 ecr 10212339], length 0
22:37:12.030569 IP bits-lb.eqiad.wikimedia.org.http > dhcp-140-247-103-184.fas.harvard.edu.41905: Flags [P.], seq 1:569, ack 569, win 31, options [nop,nop,TS val 1158341477 ecr 10212339], length 568
22:37:12.030582 IP dhcp-140-247-103-184.fas.harvard.edu.41905 > bits-lb.eqiad.wikimedia.org.http: Flags [.], ack 569, win 246, options [nop,nop,TS val 10212343 ecr 1158341477], length 0
22:37:12.030750 IP bits-lb.eqiad.wikimedia.org.http > dhcp-140-247-103-184.fas.harvard.edu.41909: Flags [.], ack 481, win 31, options [nop,nop,TS val 1158050566 ecr 10212339], length 0
22:37:12.031001 IP bits-lb.eqiad.wikimedia.org.http > dhcp-140-247-103-184.fas.harvard.edu.41909: Flags [P.], seq 1:467, ack 481, win 31, options [nop,nop,TS val 1158050566 ecr 10212339], length 466
22:37:12.031013 IP dhcp-140-247-103-184.fas.harvard.edu.41909 > bits-lb.eqiad.wikimedia.org.http: Flags [.], ack 467, win 245, options [nop,nop,TS val 10212343 ecr 1158050566], length 0
22:37:12.031019 IP bits-lb.eqiad.wikimedia.org.http > dhcp-140-247-103-184.fas.harvard.edu.41909: Flags [F.], seq 467, ack 481, win 31, options [nop,nop,TS val 1158050566 ecr 10212339], length 0
22:37:12.031027 IP bits-lb.eqiad.wikimedia.org.http > dhcp-140-247-103-184.fas.harvard.edu.41904: Flags [.], ack 554, win 31, options [nop,nop,TS val 1157069765 ecr 10212339], length 0
22:37:12.031350 IP bits-lb.eqiad.wikimedia.org.http > dhcp-140-247-103-184.fas.harvard.edu.41904: Flags [P.], seq 1:578, ack 554, win 31, options [nop,nop,TS val 1157069765 ecr 10212339], length 577
22:37:12.031359 IP dhcp-140-247-103-184.fas.harvard.edu.41904 > bits-lb.eqiad.wikimedia.org.http: Flags [.], ack 578, win 247, options [nop,nop,TS val 10212343 ecr 1157069765], length 0
22:37:12.031485 IP bits-lb.eqiad.wikimedia.org.http > dhcp-140-247-103-184.fas.harvard.edu.41907: Flags [.], seq 1:2737, ack 558, win 31, options [nop,nop,TS val 1198814487 ecr 10212339], length 2736
22:37:12.031492 IP dhcp-140-247-103-184.fas.harvard.edu.41907 > bits-lb.eqiad.wikimedia.org.http: Flags [.], ack 2737, win 314, options [nop,nop,TS val 10212343 ecr 1198814487], length 0
22:37:12.031537 IP bits-lb.eqiad.wikimedia.org.http > dhcp-140-247-103-184.fas.harvard.edu.41907: Flags [.], seq 2737:8209, ack 558, win 31, options [nop,nop,TS val 1198814487 ecr 10212339], length 5472
22:37:12.031545 IP dhcp-140-247-103-184.fas.harvard.edu.41907 > bits-lb.eqiad.wikimedia.org.http: Flags [.], ack 8209, win 485, options [nop,nop,TS val 10212343 ecr 1198814487], length 0
22:37:12.031584 IP bits-lb.eqiad.wikimedia.org.http > dhcp-140-247-103-184.fas.harvard.edu.41907: Flags [P.], seq 8209:12093, ack 558, win 31, options [nop,nop,TS val 1198814487 ecr 10212339], length 3884
22:37:12.031590 IP dhcp-140-247-103-184.fas.harvard.edu.41907 > bits-lb.eqiad.wikimedia.org.http: Flags [.], ack 12093, win 579, options [nop,nop,TS val 10212343 ecr 1198814487], length 0
22:37:12.032495 IP wikipedia-lb.eqiad.wikimedia.org.http > dhcp-140-247-103-184.fas.harvard.edu.51250: Flags [P.], seq 9621:9986, ack 1728, win 19, options [nop,nop,TS val 4080466708 ecr 10212339], length 365
22:37:12.032519 IP dhcp-140-247-103-184.fas.harvard.edu.51250 > wikipedia-lb.eqiad.wikimedia.org.http: Flags [.], ack 9986, win 590, options [nop,nop,TS val 10212343 ecr 4080466708], length 0
22:37:12.032730 IP dhcp-140-247-103-184.fas.harvard.edu.41909 > bits-lb.eqiad.wikimedia.org.http: Flags [F.], seq 481, ack 468, win 245, options [nop,nop,TS val 10212343 ecr 1158050566], length 0
22:37:12.064761 IP dhcp-140-247-103-184.fas.harvard.edu.41907 > bits-lb.eqiad.wikimedia.org.http: Flags [P.], seq 558:1240, ack 12093, win 606, options [nop,nop,TS val 10212347 ecr 1198814487], length 682
22:37:12.074951 IP bits-lb.eqiad.wikimedia.org.http > dhcp-140-247-103-184.fas.harvard.edu.41909: Flags [.], ack 482, win 31, options [nop,nop,TS val 1158050577 ecr 10212343], length 0
22:37:12.107367 IP bits-lb.eqiad.wikimedia.org.http > dhcp-140-247-103-184.fas.harvard.edu.41907: Flags [P.], seq 12093:12683, ack 1240, win 34, options [nop,nop,TS val 1198814506 ecr 10212347], length 590
22:37:12.107395 IP dhcp-140-247-103-184.fas.harvard.edu.41907 > bits-lb.eqiad.wikimedia.org.http: Flags [.], ack 12683, win 649, options [nop,nop,TS val 10212351 ecr 1198814506], length 0
22:37:12.251972 IP dhcp-140-247-103-184.fas.harvard.edu.41907 > bits-lb.eqiad.wikimedia.org.http: Flags [P.], seq 1240:2082, ack 12683, win 649, options [nop,nop,TS val 10212365 ecr 1198814506], length 842
22:37:12.263741 IP dhcp-140-247-103-184.fas.harvard.edu.41904 > bits-lb.eqiad.wikimedia.org.http: Flags [P.], seq 554:1140, ack 578, win 247, options [nop,nop,TS val 10212367 ecr 1157069765], length 586
22:37:12.294422 IP bits-lb.eqiad.wikimedia.org.http > dhcp-140-247-103-184.fas.harvard.edu.41907: Flags [.], seq 12683:23627, ack 2082, win 37, options [nop,nop,TS val 1198814552 ecr 10212365], length 10944
22:37:12.294457 IP dhcp-140-247-103-184.fas.harvard.edu.41907 > bits-lb.eqiad.wikimedia.org.http: Flags [.], ack 23627, win 594, options [nop,nop,TS val 10212370 ecr 1198814552], length 0
22:37:12.294729 IP bits-lb.eqiad.wikimedia.org.http > dhcp-140-247-103-184.fas.harvard.edu.41907: Flags [.], seq 23627:27731, ack 2082, win 37, options [nop,nop,TS val 1198814552 ecr 10212365], length 4104
22:37:12.295582 IP dhcp-140-247-103-184.fas.harvard.edu.41907 > bits-lb.eqiad.wikimedia.org.http: Flags [.], ack 27731, win 649, options [nop,nop,TS val 10212370 ecr 1198814552], length 0
22:37:12.306623 IP bits-lb.eqiad.wikimedia.org.http > dhcp-140-247-103-184.fas.harvard.edu.41904: Flags [P.], seq 578:1170, ack 1140, win 33, options [nop,nop,TS val 1157069834 ecr 10212367], length 592
22:37:12.306666 IP dhcp-140-247-103-184.fas.harvard.edu.41904 > bits-lb.eqiad.wikimedia.org.http: Flags [.], ack 1170, win 265, options [nop,nop,TS val 10212371 ecr 1157069834], length 0
22:37:12.336659 IP bits-lb.eqiad.wikimedia.org.http > dhcp-140-247-103-184.fas.harvard.edu.41907: Flags [P.], seq 27731:32641, ack 2082, win 37, options [nop,nop,TS val 1198814563 ecr 10212370], length 4910
22:37:12.336776 IP dhcp-140-247-103-184.fas.harvard.edu.41907 > bits-lb.eqiad.wikimedia.org.http: Flags [.], ack 32641, win 649, options [nop,nop,TS val 10212374 ecr 1198814563], length 0
22:37:12.362183 IP dhcp-140-247-103-184.fas.harvard.edu.36804 > upload-lb.eqiad.wikimedia.org.http: Flags [P.], seq 3591458649:3591459195, ack 1054622706, win 229, options [nop,nop,TS val 10212376 ecr 830584508], length 546
22:37:12.387786 IP dhcp-140-247-103-184.fas.harvard.edu.46123 > wikimedia-lb.eqiad.wikimedia.org.http: Flags [P.], seq 4114888156:4114888679, ack 2766119663, win 229, options [nop,nop,TS val 10212379 ecr 4080759190], length 523
22:37:12.424683 IP dhcp-140-247-103-184.fas.harvard.edu.41907 > bits-lb.eqiad.wikimedia.org.http: Flags [P.], seq 2082:3234, ack 32641, win 649, options [nop,nop,TS val 10212383 ecr 1198814563], length 1152
22:37:12.427147 IP upload-lb.eqiad.wikimedia.org.http > dhcp-140-247-103-184.fas.harvard.edu.36804: Flags [.], ack 546, win 31, options [nop,nop,TS val 830584656 ecr 10212376], length 0
22:37:12.427344 IP upload-lb.eqiad.wikimedia.org.http > dhcp-140-247-103-184.fas.harvard.edu.36804: Flags [P.], seq 1:504, ack 546, win 31, options [nop,nop,TS val 830584656 ecr 10212376], length 503
22:37:12.427358 IP dhcp-140-247-103-184.fas.harvard.edu.36804 > upload-lb.eqiad.wikimedia.org.http: Flags [.], ack 504, win 245, options [nop,nop,TS val 10212383 ecr 830584656], length 0
22:37:12.433636 IP dhcp-140-247-103-184.fas.harvard.edu.41904 > bits-lb.eqiad.wikimedia.org.http: Flags [P.], seq 1140:1770, ack 1170, win 265, options [nop,nop,TS val 10212384 ecr 1157069834], length 630
22:37:12.443789 IP dhcp-140-247-103-184.fas.harvard.edu.41905 > bits-lb.eqiad.wikimedia.org.http: Flags [P.], seq 569:1215, ack 569, win 246, options [nop,nop,TS val 10212385 ecr 1158341477], length 646
22:37:12.449222 IP dhcp-140-247-103-184.fas.harvard.edu.41906 > bits-lb.eqiad.wikimedia.org.http: Flags [P.], seq 726:1286, ack 571, win 246, options [nop,nop,TS val 10212385 ecr 1158050566], length 560
22:37:12.452553 IP dhcp-140-247-103-184.fas.harvard.edu.41908 > bits-lb.eqiad.wikimedia.org.http: Flags [P.], seq 1739542851:1739543383, ack 1810829130, win 229, options [nop,nop,TS val 10212385 ecr 1198814431], length 532
22:37:12.452696 IP wikimedia-lb.eqiad.wikimedia.org.http > dhcp-140-247-103-184.fas.harvard.edu.46123: Flags [.], ack 523, win 14, options [nop,nop,TS val 4080759252 ecr 10212379], length 0
22:37:12.453631 IP wikimedia-lb.eqiad.wikimedia.org.http > dhcp-140-247-103-184.fas.harvard.edu.46123: Flags [P.], seq 1:491, ack 523, win 14, options [nop,nop,TS val 4080759252 ecr 10212379], length 490
22:37:12.453648 IP dhcp-140-247-103-184.fas.harvard.edu.46123 > wikimedia-lb.eqiad.wikimedia.org.http: Flags [.], ack 491, win 245, options [nop,nop,TS val 10212386 ecr 4080759252], length 0
22:37:12.453831 IP wikimedia-lb.eqiad.wikimedia.org.http > dhcp-140-247-103-184.fas.harvard.edu.46123: Flags [P.], seq 491:533, ack 523, win 14, options [nop,nop,TS val 4080759252 ecr 10212379], length 42
22:37:12.453838 IP dhcp-140-247-103-184.fas.harvard.edu.46123 > wikimedia-lb.eqiad.wikimedia.org.http: Flags [.], ack 533, win 245, options [nop,nop,TS val 10212386 ecr 4080759252], length 0
22:37:12.461426 IP dhcp-140-247-103-184.fas.harvard.edu.41920 > bits-lb.eqiad.wikimedia.org.http: Flags [S], seq 3300085557, win 14600, options [mss 1460,sackOK,TS val 10212386 ecr 0,nop,wscale 6], length 0
22:37:12.467117 IP bits-lb.eqiad.wikimedia.org.http > dhcp-140-247-103-184.fas.harvard.edu.41907: Flags [P.], seq 32641:33231, ack 3234, win 43, options [nop,nop,TS val 1198814596 ecr 10212383], length 590
22:37:12.467146 IP dhcp-140-247-103-184.fas.harvard.edu.41907 > bits-lb.eqiad.wikimedia.org.http: Flags [.], ack 33231, win 661, options [nop,nop,TS val 10212387 ecr 1198814596], length 0
22:37:12.472351 IP dhcp-140-247-103-184.fas.harvard.edu.41907 > bits-lb.eqiad.wikimedia.org.http: Flags [P.], seq 3234:3804, ack 33231, win 661, options [nop,nop,TS val 10212387 ecr 1198814596], length 570
22:37:12.472494 IP dhcp-140-247-103-184.fas.harvard.edu.46123 > wikimedia-lb.eqiad.wikimedia.org.http: Flags [P.], seq 523:1059, ack 533, win 245, options [nop,nop,TS val 10212387 ecr 4080759252], length 536
22:37:12.476294 IP bits-lb.eqiad.wikimedia.org.http > dhcp-140-247-103-184.fas.harvard.edu.41904: Flags [P.], seq 1170:1762, ack 1770, win 36, options [nop,nop,TS val 1157069877 ecr 10212384], length 592
22:37:12.476330 IP dhcp-140-247-103-184.fas.harvard.edu.41904 > bits-lb.eqiad.wikimedia.org.http: Flags [.], ack 1762, win 284, options [nop,nop,TS val 10212388 ecr 1157069877], length 0
22:37:12.491199 IP bits-lb.eqiad.wikimedia.org.http > dhcp-140-247-103-184.fas.harvard.edu.41905: Flags [P.], seq 569:1159, ack 1215, win 34, options [nop,nop,TS val 1158341592 ecr 10212385], length 590
22:37:12.491235 IP dhcp-140-247-103-184.fas.harvard.edu.41905 > bits-lb.eqiad.wikimedia.org.http: Flags [.], ack 1159, win 265, options [nop,nop,TS val 10212389 ecr 1158341592], length 0
22:37:12.491443 IP bits-lb.eqiad.wikimedia.org.http > dhcp-140-247-103-184.fas.harvard.edu.41906: Flags [P.], seq 571:1001, ack 1286, win 34, options [nop,nop,TS val 1158050682 ecr 10212385], length 430
22:37:12.491463 IP dhcp-140-247-103-184.fas.harvard.edu.41906 > bits-lb.eqiad.wikimedia.org.http: Flags [.], ack 1001, win 264, options [nop,nop,TS val 10212389 ecr 1158050682], length 0
22:37:12.494713 IP bits-lb.eqiad.wikimedia.org.http > dhcp-140-247-103-184.fas.harvard.edu.41908: Flags [.], ack 532, win 31, options [nop,nop,TS val 1198814603 ecr 10212385], length 0
22:37:12.494885 IP bits-lb.eqiad.wikimedia.org.http > dhcp-140-247-103-184.fas.harvard.edu.41908: Flags [P.], seq 1:319, ack 532, win 31, options [nop,nop,TS val 1198814603 ecr 10212385], length 318
22:37:12.494903 IP dhcp-140-247-103-184.fas.harvard.edu.41908 > bits-lb.eqiad.wikimedia.org.http: Flags [.], ack 319, win 245, options [nop,nop,TS val 10212390 ecr 1198814603], length 0
22:37:12.503974 IP bits-lb.eqiad.wikimedia.org.http > dhcp-140-247-103-184.fas.harvard.edu.41920: Flags [S.], seq 1129121, ack 3300085558, win 14480, options [mss 1380,sackOK,TS val 1158050685 ecr 10212386,nop,wscale 9], length 0
22:37:12.504013 IP dhcp-140-247-103-184.fas.harvard.edu.41920 > bits-lb.eqiad.wikimedia.org.http: Flags [.], ack 1, win 229, options [nop,nop,TS val 10212391 ecr 1158050685], length 0
22:37:12.514546 IP bits-lb.eqiad.wikimedia.org.http > dhcp-140-247-103-184.fas.harvard.edu.41907: Flags [P.], seq 33231:33660, ack 3804, win 47, options [nop,nop,TS val 1198814608 ecr 10212387], length 429
22:37:12.537740 IP wikimedia-lb.eqiad.wikimedia.org.http > dhcp-140-247-103-184.fas.harvard.edu.46123: Flags [P.], seq 533:1002, ack 1059, win 16, options [nop,nop,TS val 4080759261 ecr 10212387], length 469
22:37:12.537772 IP wikimedia-lb.eqiad.wikimedia.org.http > dhcp-140-247-103-184.fas.harvard.edu.46123: Flags [P.], seq 1002:1022, ack 1059, win 16, options [nop,nop,TS val 4080759261 ecr 10212387], length 20
22:37:12.537889 IP dhcp-140-247-103-184.fas.harvard.edu.46123 > wikimedia-lb.eqiad.wikimedia.org.http: Flags [.], ack 1022, win 262, options [nop,nop,TS val 10212394 ecr 4080759261], length 0
22:37:12.563391 IP dhcp-140-247-103-184.fas.harvard.edu.41907 > bits-lb.eqiad.wikimedia.org.http: Flags [.], ack 33660, win 661, options [nop,nop,TS val 10212396 ecr 1198814608], length 0
