19:24:03.133380 IP 4.53.56.76.http > dhcp-140-247-103-184.fas.harvard.edu.60091: Flags [P.], seq 2687270418:2687271090, ack 1029852459, win 487, length 672
19:24:03.133415 IP dhcp-140-247-103-184.fas.harvard.edu.60091 > 4.53.56.76.http: Flags [.], ack 672, win 12276, length 0
19:24:03.133432 IP 4.53.56.76.http > dhcp-140-247-103-184.fas.harvard.edu.60091: Flags [P.], seq 672:5052, ack 1, win 487, length 4380
19:24:03.133450 IP dhcp-140-247-103-184.fas.harvard.edu.60091 > 4.53.56.76.http: Flags [.], ack 5052, win 12276, length 0
19:24:03.133461 IP 4.53.56.76.http > dhcp-140-247-103-184.fas.harvard.edu.60091: Flags [P.], seq 5052:6512, ack 1, win 487, length 1460
19:24:03.133471 IP dhcp-140-247-103-184.fas.harvard.edu.60091 > 4.53.56.76.http: Flags [.], ack 6512, win 12276, length 0
19:24:03.133482 IP 4.53.56.76.http > dhcp-140-247-103-184.fas.harvard.edu.60091: Flags [P.], seq 6512:7972, ack 1, win 487, length 1460
19:24:03.133492 IP dhcp-140-247-103-184.fas.harvard.edu.60091 > 4.53.56.76.http: Flags [.], ack 7972, win 12276, length 0
19:24:03.133499 IP 4.53.56.76.http > dhcp-140-247-103-184.fas.harvard.edu.60091: Flags [P.], seq 12272:12352, ack 1, win 487, length 80
19:24:03.133509 IP dhcp-140-247-103-184.fas.harvard.edu.60091 > 4.53.56.76.http: Flags [.], ack 7972, win 12276, options [nop,nop,sack 1 {12272:12352}], length 0
19:24:03.133516 IP 4.53.56.76.http > dhcp-140-247-103-184.fas.harvard.edu.60091: Flags [P.], seq 9352:9432, ack 1, win 487, length 80
19:24:03.133524 IP dhcp-140-247-103-184.fas.harvard.edu.60091 > 4.53.56.76.http: Flags [.], ack 7972, win 12276, options [nop,nop,sack 2 {9352:9432}{12272:12352}], length 0
19:24:03.133531 IP 4.53.56.76.http > dhcp-140-247-103-184.fas.harvard.edu.60091: Flags [.], seq 9432:10812, ack 1, win 487, length 1380
19:24:03.133538 IP dhcp-140-247-103-184.fas.harvard.edu.60091 > 4.53.56.76.http: Flags [.], ack 7972, win 12276, options [nop,nop,sack 2 {9352:10812}{12272:12352}], length 0
19:24:03.133541 IP 4.53.56.76.http > dhcp-140-247-103-184.fas.harvard.edu.60091: Flags [.], seq 10892:12272, ack 1, win 487, length 1380
19:24:03.133549 IP dhcp-140-247-103-184.fas.harvard.edu.60091 > 4.53.56.76.http: Flags [.], ack 7972, win 12276, options [nop,nop,sack 2 {10892:12352}{9352:10812}], length 0
19:24:03.133554 IP 4.53.56.76.http > dhcp-140-247-103-184.fas.harvard.edu.60091: Flags [.], seq 7972:9352, ack 1, win 487, length 1380
19:24:03.133562 IP dhcp-140-247-103-184.fas.harvard.edu.60091 > 4.53.56.76.http: Flags [.], ack 10812, win 12276, options [nop,nop,sack 1 {10892:12352}], length 0
19:24:03.133566 IP 4.53.56.76.http > dhcp-140-247-103-184.fas.harvard.edu.60091: Flags [P.], seq 10812:10892, ack 1, win 487, length 80
19:24:03.133572 IP dhcp-140-247-103-184.fas.harvard.edu.60091 > 4.53.56.76.http: Flags [.], ack 12352, win 12276, length 0
19:24:03.133587 IP 4.53.56.76.http > dhcp-140-247-103-184.fas.harvard.edu.60091: Flags [.], seq 19252:20632, ack 1, win 487, length 1380
19:24:03.133593 IP 4.53.56.76.http > dhcp-140-247-103-184.fas.harvard.edu.60091: Flags [.], seq 16492:17872, ack 1, win 487, length 1380
19:24:03.133597 IP 4.53.56.76.http > dhcp-140-247-103-184.fas.harvard.edu.60091: Flags [P.], seq 22012:22572, ack 1, win 487, length 560
19:24:03.133603 IP 4.53.56.76.http > dhcp-140-247-103-184.fas.harvard.edu.60091: Flags [.], seq 13732:15112, ack 1, win 487, length 1380
19:24:03.133603 IP dhcp-140-247-103-184.fas.harvard.edu.60091 > 4.53.56.76.http: Flags [.], ack 12352, win 12276, options [nop,nop,sack 1 {19252:20632}], length 0
19:24:03.133608 IP 4.53.56.76.http > dhcp-140-247-103-184.fas.harvard.edu.60091: Flags [.], seq 12352:13732, ack 1, win 487, length 1380
19:24:03.133612 IP dhcp-140-247-103-184.fas.harvard.edu.60091 > 4.53.56.76.http: Flags [.], ack 12352, win 12276, options [nop,nop,sack 2 {16492:17872}{19252:20632}], length 0
19:24:03.133614 IP 4.53.56.76.http > dhcp-140-247-103-184.fas.harvard.edu.60091: Flags [.], seq 15112:16492, ack 1, win 487, length 1380
19:24:03.133618 IP dhcp-140-247-103-184.fas.harvard.edu.60091 > 4.53.56.76.http: Flags [.], ack 12352, win 12276, options [nop,nop,sack 3 {22012:22572}{16492:17872}{19252:20632}], length 0
19:24:03.133619 IP 4.53.56.76.http > dhcp-140-247-103-184.fas.harvard.edu.60091: Flags [.], seq 20632:22012, ack 1, win 487, length 1380
19:24:03.133624 IP dhcp-140-247-103-184.fas.harvard.edu.60091 > 4.53.56.76.http: Flags [.], ack 12352, win 12276, options [nop,nop,sack 4 {13732:15112}{22012:22572}{16492:17872}{19252:20632}], length 0
19:24:04.088593 IP 4.53.56.76.http > dhcp-140-247-103-184.fas.harvard.edu.60091: Flags [P.], seq 65536:67832, ack 1, win 487, length 2296
19:24:04.088626 IP dhcp-140-247-103-184.fas.harvard.edu.60091 > 4.53.56.76.http: Flags [.], ack 67832, win 12276, length 0
19:24:04.088639 IP 4.53.56.76.http > dhcp-140-247-103-184.fas.harvard.edu.60091: Flags [.], seq 67832:69212, ack 1, win 487, length 1380
19:24:04.088650 IP dhcp-140-247-103-184.fas.harvard.edu.60091 > 4.53.56.76.http: Flags [.], ack 69212, win 12276, length 0
19:24:04.088654 IP 4.53.56.76.http > dhcp-140-247-103-184.fas.harvard.edu.60091: Flags [P.], seq 70592:70752, ack 1, win 487, length 160
19:24:04.088660 IP dhcp-140-247-103-184.fas.harvard.edu.60091 > 4.53.56.76.http: Flags [.], ack 69212, win 12276, options [nop,nop,sack 1 {70592:70752}], length 0
19:24:04.088665 IP 4.53.56.76.http > dhcp-140-247-103-184.fas.harvard.edu.60091: Flags [P.], seq 72132:72212, ack 1, win 487, length 80
19:24:04.088672 IP dhcp-140-247-103-184.fas.harvard.edu.60091 > 4.53.56.76.http: Flags [.], ack 69212, win 12276, options [nop,nop,sack 2 {72132:72212}{70592:70752}], length 0
19:24:04.088676 IP 4.53.56.76.http > dhcp-140-247-103-184.fas.harvard.edu.60091: Flags [P.], seq 73592:73672, ack 1, win 487, length 80
19:24:04.088682 IP dhcp-140-247-103-184.fas.harvard.edu.60091 > 4.53.56.76.http: Flags [.], ack 69212, win 12276, options [nop,nop,sack 3 {73592:73672}{72132:72212}{70592:70752}], length 0
19:24:04.088687 IP 4.53.56.76.http > dhcp-140-247-103-184.fas.harvard.edu.60091: Flags [.], seq 70752:72132, ack 1, win 487, length 1380
19:24:04.088691 IP 4.53.56.76.http > dhcp-140-247-103-184.fas.harvard.edu.60091: Flags [.], seq 72212:73592, ack 1, win 487, length 1380
19:24:04.088695 IP 4.53.56.76.http > dhcp-140-247-103-184.fas.harvard.edu.60091: Flags [.], seq 73672:75052, ack 1, win 487, length 1380
19:24:04.088698 IP 4.53.56.76.http > dhcp-140-247-103-184.fas.harvard.edu.60091: Flags [.], seq 76432:77812, ack 1, win 487, length 1380
19:24:04.088701 IP 4.53.56.76.http > dhcp-140-247-103-184.fas.harvard.edu.60091: Flags [.], seq 69212:70592, ack 1, win 487, length 1380
19:24:04.088705 IP 4.53.56.76.http > dhcp-140-247-103-184.fas.harvard.edu.60091: Flags [.], seq 80572:81952, ack 1, win 487, length 1380
19:24:04.088704 IP dhcp-140-247-103-184.fas.harvard.edu.60091 > 4.53.56.76.http: Flags [.], ack 69212, win 12276, options [nop,nop,sack 2 {70592:72212}{73592:73672}], length 0
19:24:04.088709 IP 4.53.56.76.http > dhcp-140-247-103-184.fas.harvard.edu.60091: Flags [.], seq 79192:80572, ack 1, win 487, length 1380
19:24:04.088713 IP 4.53.56.76.http > dhcp-140-247-103-184.fas.harvard.edu.60091: Flags [.], seq 77812:79192, ack 1, win 487, length 1380
19:24:04.088714 IP dhcp-140-247-103-184.fas.harvard.edu.60091 > 4.53.56.76.http: Flags [.], ack 69212, win 12276, options [nop,nop,sack 1 {70592:73672}], length 0
19:24:04.088717 IP 4.53.56.76.http > dhcp-140-247-103-184.fas.harvard.edu.60091: Flags [.], seq 75052:76432, ack 1, win 487, length 1380
19:24:04.088720 IP 4.53.56.76.http > dhcp-140-247-103-184.fas.harvard.edu.60091: Flags [P.], seq 81952:82432, ack 1, win 487, length 480
19:24:04.088720 IP dhcp-140-247-103-184.fas.harvard.edu.60091 > 4.53.56.76.http: Flags [.], ack 69212, win 12276, options [nop,nop,sack 1 {70592:75052}], length 0
19:24:04.088725 IP dhcp-140-247-103-184.fas.harvard.edu.60091 > 4.53.56.76.http: Flags [.], ack 69212, win 12276, options [nop,nop,sack 2 {76432:77812}{70592:75052}], length 0
19:24:04.088731 IP dhcp-140-247-103-184.fas.harvard.edu.60091 > 4.53.56.76.http: Flags [.], ack 75052, win 12276, options [nop,nop,sack 1 {76432:77812}], length 0
19:24:04.088736 IP dhcp-140-247-103-184.fas.harvard.edu.60091 > 4.53.56.76.http: Flags [.], ack 75052, win 12276, options [nop,nop,sack 2 {80572:81952}{76432:77812}], length 0
19:24:04.088740 IP dhcp-140-247-103-184.fas.harvard.edu.60091 > 4.53.56.76.http: Flags [.], ack 75052, win 12276, options [nop,nop,sack 2 {79192:81952}{76432:77812}], length 0
19:24:04.088745 IP dhcp-140-247-103-184.fas.harvard.edu.60091 > 4.53.56.76.http: Flags [.], ack 75052, win 12276, options [nop,nop,sack 1 {76432:81952}], length 0
19:24:04.088751 IP dhcp-140-247-103-184.fas.harvard.edu.60091 > 4.53.56.76.http: Flags [.], ack 81952, win 12276, length 0
19:24:04.088755 IP dhcp-140-247-103-184.fas.harvard.edu.60091 > 4.53.56.76.http: Flags [.], ack 82432, win 12276, length 0
19:24:04.089384 IP 4.53.56.76.http > dhcp-140-247-103-184.fas.harvard.edu.60091: Flags [.], seq 82432:85192, ack 1, win 487, length 2760
19:24:04.089404 IP dhcp-140-247-103-184.fas.harvard.edu.60091 > 4.53.56.76.http: Flags [.], ack 85192, win 12276, length 0
19:24:04.089455 IP 4.53.56.76.http > dhcp-140-247-103-184.fas.harvard.edu.60091: Flags [.], seq 85192:90712, ack 1, win 487, length 5520
19:24:04.089472 IP dhcp-140-247-103-184.fas.harvard.edu.60091 > 4.53.56.76.http: Flags [.], ack 90712, win 12276, length 0
19:24:04.089548 IP 4.53.56.76.http > dhcp-140-247-103-184.fas.harvard.edu.60091: Flags [.], seq 90712:96232, ack 1, win 487, length 5520
19:24:04.089571 IP dhcp-140-247-103-184.fas.harvard.edu.60091 > 4.53.56.76.http: Flags [.], ack 96232, win 12276, length 0
19:24:04.089596 IP 4.53.56.76.http > dhcp-140-247-103-184.fas.harvard.edu.60091: Flags [.], seq 96232:100372, ack 1, win 487, length 4140
19:24:04.089613 IP dhcp-140-247-103-184.fas.harvard.edu.60091 > 4.53.56.76.http: Flags [.], ack 100372, win 12276, length 0
19:24:04.089647 IP 4.53.56.76.http > dhcp-140-247-103-184.fas.harvard.edu.60091: Flags [.], seq 100372:104512, ack 1, win 487, length 4140
19:24:04.089660 IP dhcp-140-247-103-184.fas.harvard.edu.60091 > 4.53.56.76.http: Flags [.], ack 104512, win 12276, length 0
19:24:04.089702 IP 4.53.56.76.http > dhcp-140-247-103-184.fas.harvard.edu.60091: Flags [.], seq 104512:107272, ack 1, win 487, length 2760
19:24:04.089725 IP dhcp-140-247-103-184.fas.harvard.edu.60091 > 4.53.56.76.http: Flags [.], ack 107272, win 12276, length 0
19:24:04.090284 IP 4.53.56.76.http > dhcp-140-247-103-184.fas.harvard.edu.60091: Flags [.], seq 107272:111412, ack 1, win 487, length 4140
19:24:04.090301 IP dhcp-140-247-103-184.fas.harvard.edu.60091 > 4.53.56.76.http: Flags [.], ack 111412, win 12276, length 0
19:24:04.090335 IP 4.53.56.76.http > dhcp-140-247-103-184.fas.harvard.edu.60091: Flags [.], seq 111412:116932, ack 1, win 487, length 5520
19:24:04.090348 IP dhcp-140-247-103-184.fas.harvard.edu.60091 > 4.53.56.76.http: Flags [.], ack 116932, win 12276, length 0
19:24:04.090394 IP 4.53.56.76.http > dhcp-140-247-103-184.fas.harvard.edu.60091: Flags [.], seq 116932:123832, ack 1, win 487, length 6900
19:24:04.090410 IP dhcp-140-247-103-184.fas.harvard.edu.60091 > 4.53.56.76.http: Flags [.], ack 123832, win 12276, length 0
19:24:04.090493 IP 4.53.56.76.http > dhcp-140-247-103-184.fas.harvard.edu.60091: Flags [P.], seq 123832:131072, ack 1, win 487, length 7240
19:24:04.090513 IP dhcp-140-247-103-184.fas.harvard.edu.60091 > 4.53.56.76.http: Flags [.], ack 131072, win 12276, length 0
19:24:05.041359 IP 4.53.56.76.http > dhcp-140-247-103-184.fas.harvard.edu.60091: Flags [P.], seq 131072:134992, ack 1, win 487, length 3920
19:24:05.041391 IP dhcp-140-247-103-184.fas.harvard.edu.60091 > 4.53.56.76.http: Flags [.], ack 134992, win 12276, length 0
19:24:05.041406 IP 4.53.56.76.http > dhcp-140-247-103-184.fas.harvard.edu.60091: Flags [.], seq 134992:136372, ack 1, win 487, length 1380
19:24:05.041413 IP dhcp-140-247-103-184.fas.harvard.edu.60091 > 4.53.56.76.http: Flags [.], ack 136372, win 12276, length 0
19:24:05.041417 IP 4.53.56.76.http > dhcp-140-247-103-184.fas.harvard.edu.60091: Flags [P.], seq 137832:137912, ack 1, win 487, length 80
19:24:05.041426 IP dhcp-140-247-103-184.fas.harvard.edu.60091 > 4.53.56.76.http: Flags [.], ack 136372, win 12276, options [nop,nop,sack 1 {137832:137912}], length 0
19:24:05.041431 IP 4.53.56.76.http > dhcp-140-247-103-184.fas.harvard.edu.60091: Flags [P.], seq 136372:136452, ack 1, win 487, length 80
19:24:05.041438 IP dhcp-140-247-103-184.fas.harvard.edu.60091 > 4.53.56.76.http: Flags [.], ack 136452, win 12276, options [nop,nop,sack 1 {137832:137912}], length 0
19:24:05.041443 IP 4.53.56.76.http > dhcp-140-247-103-184.fas.harvard.edu.60091: Flags [.], seq 137912:139292, ack 1, win 487, length 1380
19:24:05.041449 IP dhcp-140-247-103-184.fas.harvard.edu.60091 > 4.53.56.76.http: Flags [.], ack 136452, win 12276, options [nop,nop,sack 1 {137832:139292}], length 0
19:24:05.041454 IP 4.53.56.76.http > dhcp-140-247-103-184.fas.harvard.edu.60091: Flags [.], seq 136452:137832, ack 1, win 487, length 1380
19:24:05.041461 IP dhcp-140-247-103-184.fas.harvard.edu.60091 > 4.53.56.76.http: Flags [.], ack 139292, win 12276, length 0
19:24:05.041467 IP 4.53.56.76.http > dhcp-140-247-103-184.fas.harvard.edu.60091: Flags [P.], seq 139292:140832, ack 1, win 487, length 1540
19:24:05.041474 IP 4.53.56.76.http > dhcp-140-247-103-184.fas.harvard.edu.60091: Flags [.], seq 140832:142212, ack 1, win 487, length 1380
19:24:05.041477 IP 4.53.56.76.http > dhcp-140-247-103-184.fas.harvard.edu.60091: Flags [P.], seq 146512:146672, ack 1, win 487, length 160
19:24:05.041480 IP 4.53.56.76.http > dhcp-140-247-103-184.fas.harvard.edu.60091: Flags [.], seq 143752:145132, ack 1, win 487, length 1380
19:24:05.041484 IP 4.53.56.76.http > dhcp-140-247-103-184.fas.harvard.edu.60091: Flags [.], seq 146672:148052, ack 1, win 487, length 1380
19:24:05.041487 IP 4.53.56.76.http > dhcp-140-247-103-184.fas.harvard.edu.60091: Flags [.], seq 142212:143592, ack 1, win 487, length 1380
19:24:05.041488 IP dhcp-140-247-103-184.fas.harvard.edu.60091 > 4.53.56.76.http: Flags [.], ack 140832, win 12276, length 0
19:24:05.041497 IP 4.53.56.76.http > dhcp-140-247-103-184.fas.harvard.edu.60091: Flags [.], seq 149592:150972, ack 1, win 487, length 1380
19:24:05.041498 IP dhcp-140-247-103-184.fas.harvard.edu.60091 > 4.53.56.76.http: Flags [.], ack 142212, win 12276, length 0
19:24:05.041502 IP 4.53.56.76.http > dhcp-140-247-103-184.fas.harvard.edu.60091: Flags [.], seq 152512:153892, ack 1, win 487, length 1380
19:24:05.041505 IP 4.53.56.76.http > dhcp-140-247-103-184.fas.harvard.edu.60091: Flags [P.], seq 149432:149592, ack 1, win 487, length 160
19:24:05.041505 IP dhcp-140-247-103-184.fas.harvard.edu.60091 > 4.53.56.76.http: Flags [.], ack 142212, win 12276, options [nop,nop,sack 1 {146512:146672}], length 0
19:24:05.041508 IP 4.53.56.76.http > dhcp-140-247-103-184.fas.harvard.edu.60091: Flags [.], seq 145132:146512, ack 1, win 487, length 1380
19:24:05.041511 IP dhcp-140-247-103-184.fas.harvard.edu.60091 > 4.53.56.76.http: Flags [.], ack 142212, win 12276, options [nop,nop,sack 2 {143752:145132}{146512:146672}], length 0
19:24:05.041512 IP 4.53.56.76.http > dhcp-140-247-103-184.fas.harvard.edu.60091: Flags [.], seq 150972:152352, ack 1, win 487, length 1380
19:24:05.041515 IP dhcp-140-247-103-184.fas.harvard.edu.60091 > 4.53.56.76.http: Flags [.], ack 142212, win 12276, options [nop,nop,sack 2 {146512:148052}{143752:145132}], length 0
19:24:05.041516 IP 4.53.56.76.http > dhcp-140-247-103-184.fas.harvard.edu.60091: Flags [.], seq 153892:155272, ack 1, win 487, length 1380
19:24:05.041519 IP 4.53.56.76.http > dhcp-140-247-103-184.fas.harvard.edu.60091: Flags [P.], seq 143592:143752, ack 1, win 487, length 160
19:24:05.041522 IP dhcp-140-247-103-184.fas.harvard.edu.60091 > 4.53.56.76.http: Flags [.], ack 143592, win 12276, options [nop,nop,sack 2 {146512:148052}{143752:145132}], length 0
19:24:05.041577 IP dhcp-140-247-103-184.fas.harvard.edu.60091 > 4.53.56.76.http: Flags [.], ack 155272, win 12276, length 0
19:24:05.041590 IP dhcp-140-247-103-184.fas.harvard.edu.60091 > 4.53.56.76.http: Flags [.], ack 155432, win 12276, length 0
19:24:05.042113 IP 4.53.56.76.http > dhcp-140-247-103-184.fas.harvard.edu.60091: Flags [.], seq 155432:158192, ack 1, win 487, length 2760
19:24:05.042131 IP dhcp-140-247-103-184.fas.harvard.edu.60091 > 4.53.56.76.http: Flags [.], ack 158192, win 12276, length 0
19:24:05.042168 IP 4.53.56.76.http > dhcp-140-247-103-184.fas.harvard.edu.60091: Flags [.], seq 158192:165092, ack 1, win 487, length 6900
19:24:05.042186 IP dhcp-140-247-103-184.fas.harvard.edu.60091 > 4.53.56.76.http: Flags [.], ack 165092, win 12276, length 0
19:24:05.042216 IP 4.53.56.76.http > dhcp-140-247-103-184.fas.harvard.edu.60091: Flags [.], seq 165092:170612, ack 1, win 487, length 5520
19:24:05.042236 IP dhcp-140-247-103-184.fas.harvard.edu.60091 > 4.53.56.76.http: Flags [.], ack 170612, win 12276, length 0
19:24:05.042264 IP 4.53.56.76.http > dhcp-140-247-103-184.fas.harvard.edu.60091: Flags [.], seq 170612:176132, ack 1, win 487, length 5520
19:24:05.042287 IP dhcp-140-247-103-184.fas.harvard.edu.60091 > 4.53.56.76.http: Flags [.], ack 176132, win 12276, length 0
19:24:05.042314 IP 4.53.56.76.http > dhcp-140-247-103-184.fas.harvard.edu.60091: Flags [.], seq 176132:181652, ack 1, win 487, length 5520
19:24:05.042331 IP dhcp-140-247-103-184.fas.harvard.edu.60091 > 4.53.56.76.http: Flags [.], ack 181652, win 12276, length 0
19:24:05.042365 IP 4.53.56.76.http > dhcp-140-247-103-184.fas.harvard.edu.60091: Flags [.], seq 181652:187172, ack 1, win 487, length 5520
19:24:05.042383 IP dhcp-140-247-103-184.fas.harvard.edu.60091 > 4.53.56.76.http: Flags [.], ack 187172, win 12276, length 0
19:24:05.042418 IP 4.53.56.76.http > dhcp-140-247-103-184.fas.harvard.edu.60091: Flags [.], seq 188552:189932, ack 1, win 487, length 1380
19:24:05.042438 IP dhcp-140-247-103-184.fas.harvard.edu.60091 > 4.53.56.76.http: Flags [.], ack 187172, win 12276, options [nop,nop,sack 1 {188552:189932}], length 0
19:24:05.042445 IP 4.53.56.76.http > dhcp-140-247-103-184.fas.harvard.edu.60091: Flags [.], seq 187172:188552, ack 1, win 487, length 1380
19:24:05.042454 IP dhcp-140-247-103-184.fas.harvard.edu.60091 > 4.53.56.76.http: Flags [.], ack 189932, win 12276, length 0
19:24:05.042459 IP 4.53.56.76.http > dhcp-140-247-103-184.fas.harvard.edu.60091: Flags [.], seq 189932:191312, ack 1, win 487, length 1380
19:24:05.042466 IP dhcp-140-247-103-184.fas.harvard.edu.60091 > 4.53.56.76.http: Flags [.], ack 191312, win 12276, length 0
19:24:05.042469 IP 4.53.56.76.http > dhcp-140-247-103-184.fas.harvard.edu.60091: Flags [P.], seq 195452:196608, ack 1, win 487, length 1156
19:24:05.042475 IP dhcp-140-247-103-184.fas.harvard.edu.60091 > 4.53.56.76.http: Flags [.], ack 191312, win 12276, options [nop,nop,sack 1 {195452:196608}], length 0
19:24:05.042487 IP 4.53.56.76.http > dhcp-140-247-103-184.fas.harvard.edu.60091: Flags [.], seq 191312:195452, ack 1, win 487, length 4140
19:24:05.042496 IP dhcp-140-247-103-184.fas.harvard.edu.60091 > 4.53.56.76.http: Flags [.], ack 196608, win 12276, length 0
19:24:05.878801 IP dhcp-140-247-103-184.fas.harvard.edu.43106 > fa-in-f120.1e100.net.http: Flags [F.], seq 2045240635, ack 1945247917, win 229, options [nop,nop,TS val 70338804 ecr 2516285613], length 0
19:24:05.878893 IP dhcp-140-247-103-184.fas.harvard.edu.43876 > lga15s34-in-f5.1e100.net.http: Flags [F.], seq 3085824120, ack 1031784410, win 229, options [nop,nop,TS val 70338804 ecr 2116080950], length 0
19:24:05.878927 IP dhcp-140-247-103-184.fas.harvard.edu.44369 > lga15s34-in-f9.1e100.net.http: Flags [F.], seq 3202417462, ack 1038132366, win 229, options [nop,nop,TS val 70338804 ecr 2116096736], length 0
19:24:05.878955 IP dhcp-140-247-103-184.fas.harvard.edu.51730 > lga15s34-in-f8.1e100.net.http: Flags [F.], seq 592708997, ack 1046018208, win 229, options [nop,nop,TS val 70338804 ecr 2116096076], length 0
19:24:05.878978 IP dhcp-140-247-103-184.fas.harvard.edu.51731 > lga15s34-in-f8.1e100.net.http: Flags [F.], seq 3584418192, ack 1043282805, win 229, options [nop,nop,TS val 70338804 ecr 2116096076], length 0
19:24:05.879008 IP dhcp-140-247-103-184.fas.harvard.edu.33349 > lga15s34-in-f0.1e100.net.http: Flags [F.], seq 4074775174, ack 1036450182, win 229, options [nop,nop,TS val 70338804 ecr 2116100096], length 0
19:24:05.879031 IP dhcp-140-247-103-184.fas.harvard.edu.33348 > lga15s34-in-f0.1e100.net.http: Flags [F.], seq 830508172, ack 1047381156, win 229, options [nop,nop,TS val 70338804 ecr 2116100096], length 0
19:24:05.879058 IP dhcp-140-247-103-184.fas.harvard.edu.33350 > lga15s34-in-f0.1e100.net.http: Flags [F.], seq 2523446683, ack 1033765562, win 229, options [nop,nop,TS val 70338804 ecr 2116100096], length 0
19:24:05.879078 IP dhcp-140-247-103-184.fas.harvard.edu.33351 > lga15s34-in-f0.1e100.net.http: Flags [F.], seq 3725554024, ack 1042044263, win 229, options [nop,nop,TS val 70338804 ecr 2116100096], length 0
19:24:05.879112 IP dhcp-140-247-103-184.fas.harvard.edu.50548 > lga15s34-in-f25.1e100.net.http: Flags [F.], seq 1465712045, ack 1037326203, win 229, options [nop,nop,TS val 70338804 ecr 2116097175], length 0
19:24:05.879131 IP dhcp-140-247-103-184.fas.harvard.edu.48584 > lga15s35-in-f8.1e100.net.http: Flags [F.], seq 3764759536, ack 1526207619, win 229, options [nop,nop,TS val 70338804 ecr 2201458385], length 0
19:24:05.879146 IP dhcp-140-247-103-184.fas.harvard.edu.48582 > lga15s35-in-f8.1e100.net.http: Flags [F.], seq 500254563, ack 1533933883, win 229, options [nop,nop,TS val 70338804 ecr 2201458385], length 0
19:24:05.879160 IP dhcp-140-247-103-184.fas.harvard.edu.48585 > lga15s35-in-f8.1e100.net.http: Flags [F.], seq 2320619981, ack 1534315805, win 229, options [nop,nop,TS val 70338804 ecr 2201458385], length 0
19:24:05.879185 IP dhcp-140-247-103-184.fas.harvard.edu.43642 > vc-in-f103.1e100.net.http: Flags [F.], seq 1843109337, ack 1384845761, win 229, options [nop,nop,TS val 70338804 ecr 2583029034], length 0
19:24:05.879199 IP dhcp-140-247-103-184.fas.harvard.edu.43643 > vc-in-f103.1e100.net.http: Flags [F.], seq 287073717, ack 1455576206, win 229, options [nop,nop,TS val 70338804 ecr 2584220510], length 0
19:24:05.884444 IP lga15s34-in-f5.1e100.net.http > dhcp-140-247-103-184.fas.harvard.edu.43876: Flags [F.], seq 1, ack 1, win 975, options [nop,nop,TS val 2116100955 ecr 70338804], length 0
19:24:05.884471 IP dhcp-140-247-103-184.fas.harvard.edu.43876 > lga15s34-in-f5.1e100.net.http: Flags [.], ack 2, win 229, options [nop,nop,TS val 70338805 ecr 2116100955], length 0
19:24:05.884487 IP lga15s34-in-f9.1e100.net.http > dhcp-140-247-103-184.fas.harvard.edu.44369: Flags [F.], seq 1, ack 1, win 975, options [nop,nop,TS val 2116116739 ecr 70338804], length 0
19:24:05.884498 IP dhcp-140-247-103-184.fas.harvard.edu.44369 > lga15s34-in-f9.1e100.net.http: Flags [.], ack 2, win 229, options [nop,nop,TS val 70338805 ecr 2116116739], length 0
19:24:05.884678 IP lga15s34-in-f25.1e100.net.http > dhcp-140-247-103-184.fas.harvard.edu.50548: Flags [.], ack 1, win 975, options [nop,nop,TS val 2116117178 ecr 70338804], length 0
19:24:05.884697 IP lga15s34-in-f25.1e100.net.http > dhcp-140-247-103-184.fas.harvard.edu.50548: Flags [F.], seq 1, ack 1, win 975, options [nop,nop,TS val 2116117178 ecr 70338804], length 0
19:24:05.884710 IP dhcp-140-247-103-184.fas.harvard.edu.50548 > lga15s34-in-f25.1e100.net.http: Flags [.], ack 2, win 229, options [nop,nop,TS val 70338805 ecr 2116117178], length 0
19:24:05.885055 IP lga15s35-in-f8.1e100.net.http > dhcp-140-247-103-184.fas.harvard.edu.48585: Flags [F.], seq 1, ack 1, win 975, options [nop,nop,TS val 2201478387 ecr 70338804], length 0
19:24:05.885074 IP dhcp-140-247-103-184.fas.harvard.edu.48585 > lga15s35-in-f8.1e100.net.http: Flags [.], ack 2, win 229, options [nop,nop,TS val 70338805 ecr 2201478387], length 0
19:24:05.885086 IP lga15s35-in-f8.1e100.net.http > dhcp-140-247-103-184.fas.harvard.edu.48582: Flags [F.], seq 1, ack 1, win 975, options [nop,nop,TS val 2201478387 ecr 70338804], length 0
19:24:05.885096 IP dhcp-140-247-103-184.fas.harvard.edu.48582 > lga15s35-in-f8.1e100.net.http: Flags [.], ack 2, win 229, options [nop,nop,TS val 70338805 ecr 2201478387], length 0
19:24:05.885228 IP lga15s35-in-f8.1e100.net.http > dhcp-140-247-103-184.fas.harvard.edu.48584: Flags [.], ack 1, win 975, options [nop,nop,TS val 2201478387 ecr 70338804], length 0
19:24:05.885245 IP lga15s35-in-f8.1e100.net.http > dhcp-140-247-103-184.fas.harvard.edu.48584: Flags [F.], seq 1, ack 1, win 975, options [nop,nop,TS val 2201478387 ecr 70338804], length 0
19:24:05.885254 IP dhcp-140-247-103-184.fas.harvard.edu.48584 > lga15s35-in-f8.1e100.net.http: Flags [.], ack 2, win 229, options [nop,nop,TS val 70338805 ecr 2201478387], length 0
19:24:05.909850 IP lga15s34-in-f0.1e100.net.http > dhcp-140-247-103-184.fas.harvard.edu.33349: Flags [F.], seq 1, ack 1, win 975, options [nop,nop,TS val 2116120099 ecr 70338804], length 0
19:24:05.909878 IP dhcp-140-247-103-184.fas.harvard.edu.33349 > lga15s34-in-f0.1e100.net.http: Flags [.], ack 2, win 229, options [nop,nop,TS val 70338807 ecr 2116120099], length 0
19:24:05.917345 IP vc-in-f103.1e100.net.http > dhcp-140-247-103-184.fas.harvard.edu.43642: Flags [F.], seq 1, ack 1, win 975, options [nop,nop,TS val 2583049035 ecr 70338804], length 0
19:24:05.990449 IP fa-in-f120.1e100.net.http > dhcp-140-247-103-184.fas.harvard.edu.43106: Flags [.], ack 1, win 975, options [nop,nop,TS val 2516305618 ecr 70338804], length 0
19:24:05.990498 IP fa-in-f120.1e100.net.http > dhcp-140-247-103-184.fas.harvard.edu.43106: Flags [F.], seq 1, ack 1, win 975, options [nop,nop,TS val 2516305618 ecr 70338804], length 0
19:24:05.990518 IP dhcp-140-247-103-184.fas.harvard.edu.43106 > fa-in-f120.1e100.net.http: Flags [.], ack 2, win 229, options [nop,nop,TS val 70338815 ecr 2516305618], length 0
19:24:05.996545 IP 4.53.56.76.http > dhcp-140-247-103-184.fas.harvard.edu.60091: Flags [P.], seq 196608:199232, ack 1, win 487, length 2624
19:24:05.996574 IP dhcp-140-247-103-184.fas.harvard.edu.60091 > 4.53.56.76.http: Flags [.], ack 199232, win 12276, length 0
19:24:05.996588 IP 4.53.56.76.http > dhcp-140-247-103-184.fas.harvard.edu.60091: Flags [.], seq 199232:203372, ack 1, win 487, length 4140
19:24:05.996600 IP dhcp-140-247-103-184.fas.harvard.edu.60091 > 4.53.56.76.http: Flags [.], ack 203372, win 12276, length 0
19:24:05.996606 IP 4.53.56.76.http > dhcp-140-247-103-184.fas.harvard.edu.60091: Flags [.], seq 203612:204992, ack 1, win 487, length 1380
19:24:05.996614 IP dhcp-140-247-103-184.fas.harvard.edu.60091 > 4.53.56.76.http: Flags [.], ack 203372, win 12276, options [nop,nop,sack 1 {203612:204992}], length 0
19:24:05.996617 IP 4.53.56.76.http > dhcp-140-247-103-184.fas.harvard.edu.60091: Flags [P.], seq 206372:206532, ack 1, win 487, length 160
19:24:05.996623 IP dhcp-140-247-103-184.fas.harvard.edu.60091 > 4.53.56.76.http: Flags [.], ack 203372, win 12276, options [nop,nop,sack 2 {206372:206532}{203612:204992}], length 0
19:24:05.996628 IP 4.53.56.76.http > dhcp-140-247-103-184.fas.harvard.edu.60091: Flags [P.], seq 207912:207992, ack 1, win 487, length 80
19:24:05.996633 IP dhcp-140-247-103-184.fas.harvard.edu.60091 > 4.53.56.76.http: Flags [.], ack 203372, win 12276, options [nop,nop,sack 3 {207912:207992}{206372:206532}{203612:204992}], length 0
19:24:05.996638 IP 4.53.56.76.http > dhcp-140-247-103-184.fas.harvard.edu.60091: Flags [.], seq 204992:206372, ack 1, win 487, length 1380
19:24:05.996642 IP 4.53.56.76.http > dhcp-140-247-103-184.fas.harvard.edu.60091: Flags [.], seq 207992:209372, ack 1, win 487, length 1380
19:24:05.996645 IP 4.53.56.76.http > dhcp-140-247-103-184.fas.harvard.edu.60091: Flags [P.], seq 203372:203612, ack 1, win 487, length 240
19:24:05.996649 IP 4.53.56.76.http > dhcp-140-247-103-184.fas.harvard.edu.60091: Flags [.], seq 206532:207912, ack 1, win 487, length 1380
19:24:05.996652 IP 4.53.56.76.http > dhcp-140-247-103-184.fas.harvard.edu.60091: Flags [P.], seq 209372:209452, ack 1, win 487, length 80
19:24:05.996655 IP dhcp-140-247-103-184.fas.harvard.edu.60091 > 4.53.56.76.http: Flags [.], ack 203372, win 12276, options [nop,nop,sack 2 {203612:206532}{207912:207992}], length 0
19:24:05.996665 IP dhcp-140-247-103-184.fas.harvard.edu.60091 > 4.53.56.76.http: Flags [.], ack 203372, win 12276, options [nop,nop,sack 2 {207912:209372}{203612:206532}], length 0
19:24:05.996671 IP dhcp-140-247-103-184.fas.harvard.edu.60091 > 4.53.56.76.http: Flags [.], ack 206532, win 12276, options [nop,nop,sack 1 {207912:209372}], length 0
19:24:05.996680 IP dhcp-140-247-103-184.fas.harvard.edu.60091 > 4.53.56.76.http: Flags [.], ack 209372, win 12276, length 0
19:24:05.996686 IP dhcp-140-247-103-184.fas.harvard.edu.60091 > 4.53.56.76.http: Flags [.], ack 209452, win 12276, length 0
19:24:05.997315 IP 4.53.56.76.http > dhcp-140-247-103-184.fas.harvard.edu.60091: Flags [.], seq 209452:213592, ack 1, win 487, length 4140
19:24:05.997332 IP dhcp-140-247-103-184.fas.harvard.edu.60091 > 4.53.56.76.http: Flags [.], ack 213592, win 12276, length 0
19:24:05.997372 IP 4.53.56.76.http > dhcp-140-247-103-184.fas.harvard.edu.60091: Flags [.], seq 213592:219112, ack 1, win 487, length 5520
19:24:05.997389 IP dhcp-140-247-103-184.fas.harvard.edu.60091 > 4.53.56.76.http: Flags [.], ack 219112, win 12276, length 0
19:24:05.997424 IP 4.53.56.76.http > dhcp-140-247-103-184.fas.harvard.edu.60091: Flags [.], seq 219112:224632, ack 1, win 487, length 5520
19:24:05.997447 IP dhcp-140-247-103-184.fas.harvard.edu.60091 > 4.53.56.76.http: Flags [.], ack 224632, win 12276, length 0
19:24:05.997523 IP 4.53.56.76.http > dhcp-140-247-103-184.fas.harvard.edu.60091: Flags [.], seq 224632:234292, ack 1, win 487, length 9660
19:24:05.997547 IP dhcp-140-247-103-184.fas.harvard.edu.60091 > 4.53.56.76.http: Flags [.], ack 234292, win 12276, length 0
19:24:05.997585 IP 4.53.56.76.http > dhcp-140-247-103-184.fas.harvard.edu.60091: Flags [.], seq 234292:235672, ack 1, win 487, length 1380
19:24:05.997597 IP dhcp-140-247-103-184.fas.harvard.edu.60091 > 4.53.56.76.http: Flags [.], ack 235672, win 12276, length 0
19:24:05.998125 IP 4.53.56.76.http > dhcp-140-247-103-184.fas.harvard.edu.60091: Flags [.], seq 235672:245332, ack 1, win 487, length 9660
19:24:05.998152 IP dhcp-140-247-103-184.fas.harvard.edu.60091 > 4.53.56.76.http: Flags [.], ack 245332, win 12276, length 0
19:24:05.998188 IP 4.53.56.76.http > dhcp-140-247-103-184.fas.harvard.edu.60091: Flags [.], seq 245332:250852, ack 1, win 487, length 5520
19:24:05.998208 IP dhcp-140-247-103-184.fas.harvard.edu.60091 > 4.53.56.76.http: Flags [.], ack 250852, win 12276, length 0
19:24:05.998447 IP 4.53.56.76.http > dhcp-140-247-103-184.fas.harvard.edu.60091: Flags [.], seq 250852:260512, ack 1, win 487, length 9660
19:24:05.998464 IP dhcp-140-247-103-184.fas.harvard.edu.60091 > 4.53.56.76.http: Flags [.], ack 260512, win 12276, length 0
19:24:05.998471 IP 4.53.56.76.http > dhcp-140-247-103-184.fas.harvard.edu.60091: Flags [P.], seq 261892:262144, ack 1, win 487, length 252
19:24:05.998477 IP dhcp-140-247-103-184.fas.harvard.edu.60091 > 4.53.56.76.http: Flags [.], ack 260512, win 12276, options [nop,nop,sack 1 {261892:262144}], length 0
19:24:05.998487 IP 4.53.56.76.http > dhcp-140-247-103-184.fas.harvard.edu.60091: Flags [.], seq 260512:261892, ack 1, win 487, length 1380
19:24:05.998507 IP dhcp-140-247-103-184.fas.harvard.edu.60091 > 4.53.56.76.http: Flags [.], ack 262144, win 12276, length 0
19:24:06.950597 IP 4.53.56.76.http > dhcp-140-247-103-184.fas.harvard.edu.60091: Flags [P.], seq 262144:263472, ack 1, win 487, length 1328
19:24:06.950630 IP dhcp-140-247-103-184.fas.harvard.edu.60091 > 4.53.56.76.http: Flags [.], ack 263472, win 12276, length 0
19:24:06.950646 IP 4.53.56.76.http > dhcp-140-247-103-184.fas.harvard.edu.60091: Flags [P.], seq 263472:266392, ack 1, win 487, length 2920
19:24:06.950659 IP dhcp-140-247-103-184.fas.harvard.edu.60091 > 4.53.56.76.http: Flags [.], ack 266392, win 12276, length 0
19:24:06.950665 IP 4.53.56.76.http > dhcp-140-247-103-184.fas.harvard.edu.60091: Flags [.], seq 266392:267772, ack 1, win 487, length 1380
19:24:06.950671 IP dhcp-140-247-103-184.fas.harvard.edu.60091 > 4.53.56.76.http: Flags [.], ack 267772, win 12276, length 0
19:24:06.950675 IP 4.53.56.76.http > dhcp-140-247-103-184.fas.harvard.edu.60091: Flags [.], seq 267852:269232, ack 1, win 487, length 1380
19:24:06.950680 IP 4.53.56.76.http > dhcp-140-247-103-184.fas.harvard.edu.60091: Flags [.], seq 269312:270692, ack 1, win 487, length 1380
19:24:06.950684 IP 4.53.56.76.http > dhcp-140-247-103-184.fas.harvard.edu.60091: Flags [P.], seq 267772:267852, ack 1, win 487, length 80
19:24:06.950689 IP 4.53.56.76.http > dhcp-140-247-103-184.fas.harvard.edu.60091: Flags [P.], seq 270692:272232, ack 1, win 487, length 1540
19:24:06.950695 IP 4.53.56.76.http > dhcp-140-247-103-184.fas.harvard.edu.60091: Flags [P.], seq 273612:275152, ack 1, win 487, length 1540
19:24:06.950700 IP dhcp-140-247-103-184.fas.harvard.edu.60091 > 4.53.56.76.http: Flags [.], ack 267772, win 12276, options [nop,nop,sack 1 {267852:269232}], length 0
19:24:06.950702 IP 4.53.56.76.http > dhcp-140-247-103-184.fas.harvard.edu.60091: Flags [.], seq 272232:273612, ack 1, win 487, length 1380
19:24:06.950705 IP 4.53.56.76.http > dhcp-140-247-103-184.fas.harvard.edu.60091: Flags [P.], seq 269232:269312, ack 1, win 487, length 80
19:24:06.950712 IP dhcp-140-247-103-184.fas.harvard.edu.60091 > 4.53.56.76.http: Flags [.], ack 267772, win 12276, options [nop,nop,sack 2 {269312:270692}{267852:269232}], length 0
19:24:06.950722 IP dhcp-140-247-103-184.fas.harvard.edu.60091 > 4.53.56.76.http: Flags [.], ack 269232, win 12276, options [nop,nop,sack 1 {269312:270692}], length 0
19:24:06.950730 IP dhcp-140-247-103-184.fas.harvard.edu.60091 > 4.53.56.76.http: Flags [.], ack 269232, win 12276, options [nop,nop,sack 1 {269312:272232}], length 0
19:24:06.950736 IP dhcp-140-247-103-184.fas.harvard.edu.60091 > 4.53.56.76.http: Flags [.], ack 269232, win 12276, options [nop,nop,sack 2 {273612:275152}{269312:272232}], length 0
19:24:06.950744 IP dhcp-140-247-103-184.fas.harvard.edu.60091 > 4.53.56.76.http: Flags [.], ack 269232, win 12276, options [nop,nop,sack 1 {269312:275152}], length 0
19:24:06.950751 IP dhcp-140-247-103-184.fas.harvard.edu.60091 > 4.53.56.76.http: Flags [.], ack 275152, win 12276, length 0
19:24:06.951395 IP 4.53.56.76.http > dhcp-140-247-103-184.fas.harvard.edu.60091: Flags [.], seq 275152:280672, ack 1, win 487, length 5520
19:24:06.951424 IP dhcp-140-247-103-184.fas.harvard.edu.60091 > 4.53.56.76.http: Flags [.], ack 280672, win 12276, length 0
19:24:06.951500 IP 4.53.56.76.http > dhcp-140-247-103-184.fas.harvard.edu.60091: Flags [.], seq 280672:291712, ack 1, win 487, length 11040
19:24:06.951526 IP dhcp-140-247-103-184.fas.harvard.edu.60091 > 4.53.56.76.http: Flags [.], ack 291712, win 12276, length 0
19:24:06.951793 IP 4.53.56.76.http > dhcp-140-247-103-184.fas.harvard.edu.60091: Flags [.], seq 291712:304132, ack 1, win 487, length 12420
19:24:06.951818 IP dhcp-140-247-103-184.fas.harvard.edu.60091 > 4.53.56.76.http: Flags [.], ack 304132, win 12276, length 0
19:24:06.952370 IP 4.53.56.76.http > dhcp-140-247-103-184.fas.harvard.edu.60091: Flags [.], seq 304132:326212, ack 1, win 487, length 22080
19:24:06.952402 IP dhcp-140-247-103-184.fas.harvard.edu.60091 > 4.53.56.76.http: Flags [.], ack 326212, win 12276, length 0
19:24:06.952412 IP 4.53.56.76.http > dhcp-140-247-103-184.fas.harvard.edu.60091: Flags [P.], seq 327592:327680, ack 1, win 487, length 88
19:24:06.952420 IP dhcp-140-247-103-184.fas.harvard.edu.60091 > 4.53.56.76.http: Flags [.], ack 326212, win 12276, options [nop,nop,sack 1 {327592:327680}], length 0
19:24:06.952426 IP 4.53.56.76.http > dhcp-140-247-103-184.fas.harvard.edu.60091: Flags [.], seq 326212:327592, ack 1, win 487, length 1380
19:24:06.952434 IP dhcp-140-247-103-184.fas.harvard.edu.60091 > 4.53.56.76.http: Flags [.], ack 327680, win 12276, length 0
19:24:07.904770 IP 4.53.56.76.http > dhcp-140-247-103-184.fas.harvard.edu.60091: Flags [P.], seq 327680:327712, ack 1, win 487, length 32
19:24:07.904802 IP dhcp-140-247-103-184.fas.harvard.edu.60091 > 4.53.56.76.http: Flags [.], ack 327712, win 12276, length 0
19:24:07.904819 IP 4.53.56.76.http > dhcp-140-247-103-184.fas.harvard.edu.60091: Flags [P.], seq 327712:329172, ack 1, win 487, length 1460
19:24:07.904829 IP dhcp-140-247-103-184.fas.harvard.edu.60091 > 4.53.56.76.http: Flags [.], ack 329172, win 12276, length 0
19:24:07.904835 IP 4.53.56.76.http > dhcp-140-247-103-184.fas.harvard.edu.60091: Flags [.], seq 329172:330552, ack 1, win 487, length 1380
19:24:07.904844 IP dhcp-140-247-103-184.fas.harvard.edu.60091 > 4.53.56.76.http: Flags [.], ack 330552, win 12276, length 0
19:24:07.904847 IP 4.53.56.76.http > dhcp-140-247-103-184.fas.harvard.edu.60091: Flags [P.], seq 331932:332092, ack 1, win 487, length 160
19:24:07.904853 IP dhcp-140-247-103-184.fas.harvard.edu.60091 > 4.53.56.76.http: Flags [.], ack 330552, win 12276, options [nop,nop,sack 1 {331932:332092}], length 0
19:24:07.904858 IP 4.53.56.76.http > dhcp-140-247-103-184.fas.harvard.edu.60091: Flags [.], seq 330552:331932, ack 1, win 487, length 1380
19:24:07.904865 IP dhcp-140-247-103-184.fas.harvard.edu.60091 > 4.53.56.76.http: Flags [.], ack 332092, win 12276, length 0
19:24:07.904871 IP 4.53.56.76.http > dhcp-140-247-103-184.fas.harvard.edu.60091: Flags [.], seq 332092:334852, ack 1, win 487, length 2760
19:24:07.904880 IP dhcp-140-247-103-184.fas.harvard.edu.60091 > 4.53.56.76.http: Flags [.], ack 334852, win 12276, length 0
19:24:07.904883 IP 4.53.56.76.http > dhcp-140-247-103-184.fas.harvard.edu.60091: Flags [P.], seq 336232:336472, ack 1, win 487, length 240
19:24:07.904889 IP dhcp-140-247-103-184.fas.harvard.edu.60091 > 4.53.56.76.http: Flags [.], ack 334852, win 12276, options [nop,nop,sack 1 {336232:336472}], length 0
19:24:07.904893 IP 4.53.56.76.http > dhcp-140-247-103-184.fas.harvard.edu.60091: Flags [P.], seq 337852:337932, ack 1, win 487, length 80
19:24:07.904899 IP dhcp-140-247-103-184.fas.harvard.edu.60091 > 4.53.56.76.http: Flags [.], ack 334852, win 12276, options [nop,nop,sack 2 {337852:337932}{336232:336472}], length 0
19:24:07.904904 IP 4.53.56.76.http > dhcp-140-247-103-184.fas.harvard.edu.60091: Flags [.], seq 336472:337852, ack 1, win 487, length 1380
19:24:07.904910 IP dhcp-140-247-103-184.fas.harvard.edu.60091 > 4.53.56.76.http: Flags [.], ack 334852, win 12276, options [nop,nop,sack 1 {336232:337932}], length 0
19:24:07.904918 IP 4.53.56.76.http > dhcp-140-247-103-184.fas.harvard.edu.60091: Flags [.], seq 334852:336232, ack 1, win 487, length 1380
19:24:07.904924 IP dhcp-140-247-103-184.fas.harvard.edu.60091 > 4.53.56.76.http: Flags [.], ack 337932, win 12276, length 0
19:24:07.905585 IP 4.53.56.76.http > dhcp-140-247-103-184.fas.harvard.edu.60091: Flags [.], seq 337932:346212, ack 1, win 487, length 8280
19:24:07.905607 IP dhcp-140-247-103-184.fas.harvard.edu.60091 > 4.53.56.76.http: Flags [.], ack 346212, win 12276, length 0
19:24:07.905688 IP 4.53.56.76.http > dhcp-140-247-103-184.fas.harvard.edu.60091: Flags [.], seq 346212:358632, ack 1, win 487, length 12420
19:24:07.905711 IP dhcp-140-247-103-184.fas.harvard.edu.60091 > 4.53.56.76.http: Flags [.], ack 358632, win 12276, length 0
19:24:07.905983 IP 4.53.56.76.http > dhcp-140-247-103-184.fas.harvard.edu.60091: Flags [.], seq 358632:361392, ack 1, win 487, length 2760
19:24:07.905999 IP dhcp-140-247-103-184.fas.harvard.edu.60091 > 4.53.56.76.http: Flags [.], ack 361392, win 12276, length 0
19:24:07.906010 IP 4.53.56.76.http > dhcp-140-247-103-184.fas.harvard.edu.60091: Flags [.], seq 362772:364152, ack 1, win 487, length 1380
