21:37:26.833443 IP dhcp-140-247-103-184.fas.harvard.edu.36972 > 208-47-254-27.dia.static.qwest.net.http: Flags [.], ack 510385127, win 376, options [nop,nop,TS val 9853824 ecr 504455423], length 0
21:37:26.839467 IP 208-47-254-27.dia.static.qwest.net.http > dhcp-140-247-103-184.fas.harvard.edu.36972: Flags [.], ack 1, win 8312, options [nop,nop,TS val 504500543 ecr 9840311], length 0
21:37:31.567648 IP dhcp-140-247-103-184.fas.harvard.edu.35383 > edge-star-shv-13-frc1.facebook.com.http: Flags [P.], seq 2884842151:2884843401, ack 364756324, win 245, options [nop,nop,TS val 9854297 ecr 2799013232], length 1250
21:37:31.604769 IP edge-star-shv-13-frc1.facebook.com.http > dhcp-140-247-103-184.fas.harvard.edu.35383: Flags [.], ack 1250, win 40, options [nop,nop,TS val 2799036037 ecr 9854297], length 0
21:37:31.679759 IP edge-star-shv-13-frc1.facebook.com.http > dhcp-140-247-103-184.fas.harvard.edu.35383: Flags [P.], seq 1:238, ack 1250, win 40, options [nop,nop,TS val 2799036111 ecr 9854297], length 237
21:37:31.679784 IP dhcp-140-247-103-184.fas.harvard.edu.35383 > edge-star-shv-13-frc1.facebook.com.http: Flags [.], ack 238, win 262, options [nop,nop,TS val 9854308 ecr 2799036111], length 0
21:37:31.917135 IP dhcp-140-247-103-184.fas.harvard.edu.45571 > TGV.ANYCAST-FO.CHI2.VERISIGN.COM.http: Flags [P.], seq 3076585037:3076585435, ack 2571903769, win 20620, length 398
21:37:31.940633 IP TGV.ANYCAST-FO.CHI2.VERISIGN.COM.http > dhcp-140-247-103-184.fas.harvard.edu.45571: Flags [.], ack 398, win 10712, length 0
21:37:31.943374 IP TGV.ANYCAST-FO.CHI2.VERISIGN.COM.http > dhcp-140-247-103-184.fas.harvard.edu.45571: Flags [.], seq 1:354, ack 398, win 10712, length 353
21:37:31.943393 IP dhcp-140-247-103-184.fas.harvard.edu.45571 > TGV.ANYCAST-FO.CHI2.VERISIGN.COM.http: Flags [.], ack 354, win 22682, length 0
21:37:31.943410 IP TGV.ANYCAST-FO.CHI2.VERISIGN.COM.http > dhcp-140-247-103-184.fas.harvard.edu.45571: Flags [.], seq 354:1385, ack 398, win 10712, length 1031
21:37:31.943419 IP dhcp-140-247-103-184.fas.harvard.edu.45571 > TGV.ANYCAST-FO.CHI2.VERISIGN.COM.http: Flags [.], ack 1385, win 24744, length 0
21:37:31.943424 IP TGV.ANYCAST-FO.CHI2.VERISIGN.COM.http > dhcp-140-247-103-184.fas.harvard.edu.45571: Flags [P.], seq 1385:1950, ack 398, win 10712, length 565
21:37:31.943428 IP TGV.ANYCAST-FO.CHI2.VERISIGN.COM.http > dhcp-140-247-103-184.fas.harvard.edu.45571: Flags [.], ack 398, win 10712, length 0
21:37:31.943438 IP dhcp-140-247-103-184.fas.harvard.edu.45571 > TGV.ANYCAST-FO.CHI2.VERISIGN.COM.http: Flags [.], ack 1950, win 26806, length 0
21:37:33.910551 IP dhcp-140-247-103-184.fas.harvard.edu.52472 > lga15s28-in-f1.1e100.net.http: Flags [S], seq 1976278427, win 14600, options [mss 1460,sackOK,TS val 9854531 ecr 0,nop,wscale 6], length 0
21:37:33.910832 IP dhcp-140-247-103-184.fas.harvard.edu.59068 > lis01s05-in-f15.1e100.net.http: Flags [S], seq 1209662307, win 14600, options [mss 1460,sackOK,TS val 9854531 ecr 0,nop,wscale 6], length 0
21:37:33.910867 IP dhcp-140-247-103-184.fas.harvard.edu.59069 > lis01s05-in-f15.1e100.net.http: Flags [S], seq 3380237844, win 14600, options [mss 1460,sackOK,TS val 9854531 ecr 0,nop,wscale 6], length 0
21:37:33.910894 IP dhcp-140-247-103-184.fas.harvard.edu.59070 > lis01s05-in-f15.1e100.net.http: Flags [S], seq 1095493525, win 14600, options [mss 1460,sackOK,TS val 9854531 ecr 0,nop,wscale 6], length 0
21:37:33.911330 IP dhcp-140-247-103-184.fas.harvard.edu.35688 > lga15s29-in-f1.1e100.net.http: Flags [S], seq 1644787477, win 14600, options [mss 1460,sackOK,TS val 9854531 ecr 0,nop,wscale 6], length 0
21:37:33.911362 IP dhcp-140-247-103-184.fas.harvard.edu.35689 > lga15s29-in-f1.1e100.net.http: Flags [S], seq 1421716195, win 14600, options [mss 1460,sackOK,TS val 9854531 ecr 0,nop,wscale 6], length 0
21:37:33.911393 IP dhcp-140-247-103-184.fas.harvard.edu.35690 > lga15s29-in-f1.1e100.net.http: Flags [S], seq 2704953659, win 14600, options [mss 1460,sackOK,TS val 9854531 ecr 0,nop,wscale 6], length 0
21:37:33.911762 IP dhcp-140-247-103-184.fas.harvard.edu.42905 > lga15s29-in-f7.1e100.net.http: Flags [S], seq 636706543, win 14600, options [mss 1460,sackOK,TS val 9854531 ecr 0,nop,wscale 6], length 0
21:37:33.911795 IP dhcp-140-247-103-184.fas.harvard.edu.42906 > lga15s29-in-f7.1e100.net.http: Flags [S], seq 13909677, win 14600, options [mss 1460,sackOK,TS val 9854531 ecr 0,nop,wscale 6], length 0
21:37:33.911824 IP dhcp-140-247-103-184.fas.harvard.edu.42907 > lga15s29-in-f7.1e100.net.http: Flags [S], seq 3220480425, win 14600, options [mss 1460,sackOK,TS val 9854531 ecr 0,nop,wscale 6], length 0
21:37:33.911852 IP dhcp-140-247-103-184.fas.harvard.edu.42908 > lga15s29-in-f7.1e100.net.http: Flags [S], seq 2946603214, win 14600, options [mss 1460,sackOK,TS val 9854531 ecr 0,nop,wscale 6], length 0
21:37:33.911892 IP dhcp-140-247-103-184.fas.harvard.edu.42909 > lga15s29-in-f7.1e100.net.http: Flags [S], seq 2386361848, win 14600, options [mss 1460,sackOK,TS val 9854531 ecr 0,nop,wscale 6], length 0
21:37:33.911921 IP dhcp-140-247-103-184.fas.harvard.edu.42910 > lga15s29-in-f7.1e100.net.http: Flags [S], seq 1150151018, win 14600, options [mss 1460,sackOK,TS val 9854531 ecr 0,nop,wscale 6], length 0
21:37:33.912486 IP dhcp-140-247-103-184.fas.harvard.edu.56742 > lga15s29-in-f4.1e100.net.http: Flags [S], seq 2405820126, win 14600, options [mss 1460,sackOK,TS val 9854531 ecr 0,nop,wscale 6], length 0
21:37:33.912524 IP dhcp-140-247-103-184.fas.harvard.edu.56743 > lga15s29-in-f4.1e100.net.http: Flags [S], seq 1904253050, win 14600, options [mss 1460,sackOK,TS val 9854531 ecr 0,nop,wscale 6], length 0
21:37:33.912566 IP dhcp-140-247-103-184.fas.harvard.edu.56744 > lga15s29-in-f4.1e100.net.http: Flags [S], seq 326466508, win 14600, options [mss 1460,sackOK,TS val 9854531 ecr 0,nop,wscale 6], length 0
21:37:33.912599 IP dhcp-140-247-103-184.fas.harvard.edu.56745 > lga15s29-in-f4.1e100.net.http: Flags [S], seq 1445667633, win 14600, options [mss 1460,sackOK,TS val 9854531 ecr 0,nop,wscale 6], length 0
21:37:33.912632 IP dhcp-140-247-103-184.fas.harvard.edu.56746 > lga15s29-in-f4.1e100.net.http: Flags [S], seq 1292173192, win 14600, options [mss 1460,sackOK,TS val 9854531 ecr 0,nop,wscale 6], length 0
21:37:33.917835 IP dhcp-140-247-103-184.fas.harvard.edu.56747 > lga15s29-in-f4.1e100.net.http: Flags [S], seq 3488189134, win 14600, options [mss 1460,sackOK,TS val 9854532 ecr 0,nop,wscale 6], length 0
21:37:33.918521 IP lga15s29-in-f4.1e100.net.http > dhcp-140-247-103-184.fas.harvard.edu.56742: Flags [S.], seq 419031411, ack 2405820127, win 62392, options [mss 1380,sackOK,TS val 2736876736 ecr 9854531,nop,wscale 6], length 0
21:37:33.918568 IP dhcp-140-247-103-184.fas.harvard.edu.56742 > lga15s29-in-f4.1e100.net.http: Flags [.], ack 1, win 229, options [nop,nop,TS val 9854532 ecr 2736876736], length 0
21:37:33.918624 IP lga15s29-in-f4.1e100.net.http > dhcp-140-247-103-184.fas.harvard.edu.56743: Flags [S.], seq 420197999, ack 1904253051, win 62392, options [mss 1380,sackOK,TS val 2736876737 ecr 9854531,nop,wscale 6], length 0
21:37:33.918640 IP dhcp-140-247-103-184.fas.harvard.edu.56743 > lga15s29-in-f4.1e100.net.http: Flags [.], ack 1, win 229, options [nop,nop,TS val 9854532 ecr 2736876737], length 0
21:37:33.918696 IP lga15s29-in-f4.1e100.net.http > dhcp-140-247-103-184.fas.harvard.edu.56746: Flags [S.], seq 415756879, ack 1292173193, win 62392, options [mss 1380,sackOK,TS val 2736876737 ecr 9854531,nop,wscale 6], length 0
21:37:33.918708 IP dhcp-140-247-103-184.fas.harvard.edu.56746 > lga15s29-in-f4.1e100.net.http: Flags [.], ack 1, win 229, options [nop,nop,TS val 9854532 ecr 2736876737], length 0
21:37:33.918712 IP lga15s29-in-f4.1e100.net.http > dhcp-140-247-103-184.fas.harvard.edu.56744: Flags [S.], seq 422379451, ack 326466509, win 62392, options [mss 1380,sackOK,TS val 2736876737 ecr 9854531,nop,wscale 6], length 0
21:37:33.918720 IP dhcp-140-247-103-184.fas.harvard.edu.56744 > lga15s29-in-f4.1e100.net.http: Flags [.], ack 1, win 229, options [nop,nop,TS val 9854532 ecr 2736876737], length 0
21:37:33.918873 IP lga15s29-in-f4.1e100.net.http > dhcp-140-247-103-184.fas.harvard.edu.56745: Flags [S.], seq 419406318, ack 1445667634, win 62392, options [mss 1380,sackOK,TS val 2736876737 ecr 9854531,nop,wscale 6], length 0
21:37:33.918885 IP dhcp-140-247-103-184.fas.harvard.edu.56745 > lga15s29-in-f4.1e100.net.http: Flags [.], ack 1, win 229, options [nop,nop,TS val 9854532 ecr 2736876737], length 0
21:37:33.919135 IP dhcp-140-247-103-184.fas.harvard.edu.42828 > lga15s29-in-f9.1e100.net.http: Flags [S], seq 1584230216, win 14600, options [mss 1460,sackOK,TS val 9854532 ecr 0,nop,wscale 6], length 0
21:37:33.919243 IP dhcp-140-247-103-184.fas.harvard.edu.42829 > lga15s29-in-f9.1e100.net.http: Flags [S], seq 3042718195, win 14600, options [mss 1460,sackOK,TS val 9854532 ecr 0,nop,wscale 6], length 0
21:37:33.919342 IP dhcp-140-247-103-184.fas.harvard.edu.42830 > lga15s29-in-f9.1e100.net.http: Flags [S], seq 2333512142, win 14600, options [mss 1460,sackOK,TS val 9854532 ecr 0,nop,wscale 6], length 0
21:37:33.980152 IP lga15s28-in-f1.1e100.net.http > dhcp-140-247-103-184.fas.harvard.edu.52472: Flags [.], ack 1976280109, win 954, options [nop,nop,TS val 2742400959 ecr 9854535], length 0
21:37:34.013085 IP lis01s05-in-f15.1e100.net.http > dhcp-140-247-103-184.fas.harvard.edu.59070: Flags [S.], seq 2495508686, ack 1095493526, win 62392, options [mss 1380,sackOK,TS val 2927537745 ecr 9854531,nop,wscale 6], length 0
21:37:34.013136 IP dhcp-140-247-103-184.fas.harvard.edu.59070 > lis01s05-in-f15.1e100.net.http: Flags [.], ack 1, win 229, options [nop,nop,TS val 9854541 ecr 2927537745], length 0
21:37:34.013147 IP lis01s05-in-f15.1e100.net.http > dhcp-140-247-103-184.fas.harvard.edu.59068: Flags [S.], seq 2504077891, ack 1209662308, win 62392, options [mss 1380,sackOK,TS val 2927537745 ecr 9854531,nop,wscale 6], length 0
21:37:34.013158 IP dhcp-140-247-103-184.fas.harvard.edu.59068 > lis01s05-in-f15.1e100.net.http: Flags [.], ack 1, win 229, options [nop,nop,TS val 9854541 ecr 2927537745], length 0
21:37:34.013163 IP lis01s05-in-f15.1e100.net.http > dhcp-140-247-103-184.fas.harvard.edu.59069: Flags [S.], seq 2498421997, ack 3380237845, win 62392, options [mss 1380,sackOK,TS val 2927537745 ecr 9854531,nop,wscale 6], length 0
21:37:34.013171 IP dhcp-140-247-103-184.fas.harvard.edu.59069 > lis01s05-in-f15.1e100.net.http: Flags [.], ack 1, win 229, options [nop,nop,TS val 9854541 ecr 2927537745], length 0
21:37:35.130451 IP lga15s28-in-f1.1e100.net.http > dhcp-140-247-103-184.fas.harvard.edu.52472: Flags [.], seq 0:1368, ack 1, win 975, options [nop,nop,TS val 2742402109 ecr 9854535], length 1368
21:37:35.130539 IP dhcp-140-247-103-184.fas.harvard.edu.52472 > lga15s28-in-f1.1e100.net.http: Flags [.], ack 1368, win 274, options [nop,nop,TS val 9854653 ecr 2742402109], length 0
21:37:35.130548 IP lga15s28-in-f1.1e100.net.http > dhcp-140-247-103-184.fas.harvard.edu.52472: Flags [.], seq 1368:2736, ack 1, win 975, options [nop,nop,TS val 2742402109 ecr 9854535], length 1368
21:37:35.130551 IP dhcp-140-247-103-184.fas.harvard.edu.52472 > lga15s28-in-f1.1e100.net.http: Flags [.], ack 2736, win 319, options [nop,nop,TS val 9854653 ecr 2742402109], length 0
21:37:35.130554 IP lga15s28-in-f1.1e100.net.http > dhcp-140-247-103-184.fas.harvard.edu.52472: Flags [.], seq 2736:4104, ack 1, win 975, options [nop,nop,TS val 2742402109 ecr 9854535], length 1368
21:37:35.130557 IP dhcp-140-247-103-184.fas.harvard.edu.52472 > lga15s28-in-f1.1e100.net.http: Flags [.], ack 4104, win 364, options [nop,nop,TS val 9854653 ecr 2742402109], length 0
21:37:35.130559 IP lga15s28-in-f1.1e100.net.http > dhcp-140-247-103-184.fas.harvard.edu.52472: Flags [.], seq 4104:5472, ack 1, win 975, options [nop,nop,TS val 2742402109 ecr 9854535], length 1368
21:37:35.130561 IP dhcp-140-247-103-184.fas.harvard.edu.52472 > lga15s28-in-f1.1e100.net.http: Flags [.], ack 5472, win 410, options [nop,nop,TS val 9854653 ecr 2742402109], length 0
21:37:35.130564 IP lga15s28-in-f1.1e100.net.http > dhcp-140-247-103-184.fas.harvard.edu.52472: Flags [.], seq 5472:6840, ack 1, win 975, options [nop,nop,TS val 2742402109 ecr 9854535], length 1368
21:37:35.130566 IP lga15s28-in-f1.1e100.net.http > dhcp-140-247-103-184.fas.harvard.edu.52472: Flags [P.], seq 6840:8106, ack 1, win 975, options [nop,nop,TS val 2742402109 ecr 9854535], length 1266
21:37:35.130575 IP dhcp-140-247-103-184.fas.harvard.edu.52472 > lga15s28-in-f1.1e100.net.http: Flags [.], ack 6840, win 455, options [nop,nop,TS val 9854653 ecr 2742402109], length 0
21:37:35.130581 IP dhcp-140-247-103-184.fas.harvard.edu.52472 > lga15s28-in-f1.1e100.net.http: Flags [.], ack 8106, win 500, options [nop,nop,TS val 9854653 ecr 2742402109], length 0
21:37:35.150762 IP lga15s28-in-f1.1e100.net.http > dhcp-140-247-103-184.fas.harvard.edu.52472: Flags [.], seq 8106:9474, ack 1, win 975, options [nop,nop,TS val 2742402129 ecr 9854535], length 1368
21:37:35.150791 IP dhcp-140-247-103-184.fas.harvard.edu.52472 > lga15s28-in-f1.1e100.net.http: Flags [.], ack 9474, win 545, options [nop,nop,TS val 9854655 ecr 2742402129], length 0
21:37:35.150805 IP lga15s28-in-f1.1e100.net.http > dhcp-140-247-103-184.fas.harvard.edu.52472: Flags [.], seq 9474:10842, ack 1, win 975, options [nop,nop,TS val 2742402129 ecr 9854535], length 1368
21:37:35.150812 IP dhcp-140-247-103-184.fas.harvard.edu.52472 > lga15s28-in-f1.1e100.net.http: Flags [.], ack 10842, win 591, options [nop,nop,TS val 9854655 ecr 2742402129], length 0
21:37:35.150824 IP lga15s28-in-f1.1e100.net.http > dhcp-140-247-103-184.fas.harvard.edu.52472: Flags [.], seq 10842:12210, ack 1, win 975, options [nop,nop,TS val 2742402129 ecr 9854535], length 1368
21:37:35.150829 IP dhcp-140-247-103-184.fas.harvard.edu.52472 > lga15s28-in-f1.1e100.net.http: Flags [.], ack 12210, win 636, options [nop,nop,TS val 9854655 ecr 2742402129], length 0
21:37:35.150835 IP lga15s28-in-f1.1e100.net.http > dhcp-140-247-103-184.fas.harvard.edu.52472: Flags [.], seq 12210:13578, ack 1, win 975, options [nop,nop,TS val 2742402129 ecr 9854535], length 1368
21:37:35.150841 IP dhcp-140-247-103-184.fas.harvard.edu.52472 > lga15s28-in-f1.1e100.net.http: Flags [.], ack 13578, win 626, options [nop,nop,TS val 9854655 ecr 2742402129], length 0
21:37:35.161467 IP lga15s28-in-f1.1e100.net.http > dhcp-140-247-103-184.fas.harvard.edu.52472: Flags [.], seq 13578:14946, ack 1, win 975, options [nop,nop,TS val 2742402140 ecr 9854653], length 1368
21:37:35.161488 IP dhcp-140-247-103-184.fas.harvard.edu.52472 > lga15s28-in-f1.1e100.net.http: Flags [.], ack 14946, win 661, options [nop,nop,TS val 9854656 ecr 2742402140], length 0
21:37:35.161500 IP lga15s28-in-f1.1e100.net.http > dhcp-140-247-103-184.fas.harvard.edu.52472: Flags [.], seq 14946:16314, ack 1, win 975, options [nop,nop,TS val 2742402140 ecr 9854653], length 1368
21:37:35.161507 IP dhcp-140-247-103-184.fas.harvard.edu.52472 > lga15s28-in-f1.1e100.net.http: Flags [.], ack 16314, win 654, options [nop,nop,TS val 9854656 ecr 2742402140], length 0
21:37:35.161514 IP lga15s28-in-f1.1e100.net.http > dhcp-140-247-103-184.fas.harvard.edu.52472: Flags [P.], seq 16314:16866, ack 1, win 975, options [nop,nop,TS val 2742402140 ecr 9854653], length 552
21:37:35.161520 IP dhcp-140-247-103-184.fas.harvard.edu.52472 > lga15s28-in-f1.1e100.net.http: Flags [.], ack 16866, win 646, options [nop,nop,TS val 9854656 ecr 2742402140], length 0
21:37:35.171665 IP lga15s28-in-f1.1e100.net.http > dhcp-140-247-103-184.fas.harvard.edu.52472: Flags [.], seq 16866:18234, ack 1, win 975, options [nop,nop,TS val 2742402150 ecr 9854653], length 1368
21:37:35.171689 IP lga15s28-in-f1.1e100.net.http > dhcp-140-247-103-184.fas.harvard.edu.52472: Flags [.], seq 18234:19602, ack 1, win 975, options [nop,nop,TS val 2742402150 ecr 9854653], length 1368
21:37:35.171705 IP dhcp-140-247-103-184.fas.harvard.edu.52472 > lga15s28-in-f1.1e100.net.http: Flags [.], ack 19602, win 654, options [nop,nop,TS val 9854657 ecr 2742402150], length 0
21:37:35.171714 IP lga15s28-in-f1.1e100.net.http > dhcp-140-247-103-184.fas.harvard.edu.52472: Flags [.], seq 19602:20970, ack 1, win 975, options [nop,nop,TS val 2742402150 ecr 9854653], length 1368
21:37:35.171720 IP lga15s28-in-f1.1e100.net.http > dhcp-140-247-103-184.fas.harvard.edu.52472: Flags [.], seq 20970:22338, ack 1, win 975, options [nop,nop,TS val 2742402150 ecr 9854653], length 1368
21:37:35.171725 IP lga15s28-in-f1.1e100.net.http > dhcp-140-247-103-184.fas.harvard.edu.52472: Flags [.], seq 22338:23706, ack 1, win 975, options [nop,nop,TS val 2742402150 ecr 9854653], length 1368
21:37:35.171733 IP lga15s28-in-f1.1e100.net.http > dhcp-140-247-103-184.fas.harvard.edu.52472: Flags [.], seq 23706:25074, ack 1, win 975, options [nop,nop,TS val 2742402150 ecr 9854653], length 1368
21:37:35.171738 IP lga15s28-in-f1.1e100.net.http > dhcp-140-247-103-184.fas.harvard.edu.52472: Flags [P.], seq 25074:25626, ack 1, win 975, options [nop,nop,TS val 2742402150 ecr 9854653], length 552
21:37:35.172915 IP dhcp-140-247-103-184.fas.harvard.edu.52472 > lga15s28-in-f1.1e100.net.http: Flags [.], ack 25626, win 661, options [nop,nop,TS val 9854657 ecr 2742402150], length 0
21:37:35.191996 IP lga15s28-in-f1.1e100.net.http > dhcp-140-247-103-184.fas.harvard.edu.52472: Flags [.], seq 25626:26994, ack 1, win 975, options [nop,nop,TS val 2742402171 ecr 9854655], length 1368
21:37:35.192014 IP lga15s28-in-f1.1e100.net.http > dhcp-140-247-103-184.fas.harvard.edu.52472: Flags [.], seq 26994:28362, ack 1, win 975, options [nop,nop,TS val 2742402171 ecr 9854655], length 1368
21:37:35.192017 IP lga15s28-in-f1.1e100.net.http > dhcp-140-247-103-184.fas.harvard.edu.52472: Flags [.], seq 28362:29730, ack 1, win 975, options [nop,nop,TS val 2742402171 ecr 9854655], length 1368
21:37:35.192020 IP lga15s28-in-f1.1e100.net.http > dhcp-140-247-103-184.fas.harvard.edu.52472: Flags [.], seq 29730:31098, ack 1, win 975, options [nop,nop,TS val 2742402171 ecr 9854655], length 1368
21:37:35.192022 IP lga15s28-in-f1.1e100.net.http > dhcp-140-247-103-184.fas.harvard.edu.52472: Flags [.], seq 31098:32466, ack 1, win 975, options [nop,nop,TS val 2742402171 ecr 9854655], length 1368
21:37:35.192025 IP lga15s28-in-f1.1e100.net.http > dhcp-140-247-103-184.fas.harvard.edu.52472: Flags [P.], seq 32466:32876, ack 1, win 975, options [nop,nop,TS val 2742402171 ecr 9854655], length 410
21:37:35.192045 IP dhcp-140-247-103-184.fas.harvard.edu.52472 > lga15s28-in-f1.1e100.net.http: Flags [.], ack 32876, win 661, options [nop,nop,TS val 9854659 ecr 2742402171], length 0
21:37:35.369531 IP dhcp-140-247-103-184.fas.harvard.edu.48478 > lga15s34-in-f4.1e100.net.http: Flags [S], seq 2825365663, win 14600, options [mss 1460,sackOK,TS val 9854677 ecr 0,nop,wscale 6], length 0
21:37:35.369933 IP dhcp-140-247-103-184.fas.harvard.edu.48479 > lga15s34-in-f4.1e100.net.http: Flags [S], seq 1507947979, win 14600, options [mss 1460,sackOK,TS val 9854677 ecr 0,nop,wscale 6], length 0
21:37:35.370237 IP dhcp-140-247-103-184.fas.harvard.edu.48480 > lga15s34-in-f4.1e100.net.http: Flags [S], seq 3862135474, win 14600, options [mss 1460,sackOK,TS val 9854677 ecr 0,nop,wscale 6], length 0
21:37:35.370929 IP dhcp-140-247-103-184.fas.harvard.edu.48469 > lga15s34-in-f4.1e100.net.http: Flags [P.], seq 2956542153:2956542566, ack 528151735, win 229, options [nop,nop,TS val 9854677 ecr 2815323254], length 413
21:37:35.371100 IP dhcp-140-247-103-184.fas.harvard.edu.48470 > lga15s34-in-f4.1e100.net.http: Flags [P.], seq 1644805180:1644805593, ack 519692845, win 229, options [nop,nop,TS val 9854677 ecr 2815323254], length 413
21:37:35.371309 IP dhcp-140-247-103-184.fas.harvard.edu.48471 > lga15s34-in-f4.1e100.net.http: Flags [P.], seq 3530870392:3530870825, ack 515577464, win 229, options [nop,nop,TS val 9854677 ecr 2815323254], length 433
21:37:35.375305 IP lga15s34-in-f4.1e100.net.http > dhcp-140-247-103-184.fas.harvard.edu.48478: Flags [S.], seq 540699777, ack 2825365664, win 62392, options [mss 1380,sackOK,TS val 2815324704 ecr 9854677,nop,wscale 6], length 0
21:37:35.375342 IP dhcp-140-247-103-184.fas.harvard.edu.48478 > lga15s34-in-f4.1e100.net.http: Flags [.], ack 1, win 229, options [nop,nop,TS val 9854678 ecr 2815324704], length 0
21:37:35.375696 IP lga15s34-in-f4.1e100.net.http > dhcp-140-247-103-184.fas.harvard.edu.48479: Flags [S.], seq 536882742, ack 1507947980, win 62392, options [mss 1380,sackOK,TS val 2815324704 ecr 9854677,nop,wscale 6], length 0
21:37:35.375717 IP dhcp-140-247-103-184.fas.harvard.edu.48479 > lga15s34-in-f4.1e100.net.http: Flags [.], ack 1, win 229, options [nop,nop,TS val 9854678 ecr 2815324704], length 0
21:37:35.375826 IP dhcp-140-247-103-184.fas.harvard.edu.48478 > lga15s34-in-f4.1e100.net.http: Flags [P.], seq 1:419, ack 1, win 229, options [nop,nop,TS val 9854678 ecr 2815324704], length 418
21:37:35.376005 IP lga15s34-in-f4.1e100.net.http > dhcp-140-247-103-184.fas.harvard.edu.48480: Flags [S.], seq 548114505, ack 3862135475, win 62392, options [mss 1380,sackOK,TS val 2815324704 ecr 9854677,nop,wscale 6], length 0
21:37:35.376027 IP dhcp-140-247-103-184.fas.harvard.edu.48480 > lga15s34-in-f4.1e100.net.http: Flags [.], ack 1, win 229, options [nop,nop,TS val 9854678 ecr 2815324704], length 0
21:37:35.376098 IP dhcp-140-247-103-184.fas.harvard.edu.48479 > lga15s34-in-f4.1e100.net.http: Flags [P.], seq 1:392, ack 1, win 229, options [nop,nop,TS val 9854678 ecr 2815324704], length 391
21:37:35.376337 IP dhcp-140-247-103-184.fas.harvard.edu.48480 > lga15s34-in-f4.1e100.net.http: Flags [P.], seq 1:412, ack 1, win 229, options [nop,nop,TS val 9854678 ecr 2815324704], length 411
21:37:35.376390 IP lga15s34-in-f4.1e100.net.http > dhcp-140-247-103-184.fas.harvard.edu.48469: Flags [.], ack 413, win 992, options [nop,nop,TS val 2815324705 ecr 9854677], length 0
21:37:35.376669 IP lga15s34-in-f4.1e100.net.http > dhcp-140-247-103-184.fas.harvard.edu.48469: Flags [.], seq 1:1369, ack 413, win 992, options [nop,nop,TS val 2815324705 ecr 9854677], length 1368
21:37:35.376680 IP dhcp-140-247-103-184.fas.harvard.edu.48469 > lga15s34-in-f4.1e100.net.http: Flags [.], ack 1369, win 274, options [nop,nop,TS val 9854678 ecr 2815324705], length 0
21:37:35.376689 IP lga15s34-in-f4.1e100.net.http > dhcp-140-247-103-184.fas.harvard.edu.48469: Flags [.], seq 1369:2737, ack 413, win 992, options [nop,nop,TS val 2815324705 ecr 9854677], length 1368
21:37:35.376693 IP dhcp-140-247-103-184.fas.harvard.edu.48469 > lga15s34-in-f4.1e100.net.http: Flags [.], ack 2737, win 319, options [nop,nop,TS val 9854678 ecr 2815324705], length 0
21:37:35.376698 IP lga15s34-in-f4.1e100.net.http > dhcp-140-247-103-184.fas.harvard.edu.48469: Flags [.], seq 2737:4105, ack 413, win 992, options [nop,nop,TS val 2815324705 ecr 9854677], length 1368
21:37:35.376705 IP dhcp-140-247-103-184.fas.harvard.edu.48469 > lga15s34-in-f4.1e100.net.http: Flags [.], ack 4105, win 364, options [nop,nop,TS val 9854678 ecr 2815324705], length 0
21:37:35.376709 IP lga15s34-in-f4.1e100.net.http > dhcp-140-247-103-184.fas.harvard.edu.48469: Flags [.], seq 4105:5473, ack 413, win 992, options [nop,nop,TS val 2815324705 ecr 9854677], length 1368
21:37:35.376713 IP lga15s34-in-f4.1e100.net.http > dhcp-140-247-103-184.fas.harvard.edu.48470: Flags [.], ack 413, win 992, options [nop,nop,TS val 2815324705 ecr 9854677], length 0
21:37:35.376717 IP dhcp-140-247-103-184.fas.harvard.edu.48469 > lga15s34-in-f4.1e100.net.http: Flags [.], ack 5473, win 410, options [nop,nop,TS val 9854678 ecr 2815324705], length 0
21:37:35.376722 IP lga15s34-in-f4.1e100.net.http > dhcp-140-247-103-184.fas.harvard.edu.48469: Flags [.], seq 5473:6841, ack 413, win 992, options [nop,nop,TS val 2815324705 ecr 9854677], length 1368
21:37:35.376726 IP dhcp-140-247-103-184.fas.harvard.edu.48469 > lga15s34-in-f4.1e100.net.http: Flags [.], ack 6841, win 455, options [nop,nop,TS val 9854678 ecr 2815324705], length 0
21:37:35.376731 IP lga15s34-in-f4.1e100.net.http > dhcp-140-247-103-184.fas.harvard.edu.48469: Flags [.], seq 6841:8209, ack 413, win 992, options [nop,nop,TS val 2815324705 ecr 9854677], length 1368
21:37:35.376736 IP dhcp-140-247-103-184.fas.harvard.edu.48469 > lga15s34-in-f4.1e100.net.http: Flags [.], ack 8209, win 500, options [nop,nop,TS val 9854678 ecr 2815324705], length 0
21:37:35.376740 IP lga15s34-in-f4.1e100.net.http > dhcp-140-247-103-184.fas.harvard.edu.48469: Flags [.], seq 8209:9577, ack 413, win 992, options [nop,nop,TS val 2815324705 ecr 9854677], length 1368
21:37:35.376746 IP dhcp-140-247-103-184.fas.harvard.edu.48469 > lga15s34-in-f4.1e100.net.http: Flags [.], ack 9577, win 545, options [nop,nop,TS val 9854678 ecr 2815324705], length 0
21:37:35.376752 IP lga15s34-in-f4.1e100.net.http > dhcp-140-247-103-184.fas.harvard.edu.48469: Flags [.], seq 9577:10945, ack 413, win 992, options [nop,nop,TS val 2815324705 ecr 9854677], length 1368
21:37:35.376756 IP dhcp-140-247-103-184.fas.harvard.edu.48469 > lga15s34-in-f4.1e100.net.http: Flags [.], ack 10945, win 591, options [nop,nop,TS val 9854678 ecr 2815324705], length 0
21:37:35.376760 IP lga15s34-in-f4.1e100.net.http > dhcp-140-247-103-184.fas.harvard.edu.48469: Flags [.], seq 10945:12313, ack 413, win 992, options [nop,nop,TS val 2815324705 ecr 9854677], length 1368
21:37:35.376764 IP dhcp-140-247-103-184.fas.harvard.edu.48469 > lga15s34-in-f4.1e100.net.http: Flags [.], ack 12313, win 583, options [nop,nop,TS val 9854678 ecr 2815324705], length 0
21:37:35.376768 IP lga15s34-in-f4.1e100.net.http > dhcp-140-247-103-184.fas.harvard.edu.48471: Flags [.], ack 433, win 992, options [nop,nop,TS val 2815324705 ecr 9854677], length 0
21:37:35.376775 IP lga15s34-in-f4.1e100.net.http > dhcp-140-247-103-184.fas.harvard.edu.48469: Flags [P.], seq 12313:13681, ack 413, win 992, options [nop,nop,TS val 2815324705 ecr 9854677], length 1368
21:37:35.376778 IP dhcp-140-247-103-184.fas.harvard.edu.48469 > lga15s34-in-f4.1e100.net.http: Flags [.], ack 13681, win 568, options [nop,nop,TS val 9854678 ecr 2815324705], length 0
21:37:35.377138 IP lga15s34-in-f4.1e100.net.http > dhcp-140-247-103-184.fas.harvard.edu.48470: Flags [.], seq 1:1369, ack 413, win 992, options [nop,nop,TS val 2815324705 ecr 9854677], length 1368
21:37:35.377151 IP dhcp-140-247-103-184.fas.harvard.edu.48470 > lga15s34-in-f4.1e100.net.http: Flags [.], ack 1369, win 274, options [nop,nop,TS val 9854678 ecr 2815324705], length 0
21:37:35.377158 IP lga15s34-in-f4.1e100.net.http > dhcp-140-247-103-184.fas.harvard.edu.48470: Flags [.], seq 1369:2737, ack 413, win 992, options [nop,nop,TS val 2815324705 ecr 9854677], length 1368
21:37:35.377162 IP dhcp-140-247-103-184.fas.harvard.edu.48470 > lga15s34-in-f4.1e100.net.http: Flags [.], ack 2737, win 319, options [nop,nop,TS val 9854678 ecr 2815324705], length 0
21:37:35.377167 IP lga15s34-in-f4.1e100.net.http > dhcp-140-247-103-184.fas.harvard.edu.48470: Flags [.], seq 2737:4105, ack 413, win 992, options [nop,nop,TS val 2815324705 ecr 9854677], length 1368
21:37:35.377173 IP dhcp-140-247-103-184.fas.harvard.edu.48470 > lga15s34-in-f4.1e100.net.http: Flags [.], ack 4105, win 364, options [nop,nop,TS val 9854678 ecr 2815324705], length 0
21:37:35.377177 IP lga15s34-in-f4.1e100.net.http > dhcp-140-247-103-184.fas.harvard.edu.48470: Flags [.], seq 4105:5473, ack 413, win 992, options [nop,nop,TS val 2815324705 ecr 9854677], length 1368
21:37:35.377181 IP dhcp-140-247-103-184.fas.harvard.edu.48470 > lga15s34-in-f4.1e100.net.http: Flags [.], ack 5473, win 410, options [nop,nop,TS val 9854678 ecr 2815324705], length 0
21:37:35.377185 IP lga15s34-in-f4.1e100.net.http > dhcp-140-247-103-184.fas.harvard.edu.48470: Flags [.], seq 5473:6841, ack 413, win 992, options [nop,nop,TS val 2815324705 ecr 9854677], length 1368
21:37:35.377189 IP dhcp-140-247-103-184.fas.harvard.edu.48470 > lga15s34-in-f4.1e100.net.http: Flags [.], ack 6841, win 455, options [nop,nop,TS val 9854678 ecr 2815324705], length 0
21:37:35.377193 IP lga15s34-in-f4.1e100.net.http > dhcp-140-247-103-184.fas.harvard.edu.48470: Flags [.], seq 6841:8209, ack 413, win 992, options [nop,nop,TS val 2815324705 ecr 9854677], length 1368
21:37:35.377198 IP dhcp-140-247-103-184.fas.harvard.edu.48470 > lga15s34-in-f4.1e100.net.http: Flags [.], ack 8209, win 500, options [nop,nop,TS val 9854678 ecr 2815324705], length 0
21:37:35.377202 IP lga15s34-in-f4.1e100.net.http > dhcp-140-247-103-184.fas.harvard.edu.48470: Flags [.], seq 8209:9577, ack 413, win 992, options [nop,nop,TS val 2815324705 ecr 9854677], length 1368
21:37:35.377207 IP dhcp-140-247-103-184.fas.harvard.edu.48470 > lga15s34-in-f4.1e100.net.http: Flags [.], ack 9577, win 545, options [nop,nop,TS val 9854678 ecr 2815324705], length 0
21:37:35.377211 IP lga15s34-in-f4.1e100.net.http > dhcp-140-247-103-184.fas.harvard.edu.48470: Flags [.], seq 9577:10945, ack 413, win 992, options [nop,nop,TS val 2815324705 ecr 9854677], length 1368
21:37:35.377215 IP dhcp-140-247-103-184.fas.harvard.edu.48470 > lga15s34-in-f4.1e100.net.http: Flags [.], ack 10945, win 568, options [nop,nop,TS val 9854678 ecr 2815324705], length 0
21:37:35.377219 IP lga15s34-in-f4.1e100.net.http > dhcp-140-247-103-184.fas.harvard.edu.48470: Flags [.], seq 10945:12313, ack 413, win 992, options [nop,nop,TS val 2815324705 ecr 9854677], length 1368
21:37:35.377224 IP dhcp-140-247-103-184.fas.harvard.edu.48470 > lga15s34-in-f4.1e100.net.http: Flags [.], ack 12313, win 554, options [nop,nop,TS val 9854678 ecr 2815324705], length 0
21:37:35.377228 IP lga15s34-in-f4.1e100.net.http > dhcp-140-247-103-184.fas.harvard.edu.48470: Flags [P.], seq 12313:13681, ack 413, win 992, options [nop,nop,TS val 2815324705 ecr 9854677], length 1368
21:37:35.377232 IP dhcp-140-247-103-184.fas.harvard.edu.48470 > lga15s34-in-f4.1e100.net.http: Flags [.], ack 13681, win 539, options [nop,nop,TS val 9854678 ecr 2815324705], length 0
21:37:35.377236 IP lga15s34-in-f4.1e100.net.http > dhcp-140-247-103-184.fas.harvard.edu.48471: Flags [P.], seq 1:1209, ack 433, win 992, options [nop,nop,TS val 2815324705 ecr 9854677], length 1208
21:37:35.377240 IP dhcp-140-247-103-184.fas.harvard.edu.48471 > lga15s34-in-f4.1e100.net.http: Flags [.], ack 1209, win 274, options [nop,nop,TS val 9854678 ecr 2815324705], length 0
21:37:35.381576 IP lga15s34-in-f4.1e100.net.http > dhcp-140-247-103-184.fas.harvard.edu.48478: Flags [.], ack 419, win 992, options [nop,nop,TS val 2815324710 ecr 9854678], length 0
21:37:35.381595 IP lga15s34-in-f4.1e100.net.http > dhcp-140-247-103-184.fas.harvard.edu.48479: Flags [.], ack 392, win 992, options [nop,nop,TS val 2815324710 ecr 9854678], length 0
21:37:35.381948 IP lga15s34-in-f4.1e100.net.http > dhcp-140-247-103-184.fas.harvard.edu.48480: Flags [.], ack 412, win 992, options [nop,nop,TS val 2815324710 ecr 9854678], length 0
21:37:35.381963 IP lga15s34-in-f4.1e100.net.http > dhcp-140-247-103-184.fas.harvard.edu.48478: Flags [.], seq 1:1369, ack 419, win 992, options [nop,nop,TS val 2815324710 ecr 9854678], length 1368
21:37:35.381975 IP dhcp-140-247-103-184.fas.harvard.edu.48478 > lga15s34-in-f4.1e100.net.http: Flags [.], ack 1369, win 274, options [nop,nop,TS val 9854678 ecr 2815324710], length 0
21:37:35.381980 IP lga15s34-in-f4.1e100.net.http > dhcp-140-247-103-184.fas.harvard.edu.48478: Flags [.], seq 1369:2737, ack 419, win 992, options [nop,nop,TS val 2815324710 ecr 9854678], length 1368
21:37:35.381983 IP dhcp-140-247-103-184.fas.harvard.edu.48478 > lga15s34-in-f4.1e100.net.http: Flags [.], ack 2737, win 319, options [nop,nop,TS val 9854678 ecr 2815324710], length 0
21:37:35.381986 IP lga15s34-in-f4.1e100.net.http > dhcp-140-247-103-184.fas.harvard.edu.48478: Flags [.], seq 2737:4105, ack 419, win 992, options [nop,nop,TS val 2815324710 ecr 9854678], length 1368
21:37:35.381989 IP dhcp-140-247-103-184.fas.harvard.edu.48478 > lga15s34-in-f4.1e100.net.http: Flags [.], ack 4105, win 364, options [nop,nop,TS val 9854678 ecr 2815324710], length 0
21:37:35.381992 IP lga15s34-in-f4.1e100.net.http > dhcp-140-247-103-184.fas.harvard.edu.48478: Flags [.], seq 4105:5473, ack 419, win 992, options [nop,nop,TS val 2815324710 ecr 9854678], length 1368
21:37:35.381994 IP dhcp-140-247-103-184.fas.harvard.edu.48478 > lga15s34-in-f4.1e100.net.http: Flags [.], ack 5473, win 410, options [nop,nop,TS val 9854678 ecr 2815324710], length 0
21:37:35.381997 IP lga15s34-in-f4.1e100.net.http > dhcp-140-247-103-184.fas.harvard.edu.48478: Flags [.], seq 5473:6841, ack 419, win 992, options [nop,nop,TS val 2815324710 ecr 9854678], length 1368
21:37:35.382000 IP dhcp-140-247-103-184.fas.harvard.edu.48478 > lga15s34-in-f4.1e100.net.http: Flags [.], ack 6841, win 455, options [nop,nop,TS val 9854678 ecr 2815324710], length 0
21:37:35.382003 IP lga15s34-in-f4.1e100.net.http > dhcp-140-247-103-184.fas.harvard.edu.48478: Flags [.], seq 6841:8209, ack 419, win 992, options [nop,nop,TS val 2815324710 ecr 9854678], length 1368
21:37:35.382005 IP dhcp-140-247-103-184.fas.harvard.edu.48478 > lga15s34-in-f4.1e100.net.http: Flags [.], ack 8209, win 500, options [nop,nop,TS val 9854678 ecr 2815324710], length 0
21:37:35.382008 IP lga15s34-in-f4.1e100.net.http > dhcp-140-247-103-184.fas.harvard.edu.48478: Flags [.], seq 8209:9577, ack 419, win 992, options [nop,nop,TS val 2815324710 ecr 9854678], length 1368
21:37:35.382010 IP dhcp-140-247-103-184.fas.harvard.edu.48478 > lga15s34-in-f4.1e100.net.http: Flags [.], ack 9577, win 545, options [nop,nop,TS val 9854678 ecr 2815324710], length 0
21:37:35.382013 IP lga15s34-in-f4.1e100.net.http > dhcp-140-247-103-184.fas.harvard.edu.48478: Flags [.], seq 9577:10945, ack 419, win 992, options [nop,nop,TS val 2815324710 ecr 9854678], length 1368
21:37:35.382015 IP dhcp-140-247-103-184.fas.harvard.edu.48478 > lga15s34-in-f4.1e100.net.http: Flags [.], ack 10945, win 568, options [nop,nop,TS val 9854678 ecr 2815324710], length 0
21:37:35.382018 IP lga15s34-in-f4.1e100.net.http > dhcp-140-247-103-184.fas.harvard.edu.48478: Flags [.], seq 10945:12313, ack 419, win 992, options [nop,nop,TS val 2815324710 ecr 9854678], length 1368
21:37:35.382020 IP dhcp-140-247-103-184.fas.harvard.edu.48478 > lga15s34-in-f4.1e100.net.http: Flags [.], ack 12313, win 554, options [nop,nop,TS val 9854678 ecr 2815324710], length 0
21:37:35.382023 IP lga15s34-in-f4.1e100.net.http > dhcp-140-247-103-184.fas.harvard.edu.48478: Flags [P.], seq 12313:13681, ack 419, win 992, options [nop,nop,TS val 2815324710 ecr 9854678], length 1368
21:37:35.382026 IP dhcp-140-247-103-184.fas.harvard.edu.48478 > lga15s34-in-f4.1e100.net.http: Flags [.], ack 13681, win 539, options [nop,nop,TS val 9854678 ecr 2815324710], length 0
21:37:35.382409 IP lga15s34-in-f4.1e100.net.http > dhcp-140-247-103-184.fas.harvard.edu.48469: Flags [.], seq 13681:15049, ack 413, win 992, options [nop,nop,TS val 2815324710 ecr 9854678], length 1368
21:37:35.382431 IP dhcp-140-247-103-184.fas.harvard.edu.48469 > lga15s34-in-f4.1e100.net.http: Flags [.], ack 15049, win 636, options [nop,nop,TS val 9854678 ecr 2815324710], length 0
21:37:35.382440 IP lga15s34-in-f4.1e100.net.http > dhcp-140-247-103-184.fas.harvard.edu.48480: Flags [.], seq 1:1369, ack 412, win 992, options [nop,nop,TS val 2815324710 ecr 9854678], length 1368
21:37:35.382446 IP dhcp-140-247-103-184.fas.harvard.edu.48480 > lga15s34-in-f4.1e100.net.http: Flags [.], ack 1369, win 274, options [nop,nop,TS val 9854678 ecr 2815324710], length 0
21:37:35.382452 IP lga15s34-in-f4.1e100.net.http > dhcp-140-247-103-184.fas.harvard.edu.48480: Flags [.], seq 1369:2737, ack 412, win 992, options [nop,nop,TS val 2815324710 ecr 9854678], length 1368
21:37:35.382456 IP dhcp-140-247-103-184.fas.harvard.edu.48480 > lga15s34-in-f4.1e100.net.http: Flags [.], ack 2737, win 319, options [nop,nop,TS val 9854678 ecr 2815324710], length 0
21:37:35.382461 IP lga15s34-in-f4.1e100.net.http > dhcp-140-247-103-184.fas.harvard.edu.48480: Flags [.], seq 2737:4105, ack 412, win 992, options [nop,nop,TS val 2815324710 ecr 9854678], length 1368
21:37:35.382466 IP dhcp-140-247-103-184.fas.harvard.edu.48480 > lga15s34-in-f4.1e100.net.http: Flags [.], ack 4105, win 364, options [nop,nop,TS val 9854678 ecr 2815324710], length 0
21:37:35.382471 IP lga15s34-in-f4.1e100.net.http > dhcp-140-247-103-184.fas.harvard.edu.48480: Flags [.], seq 4105:5473, ack 412, win 992, options [nop,nop,TS val 2815324710 ecr 9854678], length 1368
21:37:35.382475 IP dhcp-140-247-103-184.fas.harvard.edu.48480 > lga15s34-in-f4.1e100.net.http: Flags [.], ack 5473, win 410, options [nop,nop,TS val 9854678 ecr 2815324710], length 0
21:37:35.382479 IP lga15s34-in-f4.1e100.net.http > dhcp-140-247-103-184.fas.harvard.edu.48480: Flags [.], seq 5473:6841, ack 412, win 992, options [nop,nop,TS val 2815324710 ecr 9854678], length 1368
21:37:35.382483 IP dhcp-140-247-103-184.fas.harvard.edu.48480 > lga15s34-in-f4.1e100.net.http: Flags [.], ack 6841, win 455, options [nop,nop,TS val 9854678 ecr 2815324710], length 0
21:37:35.382487 IP lga15s34-in-f4.1e100.net.http > dhcp-140-247-103-184.fas.harvard.edu.48480: Flags [.], seq 6841:8209, ack 412, win 992, options [nop,nop,TS val 2815324710 ecr 9854678], length 1368
21:37:35.382491 IP dhcp-140-247-103-184.fas.harvard.edu.48480 > lga15s34-in-f4.1e100.net.http: Flags [.], ack 8209, win 500, options [nop,nop,TS val 9854678 ecr 2815324710], length 0
21:37:35.382494 IP lga15s34-in-f4.1e100.net.http > dhcp-140-247-103-184.fas.harvard.edu.48480: Flags [.], seq 8209:9577, ack 412, win 992, options [nop,nop,TS val 2815324710 ecr 9854678], length 1368
21:37:35.382499 IP dhcp-140-247-103-184.fas.harvard.edu.48480 > lga15s34-in-f4.1e100.net.http: Flags [.], ack 9577, win 545, options [nop,nop,TS val 9854678 ecr 2815324710], length 0
21:37:35.382504 IP lga15s34-in-f4.1e100.net.http > dhcp-140-247-103-184.fas.harvard.edu.48480: Flags [.], seq 9577:10945, ack 412, win 992, options [nop,nop,TS val 2815324710 ecr 9854678], length 1368
21:37:35.382508 IP dhcp-140-247-103-184.fas.harvard.edu.48480 > lga15s34-in-f4.1e100.net.http: Flags [.], ack 10945, win 568, options [nop,nop,TS val 9854678 ecr 2815324710], length 0
21:37:35.382512 IP lga15s34-in-f4.1e100.net.http > dhcp-140-247-103-184.fas.harvard.edu.48469: Flags [.], seq 15049:16417, ack 413, win 992, options [nop,nop,TS val 2815324710 ecr 9854678], length 1368
21:37:35.382516 IP dhcp-140-247-103-184.fas.harvard.edu.48469 > lga15s34-in-f4.1e100.net.http: Flags [.], ack 16417, win 654, options [nop,nop,TS val 9854678 ecr 2815324710], length 0
21:37:35.382520 IP lga15s34-in-f4.1e100.net.http > dhcp-140-247-103-184.fas.harvard.edu.48469: Flags [.], seq 16417:17785, ack 413, win 992, options [nop,nop,TS val 2815324711 ecr 9854678], length 1368
21:37:35.382524 IP dhcp-140-247-103-184.fas.harvard.edu.48469 > lga15s34-in-f4.1e100.net.http: Flags [.], ack 17785, win 640, options [nop,nop,TS val 9854678 ecr 2815324711], length 0
21:37:35.382528 IP lga15s34-in-f4.1e100.net.http > dhcp-140-247-103-184.fas.harvard.edu.48480: Flags [P.], seq 10945:12022, ack 412, win 992, options [nop,nop,TS val 2815324710 ecr 9854678], length 1077
21:37:35.382532 IP dhcp-140-247-103-184.fas.harvard.edu.48480 > lga15s34-in-f4.1e100.net.http: Flags [.], ack 12022, win 554, options [nop,nop,TS val 9854678 ecr 2815324710], length 0
21:37:35.382536 IP lga15s34-in-f4.1e100.net.http > dhcp-140-247-103-184.fas.harvard.edu.48469: Flags [.], seq 17785:19153, ack 413, win 992, options [nop,nop,TS val 2815324711 ecr 9854678], length 1368
21:37:35.382540 IP dhcp-140-247-103-184.fas.harvard.edu.48469 > lga15s34-in-f4.1e100.net.http: Flags [.], ack 19153, win 626, options [nop,nop,TS val 9854678 ecr 2815324711], length 0
21:37:35.382544 IP lga15s34-in-f4.1e100.net.http > dhcp-140-247-103-184.fas.harvard.edu.48469: Flags [.], seq 19153:20521, ack 413, win 992, options [nop,nop,TS val 2815324711 ecr 9854678], length 1368
