19:00:14.216763 IP 173.194.53.166.http > ThinkPad.39462: Flags [.], seq 1877408060:1877409440, ack 2440793038, win 274, length 1380
19:00:14.216807 IP ThinkPad.39462 > 173.194.53.166.http: Flags [.], ack 1380, win 4054, length 0
19:00:14.218073 IP 173.194.53.166.http > ThinkPad.39462: Flags [.], seq 1380:2760, ack 1, win 274, length 1380
19:00:14.218090 IP ThinkPad.39462 > 173.194.53.166.http: Flags [.], ack 2760, win 4054, length 0
19:00:14.218115 IP 173.194.53.166.http > ThinkPad.39462: Flags [.], seq 2760:4140, ack 1, win 274, length 1380
19:00:14.218128 IP ThinkPad.39462 > 173.194.53.166.http: Flags [.], ack 4140, win 4054, length 0
19:00:14.220456 IP 173.194.53.166.http > ThinkPad.39462: Flags [.], seq 4140:5520, ack 1, win 274, length 1380
19:00:14.220472 IP ThinkPad.39462 > 173.194.53.166.http: Flags [.], ack 5520, win 4054, length 0
19:00:14.220498 IP 173.194.53.166.http > ThinkPad.39462: Flags [.], seq 5520:6900, ack 1, win 274, length 1380
19:00:14.220509 IP ThinkPad.39462 > 173.194.53.166.http: Flags [.], ack 6900, win 4054, length 0
19:00:14.220528 IP 173.194.53.166.http > ThinkPad.39462: Flags [.], seq 6900:8280, ack 1, win 274, length 1380
19:00:14.220540 IP ThinkPad.39462 > 173.194.53.166.http: Flags [.], ack 8280, win 4054, length 0
19:00:14.220557 IP 173.194.53.166.http > ThinkPad.39462: Flags [.], seq 8280:9660, ack 1, win 274, length 1380
19:00:14.220566 IP ThinkPad.39462 > 173.194.53.166.http: Flags [.], ack 9660, win 4054, length 0
19:00:14.220580 IP 173.194.53.166.http > ThinkPad.39462: Flags [.], seq 9660:11040, ack 1, win 274, length 1380
19:00:14.220588 IP ThinkPad.39462 > 173.194.53.166.http: Flags [.], ack 11040, win 4054, length 0
19:00:14.220599 IP 173.194.53.166.http > ThinkPad.39462: Flags [.], seq 11040:12420, ack 1, win 274, length 1380
19:00:14.220606 IP ThinkPad.39462 > 173.194.53.166.http: Flags [.], ack 12420, win 4054, length 0
19:00:14.220617 IP 173.194.53.166.http > ThinkPad.39462: Flags [.], seq 12420:13800, ack 1, win 274, length 1380
19:00:14.220625 IP ThinkPad.39462 > 173.194.53.166.http: Flags [.], ack 13800, win 4054, length 0
19:00:14.220636 IP 173.194.53.166.http > ThinkPad.39462: Flags [.], seq 13800:15180, ack 1, win 274, length 1380
19:00:14.220643 IP ThinkPad.39462 > 173.194.53.166.http: Flags [.], ack 15180, win 4054, length 0
19:00:14.220654 IP 173.194.53.166.http > ThinkPad.39462: Flags [.], seq 15180:16560, ack 1, win 274, length 1380
19:00:14.220661 IP ThinkPad.39462 > 173.194.53.166.http: Flags [.], ack 16560, win 4054, length 0
19:00:14.220672 IP 173.194.53.166.http > ThinkPad.39462: Flags [.], seq 16560:17940, ack 1, win 274, length 1380
19:00:14.220679 IP ThinkPad.39462 > 173.194.53.166.http: Flags [.], ack 17940, win 4054, length 0
19:00:14.220690 IP 173.194.53.166.http > ThinkPad.39462: Flags [.], seq 17940:19320, ack 1, win 274, length 1380
19:00:14.220697 IP ThinkPad.39462 > 173.194.53.166.http: Flags [.], ack 19320, win 4047, length 0
19:00:14.220708 IP 173.194.53.166.http > ThinkPad.39462: Flags [.], seq 19320:20700, ack 1, win 274, length 1380
19:00:14.220714 IP ThinkPad.39462 > 173.194.53.166.http: Flags [.], ack 20700, win 4032, length 0
19:00:14.220725 IP 173.194.53.166.http > ThinkPad.39462: Flags [.], seq 20700:22080, ack 1, win 274, length 1380
19:00:17.996690 IP 173.194.53.166.http > ThinkPad.39462: Flags [.], seq 262144:263524, ack 1, win 274, length 1380
19:00:17.996745 IP ThinkPad.39462 > 173.194.53.166.http: Flags [.], ack 263524, win 4054, length 0
19:00:17.996778 IP 173.194.53.166.http > ThinkPad.39462: Flags [.], seq 263524:264904, ack 1, win 274, length 1380
19:00:17.996791 IP ThinkPad.39462 > 173.194.53.166.http: Flags [.], ack 264904, win 4054, length 0
19:00:17.996809 IP 173.194.53.166.http > ThinkPad.39462: Flags [.], seq 264904:266284, ack 1, win 274, length 1380
19:00:17.996822 IP ThinkPad.39462 > 173.194.53.166.http: Flags [.], ack 266284, win 4054, length 0
19:00:17.996839 IP 173.194.53.166.http > ThinkPad.39462: Flags [.], seq 266284:267664, ack 1, win 274, length 1380
19:00:17.996851 IP ThinkPad.39462 > 173.194.53.166.http: Flags [.], ack 267664, win 4054, length 0
19:00:17.996868 IP 173.194.53.166.http > ThinkPad.39462: Flags [.], seq 267664:269044, ack 1, win 274, length 1380
19:00:17.996880 IP ThinkPad.39462 > 173.194.53.166.http: Flags [.], ack 269044, win 4054, length 0
19:00:17.996896 IP 173.194.53.166.http > ThinkPad.39462: Flags [.], seq 269044:270424, ack 1, win 274, length 1380
19:00:17.996909 IP ThinkPad.39462 > 173.194.53.166.http: Flags [.], ack 270424, win 4054, length 0
19:00:17.996927 IP 173.194.53.166.http > ThinkPad.39462: Flags [.], seq 270424:271804, ack 1, win 274, length 1380
19:00:17.996940 IP ThinkPad.39462 > 173.194.53.166.http: Flags [.], ack 271804, win 4054, length 0
19:00:17.996957 IP 173.194.53.166.http > ThinkPad.39462: Flags [.], seq 271804:273184, ack 1, win 274, length 1380
19:00:17.996968 IP ThinkPad.39462 > 173.194.53.166.http: Flags [.], ack 273184, win 4054, length 0
19:00:17.996985 IP 173.194.53.166.http > ThinkPad.39462: Flags [.], seq 273184:274564, ack 1, win 274, length 1380
19:00:17.996997 IP ThinkPad.39462 > 173.194.53.166.http: Flags [.], ack 274564, win 4054, length 0
19:00:17.997014 IP 173.194.53.166.http > ThinkPad.39462: Flags [.], seq 274564:275944, ack 1, win 274, length 1380
19:00:17.997025 IP ThinkPad.39462 > 173.194.53.166.http: Flags [.], ack 275944, win 4054, length 0
19:00:17.997043 IP 173.194.53.166.http > ThinkPad.39462: Flags [.], seq 275944:277324, ack 1, win 274, length 1380
19:00:17.997054 IP ThinkPad.39462 > 173.194.53.166.http: Flags [.], ack 277324, win 4047, length 0
19:00:17.997071 IP 173.194.53.166.http > ThinkPad.39462: Flags [.], seq 277324:278704, ack 1, win 274, length 1380
19:00:17.997082 IP ThinkPad.39462 > 173.194.53.166.http: Flags [.], ack 278704, win 4032, length 0
19:00:17.997099 IP 173.194.53.166.http > ThinkPad.39462: Flags [.], seq 278704:280084, ack 1, win 274, length 1380
19:00:17.997111 IP ThinkPad.39462 > 173.194.53.166.http: Flags [.], ack 280084, win 4018, length 0
19:00:17.997129 IP 173.194.53.166.http > ThinkPad.39462: Flags [.], seq 280084:281464, ack 1, win 274, length 1380
19:00:17.997139 IP ThinkPad.39462 > 173.194.53.166.http: Flags [.], ack 281464, win 4003, length 0
19:00:17.997157 IP 173.194.53.166.http > ThinkPad.39462: Flags [.], seq 281464:282844, ack 1, win 274, length 1380
19:00:17.997167 IP ThinkPad.39462 > 173.194.53.166.http: Flags [.], ack 282844, win 3988, length 0
19:00:17.997184 IP 173.194.53.166.http > ThinkPad.39462: Flags [.], seq 282844:284224, ack 1, win 274, length 1380
19:00:17.998880 IP 173.194.53.166.http > ThinkPad.39462: Flags [.], seq 284224:285604, ack 1, win 274, length 1380
19:00:17.998914 IP 173.194.53.166.http > ThinkPad.39462: Flags [.], seq 285604:286984, ack 1, win 274, length 1380
19:00:17.998930 IP ThinkPad.39462 > 173.194.53.166.http: Flags [.], ack 286984, win 4054, length 0
19:00:17.998956 IP 173.194.53.166.http > ThinkPad.39462: Flags [.], seq 286984:288364, ack 1, win 274, length 1380
19:00:17.998978 IP 173.194.53.166.http > ThinkPad.39462: Flags [.], seq 288364:289744, ack 1, win 274, length 1380
19:00:17.998990 IP ThinkPad.39462 > 173.194.53.166.http: Flags [.], ack 289744, win 4054, length 0
19:00:17.999007 IP 173.194.53.166.http > ThinkPad.39462: Flags [.], seq 289744:291124, ack 1, win 274, length 1380
19:00:17.999021 IP 173.194.53.166.http > ThinkPad.39462: Flags [.], seq 291124:292504, ack 1, win 274, length 1380
19:00:17.999031 IP ThinkPad.39462 > 173.194.53.166.http: Flags [.], ack 292504, win 4054, length 0
19:00:17.999046 IP 173.194.53.166.http > ThinkPad.39462: Flags [.], seq 292504:293884, ack 1, win 274, length 1380
19:00:17.999063 IP 173.194.53.166.http > ThinkPad.39462: Flags [.], seq 293884:295264, ack 1, win 274, length 1380
19:00:17.999078 IP 173.194.53.166.http > ThinkPad.39462: Flags [.], seq 295264:296644, ack 1, win 274, length 1380
19:00:17.999084 IP ThinkPad.39462 > 173.194.53.166.http: Flags [.], ack 295264, win 4054, length 0
19:00:18.001238 IP 173.194.53.166.http > ThinkPad.39462: Flags [.], seq 296644:298024, ack 1, win 274, length 1380
19:00:18.001272 IP ThinkPad.39462 > 173.194.53.166.http: Flags [.], ack 298024, win 4054, length 0
19:00:18.001305 IP 173.194.53.166.http > ThinkPad.39462: Flags [.], seq 298024:299404, ack 1, win 274, length 1380
19:00:18.001326 IP 173.194.53.166.http > ThinkPad.39462: Flags [.], seq 299404:300784, ack 1, win 274, length 1380
19:00:18.001340 IP 173.194.53.166.http > ThinkPad.39462: Flags [.], seq 300784:302164, ack 1, win 274, length 1380
19:00:18.001342 IP ThinkPad.39462 > 173.194.53.166.http: Flags [.], ack 300784, win 4054, length 0
19:00:18.001352 IP 173.194.53.166.http > ThinkPad.39462: Flags [.], seq 302164:303544, ack 1, win 274, length 1380
19:00:18.001362 IP ThinkPad.39462 > 173.194.53.166.http: Flags [.], ack 303544, win 4054, length 0
19:00:18.001365 IP 173.194.53.166.http > ThinkPad.39462: Flags [.], seq 303544:304924, ack 1, win 274, length 1380
19:00:18.001377 IP 173.194.53.166.http > ThinkPad.39462: Flags [.], seq 304924:306304, ack 1, win 274, length 1380
19:00:18.001386 IP ThinkPad.39462 > 173.194.53.166.http: Flags [.], ack 306304, win 4054, length 0
19:00:18.001404 IP 173.194.53.166.http > ThinkPad.39462: Flags [.], seq 306304:307684, ack 1, win 274, length 1380
19:00:18.001419 IP 173.194.53.166.http > ThinkPad.39462: Flags [.], seq 307684:309064, ack 1, win 274, length 1380
19:00:18.001429 IP ThinkPad.39462 > 173.194.53.166.http: Flags [.], ack 309064, win 4054, length 0
19:00:18.001446 IP 173.194.53.166.http > ThinkPad.39462: Flags [.], seq 309064:310444, ack 1, win 274, length 1380
19:00:18.001459 IP 173.194.53.166.http > ThinkPad.39462: Flags [.], seq 310444:311824, ack 1, win 274, length 1380
19:00:18.001469 IP ThinkPad.39462 > 173.194.53.166.http: Flags [.], ack 311824, win 4054, length 0
19:00:18.001485 IP 173.194.53.166.http > ThinkPad.39462: Flags [.], seq 311824:313204, ack 1, win 274, length 1380
19:00:18.001498 IP 173.194.53.166.http > ThinkPad.39462: Flags [.], seq 313204:314584, ack 1, win 274, length 1380
19:00:18.001510 IP 173.194.53.166.http > ThinkPad.39462: Flags [.], seq 314584:315964, ack 1, win 274, length 1380
19:00:18.001523 IP 173.194.53.166.http > ThinkPad.39462: Flags [.], seq 315964:317344, ack 1, win 274, length 1380
19:00:18.001529 IP ThinkPad.39462 > 173.194.53.166.http: Flags [.], ack 314584, win 4054, length 0
19:00:18.001535 IP 173.194.53.166.http > ThinkPad.39462: Flags [P.], seq 327004:327680, ack 1, win 274, length 676
19:00:18.001546 IP ThinkPad.39462 > 173.194.53.166.http: Flags [.], ack 317344, win 4054, length 0
19:00:18.001562 IP ThinkPad.39462 > 173.194.53.166.http: Flags [.], ack 317344, win 4054, options [nop,nop,sack 1 {327004:327680}], length 0
19:00:18.003809 IP 173.194.53.166.http > ThinkPad.39462: Flags [.], seq 317344:318724, ack 1, win 274, length 1380
19:00:18.003832 IP ThinkPad.39462 > 173.194.53.166.http: Flags [.], ack 318724, win 4054, options [nop,nop,sack 1 {327004:327680}], length 0
19:00:18.003853 IP 173.194.53.166.http > ThinkPad.39462: Flags [.], seq 318724:320104, ack 1, win 274, length 1380
19:00:18.003865 IP ThinkPad.39462 > 173.194.53.166.http: Flags [.], ack 320104, win 4054, options [nop,nop,sack 1 {327004:327680}], length 0
19:00:18.003883 IP 173.194.53.166.http > ThinkPad.39462: Flags [.], seq 320104:321484, ack 1, win 274, length 1380
19:00:18.003895 IP ThinkPad.39462 > 173.194.53.166.http: Flags [.], ack 321484, win 4054, options [nop,nop,sack 1 {327004:327680}], length 0
19:00:18.003912 IP 173.194.53.166.http > ThinkPad.39462: Flags [.], seq 321484:322864, ack 1, win 274, length 1380
19:00:18.003923 IP ThinkPad.39462 > 173.194.53.166.http: Flags [.], ack 322864, win 4054, options [nop,nop,sack 1 {327004:327680}], length 0
19:00:18.003936 IP 173.194.53.166.http > ThinkPad.39462: Flags [.], seq 322864:324244, ack 1, win 274, length 1380
19:00:18.003944 IP ThinkPad.39462 > 173.194.53.166.http: Flags [.], ack 324244, win 4054, options [nop,nop,sack 1 {327004:327680}], length 0
19:00:18.003954 IP 173.194.53.166.http > ThinkPad.39462: Flags [.], seq 324244:325624, ack 1, win 274, length 1380
19:00:18.003962 IP ThinkPad.39462 > 173.194.53.166.http: Flags [.], ack 325624, win 4054, options [nop,nop,sack 1 {327004:327680}], length 0
19:00:18.003973 IP 173.194.53.166.http > ThinkPad.39462: Flags [.], seq 325624:327004, ack 1, win 274, length 1380
19:00:18.003981 IP ThinkPad.39462 > 173.194.53.166.http: Flags [.], ack 327680, win 4054, length 0
19:00:18.841139 IP ThinkPad.35495 > lga15s35-in-f9.1e100.net.http: Flags [S], seq 37992541, win 14600, options [mss 1460,sackOK,TS val 70196100 ecr 0,nop,wscale 6], length 0
19:00:18.851152 IP lga15s35-in-f9.1e100.net.http > ThinkPad.35495: Flags [S.], seq 2383994064, ack 37992542, win 62392, options [mss 1380,sackOK,TS val 2200065758 ecr 70196100,nop,wscale 6], length 0
19:00:18.851184 IP ThinkPad.35495 > lga15s35-in-f9.1e100.net.http: Flags [.], ack 1, win 229, options [nop,nop,TS val 70196101 ecr 2200065758], length 0
19:00:18.851565 IP ThinkPad.35495 > lga15s35-in-f9.1e100.net.http: Flags [.], seq 1:1369, ack 1, win 229, options [nop,nop,TS val 70196102 ecr 2200065758], length 1368
19:00:18.851589 IP ThinkPad.35495 > lga15s35-in-f9.1e100.net.http: Flags [P.], seq 1369:1971, ack 1, win 229, options [nop,nop,TS val 70196102 ecr 2200065758], length 602
19:00:18.863535 IP lga15s35-in-f9.1e100.net.http > ThinkPad.35495: Flags [.], ack 1971, win 954, options [nop,nop,TS val 2200065770 ecr 70196102], length 0
19:00:18.881983 IP lga15s35-in-f9.1e100.net.http > ThinkPad.35495: Flags [P.], seq 1:347, ack 1971, win 975, options [nop,nop,TS val 2200065788 ecr 70196102], length 346
19:00:18.882021 IP ThinkPad.35495 > lga15s35-in-f9.1e100.net.http: Flags [.], ack 347, win 245, options [nop,nop,TS val 70196105 ecr 2200065788], length 0
19:00:18.945472 IP 173.194.53.166.http > ThinkPad.39462: Flags [.], seq 327680:329060, ack 1, win 274, length 1380
19:00:18.945515 IP ThinkPad.39462 > 173.194.53.166.http: Flags [.], ack 329060, win 4054, length 0
19:00:18.945545 IP 173.194.53.166.http > ThinkPad.39462: Flags [.], seq 329060:330440, ack 1, win 274, length 1380
19:00:18.945557 IP ThinkPad.39462 > 173.194.53.166.http: Flags [.], ack 330440, win 4054, length 0
19:00:18.945576 IP 173.194.53.166.http > ThinkPad.39462: Flags [.], seq 330440:331820, ack 1, win 274, length 1380
19:00:18.945587 IP ThinkPad.39462 > 173.194.53.166.http: Flags [.], ack 331820, win 4054, length 0
19:00:18.945602 IP 173.194.53.166.http > ThinkPad.39462: Flags [.], seq 331820:333200, ack 1, win 274, length 1380
19:00:18.945610 IP ThinkPad.39462 > 173.194.53.166.http: Flags [.], ack 333200, win 4054, length 0
19:00:18.945622 IP 173.194.53.166.http > ThinkPad.39462: Flags [.], seq 333200:334580, ack 1, win 274, length 1380
19:00:18.945630 IP ThinkPad.39462 > 173.194.53.166.http: Flags [.], ack 334580, win 4054, length 0
19:00:18.945641 IP 173.194.53.166.http > ThinkPad.39462: Flags [.], seq 334580:335960, ack 1, win 274, length 1380
19:00:18.945647 IP ThinkPad.39462 > 173.194.53.166.http: Flags [.], ack 335960, win 4054, length 0
19:00:18.945659 IP 173.194.53.166.http > ThinkPad.39462: Flags [.], seq 335960:337340, ack 1, win 274, length 1380
19:00:18.945667 IP ThinkPad.39462 > 173.194.53.166.http: Flags [.], ack 337340, win 4054, length 0
19:00:18.945678 IP 173.194.53.166.http > ThinkPad.39462: Flags [.], seq 337340:338720, ack 1, win 274, length 1380
19:00:18.945685 IP ThinkPad.39462 > 173.194.53.166.http: Flags [.], ack 338720, win 4054, length 0
19:00:18.945697 IP 173.194.53.166.http > ThinkPad.39462: Flags [.], seq 338720:340100, ack 1, win 274, length 1380
19:00:18.945705 IP ThinkPad.39462 > 173.194.53.166.http: Flags [.], ack 340100, win 4054, length 0
19:00:18.945717 IP 173.194.53.166.http > ThinkPad.39462: Flags [.], seq 340100:341480, ack 1, win 274, length 1380
19:00:18.945724 IP ThinkPad.39462 > 173.194.53.166.http: Flags [.], ack 341480, win 4054, length 0
19:00:18.945736 IP 173.194.53.166.http > ThinkPad.39462: Flags [.], seq 341480:342860, ack 1, win 274, length 1380
19:00:18.945744 IP ThinkPad.39462 > 173.194.53.166.http: Flags [.], ack 342860, win 4047, length 0
19:00:18.945756 IP 173.194.53.166.http > ThinkPad.39462: Flags [.], seq 342860:344240, ack 1, win 274, length 1380
19:00:18.945763 IP ThinkPad.39462 > 173.194.53.166.http: Flags [.], ack 344240, win 4032, length 0
19:00:18.945774 IP 173.194.53.166.http > ThinkPad.39462: Flags [.], seq 344240:345620, ack 1, win 274, length 1380
19:00:18.945782 IP ThinkPad.39462 > 173.194.53.166.http: Flags [.], ack 345620, win 4018, length 0
19:00:18.945793 IP 173.194.53.166.http > ThinkPad.39462: Flags [.], seq 345620:347000, ack 1, win 274, length 1380
19:00:18.945800 IP ThinkPad.39462 > 173.194.53.166.http: Flags [.], ack 347000, win 4003, length 0
19:00:18.945811 IP 173.194.53.166.http > ThinkPad.39462: Flags [.], seq 347000:348380, ack 1, win 274, length 1380
19:00:18.945818 IP ThinkPad.39462 > 173.194.53.166.http: Flags [.], ack 348380, win 3988, length 0
19:00:18.945829 IP 173.194.53.166.http > ThinkPad.39462: Flags [.], seq 348380:349760, ack 1, win 274, length 1380
19:00:18.947731 IP 173.194.53.166.http > ThinkPad.39462: Flags [.], seq 351140:352520, ack 1, win 274, length 1380
19:00:18.947762 IP ThinkPad.39462 > 173.194.53.166.http: Flags [.], ack 352520, win 4054, length 0
19:00:18.947795 IP 173.194.53.166.http > ThinkPad.39462: Flags [.], seq 352520:353900, ack 1, win 274, length 1380
19:00:18.947815 IP 173.194.53.166.http > ThinkPad.39462: Flags [.], seq 353900:355280, ack 1, win 274, length 1380
19:00:18.947826 IP ThinkPad.39462 > 173.194.53.166.http: Flags [.], ack 355280, win 4054, length 0
19:00:18.947843 IP 173.194.53.166.http > ThinkPad.39462: Flags [.], seq 355280:356660, ack 1, win 274, length 1380
19:00:18.947854 IP 173.194.53.166.http > ThinkPad.39462: Flags [.], seq 356660:358040, ack 1, win 274, length 1380
19:00:18.947861 IP ThinkPad.39462 > 173.194.53.166.http: Flags [.], ack 358040, win 4054, length 0
19:00:18.952947 IP 173.194.53.166.http > ThinkPad.39462: Flags [.], seq 358040:359420, ack 1, win 274, length 1380
19:00:18.952969 IP 173.194.53.166.http > ThinkPad.39462: Flags [.], seq 359420:360800, ack 1, win 274, length 1380
19:00:18.952981 IP ThinkPad.39462 > 173.194.53.166.http: Flags [.], ack 360800, win 4054, length 0
19:00:18.952997 IP 173.194.53.166.http > ThinkPad.39462: Flags [.], seq 360800:362180, ack 1, win 274, length 1380
19:00:18.953012 IP 173.194.53.166.http > ThinkPad.39462: Flags [.], seq 362180:363560, ack 1, win 274, length 1380
19:00:18.953022 IP ThinkPad.39462 > 173.194.53.166.http: Flags [.], ack 363560, win 4054, length 0
19:00:18.953040 IP 173.194.53.166.http > ThinkPad.39462: Flags [.], seq 363560:364940, ack 1, win 274, length 1380
19:00:18.953054 IP 173.194.53.166.http > ThinkPad.39462: Flags [.], seq 364940:366320, ack 1, win 274, length 1380
19:00:18.953063 IP ThinkPad.39462 > 173.194.53.166.http: Flags [.], ack 366320, win 4054, length 0
19:00:18.953077 IP 173.194.53.166.http > ThinkPad.39462: Flags [P.], seq 392540:393216, ack 1, win 274, length 676
19:00:18.953087 IP ThinkPad.39462 > 173.194.53.166.http: Flags [.], ack 366320, win 4054, options [nop,nop,sack 1 {392540:393216}], length 0
19:00:18.953098 IP 173.194.53.166.http > ThinkPad.39462: Flags [.], seq 366320:367700, ack 1, win 274, length 1380
19:00:18.953106 IP 173.194.53.166.http > ThinkPad.39462: Flags [.], seq 367700:369080, ack 1, win 274, length 1380
19:00:18.953114 IP 173.194.53.166.http > ThinkPad.39462: Flags [.], seq 369080:370460, ack 1, win 274, length 1380
19:00:18.953115 IP ThinkPad.39462 > 173.194.53.166.http: Flags [.], ack 367700, win 4054, options [nop,nop,sack 1 {392540:393216}], length 0
19:00:18.953122 IP 173.194.53.166.http > ThinkPad.39462: Flags [.], seq 370460:371840, ack 1, win 274, length 1380
19:00:18.953130 IP 173.194.53.166.http > ThinkPad.39462: Flags [.], seq 371840:373220, ack 1, win 274, length 1380
19:00:18.953138 IP 173.194.53.166.http > ThinkPad.39462: Flags [.], seq 373220:374600, ack 1, win 274, length 1380
19:00:18.953140 IP ThinkPad.39462 > 173.194.53.166.http: Flags [.], ack 369080, win 4054, options [nop,nop,sack 1 {392540:393216}], length 0
19:00:18.953145 IP 173.194.53.166.http > ThinkPad.39462: Flags [.], seq 374600:375980, ack 1, win 274, length 1380
19:00:18.953153 IP 173.194.53.166.http > ThinkPad.39462: Flags [.], seq 375980:377360, ack 1, win 274, length 1380
19:00:18.953160 IP ThinkPad.39462 > 173.194.53.166.http: Flags [.], ack 370460, win 4054, options [nop,nop,sack 1 {392540:393216}], length 0
19:00:18.953161 IP 173.194.53.166.http > ThinkPad.39462: Flags [.], seq 377360:378740, ack 1, win 274, length 1380
19:00:18.953168 IP 173.194.53.166.http > ThinkPad.39462: Flags [.], seq 378740:380120, ack 1, win 274, length 1380
19:00:18.953175 IP 173.194.53.166.http > ThinkPad.39462: Flags [.], seq 380120:381500, ack 1, win 274, length 1380
19:00:18.953176 IP ThinkPad.39462 > 173.194.53.166.http: Flags [.], ack 371840, win 4054, options [nop,nop,sack 1 {392540:393216}], length 0
19:00:18.953183 IP 173.194.53.166.http > ThinkPad.39462: Flags [.], seq 381500:382880, ack 1, win 274, length 1380
19:00:18.953190 IP ThinkPad.39462 > 173.194.53.166.http: Flags [.], ack 373220, win 4054, options [nop,nop,sack 1 {392540:393216}], length 0
19:00:18.953202 IP ThinkPad.39462 > 173.194.53.166.http: Flags [.], ack 374600, win 4054, options [nop,nop,sack 1 {392540:393216}], length 0
19:00:18.953214 IP ThinkPad.39462 > 173.194.53.166.http: Flags [.], ack 375980, win 4054, options [nop,nop,sack 1 {392540:393216}], length 0
19:00:18.953225 IP ThinkPad.39462 > 173.194.53.166.http: Flags [.], ack 377360, win 4054, options [nop,nop,sack 1 {392540:393216}], length 0
19:00:18.953237 IP ThinkPad.39462 > 173.194.53.166.http: Flags [.], ack 378740, win 4054, options [nop,nop,sack 1 {392540:393216}], length 0
19:00:18.953249 IP ThinkPad.39462 > 173.194.53.166.http: Flags [.], ack 380120, win 4053, options [nop,nop,sack 1 {392540:393216}], length 0
19:00:18.953261 IP ThinkPad.39462 > 173.194.53.166.http: Flags [.], ack 381500, win 4038, options [nop,nop,sack 1 {392540:393216}], length 0
19:00:18.953274 IP ThinkPad.39462 > 173.194.53.166.http: Flags [.], ack 382880, win 4023, options [nop,nop,sack 1 {392540:393216}], length 0
19:00:18.955155 IP 173.194.53.166.http > ThinkPad.39462: Flags [.], seq 382880:384260, ack 1, win 274, length 1380
19:00:18.955175 IP ThinkPad.39462 > 173.194.53.166.http: Flags [.], ack 384260, win 4054, options [nop,nop,sack 1 {392540:393216}], length 0
19:00:18.955197 IP 173.194.53.166.http > ThinkPad.39462: Flags [.], seq 384260:385640, ack 1, win 274, length 1380
19:00:18.955210 IP ThinkPad.39462 > 173.194.53.166.http: Flags [.], ack 385640, win 4054, options [nop,nop,sack 1 {392540:393216}], length 0
19:00:18.955229 IP 173.194.53.166.http > ThinkPad.39462: Flags [.], seq 385640:387020, ack 1, win 274, length 1380
19:00:18.955244 IP ThinkPad.39462 > 173.194.53.166.http: Flags [.], ack 387020, win 4054, options [nop,nop,sack 1 {392540:393216}], length 0
19:00:18.955265 IP 173.194.53.166.http > ThinkPad.39462: Flags [.], seq 387020:388400, ack 1, win 274, length 1380
19:00:18.955278 IP ThinkPad.39462 > 173.194.53.166.http: Flags [.], ack 388400, win 4054, options [nop,nop,sack 1 {392540:393216}], length 0
19:00:18.955295 IP 173.194.53.166.http > ThinkPad.39462: Flags [.], seq 388400:389780, ack 1, win 274, length 1380
19:00:18.955308 IP ThinkPad.39462 > 173.194.53.166.http: Flags [.], ack 389780, win 4054, options [nop,nop,sack 1 {392540:393216}], length 0
19:00:18.955324 IP 173.194.53.166.http > ThinkPad.39462: Flags [.], seq 389780:391160, ack 1, win 274, length 1380
19:00:18.955336 IP ThinkPad.39462 > 173.194.53.166.http: Flags [.], ack 391160, win 4054, options [nop,nop,sack 1 {392540:393216}], length 0
19:00:18.955353 IP 173.194.53.166.http > ThinkPad.39462: Flags [.], seq 391160:392540, ack 1, win 274, length 1380
19:00:18.955366 IP ThinkPad.39462 > 173.194.53.166.http: Flags [.], ack 393216, win 4054, length 0
19:00:19.895233 IP 173.194.53.166.http > ThinkPad.39462: Flags [.], seq 393216:394596, ack 1, win 274, length 1380
19:00:19.895277 IP ThinkPad.39462 > 173.194.53.166.http: Flags [.], ack 394596, win 4054, length 0
19:00:19.895309 IP 173.194.53.166.http > ThinkPad.39462: Flags [.], seq 394596:395976, ack 1, win 274, length 1380
19:00:19.895321 IP ThinkPad.39462 > 173.194.53.166.http: Flags [.], ack 395976, win 4054, length 0
19:00:19.895337 IP 173.194.53.166.http > ThinkPad.39462: Flags [.], seq 395976:397356, ack 1, win 274, length 1380
19:00:19.895345 IP ThinkPad.39462 > 173.194.53.166.http: Flags [.], ack 397356, win 4054, length 0
19:00:19.895356 IP 173.194.53.166.http > ThinkPad.39462: Flags [.], seq 397356:398736, ack 1, win 274, length 1380
19:00:19.895363 IP ThinkPad.39462 > 173.194.53.166.http: Flags [.], ack 398736, win 4054, length 0
19:00:19.895375 IP 173.194.53.166.http > ThinkPad.39462: Flags [.], seq 398736:400116, ack 1, win 274, length 1380
19:00:19.895383 IP ThinkPad.39462 > 173.194.53.166.http: Flags [.], ack 400116, win 4054, length 0
19:00:19.895394 IP 173.194.53.166.http > ThinkPad.39462: Flags [.], seq 400116:401496, ack 1, win 274, length 1380
19:00:19.895402 IP ThinkPad.39462 > 173.194.53.166.http: Flags [.], ack 401496, win 4054, length 0
19:00:19.895413 IP 173.194.53.166.http > ThinkPad.39462: Flags [.], seq 401496:402876, ack 1, win 274, length 1380
19:00:19.895421 IP ThinkPad.39462 > 173.194.53.166.http: Flags [.], ack 402876, win 4054, length 0
19:00:19.895432 IP 173.194.53.166.http > ThinkPad.39462: Flags [.], seq 402876:404256, ack 1, win 274, length 1380
19:00:19.895439 IP ThinkPad.39462 > 173.194.53.166.http: Flags [.], ack 404256, win 4054, length 0
19:00:19.895450 IP 173.194.53.166.http > ThinkPad.39462: Flags [.], seq 404256:405636, ack 1, win 274, length 1380
19:00:19.895457 IP ThinkPad.39462 > 173.194.53.166.http: Flags [.], ack 405636, win 4054, length 0
19:00:19.895469 IP 173.194.53.166.http > ThinkPad.39462: Flags [.], seq 405636:407016, ack 1, win 274, length 1380
19:00:19.895477 IP 173.194.53.166.http > ThinkPad.39462: Flags [.], seq 407016:408396, ack 1, win 274, length 1380
19:00:19.895485 IP 173.194.53.166.http > ThinkPad.39462: Flags [.], seq 408396:409776, ack 1, win 274, length 1380
19:00:19.895488 IP ThinkPad.39462 > 173.194.53.166.http: Flags [.], ack 407016, win 4054, length 0
19:00:19.895493 IP 173.194.53.166.http > ThinkPad.39462: Flags [.], seq 409776:411156, ack 1, win 274, length 1380
19:00:19.895501 IP 173.194.53.166.http > ThinkPad.39462: Flags [P.], seq 458076:458752, ack 1, win 274, length 676
19:00:19.895513 IP ThinkPad.39462 > 173.194.53.166.http: Flags [.], ack 408396, win 4054, length 0
19:00:19.895529 IP ThinkPad.39462 > 173.194.53.166.http: Flags [.], ack 409776, win 4054, length 0
19:00:19.895540 IP ThinkPad.39462 > 173.194.53.166.http: Flags [.], ack 411156, win 4054, length 0
19:00:19.895552 IP ThinkPad.39462 > 173.194.53.166.http: Flags [.], ack 411156, win 4054, options [nop,nop,sack 1 {458076:458752}], length 0
19:00:19.897442 IP 173.194.53.166.http > ThinkPad.39462: Flags [.], seq 411156:412536, ack 1, win 274, length 1380
19:00:19.897474 IP ThinkPad.39462 > 173.194.53.166.http: Flags [.], ack 412536, win 4054, options [nop,nop,sack 1 {458076:458752}], length 0
19:00:19.897499 IP 173.194.53.166.http > ThinkPad.39462: Flags [.], seq 412536:413916, ack 1, win 274, length 1380
19:00:19.897512 IP ThinkPad.39462 > 173.194.53.166.http: Flags [.], ack 413916, win 4054, options [nop,nop,sack 1 {458076:458752}], length 0
19:00:19.897529 IP 173.194.53.166.http > ThinkPad.39462: Flags [.], seq 413916:415296, ack 1, win 274, length 1380
19:00:19.897540 IP ThinkPad.39462 > 173.194.53.166.http: Flags [.], ack 415296, win 4054, options [nop,nop,sack 1 {458076:458752}], length 0
19:00:19.897557 IP 173.194.53.166.http > ThinkPad.39462: Flags [.], seq 415296:416676, ack 1, win 274, length 1380
19:00:19.897568 IP ThinkPad.39462 > 173.194.53.166.http: Flags [.], ack 416676, win 4054, options [nop,nop,sack 1 {458076:458752}], length 0
19:00:19.897581 IP 173.194.53.166.http > ThinkPad.39462: Flags [.], seq 416676:418056, ack 1, win 274, length 1380
19:00:19.897589 IP ThinkPad.39462 > 173.194.53.166.http: Flags [.], ack 418056, win 4054, options [nop,nop,sack 1 {458076:458752}], length 0
19:00:19.897601 IP 173.194.53.166.http > ThinkPad.39462: Flags [.], seq 418056:419436, ack 1, win 274, length 1380
19:00:19.897608 IP ThinkPad.39462 > 173.194.53.166.http: Flags [.], ack 419436, win 4054, options [nop,nop,sack 1 {458076:458752}], length 0
19:00:19.897619 IP 173.194.53.166.http > ThinkPad.39462: Flags [.], seq 419436:420816, ack 1, win 274, length 1380
19:00:19.897626 IP ThinkPad.39462 > 173.194.53.166.http: Flags [.], ack 420816, win 4054, options [nop,nop,sack 1 {458076:458752}], length 0
19:00:19.897637 IP 173.194.53.166.http > ThinkPad.39462: Flags [.], seq 420816:422196, ack 1, win 274, length 1380
19:00:19.897645 IP ThinkPad.39462 > 173.194.53.166.http: Flags [.], ack 422196, win 4054, options [nop,nop,sack 1 {458076:458752}], length 0
19:00:19.897656 IP 173.194.53.166.http > ThinkPad.39462: Flags [.], seq 422196:423576, ack 1, win 274, length 1380
19:00:19.897663 IP ThinkPad.39462 > 173.194.53.166.http: Flags [.], ack 423576, win 4054, options [nop,nop,sack 1 {458076:458752}], length 0
19:00:19.897674 IP 173.194.53.166.http > ThinkPad.39462: Flags [.], seq 423576:424956, ack 1, win 274, length 1380
19:00:19.897682 IP 173.194.53.166.http > ThinkPad.39462: Flags [.], seq 424956:426336, ack 1, win 274, length 1380
19:00:19.897689 IP ThinkPad.39462 > 173.194.53.166.http: Flags [.], ack 424956, win 4054, options [nop,nop,sack 1 {458076:458752}], length 0
19:00:19.897690 IP 173.194.53.166.http > ThinkPad.39462: Flags [.], seq 426336:427716, ack 1, win 274, length 1380
19:00:19.897698 IP 173.194.53.166.http > ThinkPad.39462: Flags [.], seq 427716:429096, ack 1, win 274, length 1380
19:00:19.897706 IP ThinkPad.39462 > 173.194.53.166.http: Flags [.], ack 426336, win 4054, options [nop,nop,sack 1 {458076:458752}], length 0
19:00:19.897707 IP 173.194.53.166.http > ThinkPad.39462: Flags [.], seq 429096:430476, ack 1, win 274, length 1380
19:00:19.897715 IP 173.194.53.166.http > ThinkPad.39462: Flags [.], seq 430476:431856, ack 1, win 274, length 1380
19:00:19.897716 IP ThinkPad.39462 > 173.194.53.166.http: Flags [.], ack 427716, win 4054, options [nop,nop,sack 1 {458076:458752}], length 0
19:00:19.897723 IP 173.194.53.166.http > ThinkPad.39462: Flags [.], seq 431856:433236, ack 1, win 274, length 1380
19:00:19.897744 IP ThinkPad.39462 > 173.194.53.166.http: Flags [.], ack 429096, win 4054, options [nop,nop,sack 1 {458076:458752}], length 0
19:00:19.897753 IP ThinkPad.39462 > 173.194.53.166.http: Flags [.], ack 430476, win 4054, options [nop,nop,sack 1 {458076:458752}], length 0
19:00:19.897761 IP ThinkPad.39462 > 173.194.53.166.http: Flags [.], ack 431856, win 4054, options [nop,nop,sack 1 {458076:458752}], length 0
19:00:19.899591 IP 173.194.53.166.http > ThinkPad.39462: Flags [.], seq 433236:434616, ack 1, win 274, length 1380
19:00:19.899620 IP ThinkPad.39462 > 173.194.53.166.http: Flags [.], ack 434616, win 4054, options [nop,nop,sack 1 {458076:458752}], length 0
19:00:19.899644 IP 173.194.53.166.http > ThinkPad.39462: Flags [.], seq 434616:435996, ack 1, win 274, length 1380
19:00:19.899657 IP ThinkPad.39462 > 173.194.53.166.http: Flags [.], ack 435996, win 4054, options [nop,nop,sack 1 {458076:458752}], length 0
19:00:19.899675 IP 173.194.53.166.http > ThinkPad.39462: Flags [.], seq 435996:437376, ack 1, win 274, length 1380
19:00:19.899705 IP ThinkPad.39462 > 173.194.53.166.http: Flags [.], ack 437376, win 4054, options [nop,nop,sack 1 {458076:458752}], length 0
19:00:19.902341 IP 173.194.53.166.http > ThinkPad.39462: Flags [.], seq 437376:438756, ack 1, win 274, length 1380
19:00:19.902364 IP ThinkPad.39462 > 173.194.53.166.http: Flags [.], ack 438756, win 4054, options [nop,nop,sack 1 {458076:458752}], length 0
19:00:19.902386 IP 173.194.53.166.http > ThinkPad.39462: Flags [.], seq 438756:440136, ack 1, win 274, length 1380
19:00:19.902399 IP ThinkPad.39462 > 173.194.53.166.http: Flags [.], ack 440136, win 4054, options [nop,nop,sack 1 {458076:458752}], length 0
19:00:19.902417 IP 173.194.53.166.http > ThinkPad.39462: Flags [.], seq 440136:441516, ack 1, win 274, length 1380
19:00:19.902428 IP ThinkPad.39462 > 173.194.53.166.http: Flags [.], ack 441516, win 4054, options [nop,nop,sack 1 {458076:458752}], length 0
19:00:19.902445 IP 173.194.53.166.http > ThinkPad.39462: Flags [.], seq 441516:442896, ack 1, win 274, length 1380
19:00:19.902455 IP ThinkPad.39462 > 173.194.53.166.http: Flags [.], ack 442896, win 4054, options [nop,nop,sack 1 {458076:458752}], length 0
19:00:19.902469 IP 173.194.53.166.http > ThinkPad.39462: Flags [.], seq 442896:444276, ack 1, win 274, length 1380
19:00:19.902477 IP ThinkPad.39462 > 173.194.53.166.http: Flags [.], ack 444276, win 4054, options [nop,nop,sack 1 {458076:458752}], length 0
19:00:19.902488 IP 173.194.53.166.http > ThinkPad.39462: Flags [.], seq 444276:445656, ack 1, win 274, length 1380
19:00:19.902496 IP ThinkPad.39462 > 173.194.53.166.http: Flags [.], ack 445656, win 4054, options [nop,nop,sack 1 {458076:458752}], length 0
19:00:19.904457 IP 173.194.53.166.http > ThinkPad.39462: Flags [.], seq 445656:447036, ack 1, win 274, length 1380
19:00:19.904483 IP ThinkPad.39462 > 173.194.53.166.http: Flags [.], ack 447036, win 4054, options [nop,nop,sack 1 {458076:458752}], length 0
19:00:19.904512 IP 173.194.53.166.http > ThinkPad.39462: Flags [.], seq 447036:448416, ack 1, win 274, length 1380
19:00:19.904529 IP ThinkPad.39462 > 173.194.53.166.http: Flags [.], ack 448416, win 4054, options [nop,nop,sack 1 {458076:458752}], length 0
19:00:19.904553 IP 173.194.53.166.http > ThinkPad.39462: Flags [.], seq 448416:449796, ack 1, win 274, length 1380
19:00:19.904568 IP 173.194.53.166.http > ThinkPad.39462: Flags [.], seq 449796:451176, ack 1, win 274, length 1380
19:00:19.904575 IP ThinkPad.39462 > 173.194.53.166.http: Flags [.], ack 449796, win 4054, options [nop,nop,sack 1 {458076:458752}], length 0
19:00:19.904580 IP 173.194.53.166.http > ThinkPad.39462: Flags [.], seq 451176:452556, ack 1, win 274, length 1380
19:00:19.904594 IP ThinkPad.39462 > 173.194.53.166.http: Flags [.], ack 451176, win 4054, options [nop,nop,sack 1 {458076:458752}], length 0
19:00:19.904593 IP 173.194.53.166.http > ThinkPad.39462: Flags [.], seq 452556:453936, ack 1, win 274, length 1380
19:00:19.904608 IP ThinkPad.39462 > 173.194.53.166.http: Flags [.], ack 452556, win 4054, options [nop,nop,sack 1 {458076:458752}], length 0
19:00:19.904607 IP 173.194.53.166.http > ThinkPad.39462: Flags [.], seq 453936:455316, ack 1, win 274, length 1380
19:00:19.904621 IP ThinkPad.39462 > 173.194.53.166.http: Flags [.], ack 453936, win 4054, options [nop,nop,sack 1 {458076:458752}], length 0
19:00:19.904621 IP 173.194.53.166.http > ThinkPad.39462: Flags [.], seq 455316:456696, ack 1, win 274, length 1380
19:00:19.904633 IP ThinkPad.39462 > 173.194.53.166.http: Flags [.], ack 455316, win 4054, options [nop,nop,sack 1 {458076:458752}], length 0
19:00:19.904634 IP 173.194.53.166.http > ThinkPad.39462: Flags [.], seq 456696:458076, ack 1, win 274, length 1380
19:00:19.904646 IP ThinkPad.39462 > 173.194.53.166.http: Flags [.], ack 456696, win 4054, options [nop,nop,sack 1 {458076:458752}], length 0
19:00:19.904659 IP ThinkPad.39462 > 173.194.53.166.http: Flags [.], ack 458752, win 4054, length 0
19:00:20.023446 IP ThinkPad.42884 > lga15s35-in-f3.1e100.net.http: Flags [S], seq 1174955841, win 14600, options [mss 1460,sackOK,TS val 70196219 ecr 0,nop,wscale 6], length 0
19:00:20.033836 IP lga15s35-in-f3.1e100.net.http > ThinkPad.42884: Flags [S.], seq 1439087481, ack 1174955842, win 62392, options [mss 1380,sackOK,TS val 2200059982 ecr 70196219,nop,wscale 6], length 0
19:00:20.033867 IP ThinkPad.42884 > lga15s35-in-f3.1e100.net.http: Flags [.], ack 1, win 229, options [nop,nop,TS val 70196220 ecr 2200059982], length 0
19:00:20.034166 IP ThinkPad.42884 > lga15s35-in-f3.1e100.net.http: Flags [.], seq 1:1369, ack 1, win 229, options [nop,nop,TS val 70196220 ecr 2200059982], length 1368
19:00:20.034190 IP ThinkPad.42884 > lga15s35-in-f3.1e100.net.http: Flags [P.], seq 1369:1804, ack 1, win 229, options [nop,nop,TS val 70196220 ecr 2200059982], length 435
19:00:20.045036 IP lga15s35-in-f3.1e100.net.http > ThinkPad.42884: Flags [.], ack 1804, win 954, options [nop,nop,TS val 2200059994 ecr 70196220], length 0
19:00:20.060731 IP lga15s35-in-f3.1e100.net.http > ThinkPad.42884: Flags [P.], seq 1:413, ack 1804, win 975, options [nop,nop,TS val 2200060008 ecr 70196220], length 412
19:00:20.060760 IP ThinkPad.42884 > lga15s35-in-f3.1e100.net.http: Flags [.], ack 413, win 245, options [nop,nop,TS val 70196222 ecr 2200060008], length 0
19:00:30.003794 IP ThinkPad.42884 > lga15s35-in-f3.1e100.net.http: Flags [.], seq 1804:3172, ack 413, win 245, options [nop,nop,TS val 70197217 ecr 2200060008], length 1368
19:00:30.003838 IP ThinkPad.42884 > lga15s35-in-f3.1e100.net.http: Flags [P.], seq 3172:3607, ack 413, win 245, options [nop,nop,TS val 70197217 ecr 2200060008], length 435
19:00:30.211440 IP ThinkPad.42884 > lga15s35-in-f3.1e100.net.http: Flags [.], seq 1804:3172, ack 413, win 245, options [nop,nop,TS val 70197238 ecr 2200060008], length 1368
19:00:30.631490 IP ThinkPad.42884 > lga15s35-in-f3.1e100.net.http: Flags [.], seq 1804:3172, ack 413, win 245, options [nop,nop,TS val 70197280 ecr 2200060008], length 1368
19:00:31.471482 IP ThinkPad.42884 > lga15s35-in-f3.1e100.net.http: Flags [.], seq 1804:3172, ack 413, win 245, options [nop,nop,TS val 70197364 ecr 2200060008], length 1368
19:00:33.151448 IP ThinkPad.42884 > lga15s35-in-f3.1e100.net.http: Flags [.], seq 1804:3172, ack 413, win 245, options [nop,nop,TS val 70197532 ecr 2200060008], length 1368
19:00:33.166406 IP lga15s35-in-f3.1e100.net.http > ThinkPad.42884: Flags [.], ack 3607, win 975, options [nop,nop,TS val 2200073112 ecr 70197217,nop,nop,sack 1 {1804:3172}], length 0
19:00:33.193912 IP lga15s35-in-f3.1e100.net.http > ThinkPad.42884: Flags [P.], seq 413:825, ack 3607, win 975, options [nop,nop,TS val 2200073141 ecr 70197217], length 412
19:00:33.193947 IP ThinkPad.42884 > lga15s35-in-f3.1e100.net.http: Flags [.], ack 825, win 262, options [nop,nop,TS val 70197536 ecr 2200073141], length 0
19:00:35.857736 IP ThinkPad.35495 > lga15s35-in-f9.1e100.net.http: Flags [.], seq 1971:3339, ack 347, win 245, options [nop,nop,TS val 70197802 ecr 2200065788], length 1368
19:00:35.857774 IP ThinkPad.35495 > lga15s35-in-f9.1e100.net.http: Flags [P.], seq 3339:4685, ack 347, win 245, options [nop,nop,TS val 70197802 ecr 2200065788], length 1346
19:00:35.868596 IP lga15s35-in-f9.1e100.net.http > ThinkPad.35495: Flags [.], ack 4685, win 1002, options [nop,nop,TS val 2200082774 ecr 70197802], length 0
19:00:35.882285 IP lga15s35-in-f9.1e100.net.http > ThinkPad.35495: Flags [P.], seq 347:759, ack 4685, win 1002, options [nop,nop,TS val 2200082788 ecr 70197802], length 412
19:00:35.882325 IP ThinkPad.35495 > lga15s35-in-f9.1e100.net.http: Flags [.], ack 759, win 262, options [nop,nop,TS val 70197805 ecr 2200082788], length 0
19:00:36.049430 IP ThinkPad.35499 > lga15s35-in-f9.1e100.net.http: Flags [S], seq 393649385, win 14600, options [mss 1460,sackOK,TS val 70197821 ecr 0,nop,wscale 6], length 0
19:00:36.049514 IP ThinkPad.35500 > lga15s35-in-f9.1e100.net.http: Flags [S], seq 1687174188, win 14600, options [mss 1460,sackOK,TS val 70197821 ecr 0,nop,wscale 6], length 0
19:00:36.049751 IP ThinkPad.32942 > lga15s35-in-f6.1e100.net.http: Flags [S], seq 1788189905, win 14600, options [mss 1460,sackOK,TS val 70197821 ecr 0,nop,wscale 6], length 0
