21:50:01.511190 IP dhcp-140-247-103-184.fas.harvard.edu.51696 > OCSP.SFO1.VERISIGN.COM.http: Flags [F.], seq 114585539, ack 1460734256, win 26806, length 0
21:50:01.511278 IP dhcp-140-247-103-184.fas.harvard.edu.51697 > OCSP.SFO1.VERISIGN.COM.http: Flags [F.], seq 4126983361, ack 154773699, win 26806, length 0
21:50:01.511300 IP dhcp-140-247-103-184.fas.harvard.edu.51698 > OCSP.SFO1.VERISIGN.COM.http: Flags [F.], seq 1739174516, ack 236621065, win 20620, length 0
21:50:01.596531 IP OCSP.SFO1.VERISIGN.COM.http > dhcp-140-247-103-184.fas.harvard.edu.51696: Flags [F.], seq 1, ack 1, win 8190, length 0
21:50:01.596571 IP dhcp-140-247-103-184.fas.harvard.edu.51696 > OCSP.SFO1.VERISIGN.COM.http: Flags [.], ack 2, win 26806, length 0
21:50:01.596592 IP OCSP.SFO1.VERISIGN.COM.http > dhcp-140-247-103-184.fas.harvard.edu.51698: Flags [F.], seq 1, ack 1, win 8190, length 0
21:50:01.596603 IP dhcp-140-247-103-184.fas.harvard.edu.51698 > OCSP.SFO1.VERISIGN.COM.http: Flags [.], ack 2, win 20620, length 0
21:50:01.596675 IP OCSP.SFO1.VERISIGN.COM.http > dhcp-140-247-103-184.fas.harvard.edu.51697: Flags [F.], seq 1, ack 1, win 8190, length 0
21:50:01.596694 IP dhcp-140-247-103-184.fas.harvard.edu.51697 > OCSP.SFO1.VERISIGN.COM.http: Flags [.], ack 2, win 26806, length 0
21:50:05.221444 IP dhcp-140-247-103-184.fas.harvard.edu.49678 > 108.162.202.77.http: Flags [.], ack 3808174566, win 245, options [nop,nop,TS val 71214739 ecr 133868841], length 0
21:50:05.227517 IP 108.162.202.77.http > dhcp-140-247-103-184.fas.harvard.edu.49678: Flags [.], ack 1, win 17, options [nop,nop,TS val 133873341 ecr 71210239], length 0
21:50:06.222200 IP 108.162.202.77.http > dhcp-140-247-103-184.fas.harvard.edu.49678: Flags [F.], seq 1, ack 1, win 17, options [nop,nop,TS val 133873441 ecr 71210239], length 0
21:50:06.261442 IP dhcp-140-247-103-184.fas.harvard.edu.49678 > 108.162.202.77.http: Flags [.], ack 2, win 245, options [nop,nop,TS val 71214843 ecr 133873441], length 0
21:50:09.870589 IP dhcp-140-247-103-184.fas.harvard.edu.49678 > 108.162.202.77.http: Flags [F.], seq 1, ack 2, win 245, options [nop,nop,TS val 71215203 ecr 133873441], length 0
21:50:09.876841 IP 108.162.202.77.http > dhcp-140-247-103-184.fas.harvard.edu.49678: Flags [.], ack 2, win 17, options [nop,nop,TS val 133873806 ecr 71215203], length 0
21:50:16.231448 IP dhcp-140-247-103-184.fas.harvard.edu.59169 > lga15s35-in-f6.1e100.net.http: Flags [.], ack 1430395579, win 661, options [nop,nop,TS val 71215840 ecr 2210204024], length 0
21:50:16.262453 IP lga15s35-in-f6.1e100.net.http > dhcp-140-247-103-184.fas.harvard.edu.59169: Flags [.], ack 1, win 1002, options [nop,nop,TS val 2210249144 ecr 71197792], length 0
21:50:17.831423 IP dhcp-140-247-103-184.fas.harvard.edu.38465 > lga15s35-in-f28.1e100.net.http: Flags [.], ack 1421405380, win 661, options [nop,nop,TS val 71216000 ecr 2210220023], length 0
21:50:17.837223 IP lga15s35-in-f28.1e100.net.http > dhcp-140-247-103-184.fas.harvard.edu.38465: Flags [.], ack 1, win 1002, options [nop,nop,TS val 2210265143 ecr 71197957], length 0
21:50:17.859023 IP dhcp-140-247-103-184.fas.harvard.edu.49682 > 108.162.202.77.http: Flags [S], seq 1977693745, win 14600, options [mss 1460,sackOK,TS val 71216002 ecr 0,nop,wscale 6], length 0
21:50:17.866054 IP 108.162.202.77.http > dhcp-140-247-103-184.fas.harvard.edu.49682: Flags [S.], seq 458877685, ack 1977693746, win 14480, options [mss 1380,sackOK,TS val 133874605 ecr 71216002,nop,wscale 10], length 0
21:50:17.866083 IP dhcp-140-247-103-184.fas.harvard.edu.49682 > 108.162.202.77.http: Flags [.], ack 1, win 229, options [nop,nop,TS val 71216003 ecr 133874605], length 0
21:50:17.866411 IP dhcp-140-247-103-184.fas.harvard.edu.49682 > 108.162.202.77.http: Flags [.], seq 1:1369, ack 1, win 229, options [nop,nop,TS val 71216003 ecr 133874605], length 1368
21:50:17.866425 IP dhcp-140-247-103-184.fas.harvard.edu.49682 > 108.162.202.77.http: Flags [P.], seq 1369:1792, ack 1, win 229, options [nop,nop,TS val 71216003 ecr 133874605], length 423
21:50:17.872676 IP 108.162.202.77.http > dhcp-140-247-103-184.fas.harvard.edu.49682: Flags [.], ack 1, win 15, options [nop,nop,TS val 133874606 ecr 71216003,nop,nop,sack 1 {2783002263:2783002686}], length 0
21:50:17.873105 IP 108.162.202.77.http > dhcp-140-247-103-184.fas.harvard.edu.49682: Flags [.], ack 1792, win 17, options [nop,nop,TS val 133874606 ecr 71216003], length 0
21:50:17.991434 IP dhcp-140-247-103-184.fas.harvard.edu.37981 > lga15s34-in-f28.1e100.net.http: Flags [.], ack 927532187, win 661, options [nop,nop,TS val 71216016 ecr 2124847082], length 0
21:50:17.996908 IP lga15s34-in-f28.1e100.net.http > dhcp-140-247-103-184.fas.harvard.edu.37981: Flags [.], ack 1, win 1002, options [nop,nop,TS val 2124892202 ecr 71197969], length 0
21:50:18.144124 IP 108.162.202.77.http > dhcp-140-247-103-184.fas.harvard.edu.49682: Flags [P.], seq 1:324, ack 1792, win 17, options [nop,nop,TS val 133874633 ecr 71216003], length 323
21:50:18.144177 IP dhcp-140-247-103-184.fas.harvard.edu.49682 > 108.162.202.77.http: Flags [.], ack 324, win 245, options [nop,nop,TS val 71216031 ecr 133874633], length 0
21:50:18.161419 IP dhcp-140-247-103-184.fas.harvard.edu.43621 > 91.103.140.237.http: Flags [.], ack 507765551, win 661, options [nop,nop,TS val 71216033 ecr 2005374599], length 0
21:50:18.244329 IP 91.103.140.237.http > dhcp-140-247-103-184.fas.harvard.edu.43621: Flags [.], ack 1, win 25748, options [nop,nop,TS val 2005419729 ecr 71197985], length 0
21:50:19.870706 IP dhcp-140-247-103-184.fas.harvard.edu.57304 > a23-47-113-224.deploy.akamaitechnologies.com.http: Flags [F.], seq 2752537050, ack 4048768560, win 661, options [nop,nop,TS val 71216203 ecr 3942430727], length 0
21:50:19.877017 IP a23-47-113-224.deploy.akamaitechnologies.com.http > dhcp-140-247-103-184.fas.harvard.edu.57304: Flags [F.], seq 1, ack 1, win 7868, options [nop,nop,TS val 3942469567 ecr 71216203], length 0
21:50:19.877058 IP dhcp-140-247-103-184.fas.harvard.edu.57304 > a23-47-113-224.deploy.akamaitechnologies.com.http: Flags [.], ack 2, win 661, options [nop,nop,TS val 71216204 ecr 3942469567], length 0
21:50:27.664356 IP dhcp-140-247-103-184.fas.harvard.edu.59892 > wikipedia-lb.eqiad.wikimedia.org.http: Flags [S], seq 271065113, win 14600, options [mss 1460,sackOK,TS val 71216983 ecr 0,nop,wscale 6], length 0
21:50:27.707074 IP wikipedia-lb.eqiad.wikimedia.org.http > dhcp-140-247-103-184.fas.harvard.edu.59892: Flags [S.], seq 708723890, ack 271065114, win 5792, options [mss 1380,sackOK,TS val 4011224458 ecr 71216983,nop,wscale 9], length 0
21:50:27.707128 IP dhcp-140-247-103-184.fas.harvard.edu.59892 > wikipedia-lb.eqiad.wikimedia.org.http: Flags [.], ack 1, win 229, options [nop,nop,TS val 71216987 ecr 4011224458], length 0
21:50:27.707438 IP dhcp-140-247-103-184.fas.harvard.edu.59892 > wikipedia-lb.eqiad.wikimedia.org.http: Flags [P.], seq 1:710, ack 1, win 229, options [nop,nop,TS val 71216987 ecr 4011224458], length 709
21:50:27.722173 IP dhcp-140-247-103-184.fas.harvard.edu.59892 > wikipedia-lb.eqiad.wikimedia.org.http: Flags [F.], seq 710, ack 1, win 229, options [nop,nop,TS val 71216989 ecr 4011224458], length 0
21:50:27.749845 IP wikipedia-lb.eqiad.wikimedia.org.http > dhcp-140-247-103-184.fas.harvard.edu.59892: Flags [.], ack 710, win 15, options [nop,nop,TS val 4011224462 ecr 71216987], length 0
21:50:27.750908 IP wikipedia-lb.eqiad.wikimedia.org.http > dhcp-140-247-103-184.fas.harvard.edu.59892: Flags [P.], seq 1:568, ack 710, win 15, options [nop,nop,TS val 4011224462 ecr 71216987], length 567
21:50:27.750946 IP dhcp-140-247-103-184.fas.harvard.edu.59892 > wikipedia-lb.eqiad.wikimedia.org.http: Flags [R], seq 271065823, win 0, length 0
21:50:27.750958 IP wikipedia-lb.eqiad.wikimedia.org.http > dhcp-140-247-103-184.fas.harvard.edu.59892: Flags [P.], seq 568:697, ack 710, win 15, options [nop,nop,TS val 4011224462 ecr 71216987], length 129
21:50:27.750965 IP dhcp-140-247-103-184.fas.harvard.edu.59892 > wikipedia-lb.eqiad.wikimedia.org.http: Flags [R], seq 271065823, win 0, length 0
21:50:27.762636 IP dhcp-140-247-103-184.fas.harvard.edu.59893 > wikipedia-lb.eqiad.wikimedia.org.http: Flags [S], seq 2336123942, win 14600, options [mss 1460,sackOK,TS val 71216993 ecr 0,nop,wscale 6], length 0
21:50:27.805231 IP wikipedia-lb.eqiad.wikimedia.org.http > dhcp-140-247-103-184.fas.harvard.edu.59893: Flags [S.], seq 550582813, ack 2336123943, win 5792, options [mss 1380,sackOK,TS val 4010966864 ecr 71216993,nop,wscale 9], length 0
21:50:27.805280 IP dhcp-140-247-103-184.fas.harvard.edu.59893 > wikipedia-lb.eqiad.wikimedia.org.http: Flags [.], ack 1, win 229, options [nop,nop,TS val 71216997 ecr 4010966864], length 0
21:50:27.805587 IP dhcp-140-247-103-184.fas.harvard.edu.59893 > wikipedia-lb.eqiad.wikimedia.org.http: Flags [P.], seq 1:711, ack 1, win 229, options [nop,nop,TS val 71216997 ecr 4010966864], length 710
21:50:27.847857 IP wikipedia-lb.eqiad.wikimedia.org.http > dhcp-140-247-103-184.fas.harvard.edu.59893: Flags [.], ack 711, win 15, options [nop,nop,TS val 4010966868 ecr 71216997], length 0
21:50:27.848686 IP wikipedia-lb.eqiad.wikimedia.org.http > dhcp-140-247-103-184.fas.harvard.edu.59893: Flags [P.], seq 1:568, ack 711, win 15, options [nop,nop,TS val 4010966868 ecr 71216997], length 567
21:50:27.848711 IP dhcp-140-247-103-184.fas.harvard.edu.59893 > wikipedia-lb.eqiad.wikimedia.org.http: Flags [.], ack 568, win 246, options [nop,nop,TS val 71217001 ecr 4010966868], length 0
21:50:27.848725 IP wikipedia-lb.eqiad.wikimedia.org.http > dhcp-140-247-103-184.fas.harvard.edu.59893: Flags [P.], seq 568:711, ack 711, win 15, options [nop,nop,TS val 4010966868 ecr 71216997], length 143
21:50:27.848735 IP dhcp-140-247-103-184.fas.harvard.edu.59893 > wikipedia-lb.eqiad.wikimedia.org.http: Flags [.], ack 711, win 264, options [nop,nop,TS val 71217001 ecr 4010966868], length 0
21:50:27.896418 IP dhcp-140-247-103-184.fas.harvard.edu.59893 > wikipedia-lb.eqiad.wikimedia.org.http: Flags [P.], seq 711:1422, ack 711, win 264, options [nop,nop,TS val 71217006 ecr 4010966868], length 711
21:50:27.940321 IP wikipedia-lb.eqiad.wikimedia.org.http > dhcp-140-247-103-184.fas.harvard.edu.59893: Flags [P.], seq 711:1278, ack 1422, win 17, options [nop,nop,TS val 4010966877 ecr 71217006], length 567
21:50:27.940363 IP dhcp-140-247-103-184.fas.harvard.edu.59893 > wikipedia-lb.eqiad.wikimedia.org.http: Flags [.], ack 1278, win 282, options [nop,nop,TS val 71217010 ecr 4010966877], length 0
21:50:27.940373 IP wikipedia-lb.eqiad.wikimedia.org.http > dhcp-140-247-103-184.fas.harvard.edu.59893: Flags [P.], seq 1278:1401, ack 1422, win 17, options [nop,nop,TS val 4010966877 ecr 71217006], length 123
21:50:27.940380 IP dhcp-140-247-103-184.fas.harvard.edu.59893 > wikipedia-lb.eqiad.wikimedia.org.http: Flags [.], ack 1401, win 282, options [nop,nop,TS val 71217010 ecr 4010966877], length 0
21:50:28.047366 IP dhcp-140-247-103-184.fas.harvard.edu.59893 > wikipedia-lb.eqiad.wikimedia.org.http: Flags [P.], seq 1422:2134, ack 1401, win 282, options [nop,nop,TS val 71217021 ecr 4010966877], length 712
21:50:28.090998 IP wikipedia-lb.eqiad.wikimedia.org.http > dhcp-140-247-103-184.fas.harvard.edu.59893: Flags [P.], seq 1401:1968, ack 2134, win 20, options [nop,nop,TS val 4010966892 ecr 71217021], length 567
21:50:28.091030 IP dhcp-140-247-103-184.fas.harvard.edu.59893 > wikipedia-lb.eqiad.wikimedia.org.http: Flags [.], ack 1968, win 299, options [nop,nop,TS val 71217025 ecr 4010966892], length 0
21:50:28.091043 IP wikipedia-lb.eqiad.wikimedia.org.http > dhcp-140-247-103-184.fas.harvard.edu.59893: Flags [P.], seq 1968:2096, ack 2134, win 20, options [nop,nop,TS val 4010966892 ecr 71217021], length 128
21:50:28.091054 IP dhcp-140-247-103-184.fas.harvard.edu.59893 > wikipedia-lb.eqiad.wikimedia.org.http: Flags [.], ack 2096, win 317, options [nop,nop,TS val 71217025 ecr 4010966892], length 0
21:50:28.220825 IP dhcp-140-247-103-184.fas.harvard.edu.59893 > wikipedia-lb.eqiad.wikimedia.org.http: Flags [P.], seq 2134:2847, ack 2096, win 317, options [nop,nop,TS val 71217038 ecr 4010966892], length 713
21:50:28.264559 IP wikipedia-lb.eqiad.wikimedia.org.http > dhcp-140-247-103-184.fas.harvard.edu.59893: Flags [P.], seq 2096:2662, ack 2847, win 23, options [nop,nop,TS val 4010966910 ecr 71217038], length 566
21:50:28.264605 IP dhcp-140-247-103-184.fas.harvard.edu.59893 > wikipedia-lb.eqiad.wikimedia.org.http: Flags [.], ack 2662, win 335, options [nop,nop,TS val 71217043 ecr 4010966910], length 0
21:50:28.264619 IP wikipedia-lb.eqiad.wikimedia.org.http > dhcp-140-247-103-184.fas.harvard.edu.59893: Flags [P.], seq 2662:2821, ack 2847, win 23, options [nop,nop,TS val 4010966910 ecr 71217038], length 159
21:50:28.264629 IP dhcp-140-247-103-184.fas.harvard.edu.59893 > wikipedia-lb.eqiad.wikimedia.org.http: Flags [.], ack 2821, win 353, options [nop,nop,TS val 71217043 ecr 4010966910], length 0
21:50:28.460593 IP dhcp-140-247-103-184.fas.harvard.edu.59893 > wikipedia-lb.eqiad.wikimedia.org.http: Flags [P.], seq 2847:3561, ack 2821, win 353, options [nop,nop,TS val 71217062 ecr 4010966910], length 714
21:50:28.504128 IP wikipedia-lb.eqiad.wikimedia.org.http > dhcp-140-247-103-184.fas.harvard.edu.59893: Flags [P.], seq 2821:3388, ack 3561, win 26, options [nop,nop,TS val 4010966934 ecr 71217062], length 567
21:50:28.504179 IP dhcp-140-247-103-184.fas.harvard.edu.59893 > wikipedia-lb.eqiad.wikimedia.org.http: Flags [.], ack 3388, win 370, options [nop,nop,TS val 71217067 ecr 4010966934], length 0
21:50:28.504190 IP wikipedia-lb.eqiad.wikimedia.org.http > dhcp-140-247-103-184.fas.harvard.edu.59893: Flags [P.], seq 3388:3548, ack 3561, win 26, options [nop,nop,TS val 4010966934 ecr 71217062], length 160
21:50:28.504198 IP dhcp-140-247-103-184.fas.harvard.edu.59893 > wikipedia-lb.eqiad.wikimedia.org.http: Flags [.], ack 3548, win 388, options [nop,nop,TS val 71217067 ecr 4010966934], length 0
21:50:28.677062 IP dhcp-140-247-103-184.fas.harvard.edu.59893 > wikipedia-lb.eqiad.wikimedia.org.http: Flags [P.], seq 3561:4276, ack 3548, win 388, options [nop,nop,TS val 71217084 ecr 4010966934], length 715
21:50:28.753200 IP wikipedia-lb.eqiad.wikimedia.org.http > dhcp-140-247-103-184.fas.harvard.edu.59893: Flags [.], ack 4276, win 29, options [nop,nop,TS val 4010966959 ecr 71217084], length 0
21:50:28.795787 IP wikipedia-lb.eqiad.wikimedia.org.http > dhcp-140-247-103-184.fas.harvard.edu.59893: Flags [P.], seq 3548:4105, ack 4276, win 29, options [nop,nop,TS val 4010966963 ecr 71217084], length 557
21:50:28.795808 IP dhcp-140-247-103-184.fas.harvard.edu.59893 > wikipedia-lb.eqiad.wikimedia.org.http: Flags [.], ack 4105, win 406, options [nop,nop,TS val 71217096 ecr 4010966963], length 0
21:50:28.795818 IP wikipedia-lb.eqiad.wikimedia.org.http > dhcp-140-247-103-184.fas.harvard.edu.59893: Flags [P.], seq 4105:4243, ack 4276, win 29, options [nop,nop,TS val 4010966963 ecr 71217084], length 138
21:50:28.795824 IP dhcp-140-247-103-184.fas.harvard.edu.59893 > wikipedia-lb.eqiad.wikimedia.org.http: Flags [.], ack 4243, win 424, options [nop,nop,TS val 71217096 ecr 4010966963], length 0
21:50:30.629918 IP dhcp-140-247-103-184.fas.harvard.edu.59894 > wikipedia-lb.eqiad.wikimedia.org.http: Flags [S], seq 3466013062, win 14600, options [mss 1460,sackOK,TS val 71217279 ecr 0,nop,wscale 6], length 0
21:50:30.629999 IP dhcp-140-247-103-184.fas.harvard.edu.59895 > wikipedia-lb.eqiad.wikimedia.org.http: Flags [S], seq 853881344, win 14600, options [mss 1460,sackOK,TS val 71217279 ecr 0,nop,wscale 6], length 0
21:50:30.630078 IP dhcp-140-247-103-184.fas.harvard.edu.59896 > wikipedia-lb.eqiad.wikimedia.org.http: Flags [S], seq 2896261876, win 14600, options [mss 1460,sackOK,TS val 71217279 ecr 0,nop,wscale 6], length 0
21:50:30.633535 IP dhcp-140-247-103-184.fas.harvard.edu.57733 > bits-lb.eqiad.wikimedia.org.http: Flags [S], seq 16028610, win 14600, options [mss 1460,sackOK,TS val 71217280 ecr 0,nop,wscale 6], length 0
21:50:30.633600 IP dhcp-140-247-103-184.fas.harvard.edu.57734 > bits-lb.eqiad.wikimedia.org.http: Flags [S], seq 1668684857, win 14600, options [mss 1460,sackOK,TS val 71217280 ecr 0,nop,wscale 6], length 0
21:50:30.633650 IP dhcp-140-247-103-184.fas.harvard.edu.57735 > bits-lb.eqiad.wikimedia.org.http: Flags [S], seq 1631620949, win 14600, options [mss 1460,sackOK,TS val 71217280 ecr 0,nop,wscale 6], length 0
21:50:30.633705 IP dhcp-140-247-103-184.fas.harvard.edu.57736 > bits-lb.eqiad.wikimedia.org.http: Flags [S], seq 1348011589, win 14600, options [mss 1460,sackOK,TS val 71217280 ecr 0,nop,wscale 6], length 0
21:50:30.633763 IP dhcp-140-247-103-184.fas.harvard.edu.57737 > bits-lb.eqiad.wikimedia.org.http: Flags [S], seq 3854219463, win 14600, options [mss 1460,sackOK,TS val 71217280 ecr 0,nop,wscale 6], length 0
21:50:30.633816 IP dhcp-140-247-103-184.fas.harvard.edu.57738 > bits-lb.eqiad.wikimedia.org.http: Flags [S], seq 2731159258, win 14600, options [mss 1460,sackOK,TS val 71217280 ecr 0,nop,wscale 6], length 0
21:50:30.633979 IP dhcp-140-247-103-184.fas.harvard.edu.39712 > wikimedia-lb.eqiad.wikimedia.org.http: Flags [S], seq 4242361836, win 14600, options [mss 1460,sackOK,TS val 71217280 ecr 0,nop,wscale 6], length 0
21:50:30.634030 IP dhcp-140-247-103-184.fas.harvard.edu.39713 > wikimedia-lb.eqiad.wikimedia.org.http: Flags [S], seq 1577524316, win 14600, options [mss 1460,sackOK,TS val 71217280 ecr 0,nop,wscale 6], length 0
21:50:30.634088 IP dhcp-140-247-103-184.fas.harvard.edu.39714 > wikimedia-lb.eqiad.wikimedia.org.http: Flags [S], seq 2200962250, win 14600, options [mss 1460,sackOK,TS val 71217280 ecr 0,nop,wscale 6], length 0
21:50:30.634137 IP dhcp-140-247-103-184.fas.harvard.edu.39715 > wikimedia-lb.eqiad.wikimedia.org.http: Flags [S], seq 1945418963, win 14600, options [mss 1460,sackOK,TS val 71217280 ecr 0,nop,wscale 6], length 0
21:50:30.634186 IP dhcp-140-247-103-184.fas.harvard.edu.39716 > wikimedia-lb.eqiad.wikimedia.org.http: Flags [S], seq 2401296837, win 14600, options [mss 1460,sackOK,TS val 71217280 ecr 0,nop,wscale 6], length 0
21:50:30.634241 IP dhcp-140-247-103-184.fas.harvard.edu.39717 > wikimedia-lb.eqiad.wikimedia.org.http: Flags [S], seq 3323126479, win 14600, options [mss 1460,sackOK,TS val 71217280 ecr 0,nop,wscale 6], length 0
21:50:30.634399 IP dhcp-140-247-103-184.fas.harvard.edu.56325 > upload-lb.eqiad.wikimedia.org.http: Flags [S], seq 135722713, win 14600, options [mss 1460,sackOK,TS val 71217280 ecr 0,nop,wscale 6], length 0
21:50:30.634451 IP dhcp-140-247-103-184.fas.harvard.edu.56326 > upload-lb.eqiad.wikimedia.org.http: Flags [S], seq 3536318599, win 14600, options [mss 1460,sackOK,TS val 71217280 ecr 0,nop,wscale 6], length 0
21:50:30.634497 IP dhcp-140-247-103-184.fas.harvard.edu.56327 > upload-lb.eqiad.wikimedia.org.http: Flags [S], seq 2644011958, win 14600, options [mss 1460,sackOK,TS val 71217280 ecr 0,nop,wscale 6], length 0
21:50:30.634544 IP dhcp-140-247-103-184.fas.harvard.edu.56328 > upload-lb.eqiad.wikimedia.org.http: Flags [S], seq 1830451532, win 14600, options [mss 1460,sackOK,TS val 71217280 ecr 0,nop,wscale 6], length 0
21:50:30.634591 IP dhcp-140-247-103-184.fas.harvard.edu.56329 > upload-lb.eqiad.wikimedia.org.http: Flags [S], seq 3718502030, win 14600, options [mss 1460,sackOK,TS val 71217280 ecr 0,nop,wscale 6], length 0
21:50:30.634647 IP dhcp-140-247-103-184.fas.harvard.edu.56330 > upload-lb.eqiad.wikimedia.org.http: Flags [S], seq 1464080071, win 14600, options [mss 1460,sackOK,TS val 71217280 ecr 0,nop,wscale 6], length 0
21:50:30.672345 IP wikipedia-lb.eqiad.wikimedia.org.http > dhcp-140-247-103-184.fas.harvard.edu.59894: Flags [S.], seq 2438871057, ack 3466013063, win 5792, options [mss 1380,sackOK,TS val 4011359160 ecr 71217279,nop,wscale 9], length 0
21:50:30.672388 IP dhcp-140-247-103-184.fas.harvard.edu.59894 > wikipedia-lb.eqiad.wikimedia.org.http: Flags [.], ack 1, win 229, options [nop,nop,TS val 71217284 ecr 4011359160], length 0
21:50:30.672399 IP wikipedia-lb.eqiad.wikimedia.org.http > dhcp-140-247-103-184.fas.harvard.edu.59895: Flags [S.], seq 3904467747, ack 853881345, win 5792, options [mss 1380,sackOK,TS val 4011410600 ecr 71217279,nop,wscale 9], length 0
21:50:30.672410 IP dhcp-140-247-103-184.fas.harvard.edu.59895 > wikipedia-lb.eqiad.wikimedia.org.http: Flags [.], ack 1, win 229, options [nop,nop,TS val 71217284 ecr 4011410600], length 0
21:50:30.672444 IP wikipedia-lb.eqiad.wikimedia.org.http > dhcp-140-247-103-184.fas.harvard.edu.59896: Flags [S.], seq 2937310758, ack 2896261877, win 5792, options [mss 1380,sackOK,TS val 4010967151 ecr 71217279,nop,wscale 9], length 0
21:50:30.672463 IP dhcp-140-247-103-184.fas.harvard.edu.59896 > wikipedia-lb.eqiad.wikimedia.org.http: Flags [.], ack 1, win 229, options [nop,nop,TS val 71217284 ecr 4010967151], length 0
21:50:30.675885 IP bits-lb.eqiad.wikimedia.org.http > dhcp-140-247-103-184.fas.harvard.edu.57734: Flags [S.], seq 1391869189, ack 1668684858, win 14480, options [mss 1380,sackOK,TS val 983569640 ecr 71217280,nop,wscale 9], length 0
21:50:30.675917 IP dhcp-140-247-103-184.fas.harvard.edu.57734 > bits-lb.eqiad.wikimedia.org.http: Flags [.], ack 1, win 229, options [nop,nop,TS val 71217284 ecr 983569640], length 0
21:50:30.675924 IP bits-lb.eqiad.wikimedia.org.http > dhcp-140-247-103-184.fas.harvard.edu.57735: Flags [S.], seq 1468021950, ack 1631620950, win 14480, options [mss 1380,sackOK,TS val 1025314362 ecr 71217280,nop,wscale 9], length 0
21:50:30.675934 IP dhcp-140-247-103-184.fas.harvard.edu.57735 > bits-lb.eqiad.wikimedia.org.http: Flags [.], ack 1, win 229, options [nop,nop,TS val 71217284 ecr 1025314362], length 0
21:50:30.675938 IP bits-lb.eqiad.wikimedia.org.http > dhcp-140-247-103-184.fas.harvard.edu.57733: Flags [S.], seq 1081276389, ack 16028611, win 14480, options [mss 1380,sackOK,TS val 984550441 ecr 71217280,nop,wscale 9], length 0
21:50:30.675949 IP dhcp-140-247-103-184.fas.harvard.edu.57733 > bits-lb.eqiad.wikimedia.org.http: Flags [.], ack 1, win 229, options [nop,nop,TS val 71217284 ecr 984550441], length 0
21:50:30.676047 IP bits-lb.eqiad.wikimedia.org.http > dhcp-140-247-103-184.fas.harvard.edu.57737: Flags [S.], seq 2391263920, ack 3854219464, win 14480, options [mss 1380,sackOK,TS val 984550441 ecr 71217280,nop,wscale 9], length 0
21:50:30.676065 IP dhcp-140-247-103-184.fas.harvard.edu.57737 > bits-lb.eqiad.wikimedia.org.http: Flags [.], ack 1, win 229, options [nop,nop,TS val 71217284 ecr 984550441], length 0
21:50:30.676071 IP bits-lb.eqiad.wikimedia.org.http > dhcp-140-247-103-184.fas.harvard.edu.57738: Flags [S.], seq 3906064444, ack 2731159259, win 14480, options [mss 1380,sackOK,TS val 1025314362 ecr 71217280,nop,wscale 9], length 0
21:50:30.676081 IP dhcp-140-247-103-184.fas.harvard.edu.57738 > bits-lb.eqiad.wikimedia.org.http: Flags [.], ack 1, win 229, options [nop,nop,TS val 71217284 ecr 1025314362], length 0
21:50:30.676114 IP bits-lb.eqiad.wikimedia.org.http > dhcp-140-247-103-184.fas.harvard.edu.57736: Flags [S.], seq 1461888976, ack 1348011590, win 14480, options [mss 1380,sackOK,TS val 983569640 ecr 71217280,nop,wscale 9], length 0
21:50:30.676132 IP dhcp-140-247-103-184.fas.harvard.edu.57736 > bits-lb.eqiad.wikimedia.org.http: Flags [.], ack 1, win 229, options [nop,nop,TS val 71217284 ecr 983569640], length 0
21:50:30.696153 IP dhcp-140-247-103-184.fas.harvard.edu.59893 > wikipedia-lb.eqiad.wikimedia.org.http: Flags [P.], seq 4276:5057, ack 4243, win 424, options [nop,nop,TS val 71217286 ecr 4010966963], length 781
21:50:30.699292 IP wikimedia-lb.eqiad.wikimedia.org.http > dhcp-140-247-103-184.fas.harvard.edu.39712: Flags [S.], seq 4140247146, ack 4242361837, win 5792, options [mss 1380,sackOK,TS val 4011384171 ecr 71217280,nop,wscale 9], length 0
21:50:30.699357 IP dhcp-140-247-103-184.fas.harvard.edu.39712 > wikimedia-lb.eqiad.wikimedia.org.http: Flags [.], ack 1, win 229, options [nop,nop,TS val 71217286 ecr 4011384171], length 0
21:50:30.699400 IP wikimedia-lb.eqiad.wikimedia.org.http > dhcp-140-247-103-184.fas.harvard.edu.39713: Flags [S.], seq 3859244099, ack 1577524317, win 5792, options [mss 1380,sackOK,TS val 4011259476 ecr 71217280,nop,wscale 9], length 0
21:50:30.699419 IP dhcp-140-247-103-184.fas.harvard.edu.39713 > wikimedia-lb.eqiad.wikimedia.org.http: Flags [.], ack 1, win 229, options [nop,nop,TS val 71217286 ecr 4011259476], length 0
21:50:30.699479 IP wikimedia-lb.eqiad.wikimedia.org.http > dhcp-140-247-103-184.fas.harvard.edu.39714: Flags [S.], seq 2544895579, ack 2200962251, win 5792, options [mss 1380,sackOK,TS val 4011254640 ecr 71217280,nop,wscale 9], length 0
21:50:30.699500 IP dhcp-140-247-103-184.fas.harvard.edu.39714 > wikimedia-lb.eqiad.wikimedia.org.http: Flags [.], ack 1, win 229, options [nop,nop,TS val 71217286 ecr 4011254640], length 0
21:50:30.699558 IP wikimedia-lb.eqiad.wikimedia.org.http > dhcp-140-247-103-184.fas.harvard.edu.39716: Flags [S.], seq 923004483, ack 2401296838, win 5792, options [mss 1380,sackOK,TS val 4011112737 ecr 71217280,nop,wscale 9], length 0
21:50:30.699578 IP dhcp-140-247-103-184.fas.harvard.edu.39716 > wikimedia-lb.eqiad.wikimedia.org.http: Flags [.], ack 1, win 229, options [nop,nop,TS val 71217286 ecr 4011112737], length 0
21:50:30.699585 IP wikimedia-lb.eqiad.wikimedia.org.http > dhcp-140-247-103-184.fas.harvard.edu.39715: Flags [S.], seq 2548172455, ack 1945418964, win 5792, options [mss 1380,sackOK,TS val 3967092222 ecr 71217280,nop,wscale 9], length 0
21:50:30.699596 IP dhcp-140-247-103-184.fas.harvard.edu.39715 > wikimedia-lb.eqiad.wikimedia.org.http: Flags [.], ack 1, win 229, options [nop,nop,TS val 71217286 ecr 3967092222], length 0
21:50:30.699602 IP wikimedia-lb.eqiad.wikimedia.org.http > dhcp-140-247-103-184.fas.harvard.edu.39717: Flags [S.], seq 3524656621, ack 3323126480, win 5792, options [mss 1380,sackOK,TS val 4011066660 ecr 71217280,nop,wscale 9], length 0
21:50:30.699612 IP dhcp-140-247-103-184.fas.harvard.edu.39717 > wikimedia-lb.eqiad.wikimedia.org.http: Flags [.], ack 1, win 229, options [nop,nop,TS val 71217286 ecr 4011066660], length 0
21:50:30.699675 IP upload-lb.eqiad.wikimedia.org.http > dhcp-140-247-103-184.fas.harvard.edu.56326: Flags [S.], seq 2567321010, ack 3536318600, win 14480, options [mss 1380,sackOK,TS val 657084438 ecr 71217280,nop,wscale 9], length 0
21:50:30.699693 IP dhcp-140-247-103-184.fas.harvard.edu.56326 > upload-lb.eqiad.wikimedia.org.http: Flags [.], ack 1, win 229, options [nop,nop,TS val 71217286 ecr 657084438], length 0
21:50:30.699751 IP upload-lb.eqiad.wikimedia.org.http > dhcp-140-247-103-184.fas.harvard.edu.56327: Flags [S.], seq 2479357227, ack 2644011959, win 14480, options [mss 1380,sackOK,TS val 657084438 ecr 71217280,nop,wscale 9], length 0
21:50:30.699770 IP dhcp-140-247-103-184.fas.harvard.edu.56327 > upload-lb.eqiad.wikimedia.org.http: Flags [.], ack 1, win 229, options [nop,nop,TS val 71217286 ecr 657084438], length 0
21:50:30.699831 IP upload-lb.eqiad.wikimedia.org.http > dhcp-140-247-103-184.fas.harvard.edu.56325: Flags [S.], seq 88958163, ack 135722714, win 14480, options [mss 1380,sackOK,TS val 657084438 ecr 71217280,nop,wscale 9], length 0
21:50:30.699856 IP dhcp-140-247-103-184.fas.harvard.edu.56325 > upload-lb.eqiad.wikimedia.org.http: Flags [.], ack 1, win 229, options [nop,nop,TS val 71217286 ecr 657084438], length 0
21:50:30.699867 IP upload-lb.eqiad.wikimedia.org.http > dhcp-140-247-103-184.fas.harvard.edu.56328: Flags [S.], seq 1322807935, ack 1830451533, win 14480, options [mss 1380,sackOK,TS val 657084438 ecr 71217280,nop,wscale 9], length 0
21:50:30.699883 IP dhcp-140-247-103-184.fas.harvard.edu.56328 > upload-lb.eqiad.wikimedia.org.http: Flags [.], ack 1, win 229, options [nop,nop,TS val 71217286 ecr 657084438], length 0
21:50:30.699891 IP upload-lb.eqiad.wikimedia.org.http > dhcp-140-247-103-184.fas.harvard.edu.56329: Flags [S.], seq 1826443340, ack 3718502031, win 14480, options [mss 1380,sackOK,TS val 712750013 ecr 71217280,nop,wscale 9], length 0
21:50:30.699903 IP dhcp-140-247-103-184.fas.harvard.edu.56329 > upload-lb.eqiad.wikimedia.org.http: Flags [.], ack 1, win 229, options [nop,nop,TS val 71217286 ecr 712750013], length 0
21:50:30.699910 IP upload-lb.eqiad.wikimedia.org.http > dhcp-140-247-103-184.fas.harvard.edu.56330: Flags [S.], seq 3177590541, ack 1464080072, win 14480, options [mss 1380,sackOK,TS val 3466268388 ecr 71217280,nop,wscale 9], length 0
21:50:30.699922 IP dhcp-140-247-103-184.fas.harvard.edu.56330 > upload-lb.eqiad.wikimedia.org.http: Flags [.], ack 1, win 229, options [nop,nop,TS val 71217286 ecr 3466268388], length 0
21:50:30.738420 IP wikipedia-lb.eqiad.wikimedia.org.http > dhcp-140-247-103-184.fas.harvard.edu.59893: Flags [.], ack 5057, win 32, options [nop,nop,TS val 4010967157 ecr 71217286], length 0
21:50:30.822150 IP wikipedia-lb.eqiad.wikimedia.org.http > dhcp-140-247-103-184.fas.harvard.edu.59893: Flags [P.], seq 4243:4849, ack 5057, win 32, options [nop,nop,TS val 4010967166 ecr 71217286], length 606
21:50:30.822175 IP dhcp-140-247-103-184.fas.harvard.edu.59893 > wikipedia-lb.eqiad.wikimedia.org.http: Flags [.], ack 4849, win 442, options [nop,nop,TS val 71217299 ecr 4010967166], length 0
21:50:30.822185 IP wikipedia-lb.eqiad.wikimedia.org.http > dhcp-140-247-103-184.fas.harvard.edu.59893: Flags [P.], seq 4849:4869, ack 5057, win 32, options [nop,nop,TS val 4010967166 ecr 71217286], length 20
21:50:30.822191 IP dhcp-140-247-103-184.fas.harvard.edu.59893 > wikipedia-lb.eqiad.wikimedia.org.http: Flags [.], ack 4869, win 442, options [nop,nop,TS val 71217299 ecr 4010967166], length 0
21:50:30.825709 IP dhcp-140-247-103-184.fas.harvard.edu.59893 > wikipedia-lb.eqiad.wikimedia.org.http: Flags [P.], seq 5057:5803, ack 4869, win 442, options [nop,nop,TS val 71217299 ecr 4010967166], length 746
21:50:30.867980 IP wikipedia-lb.eqiad.wikimedia.org.http > dhcp-140-247-103-184.fas.harvard.edu.59893: Flags [.], ack 5803, win 35, options [nop,nop,TS val 4010967170 ecr 71217299], length 0
21:50:30.870553 IP wikipedia-lb.eqiad.wikimedia.org.http > dhcp-140-247-103-184.fas.harvard.edu.59893: Flags [P.], seq 4869:5435, ack 5803, win 35, options [nop,nop,TS val 4010967170 ecr 71217299], length 566
21:50:30.870644 IP wikipedia-lb.eqiad.wikimedia.org.http > dhcp-140-247-103-184.fas.harvard.edu.59893: Flags [.], seq 5435:8171, ack 5803, win 35, options [nop,nop,TS val 4010967170 ecr 71217299], length 2736
21:50:30.870667 IP dhcp-140-247-103-184.fas.harvard.edu.59893 > wikipedia-lb.eqiad.wikimedia.org.http: Flags [.], ack 8171, win 547, options [nop,nop,TS val 71217303 ecr 4010967170], length 0
21:50:30.870711 IP wikipedia-lb.eqiad.wikimedia.org.http > dhcp-140-247-103-184.fas.harvard.edu.59893: Flags [P.], seq 8171:9531, ack 5803, win 35, options [nop,nop,TS val 4010967170 ecr 71217299], length 1360
21:50:30.870787 IP wikipedia-lb.eqiad.wikimedia.org.http > dhcp-140-247-103-184.fas.harvard.edu.59893: Flags [.], seq 9531:12267, ack 5803, win 35, options [nop,nop,TS val 4010967170 ecr 71217299], length 2736
21:50:30.870805 IP dhcp-140-247-103-184.fas.harvard.edu.59893 > wikipedia-lb.eqiad.wikimedia.org.http: Flags [.], ack 12267, win 644, options [nop,nop,TS val 71217303 ecr 4010967170], length 0
21:50:30.870886 IP wikipedia-lb.eqiad.wikimedia.org.http > dhcp-140-247-103-184.fas.harvard.edu.59893: Flags [P.], seq 12267:13627, ack 5803, win 35, options [nop,nop,TS val 4010967170 ecr 71217299], length 1360
21:50:30.871134 IP wikipedia-lb.eqiad.wikimedia.org.http > dhcp-140-247-103-184.fas.harvard.edu.59893: Flags [.], seq 13627:17731, ack 5803, win 35, options [nop,nop,TS val 4010967170 ecr 71217299], length 4104
21:50:30.887284 IP dhcp-140-247-103-184.fas.harvard.edu.59893 > wikipedia-lb.eqiad.wikimedia.org.http: Flags [.], ack 17731, win 661, options [nop,nop,TS val 71217305 ecr 4010967170], length 0
21:50:30.912919 IP wikipedia-lb.eqiad.wikimedia.org.http > dhcp-140-247-103-184.fas.harvard.edu.59893: Flags [.], seq 17731:23203, ack 5803, win 35, options [nop,nop,TS val 4010967175 ecr 71217303], length 5472
21:50:30.913068 IP dhcp-140-247-103-184.fas.harvard.edu.59893 > wikipedia-lb.eqiad.wikimedia.org.http: Flags [.], ack 23203, win 661, options [nop,nop,TS val 71217308 ecr 4010967175], length 0
21:50:30.913092 IP wikipedia-lb.eqiad.wikimedia.org.http > dhcp-140-247-103-184.fas.harvard.edu.59893: Flags [.], seq 23203:27307, ack 5803, win 35, options [nop,nop,TS val 4010967175 ecr 71217303], length 4104
21:50:30.913144 IP wikipedia-lb.eqiad.wikimedia.org.http > dhcp-140-247-103-184.fas.harvard.edu.59893: Flags [.], seq 27307:28675, ack 5803, win 35, options [nop,nop,TS val 4010967175 ecr 71217303], length 1368
21:50:30.913630 IP dhcp-140-247-103-184.fas.harvard.edu.59893 > wikipedia-lb.eqiad.wikimedia.org.http: Flags [.], ack 28675, win 661, options [nop,nop,TS val 71217308 ecr 4010967175], length 0
21:50:30.929468 IP wikipedia-lb.eqiad.wikimedia.org.http > dhcp-140-247-103-184.fas.harvard.edu.59893: Flags [.], seq 28675:30043, ack 5803, win 35, options [nop,nop,TS val 4010967176 ecr 71217305], length 1368
21:50:30.929538 IP wikipedia-lb.eqiad.wikimedia.org.http > dhcp-140-247-103-184.fas.harvard.edu.59893: Flags [.], seq 30043:31411, ack 5803, win 35, options [nop,nop,TS val 4010967176 ecr 71217305], length 1368
21:50:30.929559 IP dhcp-140-247-103-184.fas.harvard.edu.59893 > wikipedia-lb.eqiad.wikimedia.org.http: Flags [.], ack 31411, win 661, options [nop,nop,TS val 71217309 ecr 4010967176], length 0
21:50:30.955434 IP wikipedia-lb.eqiad.wikimedia.org.http > dhcp-140-247-103-184.fas.harvard.edu.59893: Flags [.], seq 31411:35515, ack 5803, win 35, options [nop,nop,TS val 4010967179 ecr 71217308], length 4104
21:50:30.955527 IP wikipedia-lb.eqiad.wikimedia.org.http > dhcp-140-247-103-184.fas.harvard.edu.59893: Flags [.], seq 35515:40987, ack 5803, win 35, options [nop,nop,TS val 4010967179 ecr 71217308], length 5472
21:50:30.955530 IP dhcp-140-247-103-184.fas.harvard.edu.59893 > wikipedia-lb.eqiad.wikimedia.org.http: Flags [.], ack 35515, win 661, options [nop,nop,TS val 71217312 ecr 4010967179], length 0
21:50:30.955579 IP wikipedia-lb.eqiad.wikimedia.org.http > dhcp-140-247-103-184.fas.harvard.edu.59893: Flags [.], seq 40987:42355, ack 5803, win 35, options [nop,nop,TS val 4010967179 ecr 71217308], length 1368
21:50:30.955926 IP dhcp-140-247-103-184.fas.harvard.edu.59893 > wikipedia-lb.eqiad.wikimedia.org.http: Flags [.], ack 42355, win 661, options [nop,nop,TS val 71217312 ecr 4010967179], length 0
21:50:30.955963 IP wikipedia-lb.eqiad.wikimedia.org.http > dhcp-140-247-103-184.fas.harvard.edu.59893: Flags [.], seq 42355:45091, ack 5803, win 35, options [nop,nop,TS val 4010967179 ecr 71217308], length 2736
21:50:30.956394 IP dhcp-140-247-103-184.fas.harvard.edu.59893 > wikipedia-lb.eqiad.wikimedia.org.http: Flags [.], ack 45091, win 661, options [nop,nop,TS val 71217312 ecr 4010967179], length 0
21:50:30.971902 IP wikipedia-lb.eqiad.wikimedia.org.http > dhcp-140-247-103-184.fas.harvard.edu.59893: Flags [.], seq 45091:53299, ack 5803, win 35, options [nop,nop,TS val 4010967180 ecr 71217309], length 8208
21:50:30.972036 IP dhcp-140-247-103-184.fas.harvard.edu.59893 > wikipedia-lb.eqiad.wikimedia.org.http: Flags [.], ack 53299, win 661, options [nop,nop,TS val 71217314 ecr 4010967180], length 0
21:50:30.998253 IP wikipedia-lb.eqiad.wikimedia.org.http > dhcp-140-247-103-184.fas.harvard.edu.59893: Flags [P.], seq 53299:58410, ack 5803, win 35, options [nop,nop,TS val 4010967183 ecr 71217312], length 5111
21:50:30.998289 IP dhcp-140-247-103-184.fas.harvard.edu.59893 > wikipedia-lb.eqiad.wikimedia.org.http: Flags [.], ack 58410, win 683, options [nop,nop,TS val 71217316 ecr 4010967183], length 0
21:50:31.205128 IP dhcp-140-247-103-184.fas.harvard.edu.57734 > bits-lb.eqiad.wikimedia.org.http: Flags [P.], seq 1:637, ack 1, win 229, options [nop,nop,TS val 71217337 ecr 983569640], length 636
21:50:31.205392 IP dhcp-140-247-103-184.fas.harvard.edu.57735 > bits-lb.eqiad.wikimedia.org.http: Flags [P.], seq 1:480, ack 1, win 229, options [nop,nop,TS val 71217337 ecr 1025314362], length 479
21:50:31.205644 IP dhcp-140-247-103-184.fas.harvard.edu.57733 > bits-lb.eqiad.wikimedia.org.http: Flags [P.], seq 1:469, ack 1, win 229, options [nop,nop,TS val 71217337 ecr 984550441], length 468
21:50:31.205865 IP dhcp-140-247-103-184.fas.harvard.edu.57737 > bits-lb.eqiad.wikimedia.org.http: Flags [P.], seq 1:392, ack 1, win 229, options [nop,nop,TS val 71217337 ecr 984550441], length 391
21:50:31.206111 IP dhcp-140-247-103-184.fas.harvard.edu.59893 > wikipedia-lb.eqiad.wikimedia.org.http: Flags [P.], seq 5803:6622, ack 58410, win 726, options [nop,nop,TS val 71217337 ecr 4010967183], length 819
21:50:31.206320 IP dhcp-140-247-103-184.fas.harvard.edu.57738 > bits-lb.eqiad.wikimedia.org.http: Flags [P.], seq 1:466, ack 1, win 229, options [nop,nop,TS val 71217337 ecr 1025314362], length 465
21:50:31.247405 IP bits-lb.eqiad.wikimedia.org.http > dhcp-140-247-103-184.fas.harvard.edu.57734: Flags [.], ack 637, win 31, options [nop,nop,TS val 983569783 ecr 71217337], length 0
21:50:31.247619 IP bits-lb.eqiad.wikimedia.org.http > dhcp-140-247-103-184.fas.harvard.edu.57735: Flags [.], ack 480, win 31, options [nop,nop,TS val 1025314505 ecr 71217337], length 0
21:50:31.247889 IP bits-lb.eqiad.wikimedia.org.http > dhcp-140-247-103-184.fas.harvard.edu.57734: Flags [.], seq 1:5473, ack 637, win 31, options [nop,nop,TS val 983569783 ecr 71217337], length 5472
21:50:31.247957 IP dhcp-140-247-103-184.fas.harvard.edu.57734 > bits-lb.eqiad.wikimedia.org.http: Flags [.], ack 5473, win 400, options [nop,nop,TS val 71217341 ecr 983569783], length 0
21:50:31.248043 IP bits-lb.eqiad.wikimedia.org.http > dhcp-140-247-103-184.fas.harvard.edu.57735: Flags [P.], seq 1:5934, ack 480, win 31, options [nop,nop,TS val 1025314505 ecr 71217337], length 5933
21:50:31.248066 IP dhcp-140-247-103-184.fas.harvard.edu.57735 > bits-lb.eqiad.wikimedia.org.http: Flags [.], ack 5934, win 414, options [nop,nop,TS val 71217341 ecr 1025314505], length 0
21:50:31.248073 IP bits-lb.eqiad.wikimedia.org.http > dhcp-140-247-103-184.fas.harvard.edu.57734: Flags [P.], seq 5473:13681, ack 637, win 31, options [nop,nop,TS val 983569783 ecr 71217337], length 8208
21:50:31.248084 IP dhcp-140-247-103-184.fas.harvard.edu.57734 > bits-lb.eqiad.wikimedia.org.http: Flags [.], ack 13681, win 570, options [nop,nop,TS val 71217341 ecr 983569783], length 0
21:50:31.248089 IP bits-lb.eqiad.wikimedia.org.http > dhcp-140-247-103-184.fas.harvard.edu.57733: Flags [.], ack 469, win 31, options [nop,nop,TS val 984550584 ecr 71217337], length 0
21:50:31.248098 IP bits-lb.eqiad.wikimedia.org.http > dhcp-140-247-103-184.fas.harvard.edu.57737: Flags [.], ack 392, win 31, options [nop,nop,TS val 984550584 ecr 71217337], length 0
21:50:31.248188 IP bits-lb.eqiad.wikimedia.org.http > dhcp-140-247-103-184.fas.harvard.edu.57733: Flags [.], seq 1:2737, ack 469, win 31, options [nop,nop,TS val 984550584 ecr 71217337], length 2736
21:50:31.248202 IP dhcp-140-247-103-184.fas.harvard.edu.57733 > bits-lb.eqiad.wikimedia.org.http: Flags [.], ack 2737, win 314, options [nop,nop,TS val 71217341 ecr 984550584], length 0
21:50:31.248244 IP bits-lb.eqiad.wikimedia.org.http > dhcp-140-247-103-184.fas.harvard.edu.57733: Flags [.], seq 2737:5473, ack 469, win 31, options [nop,nop,TS val 984550584 ecr 71217337], length 2736
21:50:31.248261 IP dhcp-140-247-103-184.fas.harvard.edu.57733 > bits-lb.eqiad.wikimedia.org.http: Flags [.], ack 5473, win 400, options [nop,nop,TS val 71217341 ecr 984550584], length 0
21:50:31.248293 IP bits-lb.eqiad.wikimedia.org.http > dhcp-140-247-103-184.fas.harvard.edu.57733: Flags [.], seq 5473:8209, ack 469, win 31, options [nop,nop,TS val 984550584 ecr 71217337], length 2736
21:50:31.248306 IP dhcp-140-247-103-184.fas.harvard.edu.57733 > bits-lb.eqiad.wikimedia.org.http: Flags [.], ack 8209, win 485, options [nop,nop,TS val 71217341 ecr 984550584], length 0
