22:44:39.764385 IP dhcp-140-247-103-184.fas.harvard.edu.50790 > vb-in-f108.1e100.net.imaps: Flags [P.], seq 547042965:547043045, ack 3249035525, win 1316, options [nop,nop,TS val 10257117 ecr 1773883297], length 80
22:44:39.803432 IP vb-in-f108.1e100.net.imaps > dhcp-140-247-103-184.fas.harvard.edu.50790: Flags [.], ack 80, win 1002, options [nop,nop,TS val 1773901654 ecr 10257117], length 0
22:44:39.934069 IP vb-in-f108.1e100.net.imaps > dhcp-140-247-103-184.fas.harvard.edu.50790: Flags [P.], seq 1:120, ack 80, win 1002, options [nop,nop,TS val 1773901784 ecr 10257117], length 119
22:44:39.934090 IP dhcp-140-247-103-184.fas.harvard.edu.50790 > vb-in-f108.1e100.net.imaps: Flags [.], ack 120, win 1315, options [nop,nop,TS val 10257134 ecr 1773901784], length 0
22:44:39.935542 IP dhcp-140-247-103-184.fas.harvard.edu.50790 > vb-in-f108.1e100.net.imaps: Flags [P.], seq 80:122, ack 120, win 1316, options [nop,nop,TS val 10257134 ecr 1773901784], length 42
22:44:39.974832 IP vb-in-f108.1e100.net.imaps > dhcp-140-247-103-184.fas.harvard.edu.50790: Flags [.], ack 122, win 1002, options [nop,nop,TS val 1773901825 ecr 10257134], length 0
22:44:40.122124 IP vb-in-f108.1e100.net.imaps > dhcp-140-247-103-184.fas.harvard.edu.50790: Flags [P.], seq 120:464, ack 122, win 1002, options [nop,nop,TS val 1773901972 ecr 10257134], length 344
22:44:40.123024 IP dhcp-140-247-103-184.fas.harvard.edu.50790 > vb-in-f108.1e100.net.imaps: Flags [P.], seq 122:177, ack 464, win 1316, options [nop,nop,TS val 10257152 ecr 1773901972], length 55
22:44:40.162124 IP vb-in-f108.1e100.net.imaps > dhcp-140-247-103-184.fas.harvard.edu.50790: Flags [.], ack 177, win 1002, options [nop,nop,TS val 1773902012 ecr 10257152], length 0
22:44:40.814961 IP vb-in-f108.1e100.net.imaps > dhcp-140-247-103-184.fas.harvard.edu.50790: Flags [.], seq 464:1832, ack 177, win 1002, options [nop,nop,TS val 1773902665 ecr 10257152], length 1368
22:44:40.814986 IP vb-in-f108.1e100.net.imaps > dhcp-140-247-103-184.fas.harvard.edu.50790: Flags [P.], seq 1832:1889, ack 177, win 1002, options [nop,nop,TS val 1773902665 ecr 10257152], length 57
22:44:40.814991 IP vb-in-f108.1e100.net.imaps > dhcp-140-247-103-184.fas.harvard.edu.50790: Flags [.], seq 1889:3257, ack 177, win 1002, options [nop,nop,TS val 1773902665 ecr 10257152], length 1368
22:44:40.814995 IP vb-in-f108.1e100.net.imaps > dhcp-140-247-103-184.fas.harvard.edu.50790: Flags [P.], seq 3257:3314, ack 177, win 1002, options [nop,nop,TS val 1773902665 ecr 10257152], length 57
22:44:40.814998 IP vb-in-f108.1e100.net.imaps > dhcp-140-247-103-184.fas.harvard.edu.50790: Flags [.], seq 3314:4682, ack 177, win 1002, options [nop,nop,TS val 1773902665 ecr 10257152], length 1368
22:44:40.815001 IP vb-in-f108.1e100.net.imaps > dhcp-140-247-103-184.fas.harvard.edu.50790: Flags [P.], seq 4682:4739, ack 177, win 1002, options [nop,nop,TS val 1773902665 ecr 10257152], length 57
22:44:40.815023 IP vb-in-f108.1e100.net.imaps > dhcp-140-247-103-184.fas.harvard.edu.50790: Flags [.], seq 4739:6107, ack 177, win 1002, options [nop,nop,TS val 1773902665 ecr 10257152], length 1368
22:44:40.815034 IP vb-in-f108.1e100.net.imaps > dhcp-140-247-103-184.fas.harvard.edu.50790: Flags [P.], seq 7475:7589, ack 177, win 1002, options [nop,nop,TS val 1773902665 ecr 10257152], length 114
22:44:40.815048 IP dhcp-140-247-103-184.fas.harvard.edu.50790 > vb-in-f108.1e100.net.imaps: Flags [.], ack 6107, win 1245, options [nop,nop,TS val 10257222 ecr 1773902665,nop,nop,sack 1 {7475:7589}], length 0
22:44:40.815056 IP vb-in-f108.1e100.net.imaps > dhcp-140-247-103-184.fas.harvard.edu.50790: Flags [P.], seq 8957:9014, ack 177, win 1002, options [nop,nop,TS val 1773902665 ecr 10257152], length 57
22:44:40.815062 IP dhcp-140-247-103-184.fas.harvard.edu.50790 > vb-in-f108.1e100.net.imaps: Flags [.], ack 6107, win 1245, options [nop,nop,TS val 10257222 ecr 1773902665,nop,nop,sack 2 {8957:9014}{7475:7589}], length 0
22:44:40.815068 IP vb-in-f108.1e100.net.imaps > dhcp-140-247-103-184.fas.harvard.edu.50790: Flags [.], seq 6107:7475, ack 177, win 1002, options [nop,nop,TS val 1773902665 ecr 10257152], length 1368
22:44:40.815074 IP dhcp-140-247-103-184.fas.harvard.edu.50790 > vb-in-f108.1e100.net.imaps: Flags [.], ack 7589, win 1227, options [nop,nop,TS val 10257222 ecr 1773902665,nop,nop,sack 1 {8957:9014}], length 0
22:44:40.815079 IP vb-in-f108.1e100.net.imaps > dhcp-140-247-103-184.fas.harvard.edu.50790: Flags [.], seq 7589:8957, ack 177, win 1002, options [nop,nop,TS val 1773902665 ecr 10257152], length 1368
22:44:40.815085 IP dhcp-140-247-103-184.fas.harvard.edu.50790 > vb-in-f108.1e100.net.imaps: Flags [.], ack 9014, win 1213, options [nop,nop,TS val 10257222 ecr 1773902665], length 0
22:44:40.815089 IP vb-in-f108.1e100.net.imaps > dhcp-140-247-103-184.fas.harvard.edu.50790: Flags [.], seq 9014:10382, ack 177, win 1002, options [nop,nop,TS val 1773902665 ecr 10257152], length 1368
22:44:40.815093 IP dhcp-140-247-103-184.fas.harvard.edu.50790 > vb-in-f108.1e100.net.imaps: Flags [.], ack 10382, win 1198, options [nop,nop,TS val 10257222 ecr 1773902665], length 0
22:44:40.815098 IP vb-in-f108.1e100.net.imaps > dhcp-140-247-103-184.fas.harvard.edu.50790: Flags [P.], seq 10382:10904, ack 177, win 1002, options [nop,nop,TS val 1773902665 ecr 10257152], length 522
22:44:40.815104 IP dhcp-140-247-103-184.fas.harvard.edu.50790 > vb-in-f108.1e100.net.imaps: Flags [.], ack 10904, win 1190, options [nop,nop,TS val 10257222 ecr 1773902665], length 0
22:44:40.815191 IP vb-in-f108.1e100.net.imaps > dhcp-140-247-103-184.fas.harvard.edu.50790: Flags [.], seq 10904:12272, ack 177, win 1002, options [nop,nop,TS val 1773902665 ecr 10257152], length 1368
22:44:40.815200 IP dhcp-140-247-103-184.fas.harvard.edu.50790 > vb-in-f108.1e100.net.imaps: Flags [.], ack 12272, win 1170, options [nop,nop,TS val 10257222 ecr 1773902665], length 0
22:44:40.815207 IP vb-in-f108.1e100.net.imaps > dhcp-140-247-103-184.fas.harvard.edu.50790: Flags [P.], seq 12272:12329, ack 177, win 1002, options [nop,nop,TS val 1773902665 ecr 10257152], length 57
22:44:40.815213 IP dhcp-140-247-103-184.fas.harvard.edu.50790 > vb-in-f108.1e100.net.imaps: Flags [.], ack 12329, win 1170, options [nop,nop,TS val 10257222 ecr 1773902665], length 0
22:44:40.815218 IP vb-in-f108.1e100.net.imaps > dhcp-140-247-103-184.fas.harvard.edu.50790: Flags [.], seq 12329:13697, ack 177, win 1002, options [nop,nop,TS val 1773902665 ecr 10257152], length 1368
22:44:40.815224 IP dhcp-140-247-103-184.fas.harvard.edu.50790 > vb-in-f108.1e100.net.imaps: Flags [.], ack 13697, win 1152, options [nop,nop,TS val 10257222 ecr 1773902665], length 0
22:44:40.815228 IP vb-in-f108.1e100.net.imaps > dhcp-140-247-103-184.fas.harvard.edu.50790: Flags [P.], seq 13697:13754, ack 177, win 1002, options [nop,nop,TS val 1773902665 ecr 10257152], length 57
22:44:40.815233 IP dhcp-140-247-103-184.fas.harvard.edu.50790 > vb-in-f108.1e100.net.imaps: Flags [.], ack 13754, win 1152, options [nop,nop,TS val 10257222 ecr 1773902665], length 0
22:44:40.854636 IP vb-in-f108.1e100.net.imaps > dhcp-140-247-103-184.fas.harvard.edu.50790: Flags [.], seq 13754:15122, ack 177, win 1002, options [nop,nop,TS val 1773902705 ecr 10257222], length 1368
22:44:40.854657 IP dhcp-140-247-103-184.fas.harvard.edu.50790 > vb-in-f108.1e100.net.imaps: Flags [.], ack 15122, win 1302, options [nop,nop,TS val 10257226 ecr 1773902705], length 0
22:44:40.854663 IP vb-in-f108.1e100.net.imaps > dhcp-140-247-103-184.fas.harvard.edu.50790: Flags [.], seq 15122:16490, ack 177, win 1002, options [nop,nop,TS val 1773902705 ecr 10257222], length 1368
22:44:40.854668 IP dhcp-140-247-103-184.fas.harvard.edu.50790 > vb-in-f108.1e100.net.imaps: Flags [.], ack 16490, win 1288, options [nop,nop,TS val 10257226 ecr 1773902705], length 0
22:44:40.854671 IP vb-in-f108.1e100.net.imaps > dhcp-140-247-103-184.fas.harvard.edu.50790: Flags [.], seq 16490:17858, ack 177, win 1002, options [nop,nop,TS val 1773902705 ecr 10257222], length 1368
22:44:40.854676 IP dhcp-140-247-103-184.fas.harvard.edu.50790 > vb-in-f108.1e100.net.imaps: Flags [.], ack 17858, win 1273, options [nop,nop,TS val 10257226 ecr 1773902705], length 0
22:44:40.854680 IP vb-in-f108.1e100.net.imaps > dhcp-140-247-103-184.fas.harvard.edu.50790: Flags [.], seq 17858:19226, ack 177, win 1002, options [nop,nop,TS val 1773902705 ecr 10257222], length 1368
22:44:40.854682 IP dhcp-140-247-103-184.fas.harvard.edu.50790 > vb-in-f108.1e100.net.imaps: Flags [.], ack 19226, win 1259, options [nop,nop,TS val 10257226 ecr 1773902705], length 0
22:44:40.854688 IP vb-in-f108.1e100.net.imaps > dhcp-140-247-103-184.fas.harvard.edu.50790: Flags [.], seq 19226:20594, ack 177, win 1002, options [nop,nop,TS val 1773902705 ecr 10257222], length 1368
22:44:40.854692 IP dhcp-140-247-103-184.fas.harvard.edu.50790 > vb-in-f108.1e100.net.imaps: Flags [.], ack 20594, win 1244, options [nop,nop,TS val 10257226 ecr 1773902705], length 0
22:44:40.854695 IP vb-in-f108.1e100.net.imaps > dhcp-140-247-103-184.fas.harvard.edu.50790: Flags [.], seq 20594:21962, ack 177, win 1002, options [nop,nop,TS val 1773902705 ecr 10257222], length 1368
22:44:40.854698 IP dhcp-140-247-103-184.fas.harvard.edu.50790 > vb-in-f108.1e100.net.imaps: Flags [.], ack 21962, win 1230, options [nop,nop,TS val 10257226 ecr 1773902705], length 0
22:44:40.854702 IP vb-in-f108.1e100.net.imaps > dhcp-140-247-103-184.fas.harvard.edu.50790: Flags [.], seq 21962:23330, ack 177, win 1002, options [nop,nop,TS val 1773902705 ecr 10257222], length 1368
22:44:40.854706 IP dhcp-140-247-103-184.fas.harvard.edu.50790 > vb-in-f108.1e100.net.imaps: Flags [.], ack 23330, win 1216, options [nop,nop,TS val 10257226 ecr 1773902705], length 0
22:44:40.854710 IP vb-in-f108.1e100.net.imaps > dhcp-140-247-103-184.fas.harvard.edu.50790: Flags [.], seq 23330:24698, ack 177, win 1002, options [nop,nop,TS val 1773902705 ecr 10257222], length 1368
22:44:40.854714 IP vb-in-f108.1e100.net.imaps > dhcp-140-247-103-184.fas.harvard.edu.50790: Flags [.], seq 24698:26066, ack 177, win 1002, options [nop,nop,TS val 1773902705 ecr 10257222], length 1368
22:44:40.854717 IP vb-in-f108.1e100.net.imaps > dhcp-140-247-103-184.fas.harvard.edu.50790: Flags [.], seq 26066:27434, ack 177, win 1002, options [nop,nop,TS val 1773902705 ecr 10257222], length 1368
22:44:40.854720 IP vb-in-f108.1e100.net.imaps > dhcp-140-247-103-184.fas.harvard.edu.50790: Flags [.], seq 27434:28802, ack 177, win 1002, options [nop,nop,TS val 1773902705 ecr 10257222], length 1368
22:44:40.854723 IP vb-in-f108.1e100.net.imaps > dhcp-140-247-103-184.fas.harvard.edu.50790: Flags [.], seq 28802:30170, ack 177, win 1002, options [nop,nop,TS val 1773902705 ecr 10257222], length 1368
22:44:40.854840 IP vb-in-f108.1e100.net.imaps > dhcp-140-247-103-184.fas.harvard.edu.50790: Flags [.], seq 30170:31538, ack 177, win 1002, options [nop,nop,TS val 1773902705 ecr 10257222], length 1368
22:44:40.854846 IP vb-in-f108.1e100.net.imaps > dhcp-140-247-103-184.fas.harvard.edu.50790: Flags [.], seq 31538:32906, ack 177, win 1002, options [nop,nop,TS val 1773902705 ecr 10257222], length 1368
22:44:40.854851 IP vb-in-f108.1e100.net.imaps > dhcp-140-247-103-184.fas.harvard.edu.50790: Flags [.], seq 32906:34274, ack 177, win 1002, options [nop,nop,TS val 1773902705 ecr 10257222], length 1368
22:44:40.854854 IP vb-in-f108.1e100.net.imaps > dhcp-140-247-103-184.fas.harvard.edu.50790: Flags [.], seq 34274:35642, ack 177, win 1002, options [nop,nop,TS val 1773902705 ecr 10257222], length 1368
22:44:40.854856 IP vb-in-f108.1e100.net.imaps > dhcp-140-247-103-184.fas.harvard.edu.50790: Flags [.], seq 35642:37010, ack 177, win 1002, options [nop,nop,TS val 1773902705 ecr 10257222], length 1368
22:44:40.854859 IP vb-in-f108.1e100.net.imaps > dhcp-140-247-103-184.fas.harvard.edu.50790: Flags [.], seq 37010:38378, ack 177, win 1002, options [nop,nop,TS val 1773902705 ecr 10257222], length 1368
22:44:40.854862 IP vb-in-f108.1e100.net.imaps > dhcp-140-247-103-184.fas.harvard.edu.50790: Flags [.], seq 38378:39746, ack 177, win 1002, options [nop,nop,TS val 1773902705 ecr 10257222], length 1368
22:44:40.854865 IP vb-in-f108.1e100.net.imaps > dhcp-140-247-103-184.fas.harvard.edu.50790: Flags [.], seq 39746:41114, ack 177, win 1002, options [nop,nop,TS val 1773902705 ecr 10257222], length 1368
22:44:40.854983 IP dhcp-140-247-103-184.fas.harvard.edu.50790 > vb-in-f108.1e100.net.imaps: Flags [.], ack 41114, win 1029, options [nop,nop,TS val 10257226 ecr 1773902705], length 0
22:44:40.855085 IP vb-in-f108.1e100.net.imaps > dhcp-140-247-103-184.fas.harvard.edu.50790: Flags [.], seq 42482:43850, ack 177, win 1002, options [nop,nop,TS val 1773902705 ecr 10257222], length 1368
22:44:40.855098 IP dhcp-140-247-103-184.fas.harvard.edu.50790 > vb-in-f108.1e100.net.imaps: Flags [.], ack 41114, win 1029, options [nop,nop,TS val 10257226 ecr 1773902705,nop,nop,sack 1 {42482:43850}], length 0
22:44:40.855104 IP vb-in-f108.1e100.net.imaps > dhcp-140-247-103-184.fas.harvard.edu.50790: Flags [.], seq 41114:42482, ack 177, win 1002, options [nop,nop,TS val 1773902705 ecr 10257222], length 1368
22:44:40.855109 IP dhcp-140-247-103-184.fas.harvard.edu.50790 > vb-in-f108.1e100.net.imaps: Flags [.], ack 43850, win 1014, options [nop,nop,TS val 10257226 ecr 1773902705], length 0
22:44:40.855114 IP vb-in-f108.1e100.net.imaps > dhcp-140-247-103-184.fas.harvard.edu.50790: Flags [.], seq 43850:45218, ack 177, win 1002, options [nop,nop,TS val 1773902705 ecr 10257222], length 1368
22:44:40.855117 IP dhcp-140-247-103-184.fas.harvard.edu.50790 > vb-in-f108.1e100.net.imaps: Flags [.], ack 45218, win 1000, options [nop,nop,TS val 10257226 ecr 1773902705], length 0
22:44:40.893870 IP vb-in-f108.1e100.net.imaps > dhcp-140-247-103-184.fas.harvard.edu.50790: Flags [.], seq 45218:46586, ack 177, win 1002, options [nop,nop,TS val 1773902744 ecr 10257226], length 1368
22:44:40.893896 IP dhcp-140-247-103-184.fas.harvard.edu.50790 > vb-in-f108.1e100.net.imaps: Flags [.], ack 46586, win 1302, options [nop,nop,TS val 10257230 ecr 1773902744], length 0
22:44:40.893908 IP vb-in-f108.1e100.net.imaps > dhcp-140-247-103-184.fas.harvard.edu.50790: Flags [P.], seq 46586:47735, ack 177, win 1002, options [nop,nop,TS val 1773902744 ecr 10257226], length 1149
22:44:40.893913 IP dhcp-140-247-103-184.fas.harvard.edu.50790 > vb-in-f108.1e100.net.imaps: Flags [.], ack 47735, win 1288, options [nop,nop,TS val 10257230 ecr 1773902744], length 0
22:44:41.374978 IP dhcp-140-247-103-184.fas.harvard.edu.50790 > vb-in-f108.1e100.net.imaps: Flags [P.], seq 177:265, ack 47735, win 1335, options [nop,nop,TS val 10257278 ecr 1773902744], length 88
22:44:41.414076 IP vb-in-f108.1e100.net.imaps > dhcp-140-247-103-184.fas.harvard.edu.50790: Flags [.], ack 265, win 1002, options [nop,nop,TS val 1773903264 ecr 10257278], length 0
22:44:41.544201 IP vb-in-f108.1e100.net.imaps > dhcp-140-247-103-184.fas.harvard.edu.50790: Flags [P.], seq 47735:47857, ack 265, win 1002, options [nop,nop,TS val 1773903394 ecr 10257278], length 122
22:44:41.544222 IP dhcp-140-247-103-184.fas.harvard.edu.50790 > vb-in-f108.1e100.net.imaps: Flags [.], ack 47857, win 1335, options [nop,nop,TS val 10257295 ecr 1773903394], length 0
22:44:41.547503 IP dhcp-140-247-103-184.fas.harvard.edu.50790 > vb-in-f108.1e100.net.imaps: Flags [P.], seq 265:315, ack 47857, win 1335, options [nop,nop,TS val 10257295 ecr 1773903394], length 50
22:44:41.586587 IP vb-in-f108.1e100.net.imaps > dhcp-140-247-103-184.fas.harvard.edu.50790: Flags [.], ack 315, win 1002, options [nop,nop,TS val 1773903437 ecr 10257295], length 0
22:44:41.737887 IP vb-in-f108.1e100.net.imaps > dhcp-140-247-103-184.fas.harvard.edu.50790: Flags [P.], seq 47857:48204, ack 315, win 1002, options [nop,nop,TS val 1773903588 ecr 10257295], length 347
22:44:41.738697 IP dhcp-140-247-103-184.fas.harvard.edu.50790 > vb-in-f108.1e100.net.imaps: Flags [P.], seq 315:370, ack 48204, win 1377, options [nop,nop,TS val 10257314 ecr 1773903588], length 55
22:44:41.777727 IP vb-in-f108.1e100.net.imaps > dhcp-140-247-103-184.fas.harvard.edu.50790: Flags [.], ack 370, win 1002, options [nop,nop,TS val 1773903628 ecr 10257314], length 0
22:44:42.103590 IP vb-in-f108.1e100.net.imaps > dhcp-140-247-103-184.fas.harvard.edu.50790: Flags [.], seq 48204:49572, ack 370, win 1002, options [nop,nop,TS val 1773903954 ecr 10257314], length 1368
22:44:42.103606 IP vb-in-f108.1e100.net.imaps > dhcp-140-247-103-184.fas.harvard.edu.50790: Flags [P.], seq 49572:49861, ack 370, win 1002, options [nop,nop,TS val 1773903954 ecr 10257314], length 289
22:44:42.103615 IP dhcp-140-247-103-184.fas.harvard.edu.50790 > vb-in-f108.1e100.net.imaps: Flags [.], ack 49861, win 1378, options [nop,nop,TS val 10257351 ecr 1773903954], length 0
22:44:42.564087 IP dhcp-140-247-103-184.fas.harvard.edu.50790 > vb-in-f108.1e100.net.imaps: Flags [P.], seq 370:453, ack 49861, win 1407, options [nop,nop,TS val 10257397 ecr 1773903954], length 83
22:44:42.603609 IP vb-in-f108.1e100.net.imaps > dhcp-140-247-103-184.fas.harvard.edu.50790: Flags [.], ack 453, win 1002, options [nop,nop,TS val 1773904453 ecr 10257397], length 0
22:44:42.733424 IP vb-in-f108.1e100.net.imaps > dhcp-140-247-103-184.fas.harvard.edu.50790: Flags [P.], seq 49861:49980, ack 453, win 1002, options [nop,nop,TS val 1773904584 ecr 10257397], length 119
22:44:42.734953 IP dhcp-140-247-103-184.fas.harvard.edu.50790 > vb-in-f108.1e100.net.imaps: Flags [P.], seq 453:498, ack 49980, win 1407, options [nop,nop,TS val 10257414 ecr 1773904584], length 45
22:44:42.774061 IP vb-in-f108.1e100.net.imaps > dhcp-140-247-103-184.fas.harvard.edu.50790: Flags [.], ack 498, win 1002, options [nop,nop,TS val 1773904624 ecr 10257414], length 0
22:44:43.195058 IP vb-in-f108.1e100.net.imaps > dhcp-140-247-103-184.fas.harvard.edu.50790: Flags [P.], seq 49980:50324, ack 498, win 1002, options [nop,nop,TS val 1773905045 ecr 10257414], length 344
22:44:43.195730 IP dhcp-140-247-103-184.fas.harvard.edu.50790 > vb-in-f108.1e100.net.imaps: Flags [P.], seq 498:547, ack 50324, win 1407, options [nop,nop,TS val 10257460 ecr 1773905045], length 49
22:44:43.234898 IP vb-in-f108.1e100.net.imaps > dhcp-140-247-103-184.fas.harvard.edu.50790: Flags [.], ack 547, win 1002, options [nop,nop,TS val 1773905085 ecr 10257460], length 0
22:44:43.494517 IP vb-in-f108.1e100.net.imaps > dhcp-140-247-103-184.fas.harvard.edu.50790: Flags [P.], seq 50324:50639, ack 547, win 1002, options [nop,nop,TS val 1773905344 ecr 10257460], length 315
22:44:43.494534 IP vb-in-f108.1e100.net.imaps > dhcp-140-247-103-184.fas.harvard.edu.50790: Flags [P.], seq 50733:50781, ack 547, win 1002, options [nop,nop,TS val 1773905344 ecr 10257460], length 48
22:44:43.494543 IP dhcp-140-247-103-184.fas.harvard.edu.50790 > vb-in-f108.1e100.net.imaps: Flags [.], ack 50639, win 1403, options [nop,nop,TS val 10257490 ecr 1773905344,nop,nop,sack 1 {50733:50781}], length 0
22:44:43.494550 IP vb-in-f108.1e100.net.imaps > dhcp-140-247-103-184.fas.harvard.edu.50790: Flags [P.], seq 50639:50733, ack 547, win 1002, options [nop,nop,TS val 1773905344 ecr 10257460], length 94
22:44:43.494556 IP dhcp-140-247-103-184.fas.harvard.edu.50790 > vb-in-f108.1e100.net.imaps: Flags [.], ack 50781, win 1401, options [nop,nop,TS val 10257490 ecr 1773905344], length 0
22:44:43.494565 IP vb-in-f108.1e100.net.imaps > dhcp-140-247-103-184.fas.harvard.edu.50790: Flags [P.], seq 50781:50829, ack 547, win 1002, options [nop,nop,TS val 1773905344 ecr 10257460], length 48
22:44:43.494569 IP dhcp-140-247-103-184.fas.harvard.edu.50790 > vb-in-f108.1e100.net.imaps: Flags [.], ack 50829, win 1401, options [nop,nop,TS val 10257490 ecr 1773905344], length 0
22:44:43.494574 IP vb-in-f108.1e100.net.imaps > dhcp-140-247-103-184.fas.harvard.edu.50790: Flags [P.], seq 50829:50869, ack 547, win 1002, options [nop,nop,TS val 1773905344 ecr 10257460], length 40
22:44:43.494578 IP dhcp-140-247-103-184.fas.harvard.edu.50790 > vb-in-f108.1e100.net.imaps: Flags [.], ack 50869, win 1401, options [nop,nop,TS val 10257490 ecr 1773905344], length 0
22:44:43.498219 IP dhcp-140-247-103-184.fas.harvard.edu.50790 > vb-in-f108.1e100.net.imaps: Flags [P.], seq 547:775, ack 50869, win 1407, options [nop,nop,TS val 10257490 ecr 1773905344], length 228
22:44:43.537361 IP vb-in-f108.1e100.net.imaps > dhcp-140-247-103-184.fas.harvard.edu.50790: Flags [.], ack 775, win 1002, options [nop,nop,TS val 1773905388 ecr 10257490], length 0
22:44:43.839787 IP vb-in-f108.1e100.net.imaps > dhcp-140-247-103-184.fas.harvard.edu.50790: Flags [.], seq 50869:52237, ack 775, win 1002, options [nop,nop,TS val 1773905690 ecr 10257490], length 1368
22:44:43.839811 IP vb-in-f108.1e100.net.imaps > dhcp-140-247-103-184.fas.harvard.edu.50790: Flags [P.], seq 52237:52294, ack 775, win 1002, options [nop,nop,TS val 1773905690 ecr 10257490], length 57
22:44:43.839815 IP vb-in-f108.1e100.net.imaps > dhcp-140-247-103-184.fas.harvard.edu.50790: Flags [.], seq 52294:53662, ack 775, win 1002, options [nop,nop,TS val 1773905690 ecr 10257490], length 1368
22:44:43.839819 IP vb-in-f108.1e100.net.imaps > dhcp-140-247-103-184.fas.harvard.edu.50790: Flags [P.], seq 53662:53719, ack 775, win 1002, options [nop,nop,TS val 1773905690 ecr 10257490], length 57
22:44:43.839821 IP vb-in-f108.1e100.net.imaps > dhcp-140-247-103-184.fas.harvard.edu.50790: Flags [P.], seq 53719:55040, ack 775, win 1002, options [nop,nop,TS val 1773905690 ecr 10257490], length 1321
22:44:43.839824 IP vb-in-f108.1e100.net.imaps > dhcp-140-247-103-184.fas.harvard.edu.50790: Flags [.], seq 55040:56408, ack 775, win 1002, options [nop,nop,TS val 1773905690 ecr 10257490], length 1368
22:44:43.839827 IP vb-in-f108.1e100.net.imaps > dhcp-140-247-103-184.fas.harvard.edu.50790: Flags [P.], seq 56408:56465, ack 775, win 1002, options [nop,nop,TS val 1773905690 ecr 10257490], length 57
22:44:43.839830 IP vb-in-f108.1e100.net.imaps > dhcp-140-247-103-184.fas.harvard.edu.50790: Flags [.], seq 56465:57833, ack 775, win 1002, options [nop,nop,TS val 1773905690 ecr 10257490], length 1368
22:44:43.839832 IP vb-in-f108.1e100.net.imaps > dhcp-140-247-103-184.fas.harvard.edu.50790: Flags [.], seq 57833:59201, ack 775, win 1002, options [nop,nop,TS val 1773905690 ecr 10257490], length 1368
22:44:43.839836 IP vb-in-f108.1e100.net.imaps > dhcp-140-247-103-184.fas.harvard.edu.50790: Flags [P.], seq 59201:59282, ack 775, win 1002, options [nop,nop,TS val 1773905690 ecr 10257490], length 81
22:44:43.840077 IP dhcp-140-247-103-184.fas.harvard.edu.50790 > vb-in-f108.1e100.net.imaps: Flags [.], ack 59282, win 1307, options [nop,nop,TS val 10257524 ecr 1773905690], length 0
22:44:43.841856 IP dhcp-140-247-103-184.fas.harvard.edu.50790 > vb-in-f108.1e100.net.imaps: Flags [P.], seq 775:830, ack 59282, win 1407, options [nop,nop,TS val 10257524 ecr 1773905690], length 55
22:44:43.881159 IP vb-in-f108.1e100.net.imaps > dhcp-140-247-103-184.fas.harvard.edu.50790: Flags [.], ack 830, win 1002, options [nop,nop,TS val 1773905731 ecr 10257524], length 0
22:44:44.021115 IP vb-in-f108.1e100.net.imaps > dhcp-140-247-103-184.fas.harvard.edu.50790: Flags [P.], seq 59282:59487, ack 830, win 1002, options [nop,nop,TS val 1773905871 ecr 10257524], length 205
22:44:44.021136 IP vb-in-f108.1e100.net.imaps > dhcp-140-247-103-184.fas.harvard.edu.50790: Flags [P.], seq 59487:59584, ack 830, win 1002, options [nop,nop,TS val 1773905871 ecr 10257524], length 97
22:44:44.021229 IP vb-in-f108.1e100.net.imaps > dhcp-140-247-103-184.fas.harvard.edu.50790: Flags [P.], seq 59584:59645, ack 830, win 1002, options [nop,nop,TS val 1773905872 ecr 10257524], length 61
22:44:44.021236 IP vb-in-f108.1e100.net.imaps > dhcp-140-247-103-184.fas.harvard.edu.50790: Flags [P.], seq 59645:59706, ack 830, win 1002, options [nop,nop,TS val 1773905872 ecr 10257524], length 61
22:44:44.021403 IP vb-in-f108.1e100.net.imaps > dhcp-140-247-103-184.fas.harvard.edu.50790: Flags [P.], seq 59706:59805, ack 830, win 1002, options [nop,nop,TS val 1773905872 ecr 10257524], length 99
22:44:44.021459 IP vb-in-f108.1e100.net.imaps > dhcp-140-247-103-184.fas.harvard.edu.50790: Flags [P.], seq 59805:59867, ack 830, win 1002, options [nop,nop,TS val 1773905872 ecr 10257524], length 62
22:44:44.021466 IP vb-in-f108.1e100.net.imaps > dhcp-140-247-103-184.fas.harvard.edu.50790: Flags [P.], seq 59867:59929, ack 830, win 1002, options [nop,nop,TS val 1773905872 ecr 10257524], length 62
22:44:44.021538 IP vb-in-f108.1e100.net.imaps > dhcp-140-247-103-184.fas.harvard.edu.50790: Flags [P.], seq 59929:59991, ack 830, win 1002, options [nop,nop,TS val 1773905872 ecr 10257524], length 62
22:44:44.021611 IP vb-in-f108.1e100.net.imaps > dhcp-140-247-103-184.fas.harvard.edu.50790: Flags [P.], seq 59991:60053, ack 830, win 1002, options [nop,nop,TS val 1773905872 ecr 10257524], length 62
22:44:44.021697 IP vb-in-f108.1e100.net.imaps > dhcp-140-247-103-184.fas.harvard.edu.50790: Flags [P.], seq 60053:60115, ack 830, win 1002, options [nop,nop,TS val 1773905872 ecr 10257524], length 62
22:44:44.021728 IP dhcp-140-247-103-184.fas.harvard.edu.50790 > vb-in-f108.1e100.net.imaps: Flags [.], ack 60115, win 1407, options [nop,nop,TS val 10257542 ecr 1773905871], length 0
22:44:44.021750 IP vb-in-f108.1e100.net.imaps > dhcp-140-247-103-184.fas.harvard.edu.50790: Flags [P.], seq 60115:60177, ack 830, win 1002, options [nop,nop,TS val 1773905872 ecr 10257524], length 62
22:44:44.021807 IP vb-in-f108.1e100.net.imaps > dhcp-140-247-103-184.fas.harvard.edu.50790: Flags [P.], seq 60177:60239, ack 830, win 1002, options [nop,nop,TS val 1773905872 ecr 10257524], length 62
22:44:44.021821 IP dhcp-140-247-103-184.fas.harvard.edu.50790 > vb-in-f108.1e100.net.imaps: Flags [.], ack 60239, win 1407, options [nop,nop,TS val 10257542 ecr 1773905872], length 0
22:44:44.021863 IP vb-in-f108.1e100.net.imaps > dhcp-140-247-103-184.fas.harvard.edu.50790: Flags [P.], seq 60239:60279, ack 830, win 1002, options [nop,nop,TS val 1773905872 ecr 10257524], length 40
22:44:44.053446 IP dhcp-140-247-103-184.fas.harvard.edu.50790 > vb-in-f108.1e100.net.imaps: Flags [.], ack 60279, win 1407, options [nop,nop,TS val 10257546 ecr 1773905872], length 0
22:44:44.386387 IP dhcp-140-247-103-184.fas.harvard.edu.50790 > vb-in-f108.1e100.net.imaps: Flags [P.], seq 830:914, ack 60279, win 1407, options [nop,nop,TS val 10257579 ecr 1773905872], length 84
22:44:44.425450 IP vb-in-f108.1e100.net.imaps > dhcp-140-247-103-184.fas.harvard.edu.50790: Flags [.], ack 914, win 1002, options [nop,nop,TS val 1773906276 ecr 10257579], length 0
22:44:44.555619 IP vb-in-f108.1e100.net.imaps > dhcp-140-247-103-184.fas.harvard.edu.50790: Flags [P.], seq 60279:60400, ack 914, win 1002, options [nop,nop,TS val 1773906406 ecr 10257579], length 121
22:44:44.555643 IP dhcp-140-247-103-184.fas.harvard.edu.50790 > vb-in-f108.1e100.net.imaps: Flags [.], ack 60400, win 1406, options [nop,nop,TS val 10257596 ecr 1773906406], length 0
22:44:44.557114 IP dhcp-140-247-103-184.fas.harvard.edu.50790 > vb-in-f108.1e100.net.imaps: Flags [P.], seq 914:960, ack 60400, win 1407, options [nop,nop,TS val 10257596 ecr 1773906406], length 46
22:44:44.596167 IP vb-in-f108.1e100.net.imaps > dhcp-140-247-103-184.fas.harvard.edu.50790: Flags [.], ack 960, win 1002, options [nop,nop,TS val 1773906447 ecr 10257596], length 0
22:44:45.042025 IP vb-in-f108.1e100.net.imaps > dhcp-140-247-103-184.fas.harvard.edu.50790: Flags [P.], seq 60400:60746, ack 960, win 1002, options [nop,nop,TS val 1773906892 ecr 10257596], length 346
22:44:45.042803 IP dhcp-140-247-103-184.fas.harvard.edu.50790 > vb-in-f108.1e100.net.imaps: Flags [P.], seq 960:1015, ack 60746, win 1407, options [nop,nop,TS val 10257644 ecr 1773906892], length 55
22:44:45.081877 IP vb-in-f108.1e100.net.imaps > dhcp-140-247-103-184.fas.harvard.edu.50790: Flags [.], ack 1015, win 1002, options [nop,nop,TS val 1773906932 ecr 10257644], length 0
22:44:45.281031 IP vb-in-f108.1e100.net.imaps > dhcp-140-247-103-184.fas.harvard.edu.50790: Flags [.], seq 60746:62114, ack 1015, win 1002, options [nop,nop,TS val 1773907131 ecr 10257644], length 1368
22:44:45.281046 IP vb-in-f108.1e100.net.imaps > dhcp-140-247-103-184.fas.harvard.edu.50790: Flags [P.], seq 62114:62171, ack 1015, win 1002, options [nop,nop,TS val 1773907131 ecr 10257644], length 57
22:44:45.281050 IP vb-in-f108.1e100.net.imaps > dhcp-140-247-103-184.fas.harvard.edu.50790: Flags [.], seq 62171:63539, ack 1015, win 1002, options [nop,nop,TS val 1773907131 ecr 10257644], length 1368
22:44:45.281053 IP vb-in-f108.1e100.net.imaps > dhcp-140-247-103-184.fas.harvard.edu.50790: Flags [P.], seq 63539:63596, ack 1015, win 1002, options [nop,nop,TS val 1773907131 ecr 10257644], length 57
22:44:45.281056 IP vb-in-f108.1e100.net.imaps > dhcp-140-247-103-184.fas.harvard.edu.50790: Flags [P.], seq 63596:64669, ack 1015, win 1002, options [nop,nop,TS val 1773907131 ecr 10257644], length 1073
22:44:45.281059 IP vb-in-f108.1e100.net.imaps > dhcp-140-247-103-184.fas.harvard.edu.50790: Flags [.], seq 64669:66037, ack 1015, win 1002, options [nop,nop,TS val 1773907131 ecr 10257644], length 1368
22:44:45.281062 IP vb-in-f108.1e100.net.imaps > dhcp-140-247-103-184.fas.harvard.edu.50790: Flags [P.], seq 66037:66094, ack 1015, win 1002, options [nop,nop,TS val 1773907131 ecr 10257644], length 57
22:44:45.281139 IP vb-in-f108.1e100.net.imaps > dhcp-140-247-103-184.fas.harvard.edu.50790: Flags [.], seq 66094:67462, ack 1015, win 1002, options [nop,nop,TS val 1773907131 ecr 10257644], length 1368
22:44:45.281147 IP vb-in-f108.1e100.net.imaps > dhcp-140-247-103-184.fas.harvard.edu.50790: Flags [P.], seq 68830:68944, ack 1015, win 1002, options [nop,nop,TS val 1773907131 ecr 10257644], length 114
22:44:45.281155 IP dhcp-140-247-103-184.fas.harvard.edu.50790 > vb-in-f108.1e100.net.imaps: Flags [.], ack 67462, win 1321, options [nop,nop,TS val 10257668 ecr 1773907131,nop,nop,sack 1 {68830:68944}], length 0
22:44:45.281160 IP vb-in-f108.1e100.net.imaps > dhcp-140-247-103-184.fas.harvard.edu.50790: Flags [.], seq 67462:68830, ack 1015, win 1002, options [nop,nop,TS val 1773907131 ecr 10257644], length 1368
22:44:45.281165 IP dhcp-140-247-103-184.fas.harvard.edu.50790 > vb-in-f108.1e100.net.imaps: Flags [.], ack 68944, win 1307, options [nop,nop,TS val 10257668 ecr 1773907131], length 0
22:44:45.281169 IP vb-in-f108.1e100.net.imaps > dhcp-140-247-103-184.fas.harvard.edu.50790: Flags [P.], seq 70312:70369, ack 1015, win 1002, options [nop,nop,TS val 1773907131 ecr 10257644], length 57
22:44:45.281172 IP dhcp-140-247-103-184.fas.harvard.edu.50790 > vb-in-f108.1e100.net.imaps: Flags [.], ack 68944, win 1307, options [nop,nop,TS val 10257668 ecr 1773907131,nop,nop,sack 1 {70312:70369}], length 0
22:44:45.281176 IP vb-in-f108.1e100.net.imaps > dhcp-140-247-103-184.fas.harvard.edu.50790: Flags [.], seq 68944:70312, ack 1015, win 1002, options [nop,nop,TS val 1773907131 ecr 10257644], length 1368
22:44:45.281180 IP dhcp-140-247-103-184.fas.harvard.edu.50790 > vb-in-f108.1e100.net.imaps: Flags [.], ack 70369, win 1289, options [nop,nop,TS val 10257668 ecr 1773907131], length 0
22:44:45.281183 IP vb-in-f108.1e100.net.imaps > dhcp-140-247-103-184.fas.harvard.edu.50790: Flags [.], seq 70369:71737, ack 1015, win 1002, options [nop,nop,TS val 1773907131 ecr 10257644], length 1368
22:44:45.281187 IP dhcp-140-247-103-184.fas.harvard.edu.50790 > vb-in-f108.1e100.net.imaps: Flags [.], ack 71737, win 1275, options [nop,nop,TS val 10257668 ecr 1773907131], length 0
22:44:45.281190 IP vb-in-f108.1e100.net.imaps > dhcp-140-247-103-184.fas.harvard.edu.50790: Flags [P.], seq 71737:71794, ack 1015, win 1002, options [nop,nop,TS val 1773907131 ecr 10257644], length 57
22:44:45.281193 IP dhcp-140-247-103-184.fas.harvard.edu.50790 > vb-in-f108.1e100.net.imaps: Flags [.], ack 71794, win 1275, options [nop,nop,TS val 10257668 ecr 1773907131], length 0
22:44:45.281198 IP vb-in-f108.1e100.net.imaps > dhcp-140-247-103-184.fas.harvard.edu.50790: Flags [P.], seq 71794:72182, ack 1015, win 1002, options [nop,nop,TS val 1773907131 ecr 10257644], length 388
22:44:45.281202 IP dhcp-140-247-103-184.fas.harvard.edu.50790 > vb-in-f108.1e100.net.imaps: Flags [.], ack 72182, win 1269, options [nop,nop,TS val 10257668 ecr 1773907131], length 0
22:44:45.281205 IP vb-in-f108.1e100.net.imaps > dhcp-140-247-103-184.fas.harvard.edu.50790: Flags [P.], seq 72182:72321, ack 1015, win 1002, options [nop,nop,TS val 1773907131 ecr 10257644], length 139
22:44:45.281208 IP dhcp-140-247-103-184.fas.harvard.edu.50790 > vb-in-f108.1e100.net.imaps: Flags [.], ack 72321, win 1267, options [nop,nop,TS val 10257668 ecr 1773907131], length 0
22:44:45.281212 IP vb-in-f108.1e100.net.imaps > dhcp-140-247-103-184.fas.harvard.edu.50790: Flags [P.], seq 72321:72422, ack 1015, win 1002, options [nop,nop,TS val 1773907132 ecr 10257644], length 101
22:44:45.281215 IP dhcp-140-247-103-184.fas.harvard.edu.50790 > vb-in-f108.1e100.net.imaps: Flags [.], ack 72422, win 1266, options [nop,nop,TS val 10257668 ecr 1773907132], length 0
22:44:45.281219 IP vb-in-f108.1e100.net.imaps > dhcp-140-247-103-184.fas.harvard.edu.50790: Flags [P.], seq 72422:72561, ack 1015, win 1002, options [nop,nop,TS val 1773907132 ecr 10257644], length 139
22:44:45.281222 IP dhcp-140-247-103-184.fas.harvard.edu.50790 > vb-in-f108.1e100.net.imaps: Flags [.], ack 72561, win 1264, options [nop,nop,TS val 10257668 ecr 1773907132], length 0
22:44:45.281226 IP vb-in-f108.1e100.net.imaps > dhcp-140-247-103-184.fas.harvard.edu.50790: Flags [P.], seq 72561:72624, ack 1015, win 1002, options [nop,nop,TS val 1773907132 ecr 10257644], length 63
22:44:45.281228 IP dhcp-140-247-103-184.fas.harvard.edu.50790 > vb-in-f108.1e100.net.imaps: Flags [.], ack 72624, win 1264, options [nop,nop,TS val 10257668 ecr 1773907132], length 0
22:44:45.281258 IP vb-in-f108.1e100.net.imaps > dhcp-140-247-103-184.fas.harvard.edu.50790: Flags [P.], seq 72624:72788, ack 1015, win 1002, options [nop,nop,TS val 1773907132 ecr 10257644], length 164
22:44:45.281270 IP dhcp-140-247-103-184.fas.harvard.edu.50790 > vb-in-f108.1e100.net.imaps: Flags [.], ack 72788, win 1262, options [nop,nop,TS val 10257668 ecr 1773907132], length 0
22:44:45.281322 IP vb-in-f108.1e100.net.imaps > dhcp-140-247-103-184.fas.harvard.edu.50790: Flags [P.], seq 72788:72851, ack 1015, win 1002, options [nop,nop,TS val 1773907132 ecr 10257644], length 63
22:44:45.281329 IP dhcp-140-247-103-184.fas.harvard.edu.50790 > vb-in-f108.1e100.net.imaps: Flags [.], ack 72851, win 1262, options [nop,nop,TS val 10257668 ecr 1773907132], length 0
22:44:45.281455 IP vb-in-f108.1e100.net.imaps > dhcp-140-247-103-184.fas.harvard.edu.50790: Flags [P.], seq 72851:72914, ack 1015, win 1002, options [nop,nop,TS val 1773907132 ecr 10257644], length 63
22:44:45.281463 IP dhcp-140-247-103-184.fas.harvard.edu.50790 > vb-in-f108.1e100.net.imaps: Flags [.], ack 72914, win 1262, options [nop,nop,TS val 10257668 ecr 1773907132], length 0
22:44:45.281467 IP vb-in-f108.1e100.net.imaps > dhcp-140-247-103-184.fas.harvard.edu.50790: Flags [P.], seq 72914:72977, ack 1015, win 1002, options [nop,nop,TS val 1773907132 ecr 10257644], length 63
22:44:45.281470 IP dhcp-140-247-103-184.fas.harvard.edu.50790 > vb-in-f108.1e100.net.imaps: Flags [.], ack 72977, win 1262, options [nop,nop,TS val 10257668 ecr 1773907132], length 0
22:44:45.320351 IP vb-in-f108.1e100.net.imaps > dhcp-140-247-103-184.fas.harvard.edu.50790: Flags [.], seq 72977:74345, ack 1015, win 1002, options [nop,nop,TS val 1773907171 ecr 10257668], length 1368
22:44:45.320372 IP dhcp-140-247-103-184.fas.harvard.edu.50790 > vb-in-f108.1e100.net.imaps: Flags [.], ack 74345, win 1393, options [nop,nop,TS val 10257672 ecr 1773907171], length 0
22:44:45.320379 IP vb-in-f108.1e100.net.imaps > dhcp-140-247-103-184.fas.harvard.edu.50790: Flags [P.], seq 74345:75286, ack 1015, win 1002, options [nop,nop,TS val 1773907171 ecr 10257668], length 941
22:44:45.320384 IP dhcp-140-247-103-184.fas.harvard.edu.50790 > vb-in-f108.1e100.net.imaps: Flags [.], ack 75286, win 1379, options [nop,nop,TS val 10257672 ecr 1773907171], length 0
22:44:45.408296 IP vb-in-f108.1e100.net.imaps > dhcp-140-247-103-184.fas.harvard.edu.50790: Flags [.], seq 75286:76654, ack 1015, win 1002, options [nop,nop,TS val 1773907258 ecr 10257672], length 1368
22:44:45.408312 IP dhcp-140-247-103-184.fas.harvard.edu.50790 > vb-in-f108.1e100.net.imaps: Flags [.], ack 76654, win 1393, options [nop,nop,TS val 10257681 ecr 1773907258], length 0
22:44:45.408321 IP vb-in-f108.1e100.net.imaps > dhcp-140-247-103-184.fas.harvard.edu.50790: Flags [P.], seq 76654:76711, ack 1015, win 1002, options [nop,nop,TS val 1773907258 ecr 10257672], length 57
22:44:45.408326 IP vb-in-f108.1e100.net.imaps > dhcp-140-247-103-184.fas.harvard.edu.50790: Flags [.], seq 76711:78079, ack 1015, win 1002, options [nop,nop,TS val 1773907258 ecr 10257672], length 1368
22:44:45.408331 IP vb-in-f108.1e100.net.imaps > dhcp-140-247-103-184.fas.harvard.edu.50790: Flags [P.], seq 78079:78136, ack 1015, win 1002, options [nop,nop,TS val 1773907258 ecr 10257672], length 57
22:44:45.408336 IP vb-in-f108.1e100.net.imaps > dhcp-140-247-103-184.fas.harvard.edu.50790: Flags [.], seq 78136:79504, ack 1015, win 1002, options [nop,nop,TS val 1773907258 ecr 10257672], length 1368
22:44:45.408339 IP vb-in-f108.1e100.net.imaps > dhcp-140-247-103-184.fas.harvard.edu.50790: Flags [P.], seq 79504:80683, ack 1015, win 1002, options [nop,nop,TS val 1773907258 ecr 10257672], length 1179
22:44:45.408552 IP dhcp-140-247-103-184.fas.harvard.edu.50790 > vb-in-f108.1e100.net.imaps: Flags [.], ack 80683, win 1343, options [nop,nop,TS val 10257681 ecr 1773907258], length 0
22:44:45.747761 IP dhcp-140-247-103-184.fas.harvard.edu.50790 > vb-in-f108.1e100.net.imaps: Flags [P.], seq 1015:1105, ack 80683, win 1407, options [nop,nop,TS val 10257715 ecr 1773907258], length 90
22:44:45.786944 IP vb-in-f108.1e100.net.imaps > dhcp-140-247-103-184.fas.harvard.edu.50790: Flags [.], ack 1105, win 1002, options [nop,nop,TS val 1773907637 ecr 10257715], length 0
22:44:46.225380 IP vb-in-f108.1e100.net.imaps > dhcp-140-247-103-184.fas.harvard.edu.50790: Flags [P.], seq 80683:80808, ack 1105, win 1002, options [nop,nop,TS val 1773908076 ecr 10257715], length 125
22:44:46.225408 IP dhcp-140-247-103-184.fas.harvard.edu.50790 > vb-in-f108.1e100.net.imaps: Flags [.], ack 80808, win 1406, options [nop,nop,TS val 10257763 ecr 1773908076], length 0
22:44:46.227250 IP dhcp-140-247-103-184.fas.harvard.edu.50790 > vb-in-f108.1e100.net.imaps: Flags [P.], seq 1105:1157, ack 80808, win 1407, options [nop,nop,TS val 10257763 ecr 1773908076], length 52
22:44:46.266364 IP vb-in-f108.1e100.net.imaps > dhcp-140-247-103-184.fas.harvard.edu.50790: Flags [.], ack 1157, win 1002, options [nop,nop,TS val 1773908117 ecr 10257763], length 0
22:44:46.404099 IP vb-in-f108.1e100.net.imaps > dhcp-140-247-103-184.fas.harvard.edu.50790: Flags [P.], seq 80808:81158, ack 1157, win 1002, options [nop,nop,TS val 1773908254 ecr 10257763], length 350
22:44:46.404747 IP dhcp-140-247-103-184.fas.harvard.edu.50790 > vb-in-f108.1e100.net.imaps: Flags [P.], seq 1157:1206, ack 81158, win 1407, options [nop,nop,TS val 10257781 ecr 1773908254], length 49
22:44:46.444187 IP vb-in-f108.1e100.net.imaps > dhcp-140-247-103-184.fas.harvard.edu.50790: Flags [.], ack 1206, win 1002, options [nop,nop,TS val 1773908294 ecr 10257781], length 0
22:44:46.576428 IP vb-in-f108.1e100.net.imaps > dhcp-140-247-103-184.fas.harvard.edu.50790: Flags [P.], seq 81158:81416, ack 1206, win 1002, options [nop,nop,TS val 1773908427 ecr 10257781], length 258
22:44:46.576450 IP vb-in-f108.1e100.net.imaps > dhcp-140-247-103-184.fas.harvard.edu.50790: Flags [P.], seq 81416:81529, ack 1206, win 1002, options [nop,nop,TS val 1773908427 ecr 10257781], length 113
