22:43:15.301118 IP dhcp-140-247-103-184.fas.harvard.edu.52034 > 168.75.208.235.imaps: Flags [P.], seq 2607472505:2607472627, ack 3954491731, win 661, options [nop,nop,TS val 10248670 ecr 98835991], length 122
22:43:15.325655 IP 168.75.208.235.imaps > dhcp-140-247-103-184.fas.harvard.edu.52034: Flags [P.], seq 1:134, ack 122, win 252, options [nop,nop,TS val 98841253 ecr 10248670], length 133
22:43:15.325683 IP dhcp-140-247-103-184.fas.harvard.edu.52034 > 168.75.208.235.imaps: Flags [.], ack 134, win 661, options [nop,nop,TS val 10248673 ecr 98841253], length 0
22:43:15.326718 IP dhcp-140-247-103-184.fas.harvard.edu.52034 > 168.75.208.235.imaps: Flags [P.], seq 122:212, ack 134, win 661, options [nop,nop,TS val 10248673 ecr 98841253], length 90
22:43:15.359682 IP 168.75.208.235.imaps > dhcp-140-247-103-184.fas.harvard.edu.52034: Flags [P.], seq 134:475, ack 212, win 251, options [nop,nop,TS val 98841256 ecr 10248673], length 341
22:43:15.360330 IP dhcp-140-247-103-184.fas.harvard.edu.52034 > 168.75.208.235.imaps: Flags [P.], seq 212:318, ack 475, win 661, options [nop,nop,TS val 10248676 ecr 98841256], length 106
22:43:15.374631 IP 168.75.208.235.imaps > dhcp-140-247-103-184.fas.harvard.edu.52034: Flags [P.], seq 475:544, ack 318, win 251, options [nop,nop,TS val 98841258 ecr 10248676], length 69
22:43:15.375208 IP 168.75.208.235.imaps > dhcp-140-247-103-184.fas.harvard.edu.52034: Flags [P.], seq 544:2709, ack 318, win 251, options [nop,nop,TS val 98841258 ecr 10248676], length 2165
22:43:15.375221 IP dhcp-140-247-103-184.fas.harvard.edu.52034 > 168.75.208.235.imaps: Flags [.], ack 2709, win 661, options [nop,nop,TS val 10248678 ecr 98841258], length 0
22:43:15.375616 IP 168.75.208.235.imaps > dhcp-140-247-103-184.fas.harvard.edu.52034: Flags [P.], seq 2709:4077, ack 318, win 251, options [nop,nop,TS val 98841258 ecr 10248676], length 1368
22:43:15.375625 IP 168.75.208.235.imaps > dhcp-140-247-103-184.fas.harvard.edu.52034: Flags [P.], seq 4077:4302, ack 318, win 251, options [nop,nop,TS val 98841258 ecr 10248676], length 225
22:43:15.375738 IP dhcp-140-247-103-184.fas.harvard.edu.52034 > 168.75.208.235.imaps: Flags [.], ack 4302, win 654, options [nop,nop,TS val 10248678 ecr 98841258], length 0
22:43:15.375933 IP 168.75.208.235.imaps > dhcp-140-247-103-184.fas.harvard.edu.52034: Flags [P.], seq 4302:5670, ack 318, win 251, options [nop,nop,TS val 98841258 ecr 10248676], length 1368
22:43:15.375938 IP 168.75.208.235.imaps > dhcp-140-247-103-184.fas.harvard.edu.52034: Flags [P.], seq 5670:6120, ack 318, win 251, options [nop,nop,TS val 98841258 ecr 10248676], length 450
22:43:15.376005 IP dhcp-140-247-103-184.fas.harvard.edu.52034 > 168.75.208.235.imaps: Flags [.], ack 6120, win 626, options [nop,nop,TS val 10248678 ecr 98841258], length 0
22:43:15.379108 IP 168.75.208.235.imaps > dhcp-140-247-103-184.fas.harvard.edu.52034: Flags [P.], seq 6120:7488, ack 318, win 251, options [nop,nop,TS val 98841258 ecr 10248676], length 1368
22:43:15.379127 IP 168.75.208.235.imaps > dhcp-140-247-103-184.fas.harvard.edu.52034: Flags [P.], seq 7488:11313, ack 318, win 251, options [nop,nop,TS val 98841258 ecr 10248676], length 3825
22:43:15.379135 IP dhcp-140-247-103-184.fas.harvard.edu.52034 > 168.75.208.235.imaps: Flags [.], ack 11313, win 636, options [nop,nop,TS val 10248678 ecr 98841258], length 0
22:43:16.245136 IP dhcp-140-247-103-184.fas.harvard.edu.59865 > cyrus.eurecom.fr.imaps: Flags [P.], seq 3261289609:3261289699, ack 891009579, win 661, options [nop,nop,TS val 10248765 ecr 2287070674], length 90
22:43:16.364146 IP cyrus.eurecom.fr.imaps > dhcp-140-247-103-184.fas.harvard.edu.59865: Flags [P.], seq 1:38, ack 90, win 49248, options [nop,nop,TS val 2287072267 ecr 10248765], length 37
22:43:16.364176 IP dhcp-140-247-103-184.fas.harvard.edu.59865 > cyrus.eurecom.fr.imaps: Flags [.], ack 38, win 661, options [nop,nop,TS val 10248777 ecr 2287072267], length 0
22:43:16.366722 IP dhcp-140-247-103-184.fas.harvard.edu.59865 > cyrus.eurecom.fr.imaps: Flags [P.], seq 90:164, ack 38, win 661, options [nop,nop,TS val 10248777 ecr 2287072267], length 74
22:43:16.485797 IP cyrus.eurecom.fr.imaps > dhcp-140-247-103-184.fas.harvard.edu.59865: Flags [P.], seq 38:155, ack 164, win 49248, options [nop,nop,TS val 2287072280 ecr 10248777], length 117
22:43:16.523387 IP dhcp-140-247-103-184.fas.harvard.edu.59865 > cyrus.eurecom.fr.imaps: Flags [.], ack 155, win 661, options [nop,nop,TS val 10248793 ecr 2287072280], length 0
22:43:16.641850 IP cyrus.eurecom.fr.imaps > dhcp-140-247-103-184.fas.harvard.edu.59865: Flags [P.], seq 155:240, ack 164, win 49248, options [nop,nop,TS val 2287072295 ecr 10248793], length 85
22:43:16.641870 IP dhcp-140-247-103-184.fas.harvard.edu.59865 > cyrus.eurecom.fr.imaps: Flags [.], ack 240, win 661, options [nop,nop,TS val 10248804 ecr 2287072295], length 0
22:43:16.643917 IP dhcp-140-247-103-184.fas.harvard.edu.59865 > cyrus.eurecom.fr.imaps: Flags [P.], seq 164:238, ack 240, win 661, options [nop,nop,TS val 10248805 ecr 2287072295], length 74
22:43:16.763274 IP cyrus.eurecom.fr.imaps > dhcp-140-247-103-184.fas.harvard.edu.59865: Flags [P.], seq 240:341, ack 238, win 49248, options [nop,nop,TS val 2287072307 ecr 10248805], length 101
22:43:16.793437 IP dhcp-140-247-103-184.fas.harvard.edu.59865 > cyrus.eurecom.fr.imaps: Flags [.], ack 341, win 661, options [nop,nop,TS val 10248820 ecr 2287072307], length 0
22:43:16.911825 IP cyrus.eurecom.fr.imaps > dhcp-140-247-103-184.fas.harvard.edu.59865: Flags [P.], seq 341:527, ack 238, win 49248, options [nop,nop,TS val 2287072322 ecr 10248820], length 186
22:43:16.911843 IP dhcp-140-247-103-184.fas.harvard.edu.59865 > cyrus.eurecom.fr.imaps: Flags [.], ack 527, win 661, options [nop,nop,TS val 10248831 ecr 2287072322], length 0
22:43:17.324478 IP dhcp-140-247-103-184.fas.harvard.edu.59865 > cyrus.eurecom.fr.imaps: Flags [P.], seq 238:328, ack 527, win 661, options [nop,nop,TS val 10248873 ecr 2287072322], length 90
22:43:17.478515 IP cyrus.eurecom.fr.imaps > dhcp-140-247-103-184.fas.harvard.edu.59865: Flags [P.], seq 527:644, ack 328, win 49248, options [nop,nop,TS val 2287072379 ecr 10248873], length 117
22:43:17.478539 IP dhcp-140-247-103-184.fas.harvard.edu.59865 > cyrus.eurecom.fr.imaps: Flags [.], ack 644, win 661, options [nop,nop,TS val 10248888 ecr 2287072379], length 0
22:43:17.482576 IP dhcp-140-247-103-184.fas.harvard.edu.59865 > cyrus.eurecom.fr.imaps: Flags [P.], seq 328:418, ack 644, win 661, options [nop,nop,TS val 10248888 ecr 2287072379], length 90
22:43:17.602257 IP cyrus.eurecom.fr.imaps > dhcp-140-247-103-184.fas.harvard.edu.59865: Flags [P.], seq 644:825, ack 418, win 49248, options [nop,nop,TS val 2287072391 ecr 10248888], length 181
22:43:17.603385 IP dhcp-140-247-103-184.fas.harvard.edu.59865 > cyrus.eurecom.fr.imaps: Flags [P.], seq 418:492, ack 825, win 661, options [nop,nop,TS val 10248901 ecr 2287072391], length 74
22:43:17.723062 IP cyrus.eurecom.fr.imaps > dhcp-140-247-103-184.fas.harvard.edu.59865: Flags [P.], seq 825:1214, ack 492, win 49248, options [nop,nop,TS val 2287072403 ecr 10248901], length 389
22:43:17.753418 IP dhcp-140-247-103-184.fas.harvard.edu.59865 > cyrus.eurecom.fr.imaps: Flags [.], ack 1214, win 661, options [nop,nop,TS val 10248916 ecr 2287072403], length 0
22:43:19.353762 IP dhcp-140-247-103-184.fas.harvard.edu.52134 > zproxy110.enst.fr.imaps: Flags [P.], seq 2029995497:2029995587, ack 2420585010, win 1543, options [nop,nop,TS val 10249076 ecr 1852303487], length 90
22:43:19.446802 IP zproxy110.enst.fr.imaps > dhcp-140-247-103-184.fas.harvard.edu.52134: Flags [P.], seq 1:54, ack 90, win 62, options [nop,nop,TS val 1852307915 ecr 10249076], length 53
22:43:19.446826 IP dhcp-140-247-103-184.fas.harvard.edu.52134 > zproxy110.enst.fr.imaps: Flags [.], ack 54, win 1543, options [nop,nop,TS val 10249085 ecr 1852307915], length 0
22:43:19.447995 IP zproxy110.enst.fr.imaps > dhcp-140-247-103-184.fas.harvard.edu.52134: Flags [.], seq 54:1422, ack 90, win 62, options [nop,nop,TS val 1852307915 ecr 10249076], length 1368
22:43:19.448007 IP dhcp-140-247-103-184.fas.harvard.edu.52134 > zproxy110.enst.fr.imaps: Flags [.], ack 1422, win 1529, options [nop,nop,TS val 10249085 ecr 1852307915], length 0
22:43:19.448510 IP zproxy110.enst.fr.imaps > dhcp-140-247-103-184.fas.harvard.edu.52134: Flags [.], seq 1422:2790, ack 90, win 62, options [nop,nop,TS val 1852307915 ecr 10249076], length 1368
22:43:19.448523 IP dhcp-140-247-103-184.fas.harvard.edu.52134 > zproxy110.enst.fr.imaps: Flags [.], ack 2790, win 1529, options [nop,nop,TS val 10249085 ecr 1852307915], length 0
22:43:19.538855 IP zproxy110.enst.fr.imaps > dhcp-140-247-103-184.fas.harvard.edu.52134: Flags [.], seq 2790:5526, ack 90, win 62, options [nop,nop,TS val 1852307924 ecr 10249085], length 2736
22:43:19.538874 IP dhcp-140-247-103-184.fas.harvard.edu.52134 > zproxy110.enst.fr.imaps: Flags [.], ack 5526, win 1518, options [nop,nop,TS val 10249094 ecr 1852307924], length 0
22:43:19.540126 IP zproxy110.enst.fr.imaps > dhcp-140-247-103-184.fas.harvard.edu.52134: Flags [.], seq 5526:8262, ack 90, win 62, options [nop,nop,TS val 1852307924 ecr 10249085], length 2736
22:43:19.540140 IP dhcp-140-247-103-184.fas.harvard.edu.52134 > zproxy110.enst.fr.imaps: Flags [.], ack 8262, win 1518, options [nop,nop,TS val 10249094 ecr 1852307924], length 0
22:43:19.540580 IP zproxy110.enst.fr.imaps > dhcp-140-247-103-184.fas.harvard.edu.52134: Flags [.], seq 8262:10998, ack 90, win 62, options [nop,nop,TS val 1852307924 ecr 10249085], length 2736
22:43:19.540596 IP dhcp-140-247-103-184.fas.harvard.edu.52134 > zproxy110.enst.fr.imaps: Flags [.], ack 10998, win 1494, options [nop,nop,TS val 10249094 ecr 1852307924], length 0
22:43:19.630960 IP zproxy110.enst.fr.imaps > dhcp-140-247-103-184.fas.harvard.edu.52134: Flags [.], seq 10998:15102, ack 90, win 62, options [nop,nop,TS val 1852307933 ecr 10249094], length 4104
22:43:19.630979 IP dhcp-140-247-103-184.fas.harvard.edu.52134 > zproxy110.enst.fr.imaps: Flags [.], ack 15102, win 1508, options [nop,nop,TS val 10249103 ecr 1852307933], length 0
22:43:19.632049 IP zproxy110.enst.fr.imaps > dhcp-140-247-103-184.fas.harvard.edu.52134: Flags [P.], seq 15102:15931, ack 90, win 62, options [nop,nop,TS val 1852307933 ecr 10249094], length 829
22:43:19.632063 IP dhcp-140-247-103-184.fas.harvard.edu.52134 > zproxy110.enst.fr.imaps: Flags [.], ack 15931, win 1529, options [nop,nop,TS val 10249103 ecr 1852307933], length 0
22:43:36.542982 IP zproxy110.enst.fr.imaps > dhcp-140-247-103-184.fas.harvard.edu.52134: Flags [P.], seq 15931:15984, ack 90, win 62, options [nop,nop,TS val 1852309624 ecr 10249103], length 53
22:43:36.543011 IP dhcp-140-247-103-184.fas.harvard.edu.52134 > zproxy110.enst.fr.imaps: Flags [.], ack 15984, win 1540, options [nop,nop,TS val 10250794 ecr 1852309624], length 0
22:43:36.547352 IP zproxy110.enst.fr.imaps > dhcp-140-247-103-184.fas.harvard.edu.52134: Flags [.], seq 15984:17352, ack 90, win 62, options [nop,nop,TS val 1852309625 ecr 10249103], length 1368
22:43:36.547369 IP dhcp-140-247-103-184.fas.harvard.edu.52134 > zproxy110.enst.fr.imaps: Flags [.], ack 17352, win 1529, options [nop,nop,TS val 10250795 ecr 1852309625], length 0
22:43:36.601396 IP zproxy110.enst.fr.imaps > dhcp-140-247-103-184.fas.harvard.edu.52134: Flags [.], seq 17352:18720, ack 90, win 62, options [nop,nop,TS val 1852309630 ecr 10249103], length 1368
22:43:36.601411 IP dhcp-140-247-103-184.fas.harvard.edu.52134 > zproxy110.enst.fr.imaps: Flags [.], ack 18720, win 1529, options [nop,nop,TS val 10250800 ecr 1852309630], length 0
22:43:36.635132 IP zproxy110.enst.fr.imaps > dhcp-140-247-103-184.fas.harvard.edu.52134: Flags [P.], seq 18720:19476, ack 90, win 62, options [nop,nop,TS val 1852309633 ecr 10250794], length 756
22:43:36.635150 IP dhcp-140-247-103-184.fas.harvard.edu.52134 > zproxy110.enst.fr.imaps: Flags [.], ack 19476, win 1529, options [nop,nop,TS val 10250804 ecr 1852309633], length 0
22:43:36.638730 IP dhcp-140-247-103-184.fas.harvard.edu.52134 > zproxy110.enst.fr.imaps: Flags [P.], seq 90:164, ack 19476, win 1543, options [nop,nop,TS val 10250804 ecr 1852309633], length 74
22:43:36.757272 IP zproxy110.enst.fr.imaps > dhcp-140-247-103-184.fas.harvard.edu.52134: Flags [P.], seq 19476:19529, ack 164, win 62, options [nop,nop,TS val 1852309646 ecr 10250804], length 53
22:43:36.758281 IP dhcp-140-247-103-184.fas.harvard.edu.52134 > zproxy110.enst.fr.imaps: Flags [P.], seq 164:270, ack 19529, win 1543, options [nop,nop,TS val 10250816 ecr 1852309646], length 106
22:43:36.869512 IP zproxy110.enst.fr.imaps > dhcp-140-247-103-184.fas.harvard.edu.52134: Flags [.], seq 19529:22265, ack 270, win 62, options [nop,nop,TS val 1852309657 ecr 10250816], length 2736
22:43:36.869594 IP dhcp-140-247-103-184.fas.harvard.edu.52134 > zproxy110.enst.fr.imaps: Flags [.], ack 22265, win 1518, options [nop,nop,TS val 10250827 ecr 1852309657], length 0
22:43:36.869624 IP zproxy110.enst.fr.imaps > dhcp-140-247-103-184.fas.harvard.edu.52134: Flags [P.], seq 22265:23662, ack 270, win 62, options [nop,nop,TS val 1852309657 ecr 10250816], length 1397
22:43:36.869633 IP dhcp-140-247-103-184.fas.harvard.edu.52134 > zproxy110.enst.fr.imaps: Flags [.], ack 23662, win 1529, options [nop,nop,TS val 10250827 ecr 1852309657], length 0
22:43:36.899041 IP zproxy110.enst.fr.imaps > dhcp-140-247-103-184.fas.harvard.edu.52134: Flags [.], seq 23662:26398, ack 270, win 62, options [nop,nop,TS val 1852309660 ecr 10250816], length 2736
22:43:36.899099 IP dhcp-140-247-103-184.fas.harvard.edu.52134 > zproxy110.enst.fr.imaps: Flags [.], ack 26398, win 1518, options [nop,nop,TS val 10250830 ecr 1852309660], length 0
22:43:36.961699 IP zproxy110.enst.fr.imaps > dhcp-140-247-103-184.fas.harvard.edu.52134: Flags [.], seq 26398:30502, ack 270, win 62, options [nop,nop,TS val 1852309666 ecr 10250827], length 4104
22:43:36.961760 IP dhcp-140-247-103-184.fas.harvard.edu.52134 > zproxy110.enst.fr.imaps: Flags [.], ack 30502, win 1508, options [nop,nop,TS val 10250836 ecr 1852309666], length 0
22:43:36.961799 IP zproxy110.enst.fr.imaps > dhcp-140-247-103-184.fas.harvard.edu.52134: Flags [.], seq 30502:33238, ack 270, win 62, options [nop,nop,TS val 1852309666 ecr 10250827], length 2736
22:43:36.961906 IP zproxy110.enst.fr.imaps > dhcp-140-247-103-184.fas.harvard.edu.52134: Flags [.], seq 33238:34606, ack 270, win 62, options [nop,nop,TS val 1852309666 ecr 10250827], length 1368
22:43:36.962488 IP dhcp-140-247-103-184.fas.harvard.edu.52134 > zproxy110.enst.fr.imaps: Flags [.], ack 34606, win 1469, options [nop,nop,TS val 10250836 ecr 1852309666], length 0
22:43:36.992692 IP zproxy110.enst.fr.imaps > dhcp-140-247-103-184.fas.harvard.edu.52134: Flags [.], seq 34606:37342, ack 270, win 62, options [nop,nop,TS val 1852309669 ecr 10250830], length 2736
22:43:36.992706 IP dhcp-140-247-103-184.fas.harvard.edu.52134 > zproxy110.enst.fr.imaps: Flags [.], ack 37342, win 1518, options [nop,nop,TS val 10250839 ecr 1852309669], length 0
22:43:36.992858 IP zproxy110.enst.fr.imaps > dhcp-140-247-103-184.fas.harvard.edu.52134: Flags [.], seq 37342:38710, ack 270, win 62, options [nop,nop,TS val 1852309669 ecr 10250830], length 1368
22:43:37.023412 IP dhcp-140-247-103-184.fas.harvard.edu.52134 > zproxy110.enst.fr.imaps: Flags [.], ack 38710, win 1543, options [nop,nop,TS val 10250843 ecr 1852309669], length 0
22:43:37.054599 IP zproxy110.enst.fr.imaps > dhcp-140-247-103-184.fas.harvard.edu.52134: Flags [.], seq 38710:44182, ack 270, win 62, options [nop,nop,TS val 1852309675 ecr 10250836], length 5472
22:43:37.054614 IP dhcp-140-247-103-184.fas.harvard.edu.52134 > zproxy110.enst.fr.imaps: Flags [.], ack 44182, win 1497, options [nop,nop,TS val 10250846 ecr 1852309675], length 0
22:43:37.054706 IP zproxy110.enst.fr.imaps > dhcp-140-247-103-184.fas.harvard.edu.52134: Flags [.], seq 44182:49654, ack 270, win 62, options [nop,nop,TS val 1852309675 ecr 10250836], length 5472
22:43:37.054722 IP dhcp-140-247-103-184.fas.harvard.edu.52134 > zproxy110.enst.fr.imaps: Flags [.], ack 49654, win 1451, options [nop,nop,TS val 10250846 ecr 1852309675], length 0
22:43:37.115494 IP zproxy110.enst.fr.imaps > dhcp-140-247-103-184.fas.harvard.edu.52134: Flags [P.], seq 49654:52570, ack 270, win 62, options [nop,nop,TS val 1852309681 ecr 10250843], length 2916
22:43:37.115512 IP dhcp-140-247-103-184.fas.harvard.edu.52134 > zproxy110.enst.fr.imaps: Flags [.], ack 52570, win 1517, options [nop,nop,TS val 10250852 ecr 1852309681], length 0
22:43:41.114595 IP dhcp-140-247-103-184.fas.harvard.edu.50790 > vb-in-f108.1e100.net.imaps: Flags [P.], seq 547040614:547040700, ack 3247504507, win 931, options [nop,nop,TS val 10251252 ecr 1773785390], length 86
22:43:41.154004 IP vb-in-f108.1e100.net.imaps > dhcp-140-247-103-184.fas.harvard.edu.50790: Flags [.], ack 86, win 1002, options [nop,nop,TS val 1773843004 ecr 10251252], length 0
22:43:41.284426 IP vb-in-f108.1e100.net.imaps > dhcp-140-247-103-184.fas.harvard.edu.50790: Flags [P.], seq 1:121, ack 86, win 1002, options [nop,nop,TS val 1773843135 ecr 10251252], length 120
22:43:41.284444 IP dhcp-140-247-103-184.fas.harvard.edu.50790 > vb-in-f108.1e100.net.imaps: Flags [.], ack 121, win 930, options [nop,nop,TS val 10251269 ecr 1773843135], length 0
22:43:41.285903 IP dhcp-140-247-103-184.fas.harvard.edu.50790 > vb-in-f108.1e100.net.imaps: Flags [P.], seq 86:134, ack 121, win 931, options [nop,nop,TS val 10251269 ecr 1773843135], length 48
22:43:41.324992 IP vb-in-f108.1e100.net.imaps > dhcp-140-247-103-184.fas.harvard.edu.50790: Flags [.], ack 134, win 1002, options [nop,nop,TS val 1773843175 ecr 10251269], length 0
22:43:41.769287 IP vb-in-f108.1e100.net.imaps > dhcp-140-247-103-184.fas.harvard.edu.50790: Flags [P.], seq 121:466, ack 134, win 1002, options [nop,nop,TS val 1773843620 ecr 10251269], length 345
22:43:41.770323 IP dhcp-140-247-103-184.fas.harvard.edu.50790 > vb-in-f108.1e100.net.imaps: Flags [P.], seq 134:183, ack 466, win 931, options [nop,nop,TS val 10251317 ecr 1773843620], length 49
22:43:41.809716 IP vb-in-f108.1e100.net.imaps > dhcp-140-247-103-184.fas.harvard.edu.50790: Flags [.], ack 183, win 1002, options [nop,nop,TS val 1773843660 ecr 10251317], length 0
22:43:41.938974 IP vb-in-f108.1e100.net.imaps > dhcp-140-247-103-184.fas.harvard.edu.50790: Flags [P.], seq 466:530, ack 183, win 1002, options [nop,nop,TS val 1773843789 ecr 10251317], length 64
22:43:41.938987 IP vb-in-f108.1e100.net.imaps > dhcp-140-247-103-184.fas.harvard.edu.50790: Flags [P.], seq 530:595, ack 183, win 1002, options [nop,nop,TS val 1773843789 ecr 10251317], length 65
22:43:41.938991 IP vb-in-f108.1e100.net.imaps > dhcp-140-247-103-184.fas.harvard.edu.50790: Flags [P.], seq 595:660, ack 183, win 1002, options [nop,nop,TS val 1773843789 ecr 10251317], length 65
22:43:41.938995 IP vb-in-f108.1e100.net.imaps > dhcp-140-247-103-184.fas.harvard.edu.50790: Flags [P.], seq 660:705, ack 183, win 1002, options [nop,nop,TS val 1773843789 ecr 10251317], length 45
22:43:41.938998 IP vb-in-f108.1e100.net.imaps > dhcp-140-247-103-184.fas.harvard.edu.50790: Flags [P.], seq 705:750, ack 183, win 1002, options [nop,nop,TS val 1773843789 ecr 10251317], length 45
22:43:41.939001 IP vb-in-f108.1e100.net.imaps > dhcp-140-247-103-184.fas.harvard.edu.50790: Flags [P.], seq 750:795, ack 183, win 1002, options [nop,nop,TS val 1773843789 ecr 10251317], length 45
22:43:41.939003 IP vb-in-f108.1e100.net.imaps > dhcp-140-247-103-184.fas.harvard.edu.50790: Flags [P.], seq 795:841, ack 183, win 1002, options [nop,nop,TS val 1773843789 ecr 10251317], length 46
22:43:41.939048 IP vb-in-f108.1e100.net.imaps > dhcp-140-247-103-184.fas.harvard.edu.50790: Flags [P.], seq 841:887, ack 183, win 1002, options [nop,nop,TS val 1773843789 ecr 10251317], length 46
22:43:41.939055 IP vb-in-f108.1e100.net.imaps > dhcp-140-247-103-184.fas.harvard.edu.50790: Flags [P.], seq 887:933, ack 183, win 1002, options [nop,nop,TS val 1773843789 ecr 10251317], length 46
22:43:41.939198 IP vb-in-f108.1e100.net.imaps > dhcp-140-247-103-184.fas.harvard.edu.50790: Flags [P.], seq 933:1000, ack 183, win 1002, options [nop,nop,TS val 1773843790 ecr 10251317], length 67
22:43:41.939209 IP vb-in-f108.1e100.net.imaps > dhcp-140-247-103-184.fas.harvard.edu.50790: Flags [P.], seq 1000:1046, ack 183, win 1002, options [nop,nop,TS val 1773843790 ecr 10251317], length 46
22:43:41.939215 IP vb-in-f108.1e100.net.imaps > dhcp-140-247-103-184.fas.harvard.edu.50790: Flags [P.], seq 1046:1092, ack 183, win 1002, options [nop,nop,TS val 1773843790 ecr 10251317], length 46
22:43:41.939221 IP vb-in-f108.1e100.net.imaps > dhcp-140-247-103-184.fas.harvard.edu.50790: Flags [P.], seq 1092:1138, ack 183, win 1002, options [nop,nop,TS val 1773843790 ecr 10251317], length 46
22:43:41.939279 IP vb-in-f108.1e100.net.imaps > dhcp-140-247-103-184.fas.harvard.edu.50790: Flags [P.], seq 1138:1205, ack 183, win 1002, options [nop,nop,TS val 1773843790 ecr 10251317], length 67
22:43:41.939438 IP vb-in-f108.1e100.net.imaps > dhcp-140-247-103-184.fas.harvard.edu.50790: Flags [P.], seq 1205:1251, ack 183, win 1002, options [nop,nop,TS val 1773843790 ecr 10251317], length 46
22:43:41.939491 IP vb-in-f108.1e100.net.imaps > dhcp-140-247-103-184.fas.harvard.edu.50790: Flags [P.], seq 1251:1320, ack 183, win 1002, options [nop,nop,TS val 1773843790 ecr 10251317], length 69
22:43:41.939498 IP vb-in-f108.1e100.net.imaps > dhcp-140-247-103-184.fas.harvard.edu.50790: Flags [P.], seq 1320:1389, ack 183, win 1002, options [nop,nop,TS val 1773843790 ecr 10251317], length 69
22:43:41.939501 IP vb-in-f108.1e100.net.imaps > dhcp-140-247-103-184.fas.harvard.edu.50790: Flags [P.], seq 1389:1436, ack 183, win 1002, options [nop,nop,TS val 1773843790 ecr 10251317], length 47
22:43:41.939627 IP vb-in-f108.1e100.net.imaps > dhcp-140-247-103-184.fas.harvard.edu.50790: Flags [P.], seq 1436:1505, ack 183, win 1002, options [nop,nop,TS val 1773843790 ecr 10251317], length 69
22:43:41.939632 IP vb-in-f108.1e100.net.imaps > dhcp-140-247-103-184.fas.harvard.edu.50790: Flags [P.], seq 1505:1552, ack 183, win 1002, options [nop,nop,TS val 1773843790 ecr 10251317], length 47
22:43:41.939743 IP dhcp-140-247-103-184.fas.harvard.edu.50790 > vb-in-f108.1e100.net.imaps: Flags [.], ack 1552, win 931, options [nop,nop,TS val 10251334 ecr 1773843789], length 0
22:43:41.939793 IP vb-in-f108.1e100.net.imaps > dhcp-140-247-103-184.fas.harvard.edu.50790: Flags [P.], seq 1552:1643, ack 183, win 1002, options [nop,nop,TS val 1773843790 ecr 10251317], length 91
22:43:41.940037 IP vb-in-f108.1e100.net.imaps > dhcp-140-247-103-184.fas.harvard.edu.50790: Flags [P.], seq 1643:1712, ack 183, win 1002, options [nop,nop,TS val 1773843790 ecr 10251317], length 69
22:43:41.940050 IP vb-in-f108.1e100.net.imaps > dhcp-140-247-103-184.fas.harvard.edu.50790: Flags [P.], seq 1712:1759, ack 183, win 1002, options [nop,nop,TS val 1773843790 ecr 10251317], length 47
22:43:41.940058 IP vb-in-f108.1e100.net.imaps > dhcp-140-247-103-184.fas.harvard.edu.50790: Flags [P.], seq 1828:1897, ack 183, win 1002, options [nop,nop,TS val 1773843790 ecr 10251317], length 69
22:43:41.940062 IP dhcp-140-247-103-184.fas.harvard.edu.50790 > vb-in-f108.1e100.net.imaps: Flags [.], ack 1759, win 928, options [nop,nop,TS val 10251334 ecr 1773843790,nop,nop,sack 1 {1828:1897}], length 0
22:43:41.940066 IP vb-in-f108.1e100.net.imaps > dhcp-140-247-103-184.fas.harvard.edu.50790: Flags [P.], seq 1759:1828, ack 183, win 1002, options [nop,nop,TS val 1773843790 ecr 10251317], length 69
22:43:41.940069 IP dhcp-140-247-103-184.fas.harvard.edu.50790 > vb-in-f108.1e100.net.imaps: Flags [.], ack 1897, win 926, options [nop,nop,TS val 10251334 ecr 1773843790], length 0
22:43:41.940171 IP vb-in-f108.1e100.net.imaps > dhcp-140-247-103-184.fas.harvard.edu.50790: Flags [P.], seq 1897:1966, ack 183, win 1002, options [nop,nop,TS val 1773843790 ecr 10251317], length 69
22:43:41.940177 IP dhcp-140-247-103-184.fas.harvard.edu.50790 > vb-in-f108.1e100.net.imaps: Flags [.], ack 1966, win 925, options [nop,nop,TS val 10251334 ecr 1773843790], length 0
22:43:41.940180 IP vb-in-f108.1e100.net.imaps > dhcp-140-247-103-184.fas.harvard.edu.50790: Flags [P.], seq 1966:2035, ack 183, win 1002, options [nop,nop,TS val 1773843790 ecr 10251317], length 69
22:43:41.940183 IP dhcp-140-247-103-184.fas.harvard.edu.50790 > vb-in-f108.1e100.net.imaps: Flags [.], ack 2035, win 924, options [nop,nop,TS val 10251334 ecr 1773843790], length 0
22:43:41.979092 IP vb-in-f108.1e100.net.imaps > dhcp-140-247-103-184.fas.harvard.edu.50790: Flags [.], seq 2035:3403, ack 183, win 1002, options [nop,nop,TS val 1773843829 ecr 10251334], length 1368
22:43:41.979110 IP dhcp-140-247-103-184.fas.harvard.edu.50790 > vb-in-f108.1e100.net.imaps: Flags [.], ack 3403, win 916, options [nop,nop,TS val 10251338 ecr 1773843829], length 0
22:43:41.979116 IP vb-in-f108.1e100.net.imaps > dhcp-140-247-103-184.fas.harvard.edu.50790: Flags [P.], seq 3403:3895, ack 183, win 1002, options [nop,nop,TS val 1773843829 ecr 10251334], length 492
22:43:41.979120 IP dhcp-140-247-103-184.fas.harvard.edu.50790 > vb-in-f108.1e100.net.imaps: Flags [.], ack 3895, win 909, options [nop,nop,TS val 10251338 ecr 1773843829], length 0
22:43:42.066099 IP vb-in-f108.1e100.net.imaps > dhcp-140-247-103-184.fas.harvard.edu.50790: Flags [.], seq 3895:5263, ack 183, win 1002, options [nop,nop,TS val 1773843916 ecr 10251338], length 1368
22:43:42.066118 IP dhcp-140-247-103-184.fas.harvard.edu.50790 > vb-in-f108.1e100.net.imaps: Flags [.], ack 5263, win 916, options [nop,nop,TS val 10251347 ecr 1773843916], length 0
22:43:42.066124 IP vb-in-f108.1e100.net.imaps > dhcp-140-247-103-184.fas.harvard.edu.50790: Flags [P.], seq 5263:5320, ack 183, win 1002, options [nop,nop,TS val 1773843916 ecr 10251338], length 57
22:43:42.066128 IP dhcp-140-247-103-184.fas.harvard.edu.50790 > vb-in-f108.1e100.net.imaps: Flags [.], ack 5320, win 916, options [nop,nop,TS val 10251347 ecr 1773843916], length 0
22:43:42.066132 IP vb-in-f108.1e100.net.imaps > dhcp-140-247-103-184.fas.harvard.edu.50790: Flags [.], seq 5320:6688, ack 183, win 1002, options [nop,nop,TS val 1773843916 ecr 10251338], length 1368
22:43:42.066136 IP dhcp-140-247-103-184.fas.harvard.edu.50790 > vb-in-f108.1e100.net.imaps: Flags [.], ack 6688, win 899, options [nop,nop,TS val 10251347 ecr 1773843916], length 0
22:43:42.066140 IP vb-in-f108.1e100.net.imaps > dhcp-140-247-103-184.fas.harvard.edu.50790: Flags [P.], seq 6688:6745, ack 183, win 1002, options [nop,nop,TS val 1773843916 ecr 10251338], length 57
22:43:42.066143 IP dhcp-140-247-103-184.fas.harvard.edu.50790 > vb-in-f108.1e100.net.imaps: Flags [.], ack 6745, win 899, options [nop,nop,TS val 10251347 ecr 1773843916], length 0
22:43:42.066147 IP vb-in-f108.1e100.net.imaps > dhcp-140-247-103-184.fas.harvard.edu.50790: Flags [.], seq 6745:8113, ack 183, win 1002, options [nop,nop,TS val 1773843916 ecr 10251338], length 1368
22:43:42.066150 IP dhcp-140-247-103-184.fas.harvard.edu.50790 > vb-in-f108.1e100.net.imaps: Flags [.], ack 8113, win 881, options [nop,nop,TS val 10251347 ecr 1773843916], length 0
22:43:42.066154 IP vb-in-f108.1e100.net.imaps > dhcp-140-247-103-184.fas.harvard.edu.50790: Flags [P.], seq 8113:8170, ack 183, win 1002, options [nop,nop,TS val 1773843916 ecr 10251338], length 57
22:43:42.066157 IP dhcp-140-247-103-184.fas.harvard.edu.50790 > vb-in-f108.1e100.net.imaps: Flags [.], ack 8170, win 881, options [nop,nop,TS val 10251347 ecr 1773843916], length 0
22:43:42.066160 IP vb-in-f108.1e100.net.imaps > dhcp-140-247-103-184.fas.harvard.edu.50790: Flags [P.], seq 8170:8792, ack 183, win 1002, options [nop,nop,TS val 1773843916 ecr 10251338], length 622
22:43:42.066164 IP dhcp-140-247-103-184.fas.harvard.edu.50790 > vb-in-f108.1e100.net.imaps: Flags [.], ack 8792, win 872, options [nop,nop,TS val 10251347 ecr 1773843916], length 0
22:43:42.071715 IP dhcp-140-247-103-184.fas.harvard.edu.50790 > vb-in-f108.1e100.net.imaps: Flags [P.], seq 183:467, ack 8792, win 931, options [nop,nop,TS val 10251347 ecr 1773843916], length 284
22:43:42.110875 IP vb-in-f108.1e100.net.imaps > dhcp-140-247-103-184.fas.harvard.edu.50790: Flags [.], ack 467, win 1002, options [nop,nop,TS val 1773843961 ecr 10251347], length 0
22:43:42.342626 IP vb-in-f108.1e100.net.imaps > dhcp-140-247-103-184.fas.harvard.edu.50790: Flags [P.], seq 8792:9659, ack 467, win 1002, options [nop,nop,TS val 1773844193 ecr 10251347], length 867
22:43:42.342644 IP vb-in-f108.1e100.net.imaps > dhcp-140-247-103-184.fas.harvard.edu.50790: Flags [P.], seq 9659:10091, ack 467, win 1002, options [nop,nop,TS val 1773844193 ecr 10251347], length 432
22:43:42.342936 IP dhcp-140-247-103-184.fas.harvard.edu.50790 > vb-in-f108.1e100.net.imaps: Flags [.], ack 10091, win 931, options [nop,nop,TS val 10251374 ecr 1773844193], length 0
22:43:42.342986 IP vb-in-f108.1e100.net.imaps > dhcp-140-247-103-184.fas.harvard.edu.50790: Flags [P.], seq 10091:10726, ack 467, win 1002, options [nop,nop,TS val 1773844193 ecr 10251347], length 635
22:43:42.343029 IP vb-in-f108.1e100.net.imaps > dhcp-140-247-103-184.fas.harvard.edu.50790: Flags [P.], seq 10726:11483, ack 467, win 1002, options [nop,nop,TS val 1773844193 ecr 10251347], length 757
22:43:42.343082 IP dhcp-140-247-103-184.fas.harvard.edu.50790 > vb-in-f108.1e100.net.imaps: Flags [.], ack 11483, win 916, options [nop,nop,TS val 10251374 ecr 1773844193], length 0
22:43:42.343173 IP vb-in-f108.1e100.net.imaps > dhcp-140-247-103-184.fas.harvard.edu.50790: Flags [P.], seq 11483:11883, ack 467, win 1002, options [nop,nop,TS val 1773844194 ecr 10251347], length 400
22:43:42.343393 IP vb-in-f108.1e100.net.imaps > dhcp-140-247-103-184.fas.harvard.edu.50790: Flags [P.], seq 11883:12281, ack 467, win 1002, options [nop,nop,TS val 1773844194 ecr 10251347], length 398
22:43:42.343457 IP dhcp-140-247-103-184.fas.harvard.edu.50790 > vb-in-f108.1e100.net.imaps: Flags [.], ack 12281, win 931, options [nop,nop,TS val 10251375 ecr 1773844194], length 0
22:43:42.343640 IP vb-in-f108.1e100.net.imaps > dhcp-140-247-103-184.fas.harvard.edu.50790: Flags [P.], seq 12281:12896, ack 467, win 1002, options [nop,nop,TS val 1773844194 ecr 10251347], length 615
22:43:42.343853 IP vb-in-f108.1e100.net.imaps > dhcp-140-247-103-184.fas.harvard.edu.50790: Flags [P.], seq 12896:13511, ack 467, win 1002, options [nop,nop,TS val 1773844194 ecr 10251347], length 615
22:43:42.343864 IP vb-in-f108.1e100.net.imaps > dhcp-140-247-103-184.fas.harvard.edu.50790: Flags [P.], seq 13511:13997, ack 467, win 1002, options [nop,nop,TS val 1773844194 ecr 10251347], length 486
22:43:42.343931 IP dhcp-140-247-103-184.fas.harvard.edu.50790 > vb-in-f108.1e100.net.imaps: Flags [.], ack 13997, win 905, options [nop,nop,TS val 10251375 ecr 1773844194], length 0
22:43:42.344037 IP vb-in-f108.1e100.net.imaps > dhcp-140-247-103-184.fas.harvard.edu.50790: Flags [P.], seq 13997:14466, ack 467, win 1002, options [nop,nop,TS val 1773844194 ecr 10251347], length 469
22:43:42.344096 IP vb-in-f108.1e100.net.imaps > dhcp-140-247-103-184.fas.harvard.edu.50790: Flags [P.], seq 14466:14879, ack 467, win 1002, options [nop,nop,TS val 1773844194 ecr 10251347], length 413
22:43:42.344112 IP dhcp-140-247-103-184.fas.harvard.edu.50790 > vb-in-f108.1e100.net.imaps: Flags [.], ack 14879, win 902, options [nop,nop,TS val 10251375 ecr 1773844194], length 0
22:43:42.382335 IP vb-in-f108.1e100.net.imaps > dhcp-140-247-103-184.fas.harvard.edu.50790: Flags [.], seq 14879:16247, ack 467, win 1002, options [nop,nop,TS val 1773844232 ecr 10251374], length 1368
22:43:42.382354 IP vb-in-f108.1e100.net.imaps > dhcp-140-247-103-184.fas.harvard.edu.50790: Flags [.], seq 16247:17615, ack 467, win 1002, options [nop,nop,TS val 1773844232 ecr 10251374], length 1368
22:43:42.382364 IP dhcp-140-247-103-184.fas.harvard.edu.50790 > vb-in-f108.1e100.net.imaps: Flags [.], ack 17615, win 902, options [nop,nop,TS val 10251378 ecr 1773844232], length 0
22:43:42.382371 IP vb-in-f108.1e100.net.imaps > dhcp-140-247-103-184.fas.harvard.edu.50790: Flags [.], seq 17615:18983, ack 467, win 1002, options [nop,nop,TS val 1773844232 ecr 10251374], length 1368
22:43:42.382378 IP vb-in-f108.1e100.net.imaps > dhcp-140-247-103-184.fas.harvard.edu.50790: Flags [.], seq 18983:20351, ack 467, win 1002, options [nop,nop,TS val 1773844232 ecr 10251374], length 1368
22:43:42.382381 IP vb-in-f108.1e100.net.imaps > dhcp-140-247-103-184.fas.harvard.edu.50790: Flags [.], seq 20351:21719, ack 467, win 1002, options [nop,nop,TS val 1773844232 ecr 10251374], length 1368
22:43:42.382385 IP vb-in-f108.1e100.net.imaps > dhcp-140-247-103-184.fas.harvard.edu.50790: Flags [.], seq 21719:23087, ack 467, win 1002, options [nop,nop,TS val 1773844232 ecr 10251374], length 1368
22:43:42.382388 IP vb-in-f108.1e100.net.imaps > dhcp-140-247-103-184.fas.harvard.edu.50790: Flags [.], seq 23087:24455, ack 467, win 1002, options [nop,nop,TS val 1773844232 ecr 10251374], length 1368
22:43:42.382392 IP vb-in-f108.1e100.net.imaps > dhcp-140-247-103-184.fas.harvard.edu.50790: Flags [.], seq 24455:25823, ack 467, win 1002, options [nop,nop,TS val 1773844232 ecr 10251374], length 1368
22:43:42.382627 IP dhcp-140-247-103-184.fas.harvard.edu.50790 > vb-in-f108.1e100.net.imaps: Flags [.], ack 25823, win 816, options [nop,nop,TS val 10251378 ecr 1773844232], length 0
22:43:42.383286 IP vb-in-f108.1e100.net.imaps > dhcp-140-247-103-184.fas.harvard.edu.50790: Flags [.], seq 25823:27191, ack 467, win 1002, options [nop,nop,TS val 1773844233 ecr 10251375], length 1368
22:43:42.383293 IP vb-in-f108.1e100.net.imaps > dhcp-140-247-103-184.fas.harvard.edu.50790: Flags [.], seq 27191:28559, ack 467, win 1002, options [nop,nop,TS val 1773844233 ecr 10251375], length 1368
22:43:42.383298 IP dhcp-140-247-103-184.fas.harvard.edu.50790 > vb-in-f108.1e100.net.imaps: Flags [.], ack 28559, win 830, options [nop,nop,TS val 10251378 ecr 1773844233], length 0
22:43:42.383302 IP vb-in-f108.1e100.net.imaps > dhcp-140-247-103-184.fas.harvard.edu.50790: Flags [.], seq 28559:29927, ack 467, win 1002, options [nop,nop,TS val 1773844233 ecr 10251375], length 1368
22:43:42.383305 IP vb-in-f108.1e100.net.imaps > dhcp-140-247-103-184.fas.harvard.edu.50790: Flags [.], seq 29927:31295, ack 467, win 1002, options [nop,nop,TS val 1773844233 ecr 10251375], length 1368
22:43:42.383306 IP vb-in-f108.1e100.net.imaps > dhcp-140-247-103-184.fas.harvard.edu.50790: Flags [.], seq 31295:32663, ack 467, win 1002, options [nop,nop,TS val 1773844233 ecr 10251375], length 1368
22:43:42.383310 IP vb-in-f108.1e100.net.imaps > dhcp-140-247-103-184.fas.harvard.edu.50790: Flags [.], seq 32663:34031, ack 467, win 1002, options [nop,nop,TS val 1773844233 ecr 10251375], length 1368
22:43:42.383312 IP vb-in-f108.1e100.net.imaps > dhcp-140-247-103-184.fas.harvard.edu.50790: Flags [P.], seq 34031:35029, ack 467, win 1002, options [nop,nop,TS val 1773844233 ecr 10251375], length 998
22:43:42.383314 IP dhcp-140-247-103-184.fas.harvard.edu.50790 > vb-in-f108.1e100.net.imaps: Flags [.], ack 32663, win 801, options [nop,nop,TS val 10251378 ecr 1773844233], length 0
22:43:42.383380 IP dhcp-140-247-103-184.fas.harvard.edu.50790 > vb-in-f108.1e100.net.imaps: Flags [.], ack 35029, win 773, options [nop,nop,TS val 10251379 ecr 1773844233], length 0
22:43:42.386648 IP dhcp-140-247-103-184.fas.harvard.edu.50790 > vb-in-f108.1e100.net.imaps: Flags [P.], seq 467:787, ack 35029, win 931, options [nop,nop,TS val 10251379 ecr 1773844233], length 320
22:43:42.425955 IP vb-in-f108.1e100.net.imaps > dhcp-140-247-103-184.fas.harvard.edu.50790: Flags [.], ack 787, win 1002, options [nop,nop,TS val 1773844276 ecr 10251379], length 0
22:43:42.777923 IP vb-in-f108.1e100.net.imaps > dhcp-140-247-103-184.fas.harvard.edu.50790: Flags [.], seq 35029:36397, ack 787, win 1002, options [nop,nop,TS val 1773844628 ecr 10251379], length 1368
22:43:42.777947 IP vb-in-f108.1e100.net.imaps > dhcp-140-247-103-184.fas.harvard.edu.50790: Flags [P.], seq 36397:36454, ack 787, win 1002, options [nop,nop,TS val 1773844628 ecr 10251379], length 57
22:43:42.777951 IP vb-in-f108.1e100.net.imaps > dhcp-140-247-103-184.fas.harvard.edu.50790: Flags [P.], seq 36454:37127, ack 787, win 1002, options [nop,nop,TS val 1773844628 ecr 10251379], length 673
22:43:42.777954 IP vb-in-f108.1e100.net.imaps > dhcp-140-247-103-184.fas.harvard.edu.50790: Flags [.], seq 37127:38495, ack 787, win 1002, options [nop,nop,TS val 1773844628 ecr 10251379], length 1368
22:43:42.777957 IP vb-in-f108.1e100.net.imaps > dhcp-140-247-103-184.fas.harvard.edu.50790: Flags [P.], seq 38495:38552, ack 787, win 1002, options [nop,nop,TS val 1773844628 ecr 10251379], length 57
22:43:42.777960 IP vb-in-f108.1e100.net.imaps > dhcp-140-247-103-184.fas.harvard.edu.50790: Flags [.], seq 38552:39920, ack 787, win 1002, options [nop,nop,TS val 1773844628 ecr 10251379], length 1368
22:43:42.777963 IP vb-in-f108.1e100.net.imaps > dhcp-140-247-103-184.fas.harvard.edu.50790: Flags [P.], seq 39920:39977, ack 787, win 1002, options [nop,nop,TS val 1773844628 ecr 10251379], length 57
22:43:42.778112 IP vb-in-f108.1e100.net.imaps > dhcp-140-247-103-184.fas.harvard.edu.50790: Flags [.], seq 39977:41345, ack 787, win 1002, options [nop,nop,TS val 1773844628 ecr 10251379], length 1368
22:43:42.778118 IP vb-in-f108.1e100.net.imaps > dhcp-140-247-103-184.fas.harvard.edu.50790: Flags [P.], seq 41345:41402, ack 787, win 1002, options [nop,nop,TS val 1773844628 ecr 10251379], length 57
22:43:42.778121 IP vb-in-f108.1e100.net.imaps > dhcp-140-247-103-184.fas.harvard.edu.50790: Flags [P.], seq 42770:42827, ack 787, win 1002, options [nop,nop,TS val 1773844628 ecr 10251379], length 57
22:43:42.778130 IP dhcp-140-247-103-184.fas.harvard.edu.50790 > vb-in-f108.1e100.net.imaps: Flags [.], ack 41402, win 842, options [nop,nop,TS val 10251418 ecr 1773844628,nop,nop,sack 1 {42770:42827}], length 0
22:43:42.778135 IP vb-in-f108.1e100.net.imaps > dhcp-140-247-103-184.fas.harvard.edu.50790: Flags [.], seq 41402:42770, ack 787, win 1002, options [nop,nop,TS val 1773844628 ecr 10251379], length 1368
22:43:42.778139 IP dhcp-140-247-103-184.fas.harvard.edu.50790 > vb-in-f108.1e100.net.imaps: Flags [.], ack 42827, win 828, options [nop,nop,TS val 10251418 ecr 1773844628], length 0
22:43:42.778142 IP vb-in-f108.1e100.net.imaps > dhcp-140-247-103-184.fas.harvard.edu.50790: Flags [.], seq 42827:44195, ack 787, win 1002, options [nop,nop,TS val 1773844628 ecr 10251379], length 1368
22:43:42.778144 IP dhcp-140-247-103-184.fas.harvard.edu.50790 > vb-in-f108.1e100.net.imaps: Flags [.], ack 44195, win 813, options [nop,nop,TS val 10251418 ecr 1773844628], length 0
22:43:42.778147 IP vb-in-f108.1e100.net.imaps > dhcp-140-247-103-184.fas.harvard.edu.50790: Flags [P.], seq 44195:45469, ack 787, win 1002, options [nop,nop,TS val 1773844628 ecr 10251379], length 1274
22:43:42.778150 IP dhcp-140-247-103-184.fas.harvard.edu.50790 > vb-in-f108.1e100.net.imaps: Flags [.], ack 45469, win 799, options [nop,nop,TS val 10251418 ecr 1773844628], length 0
22:43:42.778550 IP vb-in-f108.1e100.net.imaps > dhcp-140-247-103-184.fas.harvard.edu.50790: Flags [.], seq 45469:46837, ack 787, win 1002, options [nop,nop,TS val 1773844629 ecr 10251379], length 1368
22:43:42.778568 IP dhcp-140-247-103-184.fas.harvard.edu.50790 > vb-in-f108.1e100.net.imaps: Flags [.], ack 46837, win 817, options [nop,nop,TS val 10251418 ecr 1773844629], length 0
22:43:42.778571 IP vb-in-f108.1e100.net.imaps > dhcp-140-247-103-184.fas.harvard.edu.50790: Flags [P.], seq 46837:46894, ack 787, win 1002, options [nop,nop,TS val 1773844629 ecr 10251379], length 57
22:43:42.778574 IP dhcp-140-247-103-184.fas.harvard.edu.50790 > vb-in-f108.1e100.net.imaps: Flags [.], ack 46894, win 817, options [nop,nop,TS val 10251418 ecr 1773844629], length 0
